-- phpMyAdmin SQL Dump
-- version 5.2.1
-- https://www.phpmyadmin.net/
--
-- Host: localhost:3306
-- Waktu pembuatan: 09 Des 2024 pada 15.00
-- Versi server: 10.11.9-MariaDB-cll-lve
-- Versi PHP: 8.3.13

SET SQL_MODE = "NO_AUTO_VALUE_ON_ZERO";
START TRANSACTION;
SET time_zone = "+00:00";


/*!40101 SET @OLD_CHARACTER_SET_CLIENT=@@CHARACTER_SET_CLIENT */;
/*!40101 SET @OLD_CHARACTER_SET_RESULTS=@@CHARACTER_SET_RESULTS */;
/*!40101 SET @OLD_COLLATION_CONNECTION=@@COLLATION_CONNECTION */;
/*!40101 SET NAMES utf8mb4 */;

--
-- Database: `u4397696_pmb`
--

-- --------------------------------------------------------

--
-- Struktur dari tabel `biaya_kuliah_pmb`
--

CREATE TABLE `biaya_kuliah_pmb` (
  `id_biayakuliahpmb` int(11) NOT NULL,
  `item_biaya` varchar(100) NOT NULL,
  `jlh_uang` int(11) NOT NULL
) ENGINE=MyISAM DEFAULT CHARSET=latin1 COLLATE=latin1_swedish_ci;

--
-- Dumping data untuk tabel `biaya_kuliah_pmb`
--

INSERT INTO `biaya_kuliah_pmb` (`id_biayakuliahpmb`, `item_biaya`, `jlh_uang`) VALUES
(1, 'Biaya Registrasi', 1510000),
(2, 'Biaya Pengembangan Kampus', 3000000),
(3, 'SPP Tetap', 2150000);

-- --------------------------------------------------------

--
-- Struktur dari tabel `biaya_kuliah_pmbtest`
--

CREATE TABLE `biaya_kuliah_pmbtest` (
  `id_biayakuliahpmb` int(11) NOT NULL,
  `item_biaya` varchar(100) NOT NULL,
  `jlh_uang` int(11) NOT NULL
) ENGINE=MyISAM DEFAULT CHARSET=latin1 COLLATE=latin1_swedish_ci;

--
-- Dumping data untuk tabel `biaya_kuliah_pmbtest`
--

INSERT INTO `biaya_kuliah_pmbtest` (`id_biayakuliahpmb`, `item_biaya`, `jlh_uang`) VALUES
(1, 'Biaya Registrasi', 1510000),
(2, 'Biaya Pengembangan Kampus', 3250000),
(3, 'SPP Tetap', 2150000);

-- --------------------------------------------------------

--
-- Struktur dari tabel `bukti_bayar`
--

CREATE TABLE `bukti_bayar` (
  `id_bukti_bayar` int(11) NOT NULL,
  `akunb_msiswa` varchar(225) NOT NULL,
  `nama_pengirim` varchar(100) NOT NULL,
  `bank_pengirim` varchar(50) NOT NULL,
  `tgl_trans` varchar(20) NOT NULL,
  `jam_trans` varchar(20) NOT NULL,
  `nomor_refe` varchar(225) NOT NULL,
  `jlh_bayar` int(11) NOT NULL,
  `bukti_bayar` varchar(225) NOT NULL,
  `validasi_bukti` int(2) NOT NULL,
  `tgl_validbukti` varchar(50) NOT NULL,
  `yg_validasi` varchar(10) NOT NULL,
  `konfirm_bauk` int(2) NOT NULL,
  `yg_validasibauk` varchar(50) NOT NULL,
  `tgl_konfirmbauk` varchar(50) NOT NULL
) ENGINE=MyISAM DEFAULT CHARSET=latin1 COLLATE=latin1_swedish_ci;

--
-- Dumping data untuk tabel `bukti_bayar`
--

INSERT INTO `bukti_bayar` (`id_bukti_bayar`, `akunb_msiswa`, `nama_pengirim`, `bank_pengirim`, `tgl_trans`, `jam_trans`, `nomor_refe`, `jlh_bayar`, `bukti_bayar`, `validasi_bukti`, `tgl_validbukti`, `yg_validasi`, `konfirm_bauk`, `yg_validasibauk`, `tgl_konfirmbauk`) VALUES
(19, '99994029620cf673d7953', 'Titin  Artika', 'Bank Kalbar', '05/04/2022', '14:32:06', 'T 095TL01-50', 6660000, 'd58d4455d02c27684d1ec20e11cc4665.jpeg', 3, '2022-04-07 09:43:53', '49', 1, '', ''),
(17, '21346512620b111d41d6f', 'Marianus Sius', 'Bank Rakyat Indonesia (BRI)', '05/04/2022', '10:30:42', '446496275304', 6910000, '7caa0c784c70e54cba4a30df524dacbe.jpeg', 2, '2022-04-05 14:06:15', '45', 1, '', ''),
(18, '99994029620cf673d7953', 'Titin  Artika', 'bank kalbar', '05/04/2022', '14:32:06', 'T 095TL01-50', 6660000, 'ec8ea2632d687663db89445d91bc5f82.jpeg', 2, '2022-04-06 09:59:52', '49', 1, '', ''),
(5, '13804147620215534a20a', 'Daniel Handi', 'Kalbar', '04/04/2022', '10:34:47', 'T.I30', 6660000, 'a6c302a7e8fa0af3546825076b5e8172.jpg', 2, '2022-04-04 11:40:23', '49', 1, '', ''),
(6, '13804147620215534a20a', 'Daniel Handi', 'Kalbar', '04/04/2022', '10:34:47', '123', 666000, '339d19d3a557e20866ac5c27cba189c3.jpg', 3, '2022-04-04 11:40:33', '49', 1, '', ''),
(7, '13804147620215534a20a', 'Daniel Handi', 'Kalbar', '04/04/2022', '10:34:47', '123', 666000, '9e5444ced15a0a3c4a48a2c2d0181479.jpg', 3, '2022-04-04 11:40:39', '49', 1, '', ''),
(8, '13804147620215534a20a', 'Daniel Handi', 'Kalbar', '04/04/2022', '10:34:47', '123', 666000, 'd0b6bffaebd5149d352af202da7c5022.jpg', 3, '2022-04-04 11:40:51', '49', 1, '', ''),
(9, '13804147620215534a20a', 'Daniel Handi', 'Kalbar', '04/04/2022', '10:34:47', 'T.130', 666000, 'c2a0b8c6aa0fbffccdba641a73d7a005.jpg', 3, '2022-04-04 11:39:59', '49', 1, '', ''),
(10, '102278626216ee89505ae', 'Elsa sumita', 'Bank kalbar', '04/04/2022', '13:51:44', '36972', 6660000, '0d5cd45ad81aa1683a96e30b3d2456e7.jpg', 3, '2022-04-05 11:02:43', '49', 1, '', ''),
(11, '102278626216ee89505ae', 'Elsa sumita', 'Bank kalbar', '04/04/2022', '13:51;44', 'TL03/46', 6660000, '878f84a9514fc28771e7bac625c478e7.jpg', 2, '2022-04-05 09:44:14', '49', 1, '', ''),
(12, '18465175623a7c48d6aca', 'Dika furqani', 'Bank kalbar', '04/04/2022', '13:39:10', 'TL10.81', 6910000, '606d4a425f5093d308acf494dd2730cb.jpg', 2, '2022-04-05 09:45:44', '49', 1, '', ''),
(20, '9289485461fe329aaf7bc', 'Rulia netti boru manurung', 'Bank kalbar', '6 APRIL 2022', '12:24:10.131', '701481224080', 6600000, '91bc23f1297f3bf5e0e37f4702af8332.jpg', 3, '2022-04-07 16:08:27', '45', 1, '', ''),
(14, '1882963962006873c89b5', 'ELISABETH SOPHIA TRINAWATI', 'bank kalbar', '04/04/2022', '09:19:18', '60TL01/032', 660000, '09ab5aff832fb77c7fa0e0ac3be206ec.jpeg', 2, '2022-04-05 11:01:20', '49', 1, '', ''),
(15, '1882963962006873c89b5', 'ELISABETH SOPHIA TRINAWATI', 'bank kalbar', '04/04/2022', '09:19:18', '60TL01/032A', 6000000, '8ef7b628b13888ff92647cba66ac359a.jpeg', 2, '2022-04-05 11:01:32', '49', 1, '', ''),
(16, '1882963962006873c89b5', 'ELISABETH SOPHIA TRINAWATI', 'bank kalbar', '04/04/2022', '09:19:18', 'T07', 6000000, 'b7d1255409f14f726ccc61cad0d9f323.jpeg', 3, '2022-04-05 11:01:57', '49', 1, '', ''),
(21, '9289485461fe329aaf7bc', 'Rulia netti boru manurung', 'Bank kalbar', '6 APRIL 2022', '12:24:10.131', '701481224080', 6600000, 'a8d370cfe93779a2aae57e34c74942f4.jpg', 3, '2022-04-07 16:08:36', '45', 1, '', ''),
(22, '9289485461fe329aaf7bc', 'Rulia netti boru manurung', 'Bank kalbar', '6 APRIL 2022', '12:24:10.131', '701481224080', 6600000, 'd2f23b4953de1acdb8c563d341f84f0f.jpg', 3, '2022-04-07 16:08:45', '45', 1, '', ''),
(23, '9289485461fe329aaf7bc', 'Rulia netti boru manurung', 'Bank kalbar', '6 APRIL 2022', '12:24:10.131', '701481224080', 6600000, '242a4732b27e607e0df672b66dda205d.jpg', 3, '2022-04-07 16:08:53', '45', 1, '', ''),
(24, '9289485461fe329aaf7bc', 'Rulia netti boru manurung', 'BANK KALBAR', '6 APRIL 2022', '12:24:10.131', '701481224080', 6600000, '90653cd4c39386fa2633662da56d36db.jpg', 2, '2022-04-07 16:06:43', '45', 1, '', ''),
(25, '9289485461fe329aaf7bc', 'Rulia netti boru manurung', 'BANK KALBAR', '06 APRIL 2022', '13:08:16:997', '701480108150', 660000, '2d1d79141da9ddc2a8a55db6ffe92cda.jpg', 3, '2022-04-07 16:09:09', '45', 1, '', ''),
(26, '9289485461fe329aaf7bc', 'Rulia netti boru manurung', 'BANK KALBAR', '06 APRIL 2022', '13:08:16:997', '701480108150', 6600000, 'fd51738d6374cc87413751e6ef62b6ba.jpg', 3, '2022-04-07 16:09:18', '45', 1, '', ''),
(27, '99994029620cf673d7953', 'Titin  Artika', 'Bank Kalbar', '05/04/2022', '14:32:06', 'T 095TL01-50', 6660000, '78beb8da66dc084d4e90d25561c0fa31.jpeg', 3, '2022-04-07 09:45:56', '49', 1, '', ''),
(28, '9289485461fe329aaf7bc', 'Rulia netti boru manurung', 'BANK KALBAR', '06 APRIL 2022', '13:08:16:997', '701480108150', 6600000, '116c584713365636619fe2295415df82.jpg', 3, '2022-04-07 16:08:02', '45', 1, '', ''),
(29, '9289485461fe329aaf7bc', 'Rulia netti boru manurung', 'BANK KALBAR', '06 APRIL 2022', '13:08:16:997', '701480108150', 6600000, 'fe0f3f2c1bed0fd32fa8d353d380b8b2.jpg', 3, '2022-04-07 16:08:16', '45', 1, '', ''),
(30, '9289485461fe329aaf7bc', 'Rulia netti boru manurung', 'BANK KALBAR', '06 APRIL 2022', '13:98:16.997', '701480108150', 60000, '7d81ce3eea2c35bd5f0092a9bb78849a.jpg', 2, '2022-04-07 16:07:20', '45', 1, '', ''),
(31, '181669226235056e8c385', 'Putri Cahyati', 'bank kalbar', '06/04/2022', '17:09:64', 'TL 01 47', 6910000, 'e11902d98e84c40a41087da1509b096b.jpeg', 3, '2022-04-07 16:02:53', '45', 1, '', ''),
(32, '14477756621361b8378e5', 'ADRIANUS ACONIUS', 'BANK BRI', '06/04/22', '15:53:38', '06378', 6910000, '9e084ca43071dd4e38ceb8c9454fa76a.jpg', 2, '2022-04-11 08:00:10', '45', 1, '', ''),
(34, '2086668762359ca644d61', 'Pandu kurniawan', 'BANK KALBAR', '07/04/2022', '12:17:11', '54522', 6910000, 'cb7254dfef8b5e95b0f1ae7262d622c4.jpg', 2, '2022-04-07 15:58:20', '45', 1, '', ''),
(37, '1705296162391edebef17', 'Mardianus Ryan', 'BANK KALBAR', '07/04/2022', '11:22:20', '56628', 6910000, '46233e17441e5110112b5c115ca18d62.jpg', 2, '2022-04-07 15:56:16', '45', 1, '', ''),
(39, '181669226235056e8c385', 'Putri Cahyati', 'Kalbar', '06/04/2022', '12:32:54', 'TL 0147', 6910000, 'f4c3dd1e2a6e97ecd1f6aff91b579b9d.jpeg', 2, '2022-04-07 16:01:01', '45', 1, '', ''),
(40, '1091717961fbd2eeb34b1', 'Zahra Kasnita', 'SARBINI', '07/04/2022', '13:43:20 dan 13:44:0', '000006945399', 6660000, 'ca16a1204509440420a80430d5678638.jpg', 2, '2022-04-07 16:11:17', '45', 1, '', ''),
(41, '9289485461fe329aaf7bc', 'Rulia netti boru manurung', 'BANK KALBAR', '6 APRIL 2022', '12:24:10.131', '701481224080', 66000000, '3dcebb556e62eb51e93aca1d07aa5543.jpeg', 3, '2022-04-08 13:55:52', '49', 1, '', ''),
(42, '2022636562067b667d75e', 'Septini  Sena', 'Bank Kalbar', '08/04/2022', '11:03:36.246', '061321103330', 6910000, 'b1d7c25bf5b240923d6ed95c7f42f278.jpeg', 2, '2022-04-11 08:04:54', '45', 1, '', ''),
(43, '21053323620db8b6b1262', 'Kressinsia anjelya', 'Bank Kalbar', '8/04/2022', '09:30:10', '31824', 6660000, '8d73e0bee8d119f6cdbd23d493eeff8d.jpg', 2, '2022-04-11 08:02:58', '45', 1, '', ''),
(44, '21053323620db8b6b1262', 'Kressinsia anjelya', 'Bank Kalbar', '8/04/2022', '09:30:10', '31824', 6660000, '0a196d8d775d1ddae2eb63f86d879e66.jpg', 3, '2022-04-11 08:03:31', '45', 1, '', ''),
(46, '6556194362257bed266e0', 'IBU SRI MULYANI', 'BNI', '10/04/2022', '11:42', '1', 6910000, '65d3dbe542cc2f65c53a37386f3a333a.jpeg', 2, '2022-04-11 09:06:46', '49', 1, '', ''),
(47, '43332236620b7fb52ed75', 'BPK SYABAR MANSAH', 'BNI', '09/04/2022', '10:33', '000000714511', 6660000, '2be1f6c0190e117f2f1cbf66b03f80ef.jpeg', 2, '2022-04-11 09:18:05', '49', 1, '', ''),
(49, '1634757261fb66b98328c', 'Siti Marsitoh', 'bank kalbar', '09/04/2022', '17:47:05', '008057', 6910000, '0208efcce35079aa75846c28ba4e3778.jpeg', 2, '2022-04-11 09:23:38', '49', 1, '', ''),
(50, '501002256226b6f797c5b', 'Thomas Nong Tety', 'BRI', '11/04/2022', '10:00:32', '500401651893', 6910000, 'ca1b469fe3cd08f1b68f40304fb9e388.jpeg', 2, '2022-04-11 11:52:10', '49', 1, '', ''),
(51, '501002256226b6f797c5b', 'Thomas Nong Tett', 'BRI', '11/04/2022', '10:00:32', '500401651893', 6910000, '9d5d5a474a6d746e01b7065bb212b7be.jpeg', 3, '2022-04-11 11:52:25', '49', 1, '', ''),
(52, '20180051620cba1ec1056', 'Eko Novianto', 'Kalbar', '11/04/2022', '11:26:37', '31122', 6910000, '6816c5f73a460719fd06ba0b0efde9b2.jpg', 2, '2022-04-11 11:53:01', '49', 1, '', ''),
(53, '18079875622ff38c3e63d', 'Veronika veti vera', 'Bank kalbar', '11 / 04 / 2022', '11 : 15', '49140', 6660000, '64c4b9f3301a6457ef9d0a2b478fac3e.jpg', 2, '2022-04-12 11:36:58', '45', 1, '', ''),
(54, '155117876231b2d57600c', 'Paulus miki ason', 'Bni', '11-4-2002', '14:39:38.108', '678880239370', 1510000, 'a1d31109f7adafd0af00bf6375d79574.jpg', 2, '2022-04-20 11:21:46', '49', 1, '', ''),
(57, '498132536209c796d440f', 'Rizky indrawan', 'Bank kalbar', 'Selasa 12 _04_2022', '10:29:42', 'Tl09/13', 6910000, '48999cf7078445376ef05e7d39f64d22.jpg', 2, '2022-04-12 11:32:23', '45', 1, '', ''),
(58, '17803437620a3113165f5', 'BORTNIANSKI SENJUNSI', 'BANK KALBAR', '12/04/2022', '11:35:01', '15', 1510000, '22679c325d39e446680c37fd3f818487.jpg', 2, '2022-04-20 10:54:31', '49', 1, '', ''),
(60, '1714879962065d7bb5a60', 'ADVENTUS RICXY PRATAMA', 'Bank Kalbar', '12/04/2022', '13:51:14', '49', 6910000, '3bc5eb26d515fd46251bf412b2ef40df.jpg', 3, '2022-04-20 10:46:51', '49', 1, '', ''),
(61, '1714879962065d7bb5a60', 'ADVENTUS RICXY PRATAMA', 'Bank Kalbar', '13/04/2022', '13:51:14', '49', 6910000, '5f787a5b08fb9368ea175465f79300f8.jpg', 2, '2022-04-20 10:45:12', '49', 1, '', ''),
(63, '118911066201df416c924', 'Genita Oktaviani', 'Bank Kalbar', '13/04/2022', '11:00', '21294', 4000000, '9ef9bb51c0da0f03e1aa43585d4a0201.jpeg', 2, '2022-04-20 10:35:07', '49', 1, '', ''),
(65, '198756736218a22c724e5', 'SRI LESTARI', 'BRI', '13/04/2022', '14:14:01', '20220413141353144737', 6660000, '592c7958d194fa8a4332b5d1245870a0.jpeg', 2, '2022-04-20 11:38:56', '49', 1, '', ''),
(66, '63325725621a44360cc2f', 'Yenti Tuti Apra', 'Kalbar', '13/04/2022', '09:58:02', '38142', 1510000, '87daff88c9d5add55c0e193c64d2bcd2.jpeg', 2, '2022-04-21 09:00:14', '49', 1, '', ''),
(68, '2102925062162dbb37295', 'LORENSIA VIVIN ANJELINA', 'KALBAR NANGA MAU', '13/04/2022', '09:53:30', '36738', 1510000, 'a15d79a5b5bb9d4862999cb1cd56a03f.jpeg', 2, '2022-04-21 08:17:52', '49', 1, '', ''),
(69, '131784926201c778c4d9d', 'YULIANA', 'Bank BRI', '14/04/2022', '08:26:12', '137918', 6910000, '516c63680c855c9ec0b1705aa62242b8.jpg', 2, '2022-04-20 10:32:21', '49', 1, '', ''),
(70, '177983516210535f236ee', 'Agus leo hasibuan', 'Bank kalbar', '14/04/2022', '17:44:25', '897430544230', 6910000, '7548c5da7ab2be8fa5113379ea4a1235.jpg', 2, '2022-04-20 11:10:24', '49', 1, '', ''),
(93, '175937856200e148ef286', 'CRISMAS AYU UTAMI', 'bank kalbar', '14/04/2022', '09:45:16', '945150', 1510000, '09a2e336e9a9547207742e5630cef843.jpeg', 2, '2022-04-20 13:29:50', '49', 1, '', ''),
(72, '1932989561fb8f47a502f', 'LEONARDUS ALDO', 'BANK KALBAR', '14/04/2022', '11:01:37', '141113580004878', 2500000, '54b645aaf32f84d660fc8300addc6245.jpg', 2, '2022-04-20 10:22:23', '49', 1, '', ''),
(73, '14338527620b98254ff71', 'SINTA CHRIS MARLESTY', 'BANK KALBAR', '12/04/2022', '10:47:02', '29952', 6910000, '9fcdb493347899d13e5f40d9863b4d22.jpeg', 2, '2022-04-20 10:58:59', '49', 1, '', ''),
(74, '1723553361fb7156c5441', 'Nia selfiana', 'BRI-Sophie Agus Adhari', '15april2022', '13:03', '5148', 6910000, 'ee5c37fe7ec61e4c1e51e13ed913c023.jpg', 2, '2022-04-20 14:26:32', '49', 1, '', ''),
(76, '12290226622f45eb9846f', 'Novel Daviria Lenfi', 'BRI', '15/04/2021', '16:11:44', '48204', 6910000, '2795e3ffb5ea5bbd420df0a8ef7a4384.jpg', 2, '2022-04-20 11:26:32', '49', 1, '', ''),
(77, '15424269620e3dd488754', 'Nelly Ana', 'Kalbar', '14/04/2022', '13:36:15', '32292', 6660000, '5d085337f3ad8f24b166592aedff33b8.jpg', 2, '2022-04-20 11:01:05', '49', 1, '', ''),
(78, '106864276220606540ea9', 'Yohanes Kusnadi', '483001006147530', '15/04/2022', '18:11:13', '000003545622', 6910000, 'ac3745159cee01ce176c6f725cf69233.jpg', 2, '2022-04-20 11:30:00', '49', 1, '', ''),
(79, '8665505561fc9c8817223', 'RENDI FIKRIAN AKMAL', 'BANK BRI', '16/04/2022', '08:08:06', '1656', 6660000, '7227de5ef66638291d8e2cdaeef80da9.jpg', 2, '2022-04-20 10:25:25', '49', 1, '', ''),
(81, '194516106201b3801e293', 'REZALDI GUNTARA', 'BRI', '15/04/2022', '10:40:28', '341026', 4760000, '6882c846d02379a772e8f04a8191b820.jpg', 2, '2022-04-20 10:29:12', '49', 1, '', ''),
(82, '175719716231dbf1a8774', 'Rikka Aryani', 'Bank 5000', '16/04/2022', '09:26', '51012', 6910000, '19d6503ec934af12d9da9b6ab20236cf.jpg', 2, '2022-04-20 14:22:04', '49', 1, '', ''),
(83, '7686307361fb6ca8a5aff', 'YUNIZA', 'BRI', '16/04/2022', '10:10:20', '888601', 4760000, '5468d015c8ddc64686479164fea6198b.jpg', 2, '2022-04-20 10:08:51', '49', 1, '', ''),
(92, '19253063623e7811a38df', 'Theresia Dila Rananda', 'Bank Kalbar', '15/04/2022', '13:03:28.234', '061320103270', 6660000, 'df54fdd3f882dbc28b649f3fd7a31948.jpg', 2, '2022-04-20 13:32:31', '49', 1, '', ''),
(85, '1702027861fb7d5ed913f', 'SONIA HARDIYANTI', 'BANK KALBAR', '18/04/2022', '08:56:14', 'TL01.08', 6910000, '85f0c51f1729fc1df9e2fd46f7e4b2b2.jpg', 3, '2022-04-20 10:20:37', '49', 1, '', ''),
(86, '1702027861fb7d5ed913f', 'SONIA HARDIYANTI', 'BANK KALBAR', '18/04/2022', '08:56:14', 'TL01.08', 6910000, '1674c15ba545b28e75006650527f23ba.jpeg', 2, '2022-04-20 10:20:25', '49', 1, '', ''),
(87, '21358873620a18d0a9d4d', 'NANA DAHRIYANTI', 'PT INKLUSI KEUANGAN NUSANTARA', '19/04/2022', '08:57', '28080', 6660000, 'ef79866042fc1f8fba4cd87d471a26a3.jpg', 3, '2022-04-20 10:52:05', '49', 1, '', ''),
(88, '21358873620a18d0a9d4d', 'Nana dahriyanti', 'BRI', '19/04/2022', '08:57', '010623/PB', 6660000, '4c76807a78db42637ddb5347d02f4a48.jpg', 2, '2022-04-20 10:50:41', '49', 1, '', ''),
(89, '12420662620b0a348e040', 'Marsela Tifani putri Yolanda', 'BANK KALBAR', '18/04/2022', '14:31:30', 'TL01.83', 2000000, 'ce59cdc74a2054a6c7fea5a9be511de1.jpg', 2, '2022-04-20 10:57:31', '49', 1, '', ''),
(91, '19945356620f30cc444bc', 'Maysanda', 'BRI', '18/4 /2022', '16:57', '6899', 4760000, '32beaae2e0a05a14067480153bb33033.jpg', 2, '2022-04-20 11:03:44', '49', 1, '', ''),
(94, '130626386201c042c8382', 'oktaviana itis helda', 'bank kalbar', '15/04/2022', '18:02:16', '601580', 6910000, 'f4e8f73c80bf53b028c5c94a453c0ce6.jpeg', 2, '2022-04-20 13:46:52', '49', 1, '', ''),
(95, '5929541462145f8f2c425', 'supirman', 'bank kalbar', '13/04/2022', '10:16:56', '28', 6660000, 'e18d7be7ceabcb3a75e55b5cc1692243.jpeg', 2, '2022-04-20 14:04:45', '49', 1, '', ''),
(96, '163310986222c1d9a73c8', 'Nicko Wiratman', 'Bank BNI', '21/04/2022', '21.06.00', '20220421210601515823', 6660000, '385eef1d5b850f7b0d7ba277e9172525.jpg', 2, '2022-04-23 08:16:55', '49', 1, '', ''),
(98, '2137601361fb78969922e', 'Marselinus mau', 'Bank mandiri', '23/04/2022', '13:23;36', '211337215877', 6910000, '8c61f156ccab62b0435bc8563149fee0.jpg', 2, '2022-04-25 10:08:11', '49', 1, '', ''),
(99, '183720976200ce34455bd', 'Rieska Yosikha', 'bank kalbar', '21/04/2022', '13:31:50', 'Tl03/33', 6910000, '3ca49755626a74fba3c62f955c087f04.jpg', 2, '2022-04-25 10:25:43', '49', 1, '', ''),
(100, '63325725621a44360cc2f', 'Yenti Tuti Apra', 'Kalbar', '27/04/2022', '13:20:15', '38142', 3000000, '74122412bca3b042b7b6a4a0e195beea.jpg', 2, '2022-04-28 13:13:52', '49', 1, '', ''),
(102, '50717867620732da333f6', 'Veronika Rini', 'Bank Kalbar', '28/04/2022', '09:05:48', '002', 666000, 'be2faffab903b65ce3c21a13f28d4dd0.jpg', 3, '2022-04-28 13:16:11', '49', 1, '', ''),
(103, '50717867620732da333f6', 'Veronika Rini', 'Bank Kalbar', '28/04/2022', '09:05:10', '002', 666000, '9f94779f7b6c7adff8d9d02ae15f0d14.jpg', 3, '2022-04-28 13:16:17', '49', 1, '', ''),
(104, '50717867620732da333f6', 'Veronika Rini', 'Bank Kalbar', '28/04/2022', '09:05:48', '002', 666000, '2409951c8b57442f41732035824c4b98.jpg', 3, '2022-04-28 13:16:25', '49', 1, '', ''),
(105, '50717867620732da333f6', 'Veronika Rini', 'Bank Kalbar', '28/04/2022', '09:05:48', '002', 666000, '1cf45e36d547b12f05bc6f06c44c47dd.jpg', 3, '2022-04-28 13:16:31', '49', 1, '', ''),
(106, '50717867620732da333f6', 'Veronika Rini', 'Bank Kalbar', '28/04/2022', '09:05:48', '002', 666000, '19832a600101f4540c1bdf77efbcaed8.jpg', 3, '2022-04-28 13:16:37', '49', 1, '', ''),
(107, '50717867620732da333f6', 'Veronika Rini', 'Bank Kalbar', '28/04/2022', '09:05:48', '1.17', 6660000, 'eba6cad295b24eeb5c3c00f9b960bc8f.jpg', 2, '2022-04-28 13:15:26', '49', 1, '', ''),
(108, '50717867620732da333f6', 'Veronika Rini', 'Bank Kalbar', '28/04/2022', '09:05:48', '002', 666000, '44afed3f9658b773252f7b7cc64fd9bb.jpg', 3, '2022-04-28 13:16:46', '49', 1, '', ''),
(110, '25133609621371ad52f88', 'Yohanes Kusnadi', 'BRI', '27/04/2022', '16:04:58', '000003658216', 5000000, 'f731675683d082495d40803169f476bd.jpeg', 2, '2022-04-28 15:22:53', '49', 1, '', ''),
(111, '25133609621371ad52f88', 'Yohanes Kusnadi', 'BRI', '27/04/2022', '16:06:25', '000003674620', 1725000, '67edd8e0790f05b3f72342547f72b77f.jpeg', 2, '2022-04-28 15:21:44', '49', 1, '', ''),
(112, '927274916239d301b8f16', 'Wulandari lestari', 'bank kalbar', '11/05/2022', '14:05:00', '72', 1510000, '2fdd7a6f6ddc006c0747ae236439a6dd.jpeg', 3, '2022-06-20 08:19:18', '49', 1, '', ''),
(113, '833691926242c9bc5e79a', 'LAURENSIUS HENDRA', 'KALBAR', '13/05/2022', '10:51:37', '1.48', 6660000, 'f34ff60ab014bdca5f948ada74f4bc9d.jpg', 2, '2022-05-18 08:43:56', '49', 1, '', ''),
(114, '14483291625e7d81aa732', 'wulandari lestari', 'BANK KALBAR', '11/05/2022', '14.30', 't 072', 1510000, '435785377e3231bd762f002ea17e6234.jpeg', 2, '2022-06-16 15:39:31', '45', 1, '', ''),
(115, '2003469961fb88dcb1bfa', 'MARIA ELVINDA SEVTIA NINGKAU', 'bank kalbar', '24/05/2022', '12:53:58', 'TL01.17', 6660000, '6d65a4a512ca1765e8b82df08f312ff3.jpeg', 2, '2022-05-27 13:57:56', '49', 1, '', ''),
(116, '13951185626614738a4d4', 'Abdul Heri', 'KALBAR', '31/05/2022', '08:24.57', '124722', 1510000, '735004d25eed87df646396cbc8d6987b.jpeg', 2, '2022-06-03 11:45:25', '49', 1, '', ''),
(117, '2102925062162dbb37295', 'Lorensia Vivin Anjelina', 'Kalbar Nanga Mau', '02/06/2022', '11:20:47', '36738', 2150000, 'aac5dee1d16fff7a1b9bdbae06df842b.jpg', 2, '2022-06-03 11:26:38', '49', 1, '', ''),
(118, '12160370625f706185001', 'Miranda syahfitri', 'BANK KALBAR', '07/06/2022', '9:33:21', '040 KBK040TL09 D23040TL09 00000 024', 666000, '56a1e086e3c06f919041a6b131345158.jpg', 3, '2022-06-09 14:43:36', '49', 1, '', ''),
(119, '12160370625f706185001', 'Miranda syahfitri', 'BANK KALBAR', '07:06:2022', '9:33:21', '040 KBK040TL09 D23040TL09 00000 024', 6660000, '7c58a4c836bdfdc596fea8602c8c67bb.jpg', 2, '2022-06-09 14:43:51', '49', 1, '', ''),
(120, '148867676245a5317a4ec', 'IBU JULIANTI SITINDAON', 'BANK BNI', '13 Juni 2022', '16.18', '8402', 6660000, '28a64c7f7144982c2934f95ca199ce01.jpg', 2, '2022-06-14 15:05:43', '49', 1, '', ''),
(121, '420723216242fd919b8ad', 'MARIA LUPITA', 'BANK KALBAR', '14/06/2022', '10:17:35', '1:23', 6660000, '8ad7f38b7269b5eecf8fbd699bd6ac2c.jpg', 3, '2022-06-14 14:59:37', '49', 1, '', ''),
(122, '213995176287a37ec276e', 'Enjelita', 'Bank kalbar', '14/06/2022', '9:18:05', 'Tl03/12', 6910000, '010274105f13352e5db40e4416c19b8f.jpg', 2, '2022-06-14 14:21:42', '49', 1, '', ''),
(123, '12253862627c8885803d1', 'FARIZKA SHERLY PANGARIBUAN', 'BNI', '14/06/2022', '10:47', '000000009090', 1510000, 'a058fc170b1d873aa64a72b64f0307ef.jpg', 2, '2022-06-16 13:46:30', '45', 1, '', ''),
(131, '61085857625fc38e8ca06', 'RENA', 'Bank kalbar', '14/06/2022', '14:19:59', 'T056', 6910000, 'b376a99d95347be15109ea0f0bd86268.jpg', 2, '2022-06-14 14:57:02', '49', 1, '', ''),
(187, '1560143262667f03d107b', 'Alda Putri Anggriawan', 'Bank Kalbar', '17/06/2022', '9:29:04', '126360', 6660000, 'b686719008451f24114e536c3f428c68.jpeg', 2, '2022-06-17 14:14:06', '45', 1, '', ''),
(186, '17171239624a6b69883a1', 'DIAN WAHIDAH SARI', 'Bank kalbar', '16/06/2022', '17:55:48', '283210555470', 6910000, '1ce5213b8562fe4668ac2f38a54dd15f.jpg', 2, '2022-06-17 14:24:51', '45', 1, '', ''),
(185, '10182076625e1e7ab26ba', 'ANGELA JENIA', 'BANK KALBAR', '15/06/2022', '09:10:20', '015', 6660000, '6ffc22d77b52277b93f64fc9e6740741.jpg', 2, '2022-06-17 14:22:13', '45', 1, '', ''),
(129, '420723216242fd919b8ad', 'MARIA LUPITA', 'BANK KALBAR', '14/06/2022', '10:17:35', '1:23', 6660000, 'e731dae0b2b167125359ae77a4144e6e.jpg', 2, '2022-06-14 14:59:24', '49', 1, '', ''),
(132, '32179089624aba428d5d7', 'ELLY DIANA', 'KALBAR', '14/06/2022', '10:56:10', '0401L06 D23040TL06 00000 051', 1510000, '9df93b9bcd515fbb0f89c05ed6da57f9.jpeg', 2, '2022-06-16 14:28:10', '45', 1, '', ''),
(133, '134465016248162930c22', 'MEIMI FRANSISKA', 'KALBAR', '14/06/2022', '11:23:22', '040 KBK0401L06 00000 051', 1510000, '406710c031b2cb256fdcaab800d44b46.jpeg', 2, '2022-06-16 14:31:23', '45', 1, '', ''),
(134, '12066840629054f7c65a4', 'KRISTINA YORPA ZANEKSA', 'KALBAR', '14/06/2022', '18:07:27.015', '263990607240', 2700000, 'e8ca22118d18833ec55731406121c3ea.jpg', 2, '2022-06-16 13:31:41', '45', 1, '', ''),
(136, '1437240862995f8b61064', 'Yohanes Ayamin', 'Bank Kalbar', '14/06/2022', '13:00', '210600', 1510000, '3224e8990265916900c4233c9aebf6b5.jpeg', 2, '2022-06-16 13:23:15', '45', 1, '', ''),
(137, '4159031362997369148a0', 'ROSARIA SONATA', 'Barlindo', '14 jun 2022', '21:42:59.123', '518660942570', 3000000, '4a60c57cf022f3e2c07278c6b57db0cc.jpg', 2, '2022-06-16 12:07:20', '45', 1, '', ''),
(178, '22941030624c3c4527d65', 'Rosaria Maharani', 'Bank KALBAR', '16/06/2022', '10:49:19', '18', 1510000, '34c86206d0059c7e3dd41e4a36d17eb7.jpg', 2, '2022-06-16 15:07:45', '45', 1, '', ''),
(177, '38426723628c6ede5b6df', 'JUSTHIN MARCELLO', 'BNI', '16/06/2022', '12:22:07', '20210616122206298609', 6910000, 'fdce8ddf2da6c68a6c651613cc0ba96b.jpg', 2, '2022-06-16 15:21:33', '45', 1, '', ''),
(143, '1975752962983814b7afa', 'TRI RATNA SARI', 'Bank Kalbar', '15/06/2022', '09:36:36', '123', 6910000, '96b29906c8bce937eab4cdfea15b35b5.jpg', 2, '2022-06-16 13:25:41', '45', 1, '', ''),
(145, '955607026267965410fce', 'LIAWINA MUTIA', 'BANK KALBAR', '13/06/2022', '10:52:54', 'TL06/10', 6660000, 'bb1317c4c191aa7bf14a00b195eca0b3.jpeg', 2, '2022-06-16 13:58:34', '45', 1, '', ''),
(146, '16242394627deb4656ab9', 'Nesia Marsyenehemia', 'Bank Kalbar', '15/06/2022', '8:36:10', '166374', 6660000, '212e718b860c545dd9e61c402d077f64.jpeg', 2, '2022-06-16 13:40:36', '45', 1, '', ''),
(175, '13425970627afb1893d1a', 'Simplisius Febriananda Ude', 'Bank kalbar', '16/06/2022', '12:46:53', '060 KBK060TI01 D23060PT01', 6660000, '59b893c20794709b75f89c9fd2a28419.jpg', 2, '2022-06-16 14:21:50', '45', 1, '', ''),
(148, '76124920625fa263db104', 'ANGELINA SEPTIANI CLARA', 'BNI', '15/06/2022', '13:10', '113724', 6910000, '20c0804911c9bc93450b0d1cea86e0ca.jpg', 2, '2022-06-16 14:07:00', '45', 1, '', ''),
(149, '91665820624fc4156d5ee', 'Angela Stevani', 'Bank Kalbar', '15/06/2022', '13:04:01', '291890104000', 6910000, 'c57b514fdac7eaf2ff550392e52ebf02.jpg', 2, '2022-06-16 14:24:34', '45', 1, '', ''),
(173, '798557856285b7d2ccebc', 'Rosti', 'Kalbar', '16/06/2022', '13:05:18', '002', 6910000, '19fb9af4106fa5d96d0ca0bcd8656823.jpg', 2, '2022-06-16 14:18:49', '45', 1, '', ''),
(184, '16834446627b60923e97a', 'Tani', 'Bank kalbar', '15/06/2022', '14:07:37', '159822', 4000000, '2ab32574e5a4bafc9e532dba98c83bd9.jpg', 2, '2022-06-17 14:11:01', '45', 1, '', ''),
(193, '65387929629470fa5a6b7', 'Meisin Wulandari', 'BANK KALBAR', '16/06/2022', '11:36:53', 'TL06/28', 3000000, '7097d13317763440d1718d19f227c462.jpeg', 2, '2022-06-18 08:11:13', '45', 1, '', ''),
(154, '4159031362997369148a0', 'ROSARIA SONATA', 'Barlindo', '15 jun 2022', '15:00:14,943', '518660300080', 250000, 'cd865f4e8c2cbbf09c67e580c70bd708.jpeg', 2, '2022-06-16 12:21:03', '45', 1, '', ''),
(189, '1945954662348130eec1b', 'IIN WAHYUKU', 'BANK BNI', '16/06/2022', '14:27:41', '308193302', 6910000, '4fe9cff01875eb94cbe025d2b07c695f.jpg', 2, '2022-06-17 14:37:38', '45', 1, '', ''),
(188, '570142486249841a4157a', 'Tati Sumira', 'Bank Kalbar', '17/06/2022', '09:23:52', '001584', 1510000, '5fee2db59de4d53b83582f36f167f553.jpg', 2, '2022-06-17 14:35:09', '45', 1, '', ''),
(182, '40929391628ccbea16d32', 'Imellia', 'Bank Kalbar', '16/06/2022', '10:35:31', 'KRK041PC01 (195390)', 1510000, '92edbd361f87cdae005b38f6f94e7fbd.jpg', 2, '2022-06-17 14:05:56', '45', 1, '', ''),
(180, '174862186299b31cdce63', 'Yuda kustian', 'Bank Kalbar', '14/06/2022', '11:12', '123', 6910000, '73982cdabe67898cdb0737da5a7ce17a.jpg', 2, '2022-06-16 15:42:27', '45', 1, '', ''),
(181, '17671528626e92a356001', 'Pransiska Aprilia', 'BANK MANDIRI', '16/06/2022', '15:06:52', '140400', 6910000, 'aa99691e95dc1b1b7858a0196eb1ce60.jpg', 2, '2022-06-16 15:34:19', '45', 1, '', ''),
(164, '160160736243932e16682', 'Dwi sri aprianti', 'Kalbar', '15/06/2022', '11:10:57', '0118', 6910000, 'cf80f05e38ccbd1ba56051b3f08f70c5.jpg', 2, '2022-06-16 14:57:37', '45', 1, '', ''),
(165, '19534314628ae33256b39', 'Mariana Ratu Ayu', 'BANK KALBAR', '16/06/2022', '8:30:15', '4010006517', 1510000, 'e78cc7352312017c43f7bde190c14b72.jpg', 2, '2022-06-16 13:34:26', '45', 1, '', ''),
(176, '18431177625e70ccf3380', 'MILDA SHAFIRA', 'BANK KALBAR', '16-06-2022', '12:50:56', '002', 6910000, 'a5073101ad7d012bc12d0e8b13d99d67.jpg', 2, '2022-06-16 15:14:27', '45', 1, '', ''),
(170, '253497876290577126df0', 'Gedy Christiano Ronaldo', 'Bank Kalbar', '16/06/2022', '11:30', '4010006517', 6910000, '507f1109bdcc90f4f16f75ed1529ecf1.jpg', 2, '2022-06-16 13:29:30', '45', 1, '', ''),
(172, '17148830628472662fdc6', 'Aurelia Juniarti', 'Bank KALBAR', '16/06/2022', '11:30:49', '500628864791', 6910000, 'd449cf70e469557b31f1f127a7ecd1c1.jpg', 2, '2022-06-16 14:03:10', '45', 1, '', ''),
(191, '16058695628a13283328c', 'RUTH OKTA HACITA DEA', 'BANK KALBAR', '16/06/2022', '13:33:42', 'T22', 4760000, '4d0ae2e424e5b3814a5acb9dbd5f1e8a.jpg', 2, '2022-06-17 14:27:32', '45', 1, '', ''),
(192, '23838550629026392d8fd', 'rola sandika', 'bank kalbar', '17/06/2022', '14:05:53', '006259', 6910000, '19bb0f497465c899f2cbd2e42482085e.jpg', 2, '2022-06-18 07:58:04', '45', 1, '', ''),
(194, '10532360629ac55843fc3', 'Yeni Mariani.L', 'Bank kalbar', '17/06/2022', '1:44', 'Yeni Mariani.L 2003', 6910000, 'e4dd89c98b339941f7d3eece014ab2cc.jpg', 2, '2022-06-18 07:49:54', '45', 1, '', ''),
(195, '15868715629430b310f48', 'Rika', 'Kalbar', '17 /06/2022', '09:04:51', 'TL09/06', 6660000, '831f233a51e8bb6d7b94cee3259638da.jpg', 2, '2022-06-18 07:52:26', '45', 1, '', ''),
(208, '14581941629d6c9f5ecce', 'Yeni Yuspitasari', 'Bank Kalbar', '17/06/2022', '14:57:17', '002194', 6910000, '855be8fa6451d8246c606324dca92114.jpg', 2, '2022-06-18 10:37:32', '45', 1, '', ''),
(197, '396380796288d1aadee34', 'Ibu henny', 'Bni', '17/06/2022', '13:01', '07635', 6910000, '524d19aae66b84cca6cd909af3e63aac.jpg', 2, '2022-06-18 08:02:58', '45', 1, '', ''),
(213, '12554769624417ccaccb1', 'Transfer', 'Kalbar', '19/06/2022', '17:42:30', '518660542280', 6660000, '23333d9f88809f434b4b6a761cc9fe81.jpg', 2, '2022-06-20 11:24:06', '49', 1, '', ''),
(203, '5936826762846b66cb366', 'Indah lestari', 'Bank kalbar', '17/06/2022', '14:38:33', '4010006517', 6910000, '548037cdc97ef2ac64b62216cd6e47f3.jpg', 2, '2022-06-18 08:06:14', '45', 1, '', ''),
(211, '14581941629d6c9f5ecce', 'Yeni Yuspitasari', 'Bank Kalbar', '17/06/2022', '14:57:17', '002194', 6910000, '957966ce9419061c1cd13ecd41dbb20d.jpg', 3, '2022-06-20 07:37:20', '49', 1, '', ''),
(205, '14354031627b260a218fc', 'Kristianus arianto', 'Bank kalbar', '17/06/2022', '10:41:13', '500586715394', 6910000, '26f54ac02a66832d1257753c922ebf22.jpg', 2, '2022-06-18 08:07:50', '45', 1, '', ''),
(212, '14554847628b03c81840e', 'PRANSISKUS SENSI', 'BANK KALBAR', '17/06/2022', '13:38:02', 'UMM.02', 1510000, '8c6f7f79a2654345d42ce7be2e02485d.jpeg', 2, '2022-06-20 11:35:10', '49', 1, '', ''),
(214, '927274916239d301b8f16', 'wulan', 'bank kalbar', '04/04/2022', '09:19:18', 'T07', 6660000, '4db3a84368035064466579be5fe63cab.jpeg', 3, '2022-06-20 08:19:42', '49', 1, '', ''),
(216, '12191273626b6f1c225f0', 'Modesta Mayasari', 'Bank Mandiri', '17/06/2022', '14:56:19', '2206171121187250411', 6910000, '89b5bae6fce31de4ca08595d42daaccc.jpg', 2, '2022-06-20 11:21:24', '49', 1, '', ''),
(217, '46581010628873cb15683', 'Dea Arisetya Ningsih', 'Bank kalbar', '20/06/22', '09/15/50', '003614', 2000000, '483dc96f948e2f00a5a8da8b9de3e502.jpeg', 2, '2022-06-20 11:16:18', '49', 1, '', ''),
(222, '11223110627a1a580d749', 'Dea lova', 'Bank kalbar', '20/06/2022', '10:34:53', 'T16', 6910000, 'fd2b09efce6eecfae1e3ff9d5b4ee4e7.jpeg', 2, '2022-06-20 11:26:32', '49', 1, '', ''),
(219, '500359936298119c874a5', 'Stefani maharani', 'Prkmpuln Bdn pend karya bangsa', '20 Juni 2022', '9:58:28', 'TL 03/22', 6910000, '5f6c1fa38b9fee83587282b1349d72c0.jpg', 2, '2022-06-20 11:30:15', '49', 1, '', ''),
(220, '177845396266941a41a2e', 'angela stefani', 'bank kalbar', '20/06/2022', '10:00:44', 'TL03/23', 6910000, 'aa577df7fef7f27d7b6b9de3f229e1a3.jpeg', 2, '2022-06-20 11:24:46', '49', 1, '', ''),
(221, '14386690627f176944a27', 'YOHANA', 'bank kalbar', '15/06/2022', '13:42:32', '60TL01/048', 6660000, 'cce21f811fbbf7b5156e52062df6431a.jpeg', 2, '2022-06-20 11:22:39', '49', 1, '', ''),
(223, '18487923627b5848ce844', 'BARTOLOMIUS SUSANTO', 'BANK KALBAR', '20-06-2022', '10:47:44', '036', 6910000, '5c9ead099676a595e817c6c70a532475.jpg', 2, '2022-06-20 13:52:10', '49', 1, '', ''),
(226, '14874096625e55b01f517', 'Seri wanti', 'BANK KALBAR', '20/06/2022', '09:26:48', '1.12', 6910000, '8e6d1e4e42eab1ebd420626db3f9f215.jpg', 3, '2022-06-20 13:40:21', '49', 1, '', ''),
(270, '2045710462871095a6f56', 'ROSA PATREISIA SINDY', 'bank kalbar', '21/06/2022', '09:52:13', '06/12', 6660000, 'ae790971788ef0c411be134535574f63.jpeg', 2, '2022-06-21 11:12:14', '49', 1, '', ''),
(228, '12191273626b6f1c225f0', 'Modesta Mayasari', 'Bank Mandiri', '17/06/2022', '14:56:19', '2206171121187250411', 6916500, 'bc7a47b55861a32cf56b5ea45e37da71.jpeg', 3, '2022-06-20 13:45:32', '49', 1, '', ''),
(229, '14874096625e55b01f517', 'Seri Wanti', 'BANK KALBAR', '20/06/2022', '09:26:48', '1.12', 6910000, 'c19316edf8e6f3c0acf5d115db0428b4.jpg', 2, '2022-06-20 13:40:14', '49', 1, '', ''),
(230, '10739684626d10f328f23', 'Martin Edika Tabun', 'BANK KALBAR', '20/06/2022', '11:14:14', '137826', 6910000, '3eff49f666098cabb001f7baedbcc467.jpg', 2, '2022-06-21 11:23:24', '49', 1, '', ''),
(231, '19790049629ac547b01ea', 'Modesta mina', 'Bank kalbar', '20/6/2022', '10:65:22', '043 KHK0431101 D230431101 00000 063 KHK043PC01', 6910000, 'faef91f20d68ad7ebf27a1c83a74d986.jpg', 3, '2022-06-20 13:49:19', '49', 1, '', ''),
(232, '19790049629ac547b01ea', 'Modesta mina', 'Bank kalbar', '20/06/2022', '10:65:22', '043 KHK0431101 D230431101 00000 063 KHK043PC01', 6910000, 'ef3aebcc5c7ada25ef159270ab0b7f51.jpg', 2, '2022-06-20 13:50:42', '49', 1, '', ''),
(233, '1313704862438c7f069bc', 'Yolanda', 'Bank kalbar', '20/06/2022', '08:55:23 WIB', '455726849185', 6660000, '2fd2001a595cc9acc695f44a8e087aa4.jpg', 2, '2022-06-20 13:44:53', '49', 1, '', ''),
(257, '75274065629829876c4cb', 'Hestian iryandhi', 'bank kalbar', '17/06/2022', '12:45:25', 'IL05/28', 5500000, '8484d37acccd82900af728febddc6ac2.jpeg', 2, '2022-06-20 15:10:24', '49', 1, '', ''),
(256, '20849357629c18f185bad', 'APRI WANUS KRISMANTO', 'BRImo', '19/06/2022', '08:00:08', '0569', 1510000, 'fd7e83cfbaefcfa985cfa2590d06ec6a.jpeg', 2, '2022-06-20 15:06:05', '49', 1, '', ''),
(250, '8521868462455f1a52621', 'Yoseph Gusti Randa', 'bank kalbar', '20/06/2022', '10:19:14', 'TL03/29', 6660000, '92eec88f6ffb64024ef062c646b73bf0.jpeg', 2, '2022-06-20 14:03:18', '49', 1, '', ''),
(251, '95975716624968d295ae8', 'Yoseph Gusti Randa', 'bank kalbar', '20/06/2022', '10:18:34', 'TL03/28', 6660000, 'ef34d07eb44fa4097e6d419aca831879.jpeg', 2, '2022-06-20 14:03:07', '49', 1, '', ''),
(252, '13573424629ec19bbf314', 'Tiara Nisa', 'Bank Kalbar', '20/06/2022', '10:48:40', '26', 6910000, 'c6a64486e59926ce0df13ea69b0ab446.jpg', 2, '2022-06-20 14:44:27', '49', 1, '', ''),
(255, '2268908462493e1bc177c', 'Farizatul Hasanah', 'bank kalbar', '20/06/2022', '13:16:27', 'TL1/49', 2000000, 'd1015a529103eef4f1d0994ea48943d1.jpeg', 2, '2022-06-21 11:12:42', '49', 1, '', ''),
(254, '10101329628c8224eac0b', 'Yunita Sarah', 'Bank Kalbar', '20 Juni 2022', '12.00', '401006517', 6910000, '9e7ebf5ff7abd51f517c49f9da9ea35f.jpg', 2, '2022-06-20 14:58:57', '49', 1, '', ''),
(241, '77116834629da4738ea44', 'HENDRIK SUGANDI', 'KALBAR', '20/06/2022', '11:28:43', 'TL09/22', 4760000, '98b2e3a78ecda1216b970bef2b3f4742.jpg', 2, '2022-06-21 11:21:12', '49', 1, '', ''),
(264, '82708341627b64da54960', 'Oktavia Eva Wulandari', 'Bank Kalbar', '21/06/2022', '09:38:43', '123', 6910000, '64450af29d2a7fc91f4de6a37a953d6e.jpg', 2, '2022-06-21 11:25:41', '49', 1, '', ''),
(263, '1226483262844a30756e0', 'Cariswanti', 'Bank Kalbar', '21/06/2022', '09:10:16', '176904', 3500000, '8e12714528849033ff483ea8a88ae0a6.jpg', 2, '2022-06-21 11:03:06', '49', 1, '', ''),
(271, '6726096662941f2235138', 'Ester Karolina', 'Bank Kalbar', '21/06/2022', '09:04:46', '1234', 6660000, '6128d763dd3ffc8c8f08f210c18854fe.jpg', 2, '2022-06-22 10:23:25', '49', 1, '', ''),
(261, '119752796290b3447b1df', 'Winoto Harjolukito', 'Bank Kalbar', '21/06/2022', '07:10:35', '519510710330', 6910000, '38d888a9759d79a97b6160cbfa01163c.jpeg', 2, '2022-06-21 10:56:08', '49', 1, '', ''),
(260, '19974957625bb8fc596f4', 'Apriana Dea Laurenja', 'Cu keliling Kumang', '21/06/2022', '07:49:12', '104130', 6660000, '6cbdf8a25af36318fc9c499ca2f72c51.jpeg', 2, '2022-06-23 14:52:42', '49', 1, '', ''),
(259, '36021255628cae2678336', 'Devi Dara Chintya', 'Bank Kalbar', '19/06/2022', '11:29:08', '195156', 4500000, '56ad9336406870cf86c5743fef490e77.jpg', 2, '2022-06-21 11:26:43', '49', 1, '', ''),
(265, '157422946270a2a6d6134', 'Evi Sulastri', 'Bank Kalbar', '19/06/2022', '13:31:50', '455640862662', 6910000, 'e9ef00a77a3b5fe9352c039cb8448f28.jpg', 2, '2022-06-21 10:59:48', '49', 1, '', ''),
(258, '370919836279df9b053ef', 'Sufutrayadi', 'bank kalbar', '14/06/2022', '11:25:40', '05/15', 6500000, '59080b0ad4d1c09cd1d340f65d5f80b8.jpeg', 2, '2022-06-20 15:13:38', '49', 1, '', ''),
(269, '17248739625fa4cd627d8', 'APRI ELINA FITRI', 'bank kalbar', '20/06/2022', '16:10:12', '0090', 1510000, 'affc355a2e155245f2af1d3f1a2ba6f4.jpeg', 2, '2022-06-21 11:07:08', '49', 1, '', ''),
(273, '150368086268c52689b87', 'Ibu Setia Hartani', 'BNI1308773951', '21/06/2022', '11:02:35', '100000680516', 6910000, 'c2054e992adfc3c3db51b548f1858a44.jpg', 2, '2022-06-21 16:17:36', '49', 1, '', ''),
(283, '1710887862674d5d61de8', 'Margareta Nadiya Agustina', 'Kalbar', '21/06/2022', '11:28:47', 'TL03/34', 3250000, '71e8f3304e7ff06dcad8bd94d1bdf5e2.jpg', 2, '2022-06-22 13:08:46', '49', 1, '', ''),
(276, '143448456263a94e4d636', 'MARIANI', 'Bank Kalbar', '21/06/2022', '11:50:23', '12334', 6910000, '39c8d07fc80befeccd872a2f637cc361.jpg', 2, '2022-06-22 11:07:29', '49', 1, '', ''),
(281, '214612516278ce651d44f', 'Tea Natalia', 'BANK KALBAR', '21/6/2022', '10:27:58', '22', 6660000, '697cde11486dbd2f2b4a126a5e2061f9.jpg', 2, '2022-06-22 10:16:15', '49', 1, '', ''),
(280, '203808296278cb46c90a0', 'NELLY AGUSTRIANI', 'Bank Kalbar', '21/06/2022', '10:23:20', '20', 6660000, 'e9830c2ea73bb680c4477fb7007c3d39.jpg', 2, '2022-06-22 10:12:18', '49', 1, '', ''),
(308, '18783653627e6cb9b581d', 'TEGUH PRATAMA', 'KALBAR', '22/06/2022', '09:13:24', '167544', 6660000, '596288867fadca5adb2a3af371aa46c7.jpg', 2, '2022-06-22 14:56:09', '49', 1, '', ''),
(299, '19326289628350040870a', 'FIKI FIDAYANTI', 'bank BNI', '21/06/2022', '11:35', '9253', 6910000, 'f4db1dc1b143c383f6a375602931d7ab.jpeg', 2, '2022-06-21 16:27:37', '49', 1, '', ''),
(286, '2207653362665d47b7f69', 'Maria Panca Sari', 'Bank Kalbar', '21/6/2022', '11:34:19', 'TL03/36', 3660000, '57b9698cc645c4940f864554a5f5977d.jpg', 2, '2022-06-22 11:30:50', '49', 1, '', ''),
(316, '49087147624555b8d733d', 'Agustina Devi Triana', 'bank kalbar', '22/06/2022', '09:01:32', '07', 6910000, '4690b092274cc784b649388c584f7e7f.jpeg', 2, '2022-06-22 15:24:00', '49', 1, '', ''),
(288, '14484306624670a75aa7b', 'REGINA MUTIA GEMINSIS', 'KALBAR', '21-6-2022', '13:37', '1.26', 6910000, 'c42fd0a9c63dd024212f8a830422925f.jpeg', 2, '2022-06-22 09:59:39', '49', 1, '', ''),
(290, '2859443462832360c5c92', 'EKA', 'BANK KALBAR', '21/06/2022', '12:12:51', 'TL02/39', 6910000, '3e513f25b5e8d171e5f03334d07b48b5.jpg', 2, '2022-06-22 09:47:25', '49', 1, '', ''),
(291, '5945344962779f82175eb', 'Widya', 'Kalbar', '21/06/2022', '09:42:21', '040 KBK040TL03  D23040TL03 00000 039', 6660000, '52ee6f8523accbe922856b2390f11830.jpeg', 2, '2022-06-22 10:54:53', '49', 1, '', ''),
(292, '1090287862884848085b6', 'Alif Faqih Hidayatul', 'Bank Kalbar', '21 Juni 2022', '13:15:18', '185094', 6910000, '40e6af74c129b0aebf4f0d90c7b3403b.jpg', 2, '2022-06-22 10:21:31', '49', 1, '', ''),
(293, '19049447626a3f6166593', 'DORKAS', 'Kalbar', '21/06/2022', '12:48:55', '072', 6910000, '6983daf84b9e56ea74cb9eb0547050a1.jpg', 2, '2022-06-22 10:24:39', '49', 1, '', ''),
(294, '9173711562787eb233959', 'Puja Laras Sati', 'Abang May Sujiman', '21/06/2022', '14:51:07', '149292', 6910000, 'ce6c94ef303056770c9d9e4229e8152b.jpg', 2, '2022-06-23 14:28:46', '49', 1, '', ''),
(296, '15251106625f7c98b7b41', 'Eni kandayanti', 'Kalbar', '21/06/2022', '13:54:22', '112086', 6910000, 'ff0042192f8ac0494bad971317c29a15.jpg', 2, '2022-06-22 13:43:23', '49', 1, '', ''),
(298, '72927432627a68a8dc7ab', 'Asyerina Ladau', 'Bank Mandiri', '21/06/2022', '11:19:41', '3182', 6660000, '48c3d8c112b251872c00796afa2e7f73.jpeg', 2, '2022-06-21 16:24:47', '49', 1, '', ''),
(328, '16668611628b4ee935d6f', 'Fetronila Kristiani', 'bank kalbar', '22/06/2022', '10:30:47', 'T10', 6910000, 'aa0e8147d4d48f7a070b6af592e101f4.jpeg', 2, '2022-06-22 15:01:33', '49', 1, '', ''),
(303, '428777226282f30f47f91', 'Wirna', 'BRImo', '21 Jun 2022', '15:15:05', '455935341588', 6910000, '02484553a48fefd4852005934a694d94.jpeg', 2, '2022-06-22 11:27:39', '49', 1, '', ''),
(304, '334185226279c47150a08', 'ARISANDY MARIO KOSSU', 'Bank Kalbar', '21 Juni 2022', '10:25:31', '21', 6910000, 'c1fffe76432b0900e322bff92a685faa.jpg', 2, '2022-06-22 11:25:19', '49', 1, '', ''),
(305, '59108632628d9c5763965', 'Anci liansi', 'Bank kalbar cabang Nanga pinoh', '21/06/2022', '13:59', '196092', 6660000, '5f534e4600e1017b5c1df2706f04aaac.jpg', 2, '2022-06-22 11:22:44', '49', 1, '', ''),
(326, '290833096294c9ebc6cf8', 'STEVANUS SEPTARIO TRIKURNIA', 'BANK KALBAR', '22/06/2022', '13:41:23', '062', 6910000, 'e74a266938ead154d427665b1ee7bd61.jpg', 2, '2022-06-22 16:32:41', '49', 1, '', ''),
(327, '14110358628c1aa80b2ec', 'NURUL AGUSTIEN', 'bank kalbar', '22/06/2022', '09:31:11', 'T20', 6910000, '26482fb60a4829fc343e0e261260f7e4.jpeg', 2, '2022-06-22 14:52:55', '49', 1, '', ''),
(310, '843958376295825f67622', 'Siti nurfarida', 'Bank kalbar', '22/06/2022', '10:01:19', 'TL04/8', 6910000, '771dc47085932c8e09220f14621f0b9c.jpg', 2, '2022-06-22 15:15:22', '49', 1, '', ''),
(325, '87094466627246533321e', 'Emelia  Varida', 'Bank kalbar', '22/06/2022', '10:12:19', 'TL03/08', 6910000, 'e75be4b98cf1af74fad26655c4e8dc18.jpg', 2, '2022-06-22 16:05:27', '49', 1, '', ''),
(313, '5895489962944a9352e82', 'Siska', 'Bank kalbar cabang nanya pinoh', '22/06/2022', '09:27', '203346', 3000000, 'e67680fa506506fe66e74d64a281f557.jpg', 2, '2022-06-22 16:18:59', '49', 1, '', ''),
(314, '41250370629ebe789e77e', 'Resoni lestianara', 'Bank kalbar', '22/06/2022', '9:21:42', 'T01', 4000000, '65fb7563528ab22becff421f4e241c6d.jpg', 2, '2022-06-22 15:12:31', '49', 1, '', ''),
(318, '14913979624c39e2304eb', 'Anggela juliana', 'Bank Kalbar', '22-06-2022', '12:18:54', '6515003931', 6910000, '8bee271192d8acbfe02b1a5a56acb73e.jpg', 2, '2022-06-22 16:35:55', '49', 1, '', ''),
(330, '104008356279bf32ab766', 'JENNY TRIASTITI', 'bank BSI', '22/06/2022', '09:36:48', '8458', 6910000, 'f04f9cf571f5efb959d5fa2796179dea.jpeg', 2, '2022-06-22 16:27:46', '49', 1, '', ''),
(329, '4615617662831710ce2c1', 'ELIN', 'bank kalbar', '22/06/2022', '10:45:22', '5110', 6660000, 'd2ba74572ed8c9c91e51e1faecd6d1ee.jpeg', 2, '2022-06-22 16:23:07', '49', 1, '', ''),
(392, '16834446627b60923e97a', 'Tani', 'Bank kalbar', '23/06/2022', '10:34:24', '159822', 2910000, '23dc0c6d7f551d349e0d48252cbe78a2.jpg', 2, '2022-06-27 14:56:39', '49', 1, '', ''),
(323, '68924369628246315d6be', 'Asni', 'bank kalbar', '21/06/2022', '08:43:38', '1.5', 6660000, '7ad4442d63737483d65894295fef54ec.jpg', 2, '2022-06-22 13:35:52', '49', 1, '', ''),
(324, '4682373062997f9787979', 'Libertus yoga', 'bank kalbar', '21/06/2022', '13:08:37', 'TL01/80', 2410000, 'e73947c07d82271d219077f08fa1c741.jpg', 2, '2022-06-22 13:42:15', '49', 1, '', ''),
(391, '726441816281fa8661173', 'Rachel Gustus Thecarriya', 'Kantor pos', '24/06/2022', '11.10:12', '4010006517', 6910000, 'db385742c578d2dda4fdd78e161b773b.jpg', 2, '2022-06-28 15:49:53', '49', 1, '', ''),
(386, '14357476628514016215b', 'Yuliarni lilik', 'Bank Kalbar', '24/06/2022', '10:18:11', 'TL03/29', 6660000, '50728eb4f63c2939972b00937441faba.jpeg', 2, '2022-06-27 14:23:27', '49', 1, '', ''),
(385, '11943560628601c51c333', 'Dewa Maru N. Djabar', 'Bank Kalbar', '24/06/2022', '09:53:10', 'TL03/25', 3600000, '72c4154f925f94b0e1270adcf41e916e.jpeg', 2, '2022-06-27 14:25:18', '49', 1, '', ''),
(336, '819291066274e20ae07a4', 'Bank Gopay', 'Bank Kalbar', '22/06/2022', '19:43:13', '062212425002089', 3250000, '4f6a39b42e630c0eac6e9338f5e4229e.jpg', 2, '2022-06-23 15:04:48', '49', 1, '', ''),
(337, '819291066274e20ae07a4', 'Bank Gopay', 'Bank Kalbar', '22/06/2022', '19:41:32', '062212410704336', 3660000, '5392cec6fb490b82b51db223f271a184.jpg', 2, '2022-06-23 15:04:53', '49', 1, '', ''),
(338, '19856083626d1b79894f1', 'RIKI FRANSISCO', 'BANK KALBAR', '23/06/2022', '9:36:55', '123', 6910000, '186d48c7db1d5a9af6680893ccbc920e.jpg', 2, '2022-06-23 15:11:22', '49', 1, '', ''),
(339, '46952773624aa6aa16e60', 'PITER FRIDSANCEZ BHATO', 'BANK KALBAR', '22/06/2022', '12:01:45', '95/16', 6660000, 'f47b225a4f24892ef6212c9a68f97f18.jpg', 2, '2022-06-23 15:19:48', '49', 1, '', ''),
(340, '70452582629c91ca50e6f', 'Agnes safrika asari', 'Bank Kalbar', '22/06/2022', '14:17:51', 'TL09/24', 6660000, 'dd2c1799549bb821c3ded90dd0eb88e7.jpg', 2, '2022-06-23 15:14:10', '49', 1, '', ''),
(341, '81333211625cdbdfcf770', 'Novia Sisilia Rifan', 'Kalbar', '23/06/2022', '09:45:53', '002', 6910000, 'e99e2d5e5e76c18c3399a383aa1a4df0.jpeg', 2, '2022-06-23 15:24:03', '49', 1, '', ''),
(343, '43585428627b1f930a36c', 'Sesilia Goreti', 'Bank Kalbar', '23/06/2022', '11:04:42', '16', 2000000, 'a6f686617a3b4714414255bd2aef4216.jpg', 2, '2022-06-23 15:53:21', '49', 1, '', ''),
(344, '196160736289dbbec54de', 'VERONIKA ANJELINA', 'Bank kalbar', '23/06/2022', '11:57:40', 'TI 04/20', 6910000, 'ce258383108564b4800ac25f1fe94585.jpg', 2, '2022-06-23 15:25:36', '49', 1, '', ''),
(372, '94338979624a7c901330a', 'Jeny any kalingsang', 'Bank kalbar', '23/06/2022', '08:58:03', '07', 6660000, '8d65770763ba293bd4b1ad00d535c589.jpg', 2, '2022-06-23 15:39:01', '49', 1, '', ''),
(388, '490527756260f4ee6067b', 'Resti Sofiah', 'BANK KALBAR', '24/06/2022', '10:32:35', 'TL065/14', 6910000, 'e1cecd7542a234b719898d9889706b70.jpg', 2, '2022-06-28 09:18:54', '49', 1, '', ''),
(498, '39431581629d8ee84c6ce', 'MINGKI SATARIA', 'bank kalbar', '24/06/2022', '09:58:59', '022', 1510000, '88d4cf0ef25ee8f97895bd4854e17532.jpeg', 2, '2022-06-27 14:38:41', '49', 1, '', ''),
(350, '8674401628871fcba323', 'Ocha kristiani', 'bank bni', '23/06/2022', '11:47:17', '3023', 6910000, 'e2c4b38cf6fbeadfc8adbf88f12ad565.jpeg', 2, '2022-06-23 15:07:53', '49', 1, '', ''),
(351, '820213316288612c2e915', 'Vergilius yogi', 'BANK KALBAR', '22/06/2022', '11:48:34', '500652225035', 6910000, '92bef2beb75ea8ca2caf8f11baf4e36b.jpg', 2, '2022-06-23 15:43:15', '49', 1, '', ''),
(373, '19394887628487c51414c', 'Sulastri', 'bank kalbar', '23/06/2022', '10:38:47', '23', 6910000, '773ee394c6f19c8c1717a0e26fed03a4.JPG', 2, '2022-06-23 15:51:23', '49', 1, '', ''),
(376, '1009769262788a6f6a9e4', 'Suprianus', 'Bank mandiri', '23/06/2022', '16:49:06', '217433308551', 6910000, '5b2767dc0e3605bf4cfe027a6302190e.jpg', 2, '2022-06-27 14:02:11', '49', 1, '', ''),
(499, '1691318762947f8c3b289', 'Aditi', 'Bank kalbar', '27/06/2022', '14:07:35.260', '022890207330', 6910000, '2e15adc8612ec2861e3d18fcda9d4628.jpeg', 2, '2022-06-28 13:39:30', '49', 1, '', ''),
(378, '136291786279ddfb7c5c2', 'SUFUTRIYATI', 'BANK KALBAR', '14/06/2022', '11:34:00', '123', 410000, '751bf8940d03a20d856e7b9870603dbf.jpeg', 2, '2022-06-28 10:29:24', '49', 1, '', ''),
(379, '118019666278c9da3437d', 'EFIPANIA KRESENSIA KABANG', 'KALBAR', '23/06/2022', '10.33.30', '151632', 1510000, '9530148c15d5f2b8b8b0e8fc7acf8f34.jpg', 2, '2022-06-27 14:26:58', '49', 1, '', ''),
(357, '1165564462944e861a7ec', 'Yohanes gusti rendi', 'Bank kalbar', '23/06/2022', '11:10:47:322', '128141110450', 6910000, '0c85a71d79013bf4946dd0d052cd1bac.jpg', 2, '2022-06-23 15:21:11', '49', 1, '', ''),
(389, '208860686290621fc42f2', 'Agustini Kumalahsari Emelia', 'Bank Kalbar', '24/06/2022', '8:44:37', '002', 6910000, 'd1a32853a0d7362c6000829b39764b1b.jpg', 2, '2022-06-27 14:29:48', '49', 1, '', ''),
(384, '121889656284567424abe', 'MARGARETHA VELANIA', 'BANK KALBAR', '24/06/2022', '09:01:32', '123', 3000000, 'bf94c0134dfe4ad918b11b75b536b864.jpg', 2, '2022-06-27 14:46:38', '49', 1, '', ''),
(361, '194414136256362ca6154', 'Kristin Olivia putri', 'KALBAR', '23/06/2022', '13:09:32', '1.23', 6660000, 'd311b66f90930a004de6c4e88a2a566b.jpg', 2, '2022-06-23 15:54:21', '49', 1, '', ''),
(374, '136291786279ddfb7c5c2', 'SUFUTRIYATI', 'bank kalbar', '14/06/2022', '11:25:40', '5/15', 6500000, 'a9fcf0bf69b6473e4d2ff65db1ee4c34.jpg', 2, '2022-06-23 16:05:55', '49', 1, '', ''),
(375, '116996596277f22254b9b', 'Agus surahman', 'BANK KALBAR', '23/06/2022', '15:53:52', '009580', 6910000, '84b2c13e66163dc7110b5ce80e39b7a1.jpg', 2, '2022-06-28 12:22:14', '49', 1, '', ''),
(364, '20005495628deab95e25a', 'Cyausyen ati', 'Bank kalbar', '23/06/2022', '12:59:17', '07', 6910000, 'a6732b5a8ce4069bbdadeba918921076.jpg', 2, '2022-06-23 15:42:12', '49', 1, '', ''),
(390, '66543223629d7bfcd325c', 'Rokus Riki', 'Kalbar', '24/06/2022', '10 : 39 : 55', 'TL03/28', 3660000, 'b2c8f76b05406e1fb5fc55c33d7e1ab2.jpg', 2, '2022-06-27 14:48:08', '49', 1, '', ''),
(380, '134547226258dd1fd0def', 'Agustina Amelia', 'KALBAR', '22/06/2022', '13:05:57', '99684', 6660000, 'cdfbf2a6db2da2a55fcf5a6cc0c794f8.jpg', 2, '2022-06-28 15:41:37', '49', 1, '', ''),
(381, '14832726628fc506d491d', 'Riana Sabrina', 'Bank Kalbar', '14/06/2022', '14:22:47', '198432', 6910000, 'a52f9957223095d8293b206e56eb5d0c.jpg', 2, '2022-06-28 15:54:43', '49', 1, '', ''),
(566, '11578467625bfce13f26d', 'Andreas Mamba', 'Bank kalbar', '29/06/2022', '09:25:04', '07', 5400000, 'd3d06241b447aa3c4769692cd3ae5ac0.jpg', 2, '2022-06-30 10:07:51', '45', 1, '', ''),
(383, '684039696280eeddd2613', 'Ihfa agustin', 'Bank Kalbar', '24/06/2022', '09:11:52', '012', 6910000, '541187939f773f049cf7d9e359a3eb08.jpg', 2, '2022-06-28 08:44:44', '49', 1, '', ''),
(371, '16868554628389287dec6', 'Impiana', 'Bank kalbar', '23/06/2022', '10:34:02', '6521115112', 3000000, '34487fe33082cc0a4faeb9492fb75c6a.jpg', 2, '2022-06-23 15:51:57', '49', 1, '', ''),
(393, '110024926285ceb08cae3', 'Anassatia', 'BANK KALBAR', '24/06/2022', '08:32:23', '182286', 6910000, '224cf6ccdc28fb0ec269387acf30d6f3.jpg', 2, '2022-06-27 16:02:46', '49', 1, '', ''),
(394, '40263343625e5d80a5fe1', 'Yosep Malaipada', 'Bank BRI', '24/06/2022', '10:18:11', '01', 6910000, '289f53a56bee4f5e8ffbb28758b3092b.jpg', 2, '2022-06-28 11:15:17', '49', 1, '', ''),
(548, '63046789629ac7cc5603d', 'Fransiska semah Astuti', 'bank kalbar', '27/06/2022', '11:55:11', '04/18', 6910000, '133e3e9331eb4264153eb1713c75e3a1.jpeg', 2, '2022-06-28 12:28:13', '49', 1, '', ''),
(549, '118019666278c9da3437d', 'EFIPANIA KRESENSIA KABANG', 'Bank Kalbar', '28/06/2022', '11:30', '151632', 5400000, '87915bf9aef5966d3d010ffe5411837c.jpeg', 2, '2022-06-28 14:33:51', '49', 1, '', ''),
(398, '798874096285b7210567b', 'JIMSOSIO', 'Kalbar', '24/06/2022', '13:24:46', '181584', 1510000, '8192726d84cf0914a284ce9fd182ef44.jpg', 2, '2022-06-28 10:48:48', '49', 1, '', ''),
(399, '49089365629054446db61', 'MARIA HANDAYANI', 'BRI', '24/06/2022', '15:20:43', '200070', 5000000, '66246d7489e9099ac59a8c467b56cd2d.jpg', 2, '2022-06-27 15:48:36', '49', 1, '', ''),
(512, '5574606362943413e4d0a', 'Lailatun Munawarah', 'Kalbar', '27/6/2022', '11:23:45', '202644', 6910000, '9c7c43199d607744c7e95cb88bac6452.jpg', 2, '2022-06-28 14:25:20', '49', 1, '', ''),
(401, '3665204562831c6c901c5', 'Anis Natalia Sunami', 'BPD kalbar', '22/06/2022', '10:01:18', '173628', 6910000, '2c7f41b5dd3f1873217e0500a8dc0c6f.jpg', 2, '2022-06-27 15:10:57', '49', 1, '', ''),
(402, '190895696256ab6c26561', 'Maria', 'Bank kalbar', '26/06/2022', '14:13:01', '005275', 1510000, '6f759df8fe2bbc06a9d68c172138c158.jpg', 2, '2022-06-27 15:22:24', '49', 1, '', ''),
(403, '15987649625fe19b1de63', 'Revana Damayanti', 'BANK KALBAR', '24/06/2022', '13:30:00', '115362', 6910000, '48e027ec2f76d4b37fcc07479307c279.jpeg', 2, '2022-06-27 15:26:54', '49', 1, '', ''),
(405, '605505186278839d5b51e', 'Sukarni', 'Bank kalbar', '24/06/2022', '10:30:46', '149760', 6910000, 'c0fb59d35c2871da81ff60987596cd7d.jpeg', 2, '2022-06-29 16:30:05', '49', 1, '', ''),
(406, '63730820628860f5503fe', 'EPI FANIA APRILEN', 'BRI', '24/06/2022', '18:01:24', '456401991761', 6910000, '9f95f9de0fe2656987866e92bdeed684.jpg', 2, '2022-06-27 16:28:51', '49', 1, '', ''),
(536, '1381961861fe6a44d0c71', 'Noviana fransiska', 'bank kalbar', '27/06/2022', '08:50:35', '03', 1510000, 'a23e42ac762a32a1ec1a9763d3a587db.jpeg', 2, '2022-06-28 09:07:57', '49', 1, '', ''),
(571, '65387929629470fa5a6b7', 'Meisin Wulandari', 'Bank Kalbar', '01/07/2022', '08:37:19', 'TL06/08', 3910000, '9d5c87904536e0c1a0e08b8617cffc79.jpeg', 2, '2022-07-02 08:23:25', '49', 1, '', ''),
(573, '256671996277c903f0edf', 'nella agustin', 'bank Bri', '29/06/2022', '14:20:16', '7237', 4450000, 'b02a98323799ba6ce2d041476eabc140.jpeg', 2, '2022-07-02 08:39:31', '49', 1, '', ''),
(568, '1427528662a17286a831e', 'Yustina Nur Indah Sari', 'bank Lainya', '28/06/2022', '16:24:54', '4542', 6910000, '7cae24f506851f66e7674060e652c50f.jpeg', 2, '2022-06-30 12:57:17', '49', 1, '', '');
INSERT INTO `bukti_bayar` (`id_bukti_bayar`, `akunb_msiswa`, `nama_pengirim`, `bank_pengirim`, `tgl_trans`, `jam_trans`, `nomor_refe`, `jlh_bayar`, `bukti_bayar`, `validasi_bukti`, `tgl_validbukti`, `yg_validasi`, `konfirm_bauk`, `yg_validasibauk`, `tgl_konfirmbauk`) VALUES
(569, '1044361162860225689df', 'PUTRI HARIANI', 'BANK KALBAR', '27/6/2022', '10:47:05', 'TL09/19', 3500000, '92480c377e27f0471242d3b125d42fe8.jpg', 2, '2022-07-02 08:26:23', '49', 1, '', ''),
(416, '13695727626f85ee4faeb', 'Yohanes Kusnadi', 'BANK BRI', '22-06-2022', '14:24:21', '000003205698', 1910000, '09f6645bff81e5120ba70a8a80e5e3cc.jpeg', 2, '2022-06-28 15:34:41', '49', 1, '', ''),
(561, '13695727626f85ee4faeb', 'Yohanes Kusnadi', 'bank Bri', '22/06/2022', '14:23:05', '5310', 5000000, '2aa0e2fd4ed80c1e10d7ea06b0b02ea4.jpeg', 2, '2022-06-28 15:37:56', '49', 1, '', ''),
(419, '16009154629d9b289d232', 'AGUSTINO PRADYTA', 'Bank bpd kalbar', '23/06/2022', '14:40:40', '0', 1510000, '35703e06065ea932c139b422218bbab7.jpg', 2, '2022-06-28 16:01:26', '49', 1, '', ''),
(420, '16009154629d9b289d232', 'AGUSTINO PRADYTA', 'Bank bpd kalbar', '23/06/2022', '14:41:57', '0', 3250000, '944aa222884e74f212ebd1d6daa455ac.jpg', 2, '2022-06-28 16:01:37', '49', 1, '', ''),
(421, '16009154629d9b289d232', 'AGUSTINO PRADYTA', 'Bank bpd kalbar', '23/06/2022', '14:43:04', '0', 2150000, '63aaa60ca655235e88c98aecc69eaea5.jpg', 2, '2022-06-28 16:01:50', '49', 1, '', ''),
(422, '13729489628af18040053', 'JULIANTI SITINDAON', 'BNI', '25/06/2022', '10:39:00', '9027', 6910000, '62262130ff44172cff73f254ec208f7e.jpg', 2, '2022-06-28 11:19:13', '49', 1, '', ''),
(423, '665044976278a5aead555', 'Dania.Melissa', 'M-banking(Noviandi)', '25/06/2022', '10:20:57', '750261020470', 2000000, '37c5c43a44130321f5e6250447c3807a.jpg', 2, '2022-06-28 12:26:13', '49', 1, '', ''),
(424, '4390765562997bd9b885b', 'Exrisanti', 'Bank kalbar', '24/6/2022', '14:22:00', '002', 6910000, '09b6ae6ff2c4b586c75ba874ba142820.jpg', 2, '2022-06-28 10:21:24', '49', 1, '', ''),
(426, '56492346629eb258cfcd5', 'Eva Natalia', 'Bank mandiri', '25/06/2022', '11:02:29 WIB', '2206251121197276582', 3000000, '1c52734e3ae8029b744bfc720789e6d6.jpg', 2, '2022-06-28 11:46:50', '49', 1, '', ''),
(427, '19090677629470791e0e9', 'Evi sulastri', 'BRI link', '25/06/2022', '15:28:40', '456542115942', 2800000, '7ce73fe506fce4a6844e8d7eb3144ecd.jpg', 2, '2022-06-27 16:05:44', '49', 1, '', ''),
(428, '161432486271f3f12e31a', 'Mariono Iyo', 'Bank BRI', '25/06/2022', '14:02:37', '2520', 4000000, 'c11e96b6873071af48f96d2c06b6ce8d.jpg', 2, '2022-06-28 10:14:54', '49', 1, '', ''),
(431, '1089626062877fabb0100', 'MARSIANA SARTIKA', 'BANK KALBAR', '22/06/2022', '9:45:46', '184392', 1510000, '7c4e38d6a35c5ecff2cbed0bd0d2eca9.jpg', 2, '2022-06-28 09:41:27', '49', 1, '', ''),
(510, '19280716628f83a58b57f', 'ANISSA CHRISTIN SEPENRIANA', 'BANK BRI', '27/06/2022', '12:41:05', '456808643286', 6910000, 'c5586958e6914138c1c042086cd50e18.jpg', 2, '2022-06-28 14:26:54', '49', 1, '', ''),
(538, '195665176267a35c033a2', 'Desi seselia', 'bank kalbar', '24/06/2022', '13:21:12', '09/19', 6660000, 'fbe01078b42073146b26c84ba6bf6564.jpeg', 2, '2022-06-28 10:04:47', '49', 1, '', ''),
(440, '11578467625bfce13f26d', 'Neng Nurmayanti Fadi', 'Bank BRI', '26/06/2022', '15:03:16', '000006969994', 1510000, '7567b9ad0103a93c92d308edacdfac78.jpg', 2, '2022-06-27 15:31:11', '49', 1, '', ''),
(441, '152354556285a12b3130a', 'FEBRIANI', 'BANK BRI', '26/06/2022', '19:46:22', '456720620604', 6910000, '03c61c43e5c06f7c305b286a697239b3.jpeg', 2, '2022-06-27 15:07:10', '49', 1, '', ''),
(442, '1174654462480cca02539', 'Aneng gusmawati', 'Bank BRI', '26/06/2022', '19:25:22 Dan 19:26:0', '000006533439', 6910000, 'b9c1c5bff97486382bd01d634047e0b2.jpg', 2, '2022-06-28 13:41:35', '49', 1, '', ''),
(505, '43697928621c976f0282e', 'Agustina', 'Kalbar', '27/06/2022', '14:22:17', '38610', 6910000, '51c337f120f04a03955c40e263832aaa.jpg', 2, '2022-06-28 14:16:33', '49', 1, '', ''),
(444, '135465616279cd5dc474a', 'Dorotia tiana', 'kalbar', '23/06/2022', '13:26:55', '123', 6910000, '0b18b9282bc2ffa68b2493f6e933f50f.jpg', 2, '2022-06-27 15:34:05', '49', 1, '', ''),
(542, '19009113627dbdd0a3707', 'junistira Saputra', 'bank Bri', '27/06/2022', '08:18:06', '2761', 6910000, 'd2990dd538083aa1814b4126408b9626.jpeg', 2, '2022-06-28 11:39:42', '49', 1, '', ''),
(446, '99609832626e619dbae06', 'Silvister nada', 'BCA', '26/06/2022', '20:47:11', '014', 6500000, 'ce3d3d5fb19761ffacc4f4713f67e1ad.jpg', 2, '2022-06-27 14:43:34', '49', 1, '', ''),
(449, '73403007627d9bb47d25c', 'Suprianus', 'BANK MANDIRI', '27 Juni 2022', '7:33:38', '217836093466', 6910000, 'c2d121665055b808dbb9964b6c66b11a.JPG', 2, '2022-06-28 09:11:22', '49', 1, '', ''),
(450, '2028541862622a71e5bd6', 'BPK HERU SUSANTO', 'NGSABANK BNI', '26/06/2022', '0000', '117702', 1510000, 'e8e28546a5c25e31543e5c6773e2f263.jpg', 2, '2022-06-28 09:48:41', '49', 1, '', ''),
(451, '4490228362650532cb562', 'Utin Winda Astria Ningsih', 'BANK KALBAR', '24/06/2022', '16:08:17', '6277617410847259', 6910000, '388165e2ee46cb86eac8e844c2d228ab.jpg', 2, '2022-06-27 16:09:26', '49', 1, '', ''),
(452, '24410132628c832d1a36e', 'ABNEL', 'Bank BRI', '27 Juni 2022', '08:43:28.111 WIB', '761810843260', 1510000, 'b52125542bfdf13969de02e5c7e618bf.jpg', 2, '2022-06-28 14:29:31', '49', 1, '', ''),
(555, '159617336268cf1666621', 'Silvester Duvi agata', 'bank kalbar', '28/06/2022', '09:18:34', '09/07', 1510000, '89487ce21154d326e605ed04e7d8a0c3.jpeg', 2, '2022-06-28 14:32:16', '49', 1, '', ''),
(520, '597540226294c767f1f9c', 'Fikih riziana', 'Bank kalbar', '27/06/2022', '11:01', '6105145708040001', 6910000, '0d30f245dbb12b49468b4c7d02244c8c.jpg', 2, '2022-06-27 16:10:50', '49', 1, '', ''),
(455, '38072666627c5de5d9751', 'Yohana', 'Bank KALBAR', '27/6/2022', '09:31:06', '160992', 6910000, 'd27a90ac5917e1b7c116a37482746f93.jpg', 2, '2022-06-28 08:59:32', '49', 1, '', ''),
(456, '525515956246663b76805', 'Desti rizkia malik', 'BRI', '27/06/22', '10:04:20', '2775', 3250000, 'd2ad829468cfcf8772f408ee1e6606a6.jpeg', 2, '2022-06-28 11:13:23', '49', 1, '', ''),
(457, '21642246629043eeaba42', 'Hafidzah khoirunnisa', 'BANK KALBAR', '27/06/2022', '09:35:41', '-', 6910000, 'd66657a4adf529b930ffdd161b04be1b.jpg', 2, '2022-06-28 09:14:04', '49', 1, '', ''),
(537, '20849357629c18f185bad', 'Apri Wanus Krismanto', 'Bank Mandiri', '25/06/2022', '09:42:04', '0245', 5400000, 'bb610396a9c567480d0d717ff91d213a.jpeg', 2, '2022-06-28 09:33:01', '49', 1, '', ''),
(560, '15693358628883b014327', 'Kiki', 'Bank Kalbar', '28/06/2022', '24/06/2022', '6106156409030001', 6910000, '597e85f8292d587c6604418c15788b12.jpeg', 2, '2022-06-29 16:31:23', '49', 1, '', ''),
(522, '935558476295c465b92bb', 'ANISSA CRISTIN SEPENRIANA', 'BRI', '27/06/2022', '17:07:36 WIB', '456852121866', 6910000, '7e385e9b7e487d8efc7269126239a77a.jpg', 2, '2022-06-28 14:20:43', '49', 1, '', ''),
(463, '1830078262902d8b0301d', 'Rita Rosanti', 'mandiri', '27/06/2022', '09:45:05', '217836234556', 1510000, '594748562d2b90175eb629a62129cb3b.jpg', 2, '2022-06-27 15:56:36', '49', 1, '', ''),
(464, '1245995262625842d1f5d', 'Jecsika', 'Bank Kalbar', '27 Juni 2022', '10.01:48', '123', 6910000, '4e62f4d2652edb69f6ec9bd84b7a8682.jpg', 2, '2022-06-27 16:15:37', '49', 1, '', ''),
(465, '4277533362441ec76135e', 'REVA FRISKILA', 'BANK KAL-BAR', '27/06/2022', '11.00', '0', 6910000, '6bbae2613ceebe862bc11102e653d840.jpg', 2, '2022-06-28 09:51:06', '49', 1, '', ''),
(467, '17847235629d715c3dbc4', 'Dian puspita anggraini', 'Bank kalbar', '27/06/2022', '10:08:30', '003325', 7000000, '966914d1c2cef147775eacee6180d6cf.jpg', 2, '2022-06-28 15:58:37', '49', 1, '', ''),
(552, '12155869627e1e25397f3', 'JESIKA GAWAI', 'bank kalbar', '27/06/2022', '11:31:53', '36A', 6660000, '250b07d2fcf4a3fd522fe44546260d68.jpeg', 2, '2022-06-28 14:02:07', '49', 1, '', ''),
(521, '1127608262985ec08cc53', 'Toko yosua jaya jl rahmat no 74 depan gpu mukok', 'Bank kalbar', '27/06/2022', '14.56', '363907100744', 1510000, '1f605df38c0e59a70568c2316e7e823f.jpg', 2, '2022-06-28 12:37:07', '49', 1, '', ''),
(470, '183888506279d49e0f18b', 'AKIT MUSTAPA', 'BANK KALBAR', '27 juni 2022', '10:29:34', '123', 6910000, '4b8e75ecebc34d9110f2c2aca5b722ad.jpg', 2, '2022-06-27 15:51:14', '49', 1, '', ''),
(471, '5140892762452ad38ff9a', 'AHMAD SOFIAN', 'Mandiri', '27/06/2022', '11:14', '73710', 1510000, '6cd1aea21ae6655fd544b827420e8d10.jpg', 2, '2022-06-28 15:38:46', '49', 1, '', ''),
(550, '19752318627b148d8e30d', 'Rizal Alsandi', 'Bank Kalbar', '27/06/2022', '13:30:34', '157716', 6910000, 'b97b596e3fb0902c6d3562b83cd9285c.jpg', 2, '2022-06-28 14:23:21', '49', 1, '', ''),
(473, '1550239862467dc33b48a', 'WIWIK HIMTIANA', 'BRI', '27 Juni 2022', '11:02:45 WIB', '456791418562', 6910000, 'd1654efd576775ec709c2dbb1a3a9636.jpg', 2, '2022-06-28 08:56:20', '49', 1, '', ''),
(541, '20156643629b28fbb960b', 'NOVA RAMANDA SARI', 'bank kalbar', '27/06/2022', '12:46:51', '24', 2000000, '2c8862635ed79408878949e63a4a8e37.jpeg', 2, '2022-06-28 14:40:47', '49', 1, '', ''),
(545, '17504508628af2a066f25', 'Magdalena', 'bank kalbar', '27/06/2022', '14:54:37', '09/40', 6910000, 'b73ea6b648449f01262ed60caa591ef2.jpeg', 2, '2022-06-28 12:09:00', '49', 1, '', ''),
(544, '169189416298a5c38fb82', 'MUHARTI MUNITA', 'bank kalbar', '27/06/2022', '14:04:46', '0087', 2000000, 'a15161a30d780a2fc6c3a70cf8982907.jpeg', 2, '2022-06-28 11:59:13', '49', 1, '', ''),
(477, '164561896265f0b95a2dc', 'Robila Yolanda', 'KALBAR', '27/06/2022', '09:56:54', 'T028', 6910000, 'bb47f9659273ea060c6484ea98d50a1b.jpg', 2, '2022-06-28 12:18:51', '49', 1, '', ''),
(478, '3097057962903a1fb6422', 'Fransiska Vivi', 'Bank Kalbar', '27/06/2022', '10:59:12', 'TL09/22', 6660000, '5c82cece083c4d441d70029a4bb6ef13.jpeg', 2, '2022-06-27 15:52:40', '49', 1, '', ''),
(479, '36085139623c2d9789b9e', 'Yulia Regina Nita', 'Bank BRI', '24/06/2022', '06:30:17', '456407869785', 6910000, '0a971a87f631278f183bf68786e29894.jpg', 2, '2022-06-27 15:53:50', '49', 1, '', ''),
(480, '43466367628c77bb986d1', 'Detri Parida', 'Kalbar', '27/06/2022', '10:23:49', '044', 1510000, 'e643cec226f96f8912ee0b1d2af5f3f5.jpeg', 2, '2022-06-28 08:58:04', '49', 1, '', ''),
(481, '81345144626bab4056059', 'Stefania Deakesi', 'Bank kalbar', '27/06/2022', '10:18', '03/21', 2000000, '8614d394c3cc52052586cdcc187d996c.jpg', 2, '2022-06-28 09:35:42', '49', 1, '', ''),
(482, '40146978627dc1073dd96', 'Tessya Junisti', 'Kalbar', '27/06/2022', '10:21:56', '043', 6910000, '92695a9beac57f47758cb83a0cf61a69.jpg', 2, '2022-06-27 16:13:04', '49', 1, '', ''),
(483, '15312259628f5af62323b', 'Sindy audia putri', 'Bank kalbar', '27/06/2022', '8:18', '00000 007', 6660000, '3e28c88faf2334c19dc7e272b6b48ace.jpg', 2, '2022-06-28 08:53:51', '49', 1, '', ''),
(486, '10449834628349ebde7d4', 'ARY SANTOSO', 'Bang kalbar', '25/06/2022', '10:23:18', '734841023160', 6910000, '59d2f94516131260043f3a2c2bf0fcad.jpg', 2, '2022-06-27 16:04:35', '49', 1, '', ''),
(488, '114292636239b91015d35', 'BPK BUDIMAN', 'BANK BNI', '27/06/2022', '11:34', '1213', 6910000, 'b282193a293c65be454088c37b9c8ec8.JPG', 2, '2022-06-28 09:26:24', '49', 1, '', ''),
(489, '29423661627de91df36c9', 'Heru Supuco', 'BRImo', '24/06/2022', '14:12:23', '456364700462', 6910000, '518fe04679d7fdcb72295cd78a072127.jpg', 2, '2022-06-28 15:45:18', '49', 1, '', ''),
(492, '599302026285ad25ddb54', 'Aroy', 'BRI', '26/06/2022', '14:14:03', '4566782245', 3000000, '2f3669ac5b1046e52be8ce470afaee62.jpeg', 2, '2022-06-28 09:44:40', '49', 1, '', ''),
(493, '173709676295876e1f6b5', 'Adi', 'Bank kalbar', '27/06/2022', '09:06:21', '019', 6910000, '7f527cd36f2b15037a3917179a3a037f.jpg', 2, '2022-06-28 15:57:07', '49', 1, '', ''),
(495, '24821996629c02d7a5f85', 'FERONIKA ROSADY', 'BNI', '25/6/2022', '09:57:53 WIB', '20220625095739063502', 6660000, '663effe774fc66e08d14f7babf4b01b2.jpg', 2, '2022-06-27 16:33:16', '49', 1, '', ''),
(496, '103799916284767961e71', 'Maria Santika', 'Bank Kalbar', '27/06/2022', '11:41:30', '-', 6910000, 'd772373ec9df763e05769937426bf857.jpg', 2, '2022-06-28 15:51:31', '49', 1, '', ''),
(540, '30858086629bccdb1186d', 'Novita Asmarika', 'Bank Mandiri', '27/06/2022', '11:15:07', '8801', 2000000, 'b48f30d77f6da8ac5dcfcf9d7b624bfe.jpeg', 2, '2022-06-28 10:43:51', '49', 1, '', ''),
(504, '154715656279e01b10716', 'Rifki ardian', 'bank kalbar', '24/06/2022', '10:20:46', '29', 6910000, 'cf3be10826da811cb04818a2fb7d0f63.jpeg', 2, '2022-06-27 15:01:46', '49', 1, '', ''),
(554, '4446289462857be960387', 'Eko Pernanda', 'bank BNI', '27/06/2022', '13:40:00', '9140', 3000000, 'd589006dfb8851b5a1e3e189953d7538.jpeg', 2, '2022-06-28 14:18:22', '49', 1, '', ''),
(511, '612097556277c71a45c53', 'Jesika', 'BRImo', '25/06/2022', '12:03:37', '7730', 1000000, 'a74e7e451381841a5498052dab8c3118.jpeg', 2, '2022-06-28 15:26:21', '49', 1, '', ''),
(513, '49089365629054446db61', 'MARIA HANDAYANI', 'bank bri', '24/06/2022', '15:22:00', '2123', 1910000, '59183cd75a19af83fcb3d61ebd110f9d.jpeg', 2, '2022-06-27 15:48:00', '49', 1, '', ''),
(546, '1659913762845ac8e85c9', 'MUHAMMAD RIFQII RAIHAN', 'link', '27/06/2022', '18:49:00', '-', 6910000, 'de86385263fe85a7e3495f96641d1f06.jpeg', 2, '2022-06-28 12:11:03', '49', 1, '', ''),
(547, '12253862627c8885803d1', 'FARIZKA SHERLY PANGARIBUAN', 'bank kalbar', '27/06/2022', '13:11:48', '0423', 5400000, '2738ddd3afa5db6db2925eeb71136a7f.jpeg', 2, '2022-06-28 12:17:04', '49', 1, '', ''),
(526, '170884216299c4aa250b4', 'EKA DIANA', 'BRI', '27/06/2022', '17:00:19', '456850904005', 6660000, '7521fa2cabd52aa4be0c1c84ac74a5ec.jpeg', 2, '2022-06-28 12:03:02', '49', 1, '', ''),
(527, '52790270629d6452effe6', 'Pera Yunita Ningsih', 'Bank Kalbar', '27/06/2022', '10:32:40', '1500017', 6910000, 'd434966aca18272282dc0c79e370ac2f.jpg', 2, '2022-06-28 10:24:32', '49', 1, '', ''),
(539, '370919836279df9b053ef', 'Sufutrayadi', 'bank kalbar', '22/06/2022', '10:42:17', '19', 410000, '1f5d0ac749870452e2a134a7f0dd3206.jpeg', 2, '2022-06-28 10:32:01', '49', 1, '', ''),
(530, '13079995625f8b833b65f', 'IBU YUDITA SUSANTI', 'BANK BNI', '27/06/2022', '11:04', '112320', 6910000, '4935978e7162dda056b45403246b9bbe.jpg', 2, '2022-06-28 15:42:46', '49', 1, '', ''),
(553, '129301756299daf83a994', 'Faizul Awwal', 'bank kalbar', '28/06/2022', '10:34:26', '03/020', 6910000, '9630892e53c98aa84bd6bfc3e7138206.jpeg', 2, '2022-06-28 14:08:40', '49', 1, '', ''),
(543, '16581030623913ddc7152', 'Rosalia wilna', 'bank kalbar', '27/06/2022', '08:59:50', '02', 3000000, 'c14cc645c6cc12f209e800fcb30c65fe.jpeg', 2, '2022-06-28 11:43:09', '49', 1, '', ''),
(535, '88995474624135feeef35', 'Natalia Margaretha', 'Bank Kalbar', '27/06/2022', '13:14:59', '123', 4000000, 'b57af020f4178f0198479168e0955566.jpeg', 2, '2022-06-28 12:23:28', '49', 1, '', ''),
(572, '39431581629d8ee84c6ce', 'MINGKI SATARIA', 'bank kalbar', '01/07/2022', '09:45:32', '35', 3250000, '4071145b0255d704b761f53e78471ac2.jpg', 2, '2022-07-02 08:21:33', '49', 1, '', ''),
(575, '176234806284505cf09e8', 'Elvi', 'Atm', '26/06/2022', '11:26:49', '518661126470', 3000000, 'fa87569e08e42fa2bb43124f44771ce4.jpg', 2, '2022-07-04 13:30:06', '49', 1, '', ''),
(576, '7208114062443e6c0f55d', 'Tri novi mardalena siah', 'bank Bri', '04/07/2022', '10:24:01', '5523', 3000000, '1b590627971d2297f1911d52b8cb34db.jpeg', 2, '2022-07-06 09:31:13', '49', 1, '', ''),
(579, '99609832626e619dbae06', 'Silvister nada', 'BCA', '06/07/2022', '16:31:49', '014', 410000, 'b5a449391c679c3a25a3aa00371d8ccf.jpg', 2, '2022-07-07 12:32:00', '49', 1, '', ''),
(578, '2102925062162dbb37295', 'Lorensia Vivin Anjelina', 'Kalbar Nanga Mau', '06/07/2022', '10:28:40', '36738', 3000000, '0edfed62ef7200d74196f9d7f58ba996.jpg', 2, '2022-07-06 11:20:22', '49', 1, '', ''),
(580, '161432486271f3f12e31a', 'Mariono iyo', 'Bank BRI', '06/07/22', '15:21:05', '06174', 2910000, '360f9d4e163a43a5cb378f1bb8265bcd.jpg', 2, '2022-07-07 12:30:26', '49', 1, '', ''),
(581, '1108609061fbc4301916e', 'Meilia Kontesa', 'Kalbar', '07/07/2022', '13:17:37', '002', 6660000, '902f3b5db6fb4af6e7c9645841d243c9.jpg', 2, '2022-07-07 15:42:32', '49', 1, '', ''),
(583, '1226483262844a30756e0', 'Cariswanti', 'Bank Kalbar', '07/07/2022', '14:55:21', '176904', 1500000, '952ca906c6607a3fa6a19f55ea43a4fa.jpg', 2, '2022-07-11 07:55:05', '45', 1, '', ''),
(584, '16058695628a13283328c', 'RUTH OKTA HACITA DEA', 'BANK KAlBAR', '8/07/2022', '11:05:52', 'T20', 2150000, '87f3f57b5b1c05077d6e220ad6e3528a.jpeg', 2, '2022-09-01 10:21:29', '49', 1, '', ''),
(585, '570142486249841a4157a', 'Tati Sumira', 'Bank Kalbar', '09/07/2022', '16:21:38', '001504', 2150000, '3a11c458aac6c89b273fecbd74111bd9.jpg', 2, '2022-07-11 08:01:19', '45', 1, '', ''),
(586, '4014997762746974f21c0', 'ANDERMAN', 'BNI', '10-07-2022', '13:09:15 WIB', '20220710130929009973', 6910000, '44d9edd58142333f9dbe62a1586c2016.jpg', 2, '2022-07-11 07:59:27', '45', 1, '', ''),
(587, '197327426273512e0e5c7', 'Julia meliana', 'Bank Kalbar', '11/07/2022', '13:19:16', 'TL02', 6910000, '1bd407d04abe1e87c0aacac1b5b6d73c.jpeg', 2, '2022-07-12 10:45:54', '45', 1, '', ''),
(595, '2268908462493e1bc177c', 'Farizatul Hasanah', 'Bank Kalbar', '08/07/2022', '10:18:35', 'TL1/35', 4910000, 'd0faf69d66d683ab4ad38d252d7b76d0.jpeg', 2, '2022-07-13 11:19:57', '45', 1, '', ''),
(596, '599302026285ad25ddb54', 'Aroy', 'Bri', '08:07:2022', '20:30:02', '458975404059', 3910000, '0b7a37e3c90f349f6860a479794c474b.jpeg', 2, '2022-07-14 08:46:56', '45', 1, '', ''),
(599, '13951185626614738a4d4', 'Abdul Heri', 'Kalbar', '13/07/2022', '08:23:47', 'TL03/002', 5150000, '24a2068dab74a3e909621e48df429296.jpeg', 2, '2022-07-14 08:36:22', '45', 1, '', ''),
(593, '15294266628839c38b32a', 'Patsy Saela', 'Bank BPD Cabang Semitau', '11/07/2022', '10.38', '184860', 6910000, '757221700ddf222c15185dde387da605.jpg', 2, '2022-07-12 07:43:19', '45', 1, '', ''),
(601, '158449146200b30aaba17', 'Lambertus Landan', 'KALBAR', '21/07/2022', '09:35:05', 'TL02-08', 6660000, '81530749d69103efae4f8a5429dac18e.jpeg', 2, '2022-07-21 13:54:18', '45', 1, '', ''),
(602, '77116834629da4738ea44', 'HENDRIK SUGANDI', 'Kalbar', '21/07/2022', '13:20:20', 'TL09/34', 2150000, '5eac1424d76cbea88b9a8f616e9f6eac.jpg', 2, '2022-07-23 09:37:02', '45', 1, '', ''),
(605, '11029546627dd5411f72b', 'Marta Fertiyanti', 'bank kalbar', '11/07/2022', '10:53:05', '22', 1500000, '7a2ee921792d6204451197995accd185.jpeg', 2, '2022-07-23 09:45:59', '45', 1, '', ''),
(604, '2028541862622a71e5bd6', 'BPK HERU SUSANTO', 'NGSABANK BNI', '22/07/2022', '0000', '117702', 2150000, '701f9f7a25403c13be104132f62ce72f.jpg', 2, '2022-07-23 09:38:36', '45', 1, '', ''),
(606, '17139711629a53af31c9e', 'MECHAEL TAURA', 'BRI', '25/0/72022', '14:15:27', '461641415811', 6910000, '910bb20adb71c8b6f7d8a6d5d35606af.jpg', 2, '2022-07-26 12:42:51', '45', 1, '', ''),
(607, '16454593629740dfe3c24', 'Erni Aprilianti', 'Bank Kalbar', '25/07/22', '09:23:23', 'TL03/14', 3660000, 'a9757665304bb3303c341991ae792260.jpg', 2, '2022-07-26 12:39:22', '45', 1, '', ''),
(612, '88995474624135feeef35', 'Natalia Margaretha', 'Bank Kalbar', '29/07/2022', '10:15:38', 'TL09/16', 2901000, '4fd4ed697024e21373f0b5f99279c4da.jpeg', 2, '2022-07-29 12:57:26', '45', 1, '', ''),
(610, '175937856200e148ef286', 'Crismas Ayu Utami', 'Bank Kalbar', '26/07/2022', '16:54:30', '128140454270', 5150000, '1825ee5c516f286779f650aef60d2d53.jpg', 2, '2022-07-27 16:33:06', '45', 1, '', ''),
(611, '20156643629b28fbb960b', 'NOVA RAMANDA SARI', 'Bank Kalbar', '25/07/2022', '13:37:53', 'TL 01.20', 2000000, 'ac91fac13a8d68949736c1d1738054fc.jpeg', 2, '2022-07-27 16:40:21', '45', 1, '', ''),
(613, '1864493562007e59319ae', 'Yoseph Gusti Randa', 'BNI', '29/07/2022', '12:37:42', '20220729123743864845', 6660000, '8518ff4e89e522001ec9b7951be69c8b.jpeg', 2, '2022-07-29 13:03:17', '45', 1, '', ''),
(614, '665044976278a5aead555', 'Noviandi', 'Bank Kalbar', '16/07/2022', '09:45:47', '574790945450', 4660000, 'db0f5d8c84beac5af7960890915b6ce0.jpeg', 2, '2022-08-01 16:40:43', '45', 1, '', ''),
(615, '1811086662a2e16e7546d', 'Teofilus', 'Bank Kalbar', '01/08/2022', '14:55:40', 'T86', 3000000, '7565f6bf45136285e3d0b0f05efc83f2.jpeg', 2, '2022-08-03 08:42:48', '45', 1, '', ''),
(616, '16868554628389287dec6', 'Impiana', 'Bank Kalbar', '03/08/2022', '13:22:12', 'T28', 3910000, 'e944ec53f1765c393b898d23e671e80b.jpeg', 2, '2022-08-03 15:53:48', '45', 1, '', ''),
(630, '13035725627dc8c9a1d7f', 'Fusnika', 'Bank Kalbar', '09/08/2022', '13:39:40', 'T52', 6910000, '0372d6d79de1ef116a694996a0d86852.jpeg', 2, '2022-08-09 14:49:50', '45', 1, '', ''),
(632, '56492346629eb258cfcd5', 'Eva Natalia', 'Bank Kalbar', '10/08/2022', '09:32:27', '2208101122303551449', 917000, 'ed8ca8a4726bc5404bd500271497b3e0.jpg', 2, '2022-08-10 11:31:35', '45', 1, '', ''),
(633, '77270131624bddebc4222', 'Christine Ayu Firnanda', 'BRI', '11/08/2021', '17:59:20', '000003606835', 6910000, '475a1ebf146e759f49b7815890247221.jpg', 2, '2022-08-11 16:20:43', '45', 1, '', ''),
(634, '18868809627b6273ec7e0', 'Rendi Yonatan', 'BANK KALBAR', '9/8/2022', '10:30', '32', 3000000, 'abc7c01bfaade6f42abf06034447397d.jpg', 2, '2022-08-11 16:16:03', '45', 1, '', ''),
(623, '12824755626672feed95d', 'VIVI NADIA', 'Mandiri', '6 Agustus 2022', '20:12:30', '221833098047', 2000000, 'de6a2830616748b5c5232117a014fa38.jpg', 2, '2022-08-10 11:29:16', '45', 1, '', ''),
(638, '3617558462f194fdabdaa', 'Henry Elisa', 'BNI', '11/08/2022', '11:22:11', '20220811112218608901', 6910000, 'd241901dafe4112ca76a00f1df952445.jpeg', 2, '2022-08-11 16:41:24', '45', 1, '', ''),
(629, '56492346629eb258cfcd5', 'Eva Natalia', 'Bank Kalbar', '9/08/2022', '10:42:41', '2208091121263162442', 2993000, '99022250b187f896103d46cda2d678b2.jpg', 2, '2022-08-09 14:52:44', '45', 1, '', ''),
(626, '1722704462a2b4bd38dcb', 'Petrus nico febrian', 'Bank kalbar', '08/08/2022', '11:27:41', 'TL04/23', 6660000, '10c78798f3906d52b89e318b44c3d53a.jpg', 2, '2022-08-09 10:05:06', '45', 1, '', ''),
(628, '21293511625fa62768055', 'Desy Amaliasari', 'Bank Kalbar', '08/08/2022', '10:00:19', 'TL065/6', 6910000, 'be372e73737aa4a15425ba62a2ef0914.jpeg', 2, '2022-08-09 10:26:22', '45', 1, '', ''),
(640, '17248739625fa4cd627d8', 'Edy prayitno', 'BANK KALBAR', '13 AGUSTUS 2022', '15:51:18.158', '706160351160', 5150000, '3626024e58b0ee156d3dcb7394b286fb.jpg', 2, '2022-08-15 13:15:25', '45', 1, '', ''),
(639, '4159031362997369148a0', 'ROSARIA SONATA', 'KALBAR', '11 agustus 2022', '22:03:22', '518661003200', 3660000, 'ce02e4edf5761130f2d6ce3624bbf9a9.jpg', 2, '2022-08-12 13:51:51', '45', 1, '', ''),
(641, '1820381562b93a55cc063', 'Leonardo janius', 'Bank kalbar', '15/8/2022', '11:28;12', '051', 6660000, '098e30986939a724185abde9ff8c7151.jpg', 2, '2022-08-15 15:29:16', '49', 1, '', ''),
(642, '41250370629ebe789e77e', 'Resoni lestianara', 'Bank kalbar', '16/08/2022', '09:37:21', '002', 3250000, '7fce0b7c0ef139109671fdc05357bc11.jpg', 2, '2022-08-18 09:05:15', '49', 1, '', ''),
(646, '7686307361fb6ca8a5aff', 'YUNIZA', 'BRI', '18/09/22', '08:37:00', '-', 2150000, 'efa7d2fc9b49143e01566a70b67e0af2.jpg', 2, '2022-08-19 14:59:14', '45', 1, '', ''),
(644, '16561347626684f853a55', 'Dwi faradita pridati', 'Bank Kalbar', '16/08/2022', '10:39:13 WIB', 'TL02/21', 2000000, '7a371d40d633623dae86c9b4e6bded1a.jpg', 2, '2022-08-18 09:04:08', '49', 1, '', ''),
(647, '19730178629d814e46244', 'Marta nesanusari', 'Bank Kalbar', '21/08/2022', '11:33:32', '061321133300', 3000000, 'd4dfdaa6fc973c287d2b3c69c91643a7.jpg', 2, '2022-08-23 09:14:46', '45', 1, '', ''),
(648, '7442619462867d1a181d9', 'Siti Aprianti Romana', 'BANK KALBAR', '22/08/2022', '14:39:39', '51', 6910000, '5d998ff03f2db2cc1e76801b64c0ac05.jpeg', 2, '2022-08-23 09:16:01', '45', 1, '', ''),
(654, '30858086629bccdb1186d', 'Novita Asmarika', 'bank Kalbar', '23/08/2022', '11:10:23', 'T14', 4910000, '881941e10d61c6eb17415e3a69da4792.jpeg', 2, '2022-08-24 15:24:10', '49', 1, '', ''),
(651, '40929391628ccbea16d32', 'Imellia', 'BANK KALBAR', '23/08/2022', '09:47:17', 'KBK040TL03 D23040TL03 00000 036', 5400000, 'aa081e23285b74441ac2048ab0a5788c.jpg', 2, '2022-08-24 09:15:30', '45', 1, '', ''),
(652, '22941030624c3c4527d65', 'Rosaria Maharani', 'Bank KALBAR', '23/08/2022', '13:02:39', '75', 5000000, 'e37b049ed9bda6561f3196da3cfa9f9f.jpg', 2, '2022-08-23 13:32:10', '45', 1, '', ''),
(653, '63325725621a44360cc2f', 'Yenti Tuti Apra', 'Kalbar', '23/08/2022', '13:44:39', '38142', 2150000, '6da6769bc83cbde13b9902cb51a75121.jpg', 2, '2022-08-24 09:17:38', '45', 1, '', ''),
(655, '612097556277c71a45c53', 'Jesika', 'bank Kalbar', '28/07/2022', '10:50:02', 'TL02/22A', 2400000, 'd6ae7512319cd6372e4754cc6c3d800f.jpeg', 2, '2022-08-24 15:52:47', '49', 1, '', ''),
(656, '7208114062443e6c0f55d', 'Tri Novi Mardalena Siah', 'BriMo', '25/08/2022', '11:24:37', '467053280592', 3660000, '9af32032fc12443bce8b508bc41b9b2a.jpeg', 2, '2022-08-26 14:03:12', '45', 1, '', ''),
(657, '85619299628853432379e', 'Sr. Theodosia Marwanti Ety', 'Bank BCA', '25/08/2022', '14:22:00', '03852991', 6910000, '6b285ff4c4cc4e42f5f8f9631f1156ab.jpeg', 2, '2022-08-26 14:05:06', '45', 1, '', ''),
(658, '14851694629d6de2104a2', 'Septepanus Fikto Librani', 'bank Kalbar', '26/08/2022', '10:33:03', 'TL09/30', 6660000, 'ebb6beff629d5674ad159e825015776d.jpeg', 2, '2022-08-26 14:47:29', '45', 1, '', ''),
(659, '5895489962944a9352e82', 'Siska', 'Bank kalbar cabang nanga pinoh', '26/08/2022', '14:30:50', '203346', 3660000, 'd6566f63d1e1b83f0482becd2f36074c.jpg', 2, '2022-08-27 11:03:47', '49', 1, '', ''),
(660, '14799526627dcedb994f2', 'Wiwin yaswanti', 'BRI', '27/08/2022', '08:25:03', '2753', 6910000, 'df56d2e9e130d807964561e971d56500.jpeg', 2, '2022-08-27 11:09:35', '49', 1, '', ''),
(661, '570142486249841a4157a', 'ASTAWINATA', 'BANK BRI', '27/08/22', '07:31:39', '2714', 3000000, '6bde4161efa24278bcabf2e995b6b9c1.jpg', 2, '2022-08-27 11:10:03', '49', 1, '', ''),
(665, '66543223629d7bfcd325c', 'Rokus Riki', 'Kalbar', '29/08/2022', '03:37:41', '002', 3250000, '66112deb817764028123f04e541dd282.jpg', 2, '2022-08-30 08:10:24', '45', 1, '', ''),
(663, '1226483262844a30756e0', 'Cariswanti', 'Transfer rekening', '27/08/2022', '09:39', '474990939160', 1910000, 'fd2411dc789d7dc8063e9a6bee1e0501.jpeg', 2, '2022-08-27 11:11:08', '49', 1, '', ''),
(664, '612097556277c71a45c53', 'Jesika', 'bank Kalbar', '26/08/2022', '09:02:51', 'TL02023', 3510000, '11e361748a0d9b6052aea8a0d748b73a.jpeg', 2, '2022-08-27 11:04:24', '49', 1, '', ''),
(666, '4446289462857be960387', 'Julianti Sitindaon', 'Bank BNI', '29/08/2022', '15:27', '000000013888', 3910000, 'aee2163ea4281fb00eb8fba4cc8b1f06.jpeg', 2, '2022-08-30 08:17:33', '45', 1, '', ''),
(667, '19945356620f30cc444bc', 'Murtasih', 'Bank BRI', '28/08/2022', '16:19', '000003536718', 2140000, '52e4f118f3f3db2bf51499e994d9f90f.jpeg', 2, '2022-08-30 08:23:38', '45', 1, '', ''),
(668, '3486980862c251ae63d5b', 'Yeti Sulmadia', 'Bank Kalbar', '31:08:2022', '09:10:15', '061TL01/07', 6660000, '84eb1b3995f2228ce0e0d3486d1e017a.jpeg', 2, '2022-08-31 12:44:41', '45', 1, '', ''),
(672, '798874096285b7210567b', 'JIMSOSIO', 'Kalbar', '31/08/2022', '09:45:45', '500637253771', 3250000, '79c40ddcf3450c6722d4dee069c1544e.jpg', 2, '2022-09-01 10:08:52', '45', 1, '', ''),
(674, '1437240862995f8b61064', 'Yohanes Ayamin', 'Bank Kalbar', '31/08/2022', '10:49:12', 'TL03/25', 3000000, '568860b9e90ab5c33edcc06b84aa712b.jpeg', 2, '2022-09-01 10:10:16', '45', 1, '', ''),
(675, '1117583962a2bf3db4e79', 'Marya', 'Bank BRI', '01/09/2022', '10:27:26', '000003197895', 5000000, '482a903c3bf0a8a1a9e4f7710de36934.jpeg', 2, '2022-09-01 10:49:28', '45', 1, '', ''),
(676, '1117583962a2bf3db4e79', 'Marya', 'Bank BRI', '01/09/2022', '10:28:59', '000003211554', 1910000, '22aad85d4b739eb286279eef57a73458.jpeg', 2, '2022-09-01 10:49:37', '45', 1, '', ''),
(677, '4895979662cba5d11f075', 'IBU DUNA', 'Bank BNI', '01/09/2022', '11:41:32', '184', 1600000, 'e643425d8dc6730e3097e7651e93a418.jpg', 2, '2022-09-02 08:28:33', '45', 1, '', ''),
(679, '1610542962e12b7660a5a', 'Ibu julianti sitindaon', 'A BABANK BNI', '1/9/2022', '11:22', '000000014038', 5000000, '722b8f727a68d7695096f7350e6cb235.jpeg', 2, '2022-09-02 08:19:55', '45', 1, '', ''),
(680, '1387706662d9489d55f4f', 'Andi winata', 'Kalbar', '01/09/2022', '11.33.13', '283608', 6910000, 'e080b410ab8cde15defecaf0d67c1ba2.jpg', 2, '2022-09-02 08:26:52', '45', 1, '', ''),
(682, '118911066201df416c924', 'Genita Oktaviani', 'Bank Kalbar', '31/08/2022', '11:06:58', '21294', 2660000, 'cd252f1238e961f49046d5d6c1fb76db.jpg', 2, '2022-09-02 08:56:35', '45', 1, '', ''),
(688, '1732955162afe96335ab4', 'Yosi Oktaviana', 'BANK KALBAR', '2/09/2022', '10:57:51', '242658', 6910000, 'b5a1170891a042670b5a4eb13ca7dd3c.jpg', 2, '2022-09-02 17:43:02', '45', 1, '', ''),
(685, '9965057862a94656a007d', 'Brice', 'bank kalbar', '01/09/2022', '12:30:45', '327978', 6910000, 'e9bbba3daaa8f572598d48dcf89bb68b.jpg', 2, '2022-09-02 08:30:50', '45', 1, '', ''),
(686, '21118633628dbb1932e99', 'Ayu Astriana', 'Bank Kalbar', '01/09/2022', '10:19', 'TL028', 1510000, 'f440ff3e74f2aedb4d3a9d6587a55b54.jpeg', 2, '2022-09-02 08:33:05', '45', 1, '', ''),
(687, '1883672262a7101b09860', 'Caecilia Delvi besdita', 'Bank kalbar', '1/9/2022', '14:13:22', 'TL09/45', 6660000, '2f1018bb71b46ffebda279c03b4f049e.jpg', 2, '2022-09-02 08:32:06', '45', 1, '', ''),
(689, '1843357062a883d39b81b', 'Neneng Anjarwati', 'BRI', '02/09/2022', '13:22:55', '468606368071', 6910000, 'c5dcb8065756f7d05a08fdee41bf78ae.jpg', 2, '2022-09-02 17:44:16', '45', 1, '', ''),
(690, '6477533962b3aaff03e39', 'Fransiska Nava Kurnia', 'Kalbar', '02/09/2022', '09:04:11', 'TL7/6', 6910000, '78354531e4d4fb398079ba47a927e0ca.jpeg', 2, '2022-09-02 17:31:35', '45', 1, '', ''),
(691, '9489611962ba6df807c2b', 'Mira Astuti', 'Bank Kalbar', '02/09/2022', '-', '11', 6910000, '956fcf82675ab3c41bdb6a795e2041e8.jpeg', 2, '2022-09-02 17:41:52', '45', 1, '', ''),
(698, '7019891562b146272285b', 'Eli sabet', 'Mandiri', '02/09/2022', '16:53:14', '224534931168', 6910000, 'b02970b6f65e98bbf373fed306cee9af.jpg', 2, '2022-09-05 06:28:47', '45', 1, '', ''),
(693, '8530801262cb8836ac8f7', 'Katris Priayoga', 'Bank Kalbar', '02/09/2022', '10:59:53', 'T4.20', 6910000, 'c087c3d5473d7e11c734660e2355c91f.jpeg', 2, '2022-09-02 17:33:33', '45', 1, '', ''),
(694, '9137644462c788d222daf', 'Nini Lestari', 'Bank Kalbar', '02/09/2022', '10:05:48', '061TL01/57', 6910000, '4e3c6071d2e54c211d987e19cceafadc.jpeg', 2, '2022-09-02 17:34:29', '45', 1, '', ''),
(695, '1861472062e2250f05640', 'Lilis Suganda', 'Bank Kalbar', '02/09/2022', '-', 'T20', 6910000, '3dc1d4900e2a17b0f5745278c04f67d1.jpeg', 2, '2022-09-02 17:32:51', '45', 1, '', ''),
(696, '1835911562ba833bdef91', 'Selvi Herlanda', 'Bank Kalbar', '02/09/2022', '14:42:15', 'TL09/32', 2500000, 'd7685d4118c63ee503e44dbb94915e9f.jpeg', 2, '2022-09-02 17:40:20', '45', 1, '', ''),
(697, '4534939762bd03d6265b5', 'Nini Lestari', 'Bank kalbar', '2/9/2022', '13:43:08', 'TL065/36', 6910000, '9a5f0df0e00fd32b306c31a7f0187335.jpg', 2, '2022-09-02 17:38:59', '45', 1, '', ''),
(699, '5612561562a083d82af53', 'Kristina meri', 'Bank kalbar', '2/09/2022', '9:56:36', '228384', 5000000, '8c1fc4cd8f7827d36e87606363f1663c.jpg', 2, '2022-09-03 10:42:34', '49', 1, '', ''),
(700, '1911420562f35235aa7f9', 'Ratna Dewi', 'Bank Kalbar', '02/09/2022', '18:49:13', '315198', 6660000, '69184f5da0c6af50260eca04b0d8e97c.jpg', 2, '2022-09-05 06:20:53', '45', 1, '', ''),
(701, '5473192162d66e1bb3f7f', 'Yosef Aveando Derri', 'Saldo dana', '2/09/2022', '18:46', '3758', 6910000, '4651ca9abece7309f856846e6e27bca7.jpg', 2, '2022-09-05 06:23:36', '45', 1, '', ''),
(719, '1472031462b6f5fd9d6d9', 'Kharisma Yogi febiana', 'Bank Kalbar', '04/09/2022', '13:4923', '04175', 6910000, '41f5afa38927461c3dabb16973100522.jpeg', 2, '2022-09-05 10:36:40', '49', 1, '', ''),
(703, '5269838262db7594921a8', 'Ilham Setiawan', 'Bank BRI', '02/09/2022', '15:51:44', '02137', 6910000, 'fa21f568f5a374f3a2d1caa8fc4086c9.jpeg', 2, '2022-09-03 10:34:35', '49', 1, '', ''),
(704, '9241635562cfa66e3006d', 'Sartika Cahyani', 'Bank Kalbar', '01/09/2022', '13:15:00', '69TL02/035', 6660000, '7cb441fb6bf0c1635df6c7f554a03cd3.jpeg', 2, '2022-09-05 06:25:44', '45', 1, '', ''),
(706, '4533198362b96584a9a61', 'SUTERMAN', 'BANK KALBAR', '03/09/2022', '15:50:34', '031659', 6910000, 'f465e14197d6b0cfcc4ffcbd6ae501b5.jpg', 2, '2022-09-05 06:27:34', '45', 1, '', ''),
(707, '18986885629ef54bc1027', 'Maria Magdalena Lenytia', 'Bank Kalbar', '3-09-2022', '19:13:48', '026576', 6910000, '0e9b3baa617f4627b184af0701bf53a2.jpeg', 2, '2022-09-05 06:29:44', '45', 1, '', ''),
(708, '297966466295b891d3a05', 'Kalista apun', 'Mandiri', '3/09/2022', '12:47:57', '575251247550', 6910000, 'c4581d6c09ce9826c90437937093fda9.jpeg', 2, '2022-09-05 10:44:29', '49', 1, '', ''),
(715, '19090677629470791e0e9', 'Sony Chahyadi', 'BRI Link', '03/09/2022', '13:02:22', '468801286962', 1500000, '2cecae75831f3fae7022aec22a055313.jpeg', 2, '2022-09-05 10:29:35', '49', 1, '', ''),
(727, '38814852629f50852bab3', 'Emelina Santika', 'bank Kalbar', '05/09/2022', '10:01:37', 'TL03/35', 5000000, '5aecfffbda06822818d79f4d4f89da3a.jpeg', 2, '2022-09-05 14:43:57', '49', 1, '', ''),
(717, '1295089962a046a6bad7e', 'Mariono Iyo', 'Bank BRI', '04/09/2022', '15:48:41', '04367', 3660000, '91f3257e49d7c088dbbdee1967c2bf2a.jpeg', 2, '2022-09-05 10:45:31', '49', 1, '', ''),
(714, '188616866269e9adc2590', 'SAMIAN', 'BRI', '04/07/2022', '11:21:31', '000000953512', 3000000, '4fe46b01aa03a25219b33391fda561b7.jpeg', 2, '2022-09-06 15:49:23', '49', 1, '', ''),
(720, '1551308462a9e50bdbce7', 'Ilma Muafaul Husna', 'Bank Kalbar', '05/09/2022', '08:40:48', 'TL02/9', 6660000, '989b97ea91032ba23cbd9aaac064aa04.jpeg', 2, '2022-09-05 14:37:10', '49', 1, '', ''),
(721, '1345005962ccf2f86e7a9', 'SDRI DEVI NATALIA', 'BNI', '04/09/22', '14:39', '274014', 6910000, 'd4e898a9de4cc3da8ba862e3867c815e.jpeg', 2, '2022-09-05 14:29:31', '49', 1, '', ''),
(731, '1946203962b92451bf8e2', 'Rani Tri Alpiani', 'KALBAR', '05/09/2022', '10:29:20', 'TL03/43', 6910000, 'e4216442f15e227a7567df3b64f11a89.jpg', 2, '2022-09-05 14:32:25', '49', 1, '', ''),
(725, '1142152862f4f6217075b', 'Toko SB Ponsel ATK Poto', 'Bri Link', '02/09/2022', '10:01', 'V4VQD7S4Y', 6910000, 'd8de84cb0d2cb3bbe2d832dd045a26c0.jpeg', 2, '2022-09-05 10:49:48', '49', 1, '', ''),
(728, '1610542962e12b7660a5a', 'ibu julianianti sitindaon', 'A BABANK BNI', '5/9/2022', '11:18', '000000014272', 1910000, 'f7ba6158921a5ddb2b04d10faf0a72fe.jpeg', 2, '2022-09-05 14:27:00', '49', 1, '', ''),
(732, '16607464629d68150466d', 'April Liana', 'Bank Kalbar', '05-09-2022', '11:15:38', '329191115360', 3000000, '05c9ab3d21b4364b4afd6c53ca941a93.jpg', 2, '2022-09-05 14:45:58', '49', 1, '', ''),
(744, '1239402462a9c7f02137f', 'Mersya Icut', 'Bank Kalbar', '05/09/2022', '14:10:28', 'T168', 6660000, '308f129a4f98ff456240970fc29efc4d.jpeg', 2, '2022-09-06 14:42:26', '49', 1, '', ''),
(743, '5481165662b8188c82c58', 'Silfia Monicha Suryani', 'Bank Kalbar', '06/09/2022', '08:09', 'TL01/004', 6910000, 'a26006505c8d652983383ba7f4155db5.jpeg', 2, '2022-09-06 14:40:57', '49', 1, '', ''),
(735, '1681822462ad4b4b482d5', 'Yulius mardheni irvandi', 'Bank Kalbar', '05/09/2022', '11:20:37', 'TL06/42', 3660000, '8ecc2409e114316a6926ccca5eed5136.jpg', 2, '2022-09-05 14:36:00', '49', 1, '', ''),
(736, '2370397262dcbcd6e9059', 'Fransiskus Jayang', 'BANK KALBAR', '5 september 2022', '11.39.10', 'TL03/57', 6910000, 'bfe0216ee55e7b148baadc3227dbe7b5.jpeg', 2, '2022-09-08 09:56:22', '49', 1, '', ''),
(753, '6687156762b711c53a3d2', 'Fransiska Emiliani', 'Bank BRI', '07/09/2022', '19:09', '248976', 6910000, 'fff4e6a8ca025e842c2e403fe8246468.jpg', 2, '2022-09-08 16:29:11', '49', 1, '', ''),
(754, '8568048262e89d5187c7a', 'Clarissa Charisna dayanti', 'Bank Kalbar', '07/09/2022', '10:18:49', 'TL14', 6660000, '1e843eaf7ad1470951470ca541950d89.jpeg', 2, '2022-09-08 14:47:39', '49', 1, '', ''),
(747, '9850005662bbef7f3be86', 'BPK BAHRUN', 'BANK BNI', '07/09/2022', '08:49', '00', 6910000, '90d5beacb0883667ad3029f1f36a7854.jpg', 2, '2022-09-08 09:54:32', '49', 1, '', ''),
(742, '5646341362a95df31dff4', 'Krisnawati', 'Bank Kalbar', '05-09-2022', '13:15 wib', '-', 3000000, '05cddb3943877b9ae02811aafa3fffb9.jpg', 2, '2022-09-05 14:42:28', '49', 1, '', ''),
(749, '73359283629f549d3b638', 'Rika rahmah', 'Bank mandiri', '6/09/2022', '19:52', '2209061121305393525', 6910000, '43bbe99b202e7cb8333ec493495edb24.jpg', 2, '2022-09-08 09:52:45', '49', 1, '', ''),
(746, '7882179462ee2204315c8', 'DELIMA WATI', 'BNI', '06/09/2022', '18:33:04 WIB', '20220906183258071335', 6910000, 'fe297d4593d667c1acfa6b342be24acd.jpg', 2, '2022-09-08 10:00:11', '49', 1, '', ''),
(752, '1745963462b9027581e26', 'Dinawati', 'Bank Kalbar', '07/09/2022', '9:33:13', 'T017', 6910000, '3bf9f48659ae3bce91564db391e0e9e5.jpeg', 2, '2022-09-08 10:02:20', '49', 1, '', ''),
(755, '3592837062d9005945d26', 'Ica', 'Bank Kalbar', '08/09/2022', '10:00:52', 'TL02/20', 3000000, 'db287cdeb22dfc8eb513d77dc4f23ccf.jpeg', 2, '2022-09-08 16:28:54', '49', 1, '', ''),
(756, '1772661562abe1d3df17c', 'F.X. Winarto Fingky', 'Bank Kalbar', '08/09/2022', '12:49:22', 'T054', 6910000, 'c7ec7f4e8ddb3eb466cd45a2b04c3d77.jpeg', 2, '2022-09-08 16:29:23', '49', 1, '', ''),
(757, '43466367628c77bb986d1', 'Detri parida', 'Bank BRI', '08:09/2022', '16:43:39', '469789569268', 3250000, '2008d543726339a38771b6e367c24ea5.jpeg', 2, '2022-09-10 10:18:20', '49', 1, '', ''),
(758, '6553587562b54e43d5c3d', 'Uud Rizka Julsuba Putri', 'bank Kalbar', '08/09/2022', '11:20:19', 'TL 09/31', 6660000, '1e8d571c0771d854b301006e9320454e.jpeg', 2, '2022-09-09 14:56:20', '49', 1, '', ''),
(759, '1932989561fb8f47a502f', 'Leonardus Aldo Saputra', 'bank Kalbar', '07/09/2022', '16:56:56', '028292', 2400000, '1147455bcf397eb5f0d1af1d845ad8af.jpeg', 2, '2022-09-09 14:56:50', '49', 1, '', ''),
(760, '159617336268cf1666621', 'Silverster Duvi Agata', 'bank Kalbar', '31/08/2022', '13:04:37', 'TL02/10', 2150000, '7b7a62435ad2ef0fa1f7b90451e37dc6.jpeg', 2, '2022-09-09 14:56:30', '49', 1, '', ''),
(761, '6947591262f0ace878af2', 'ZULKIFLI', 'KALBAR', '09/09/2022', '13:11:26', '01', 6910000, '60847ba48e2c831422dede679ff29b4b.jpg', 2, '2022-09-10 10:26:17', '49', 1, '', ''),
(762, '1055744062bab1a6d60df', 'Lusni Setia', 'Bank Kalbar', '09/09/2022', '14:03:20', '040KBK040TL09 D23040TL09 00000 109', 6660000, 'ddcc368467027dd91f2174347ab578b7.jpeg', 2, '2022-09-10 10:26:07', '49', 1, '', ''),
(763, '2218282862a27f8d3a876', 'Fitri Nelli Sovianti', 'Bank BRI', '07/09/2022', '11:05:29', '469532288476', 6910000, 'f3134009a642aec8196ef834a8695fed.jpeg', 2, '2022-09-10 10:18:09', '49', 1, '', ''),
(764, '1441303662c25eed9a277', 'Dela', 'Bank Kalbar', '05/09/2022', '11:57:06', 'TL03/61', 6910000, '5dc9bbba094ac2562f0702c5c941565c.jpeg', 2, '2022-09-10 10:50:12', '49', 1, '', ''),
(765, '2059587862b47a8fab345', 'DEDI PATRIAN', 'BANK BRI', '10/09/2022', '10:38:37', '245700', 6910000, '8392c51b1a740d918a45e7be3f5fca74.jpg', 2, '2022-09-13 08:31:21', '49', 1, '', ''),
(784, '20156643629b28fbb960b', 'SB Ponsel', 'Bank BRI', '12/09/2022', '10:36:29', '678881036280', 2910000, 'c4a3c8403e4153f18b9ce9c7e0011b34.jpeg', 2, '2022-09-13 08:35:51', '49', 1, '', ''),
(768, '1829283262f0797f41721', 'INTAN KARTIKA SARI', 'BRI', '10/09/2022', '20:12:51', '470223792185', 6910000, '017b1153a1fce41b89da9b52d0cdbbb0.jpeg', 2, '2022-09-13 10:16:45', '49', 1, '', ''),
(769, '1906912462aadd804ea93', 'Agustina  Putri Hutari', 'BANK BRI', '10/09/2022', '10:52:24', '10212', 2000000, 'f71bc1593b6d17fa4232d7f69a90558a.jpg', 2, '2022-09-13 08:31:02', '49', 1, '', ''),
(770, '2110285662ba6c234f077', 'Emilia Rosalia', 'Bank Kalbar', '12/09/2022', '10:16:46', '040 KBK040TL03 D23040TL03 00000 057', 6910000, '28e2d7085bce7b3f4f9ca6d5259c0c6a.jpg', 2, '2022-09-13 08:35:17', '49', 1, '', ''),
(780, '1888690062c24ca90b692', 'Sindy Setiawati', 'bank Kalbar', '12/09/2022', '13:12:24', 'TL03/44', 6660000, 'f4bd2105691ce438d74d911b1cb05a0d.jpeg', 2, '2022-09-13 08:35:04', '49', 1, '', ''),
(772, '1393213762cce24ccaa55', 'Nira', 'Kalbar', '12/09/2022', '11:28:41', 'TL03/36', 6910000, '128ad180b557658a588a68afae52bb29.jpeg', 2, '2022-09-13 08:34:12', '49', 1, '', ''),
(781, '1629152562de011b81fe1', 'Septriana Ayang Linda Ratna', 'bank Kalbar', '12/09/2022', '9:07:18', 'TL03/017', 1510000, 'f3761cb05294d7bbf43c067a0a0981fe.jpeg', 2, '2022-09-13 08:33:38', '49', 1, '', ''),
(774, '1591048362e79297075d6', 'Astuti Nadia', 'Bank Kalbar', '12/09/2022', '11:00:09', '306540', 6910000, '4196cb5bf1b507171b7126636c7ebd4e.jpg', 2, '2022-09-13 08:33:12', '49', 1, '', ''),
(782, '1968796962d6331778713', 'Revina Vilka Nova', 'bank Kalbar', '12/09/2022', '12:51:53', 'T22', 6660000, 'bb95f0572f7a5316d07cc9a4c7eaa54d.jpeg', 2, '2022-09-13 08:33:58', '49', 1, '', ''),
(778, '16614973630d84dc3eb7e', 'Agus Wardianto', 'Bank Kalbar', '12/09/2022', '11:21:55', 'TL09/54', 6910000, 'c5ffd5b171394b23f9e048807a07fe18.jpg', 2, '2022-09-13 08:32:51', '49', 1, '', ''),
(779, '1101687962c98419e4d25', 'Novia Ester Pitriani', 'BANK Kalbar', '12/09/2022', '12:38:24', '268398', 6660000, 'ef5cd5fd6951f6f9ba90a3d55306ce29.jpg', 2, '2022-09-13 08:34:51', '49', 1, '', ''),
(785, '1820757062b9256115f04', 'Oktavianus Liyu', 'BANK KALBAR', '12/09/2022', '15:14:48', '026032', 6910000, '4e46a0e7c9e4f50b1a5cb3c7c0aaee6a.jpeg', 2, '2022-09-13 08:35:31', '49', 1, '', ''),
(786, '7395647362f1df42f19b5', 'Kristina Ervina', 'Bank KALBAR', '12/09/2022', '14:17:39', '123', 6910000, '280c08135a1a4735cb5d17c489301e4d.jpg', 2, '2022-09-13 09:54:33', '49', 1, '', ''),
(788, '1110648162b51b2817ccd', 'Yogi', 'Bank Kalbar  capem jongkong', '12/9/2022', '15:20', '246168', 6910000, 'e8ac610b2dd227fde38e786022d933f2.jpeg', 2, '2022-09-13 09:55:32', '49', 1, '', ''),
(789, '1084531362bbe51c2ad46', 'Rendi Kurniadi Atang', 'Mbanking', '12/09/2022', '13:14:12', '239620114090', 6910000, '14bffb9340132697e0fe7fb51361d851.jpg', 2, '2022-09-13 09:55:04', '49', 1, '', ''),
(791, '1405669262a6d63c3e5be', 'Kezia', 'Bank kalbar', '12/09/2022', '14:44:54', '103', 3000000, '7dea3704267855cf8f330adb7c869bd0.jpeg', 2, '2022-09-13 09:57:49', '49', 1, '', ''),
(792, '1274132062c7d47d51a6e', 'Petrus Sumarto', 'Bank Kalbar', '12/09/2022', '14:11:16', 'TL01/80', 6910000, '27ff421165a8e5edc1e98734330a34d4.jpg', 2, '2022-09-13 09:58:13', '49', 1, '', ''),
(794, '7559735630c8ee84180d', 'Yuli prumanti', 'Bank kalbar', '12/09/2022', '18:14', '061320614330', 6910000, 'd304a4b9d27dcce8dd8581b535b59c8f.jpeg', 2, '2022-09-14 09:43:59', '49', 1, '', ''),
(799, '7604614462f9b9358708e', 'Nikola Erni Tri Utami', 'Bank BNI', '13/09/2022', '08:59', '000000015869', 6910000, 'b95811bbf6539562f0670817948cbe77.jpg', 2, '2022-09-14 09:43:38', '49', 1, '', ''),
(800, '18430043629d9ca7cf50b', 'EPIKA SENTIA', 'Bank Kalbar', '12/09/2022', '14:30', '221130', 6910000, 'a2cbe6825b49b389dbcb6d58b5cdd0f1.jpeg', 2, '2022-09-13 15:10:46', '49', 1, '', ''),
(797, '1530891962a83d06453ff', 'Ulia Dela Handika', 'BANK KALBAR', '12/9/2022', '10:38:40', '237042', 6910000, '81d271e10d551edbcf7a8f3a810bc510.jpg', 2, '2022-09-13 09:55:43', '49', 1, '', ''),
(798, '16697284629b595792404', 'Marta Dela Conseta', 'Kalbar', '13/09/2022', '8:24:23', '4010006517', 6910000, 'bce5ae4550cc5bd2b66b67282ce09c51.jpg', 2, '2022-09-14 09:53:20', '49', 1, '', ''),
(801, '1721337462a32d82d1a0d', 'Peri Irawan', 'bank Kalbar', '12/09/2022', '13:39:17', 'T089', 6000000, '0b92becb4f22a90f1290f964d4509f27.jpeg', 2, '2022-09-13 15:10:30', '49', 1, '', ''),
(803, '2454786462a33776b03f2', 'Heriyanto', 'bank Kalbar', '12/09/2022', '22:20:51', '013379', 5000000, '5ed0e3f9121f5d68a2e244ce1ca3e846.jpeg', 2, '2022-09-14 10:04:02', '49', 1, '', ''),
(805, '2127165362d419f5820f8', 'Rosalia mariani', 'Bank kalbar', '5/9/22', '10:36:50', 'TL 09/18', 6910000, '2ece584082ca4e12eb32e33694a74810.jpg', 2, '2022-09-13 15:09:48', '49', 1, '', ''),
(806, '8260649162e744d7c12ab', 'Chandra Darma', 'Bank Mandiri', '12/09/2022', '18:21', '4010006517', 6910000, 'c09262f15550ea1a31f5b00623793399.jpeg', 2, '2022-09-14 16:13:43', '49', 1, '', ''),
(807, '2933179862eb5cac6f02a', 'Sabna Pertiwi', 'Kalbar', '13/09/2022', '13:29:40', '310284', 6910000, '76df722f8ad39403fa83209b219bf605.jpg', 2, '2022-09-14 09:44:49', '49', 1, '', ''),
(808, '4001214062b05d9ba3e20', 'Srikandi Gustiani', 'Bank Kalbar', '13/09/2022', '12:01', 'T046', 4000000, 'c9cea00335f52c9114a39b3ba3f60126.jpg', 2, '2022-09-14 09:50:48', '49', 1, '', ''),
(809, '6233209562ba79083bf50', 'Sukardi', 'Bank Kalbar', '12/09/2022', '11:02:34', 'T055', 6910000, 'ff1636c5eefb901cb8bf2827b1bcc6e4.jpg', 2, '2022-09-13 15:10:16', '49', 1, '', ''),
(810, '10614544630303be10921', 'Isma Eka Putri', 'Bank Kalbar', '13/9/2022', '11:20;3', '0', 5000000, 'b23106e922a81364b69cc1cf54f0a8f5.jpg', 2, '2022-09-14 10:09:10', '49', 1, '', ''),
(822, '2733414062b91e2342eeb', 'MARGARETA WATI', 'BANK BRI', '13/09/22', '07:12:06', '1310', 3500000, 'dcf7171a078dda122aee84011a1ce306.jpg', 2, '2022-09-14 09:50:06', '49', 1, '', ''),
(818, '1691668162a9628798fd8', 'Dea Junita', 'bank Kalbar', '13/09/2022', '11:26:58', 'T59', 6910000, '755aa6d1561a635145aaa24f7567b819.jpeg', 2, '2022-09-14 09:51:59', '49', 1, '', ''),
(819, '2075727462d6c23b511c8', 'Paskalis dodi', 'Bank kalbar', '13/09/2022', '14:18:25', 'L59', 1510000, '09840974b6cdd9f12a433fe6fada7654.jpg', 2, '2022-09-14 09:48:27', '49', 1, '', ''),
(817, '1141082662b13c2c61ac6', 'Miat Tiah', 'bank Kalbar', '13/09/2022', '10:19:44', 'T52', 3000000, '71755a0053b2fd2e7beed057a83b634f.jpeg', 2, '2022-09-14 09:50:32', '49', 1, '', ''),
(823, '1432201862e1e1a326e5b', 'Yudi Apriadi', 'Bri', '13/09/22', '15:51:42', '13423', 6660000, 'ebe77857d3522c595f005d729bb15f47.jpg', 2, '2022-09-15 14:17:53', '49', 1, '', ''),
(847, '21082815629fe21716c4f', 'Claudea Rahelia Kellytasya', 'bank Kalbar', '13/9/2022', '10:14', 'T58', 1910000, '72b315df4fdb08e4ab4c975aed477350.jpg', 2, '2022-09-14 10:08:49', '49', 1, '', ''),
(825, '4703716662ac89b39e20b', 'Ilarinus', 'BANK KALBAR', '15 Juli 2022', '14:16:02', '240786', 1500000, '671e72850499b2a13eeb568541cd07b7.jpg', 2, '2022-09-14 09:51:02', '49', 1, '', ''),
(826, '1840018262cabd462f4f2', 'Jonisius yeftha Irwandi', 'Kalbar', '13-09-2022', '14:33', '269802', 6910000, '0cd1f4dc64901e2624f59e21fc0f49b4.jpg', 2, '2022-09-14 09:49:14', '49', 1, '', ''),
(827, '8678642562eb42d8102d5', 'BPK HENDRA PRYANTO', 'Bank BNI', '13/09/2022', '13:10', '123', 3000000, '22abe539c4202e3ad959df89b5ecc694.jpg', 2, '2022-09-14 09:45:17', '49', 1, '', ''),
(829, '2057652862b864a21fc2d', 'IKHSAN GHOZALI', 'BANK KALBAR', '13/09/2022', '08/34/12', '250146', 4000000, '4816720a573adbaa7816cc3c25fbc5a5.jpeg', 2, '2022-09-14 09:50:18', '49', 1, '', ''),
(843, '21082815629fe21716c4f', 'Claudea Rahelia Kellytasya', 'Bank Kalbar', '05 - 09 - 2022', '10:55:03 ', 'T 66 ', 5000000, 'fb64c70e4ad38aa5acd72b0742b44347.jpg', 2, '2022-09-14 10:08:57', '49', 1, '', ''),
(833, '5612561562a083d82af53', 'Kristina meri', 'Bank kalbar', '13/09/2022', '10:44:44', '228384', 1910000, 'eaf0b5e1a05e82d3924b70440361f7a5.jpg', 2, '2022-09-14 09:53:06', '49', 1, '', ''),
