-- phpMyAdmin SQL Dump
-- version 5.2.1
-- https://www.phpmyadmin.net/
--
-- Host: localhost:3306
-- Waktu pembuatan: 09 Des 2024 pada 15.02
-- Versi server: 10.11.9-MariaDB-cll-lve
-- Versi PHP: 8.3.13

SET SQL_MODE = "NO_AUTO_VALUE_ON_ZERO";
START TRANSACTION;
SET time_zone = "+00:00";


/*!40101 SET @OLD_CHARACTER_SET_CLIENT=@@CHARACTER_SET_CLIENT */;
/*!40101 SET @OLD_CHARACTER_SET_RESULTS=@@CHARACTER_SET_RESULTS */;
/*!40101 SET @OLD_COLLATION_CONNECTION=@@COLLATION_CONNECTION */;
/*!40101 SET NAMES utf8mb4 */;

--
-- Database: `u4397696_pmb2023`
--

-- --------------------------------------------------------

--
-- Struktur dari tabel `biaya_kuliah_pmb`
--

CREATE TABLE `biaya_kuliah_pmb` (
  `id_biayakuliahpmb` int(11) NOT NULL,
  `item_biaya` varchar(100) NOT NULL,
  `jlh_uang` int(11) NOT NULL
) ENGINE=MyISAM DEFAULT CHARSET=latin1 COLLATE=latin1_swedish_ci;

--
-- Dumping data untuk tabel `biaya_kuliah_pmb`
--

INSERT INTO `biaya_kuliah_pmb` (`id_biayakuliahpmb`, `item_biaya`, `jlh_uang`) VALUES
(1, 'Registrasi Mahasiswa Baru', 1510000),
(2, 'Pengembangan Kampus', 3250000),
(3, 'SPP Tetap / Semester', 2280000);

-- --------------------------------------------------------

--
-- Struktur dari tabel `biaya_kuliah_pmbtest`
--

CREATE TABLE `biaya_kuliah_pmbtest` (
  `id_biayakuliahpmb` int(11) NOT NULL,
  `item_biaya` varchar(100) NOT NULL,
  `jlh_uang` int(11) NOT NULL
) ENGINE=MyISAM DEFAULT CHARSET=latin1 COLLATE=latin1_swedish_ci;

--
-- Dumping data untuk tabel `biaya_kuliah_pmbtest`
--

INSERT INTO `biaya_kuliah_pmbtest` (`id_biayakuliahpmb`, `item_biaya`, `jlh_uang`) VALUES
(1, 'Registrasi Mahasiswa Baru', 1510000),
(2, 'Pengembangan Kampus', 3500000),
(3, 'SPP Tetap / Semester', 2280000);

-- --------------------------------------------------------

--
-- Struktur dari tabel `bukti_bayar`
--

CREATE TABLE `bukti_bayar` (
  `id_bukti_bayar` int(11) NOT NULL,
  `akunb_msiswa` varchar(225) NOT NULL,
  `nama_pengirim` varchar(100) NOT NULL,
  `bank_pengirim` varchar(50) NOT NULL,
  `tgl_trans` varchar(20) NOT NULL,
  `jam_trans` varchar(20) NOT NULL,
  `nomor_refe` varchar(225) NOT NULL,
  `jlh_bayar` int(11) NOT NULL,
  `bukti_bayar` varchar(225) NOT NULL,
  `validasi_bukti` int(2) NOT NULL,
  `tgl_validbukti` varchar(50) NOT NULL,
  `yg_validasi` varchar(10) NOT NULL,
  `konfirm_bauk` int(2) NOT NULL,
  `yg_validasibauk` varchar(50) NOT NULL,
  `tgl_konfirmbauk` varchar(50) NOT NULL
) ENGINE=MyISAM DEFAULT CHARSET=latin1 COLLATE=latin1_swedish_ci;

--
-- Dumping data untuk tabel `bukti_bayar`
--

INSERT INTO `bukti_bayar` (`id_bukti_bayar`, `akunb_msiswa`, `nama_pengirim`, `bank_pengirim`, `tgl_trans`, `jam_trans`, `nomor_refe`, `jlh_bayar`, `bukti_bayar`, `validasi_bukti`, `tgl_validbukti`, `yg_validasi`, `konfirm_bauk`, `yg_validasibauk`, `tgl_konfirmbauk`) VALUES
(963, '9274496263da075134f0f', 'Mulyadi', 'Bank rakyat indonesia', '18/02/2023', '17:26', '123', 7290000, '1c5f4e4af3d8789d2c4258c5b586d9cd.jpg', 2, '2023-02-20 16:06:53', '45', 1, '', ''),
(964, '1757841863bd4b6872d1a', 'Fari Rahman', 'Bank Kalbar', '20/02/2023', '12:46:30', 'T 069TI .24', 7290000, 'ef17189baa1a10b3fa34653c15a28ffc.jpg', 2, '2023-02-20 16:14:07', '45', 1, '', ''),
(965, '9189861063c1f42bdd268', 'Gia maharani', 'Bank kalbar', '20/02/2023', '10:43:15', 'T 069TI.23', 7040000, '1349f21aa7879c50c4f97e4d95cf3c31.jpg', 2, '2023-02-20 16:18:03', '45', 1, '', ''),
(969, '1836807863de4fe775c9b', 'Bibiana Natalia', 'Brimob', '20/2/2023', '12.46.27', 'TTK-178388', 1510000, 'cb69d134d401f207d7a9f14f745ca1ae.jpg', 2, '2023-02-21 11:59:47', '45', 1, '', ''),
(968, '1394361163ba3d1e0eda5', 'Salwa', 'Bank Kalbar', '20/02/2023', '10:03:00', '069TL.19', 7290000, '91a10ac9c45a2a7e6ae0ef67c430c56b.jpeg', 2, '2023-02-20 15:52:59', '45', 1, '', ''),
(989, '1817558963e9908755de8', 'Theresia alda', 'KSP Cu Keling kumang', '23/02/2023', '11:14:30', '01-056-104-0000178', 7290000, '4863b5a4fe0f2dd69bdb5bd870a10719.jpg', 2, '2023-02-24 10:00:18', '45', 1, '', ''),
(986, '1913336163cba5ca4f43f', 'ALFINUS', 'BCA', '22/02/2023', '16:48:01', '654339', 7290000, '4ad98f5f20874b8b117d364bc1890b67.jpg', 2, '2023-02-23 12:33:58', '49', 1, '', ''),
(973, '1402666063bf803712eab', 'PIKRI', 'BANK KALBAR', '20/02/2023', '10:03:00', 'T 069TL 20', 7290000, '33fd9dd5dffd9bebefac69209a50fe29.jpg', 2, '2023-02-22 09:08:56', '49', 1, '', ''),
(992, '2114182463cb8c76992de', 'Chairunnisa', 'BANK KALBAR', '24/02/2023', '13:23:01', 'T  069TI 39', 7290000, '49cfa16d29cb0a566edf286d8673e5ac.jpg', 2, '2023-02-24 16:27:59', '49', 1, '', ''),
(983, '1072028563b564695c36e', 'Marsanda', 'BRI', '21/02/2023', '15:26:17', '4446', 7290000, 'b8ee89b7b342dbcb1faaba00c7f3e597.jpg', 2, '2023-02-22 09:10:55', '49', 1, '', ''),
(984, '2143710863ddc0e18312f', 'SANTA MARIA TITI', 'Bank BNI', '21/02/2023', '18:24:36', '20230221182433352037', 7040000, 'e7a4936c2f2dbae7ce62c7cb5f6f8d28.jpg', 2, '2023-02-22 09:13:25', '49', 1, '', ''),
(979, '8586780263db527d023d1', 'Siti Kalsum', 'Bank BRI', '20/02/2023', '13:52:49', '000000201405', 3040000, '7ecb3ce0d8f745388e1166242f25d892.jpg', 2, '2023-02-21 12:17:11', '45', 1, '', ''),
(980, '8586780263db527d023d1', 'Maria Yohana Miao', 'Bank BRI', '20/02/2023', '13:51:36', '000000192185', 4000000, '05e701cc55677ec3eaba41a6066cade9.jpg', 2, '2023-02-21 12:16:09', '45', 1, '', ''),
(991, '1700603163db59aeb8dad', 'DONA ARIFA', '738701005595530', '24-02-2023', '11:32:26', '509335946123', 7290000, '8256644119d2a86ba4519b414072c425.jpg', 2, '2023-02-25 09:37:34', '49', 1, '', ''),
(1000, '3703614163e376dde38f9', 'Susanto Yak Aban', 'BRI', '27 februari 2023', '13:46 wib', '123', 1510000, '008622914370d1b7b61fa55b653cc67b.jpg', 2, '2023-02-27 15:37:56', '49', 1, '', ''),
(999, '1110940863cfa5ffd5037', 'Leo agung', 'Bank Kalbar', '27/2/2023', '13:37:27', '300760137250', 1510000, 'df42f7e025680e432f11cfa8fbb98145.jpg', 2, '2023-02-27 15:39:48', '49', 1, '', ''),
(998, '9245609263df6e9a4b0b4', 'Matius', 'Bank BRI', '25 Februari 2023', '11:34:25', '21294', 1510000, '2348095eea0a13922cfe4270399fa56e.jpeg', 2, '2023-02-27 08:54:58', '49', 1, '', ''),
(997, '1926061863da12cf1962f', 'FREDRIC ARISTO', 'Bank kalbar', '23/02/2023', '15:20:30', 'TL05/58', 7290000, 'bf394e1700f7f0169e63fbd7125a55e7.jpg', 2, '2023-02-24 14:53:01', '49', 1, '', ''),
(1001, '5406232863ed984d9decc', 'Darti Aryani', 'bank Kalbar', '27/02/2023', '11:17', 'T045', 7290000, '24831a6565415b014c69e4b6b5560770.jpeg', 2, '2023-02-27 15:35:06', '49', 1, '', ''),
(1002, '1818811863a0559e6ed90', 'Patila Kumala Sari', 'bank Kalbar', '27/02/2023', '13:49', '06TL01/19', 7290000, 'c5a0424572ae9b271078601b689bef32.jpeg', 2, '2023-02-27 15:45:06', '49', 1, '', ''),
(1003, '9940610563bbbc98ea876', 'Heru Supoco', 'Bank BRI', '27/02/2023', '14:35', '000009438322', 1510000, 'eeeaa7cfb950517fe8861e41b85922b8.jpeg', 2, '2023-02-27 15:42:00', '49', 1, '', ''),
(1004, '1293365263b8db05504a2', 'Heru Supoco', 'Bank BRI', '27/02/2023', '14:31', '123', 1510000, 'e22954a3b0f7819c08b09fcd64327c30.jpeg', 2, '2023-02-27 15:44:08', '49', 1, '', ''),
(1009, '1218999563c3dc9f8bf7f', 'Natalia', 'BRI', '28/02/2023', '10:28:18', '000006285145', 3290000, 'b4a42f6e3adce8033eaa9b2aab0d28bb.jpeg', 2, '2023-05-13 09:27:42', '49', 1, '', ''),
(1010, '8244050963ca389e0bebe', 'Dita maidah', 'Bank kalbar', '27/02/2023', '10:33:53', '4010006517', 7040000, '0f063f51fe36be0175769ae01b3c3a1d.jpeg', 2, '2023-02-28 13:54:28', '49', 1, '', ''),
(1014, '8398325963bebea49d406', 'Pak Welly', 'BRI', '03/03/2023', '09:33:34', '502829400707', 1510000, '70cd4877faddab83f168e03775a07ddd.jpeg', 2, '2023-03-03 09:42:15', '45', 1, '', ''),
(1013, '1865920563a1433378df4', 'Humatop', 'Payfazz', '28/02/2023', '15.43', '0000000', 1510000, '2b6a8273db81993644909e1dd1524af4.jpg', 2, '2023-03-01 11:18:17', '49', 1, '', ''),
(1008, '1642444863bad9cece227', 'HERU SUPOCO', 'BRI', '27/02/2023', '16:01:03', '510169089157', 7040000, '8dcd386a494daa651df6fd7e966c759e.jpeg', 2, '2023-02-28 11:19:15', '49', 1, '', ''),
(1015, '1387605963d658664be4a', 'Mila Rosita', 'Bank Kalbar', '02/03/2023', '14: 37:43', '60', 1510000, '92d0c415a32d5143cde599222bb537e1.jpeg', 2, '2023-03-03 09:49:04', '45', 1, '', ''),
(1016, '1299026263e44e0bd7525', 'HAFIZAN', 'BNI', '17/03/2023', '09:57:54', '43671384', 1510000, '6453e29a6066bb9352902efde0032b77.jpg', 2, '2023-04-07 19:39:12', '45', 1, '', ''),
(1028, '1085950664360b4d3db8f', 'EMELDA', 'BRI', '16/05/2023', '15:34:18', '534641953210', 7290000, '6e646fa8d750abbb5c451c6043091e84.jpeg', 2, '2023-05-17 09:48:13', '45', 1, '', ''),
(1018, '1478803563f5b7358aac2', 'Tia Elpina', 'Bank Kalbar', '6 April 2023', '10:15:52', '002', 7040000, '5f98ba2e4259d87c59950dc643f01297.jpg', 2, '2023-04-07 19:32:01', '45', 1, '', ''),
(1023, '3903076163c68dcb1825e', 'Isratun Aida Septiara', 'Bank Kalbar', '11/05/2023', '12:53:23', '000.00 T 3.33', 7040000, 'ee4038e06e075c00b0d18dd3fe5ec2ec.jpeg', 2, '2023-05-13 09:27:24', '49', 1, '', ''),
(1020, '1718750063f4973c874d9', 'Maria Angela Ela', 'Bank Kalbar', '02/05/2023', '11.56', '+62 821-5596-4080', 7040000, 'dba027c5d966529e2f493b4e5160ca62.jpeg', 2, '2023-05-05 09:24:52', '49', 1, '', ''),
(1022, '1836807863de4fe775c9b', 'Bibiana Natalia', 'Cu Keling Kumang', '27/04/2023', '15:11', '72478121-1396-437d-8902-9e431f684295', 3500000, '21ea976d7af70664b915ce3b037e890c.jpeg', 2, '2023-05-03 09:41:24', '49', 1, '', ''),
(1024, '1844721764584a7bd80f2', 'Dea Yunisa', 'Bank Kalbar', '16/05/2023', '10.23', '126594', 7040000, 'b240c657eaed9101da421634abe1a5a8.jpg', 2, '2023-05-16 14:18:46', '45', 1, '', ''),
(1029, '117805096461925f27db5', 'Riana oktapiani', 'Kalbar', '16:05/2023', '08:45:30', '123', 7040000, '935cf199c6be4e3c6b05b7d1d4daebc8.jpeg', 2, '2023-05-17 09:46:10', '45', 1, '', ''),
(1030, '10560551645efbb07a01c', 'RENI KARTIKA', 'BANK KALBAR', '16/05/2023', '09:55:01', 'TL01/21', 7290000, 'dda1ff860227b948a7093ce79a410c11.jpg', 2, '2023-05-17 11:03:57', '45', 1, '', ''),
(1032, '20386607643a83c86b152', 'Ivan Irfandi', 'BANK KALBAR', '17/05/2023', '10.26', '-', 7290000, '33cbf80260bdd55412174d54596d6fa6.jpg', 2, '2023-05-19 10:13:46', '45', 1, '', ''),
(1033, '8526031764238ab2a9088', 'Tiara Rafika Utari', 'BANK KALBAR', '17/05/2023', '11:14:18', '002', 7290000, '1461bf15f0677dd6097304924ea9a613.jpg', 2, '2023-05-19 10:39:10', '45', 1, '', ''),
(1034, '542978246458ec608f87c', 'YUNI KHAIRUNNISA', 'Bank kalbar', '17/05/2023', '8:50:00', '129636', 3000000, '476007fb7a4337ce7647d87d1b73edbd.jpg', 2, '2023-05-19 10:03:40', '45', 1, '', ''),
(1045, '1886481364577fb4d4c27', 'SHINDI', 'BANK BRI', '19/05/2023', '08:05:02', '125658', 7040000, '3fdc69e8a603e7945f544965a7d6d054.jpg', 2, '2023-05-19 10:33:22', '45', 1, '', ''),
(1038, '1811689063f9f7820e87f', 'Aldysius Saputra', 'BANK KALBAR', '17/05/2023', '14:32:29', 'KRK041PC01', 5000000, 'cab138cf5bd6fd334ba0a7bd9a8549b3.jpg', 2, '2023-05-19 10:44:31', '45', 1, '', ''),
(1039, '21361878644f9362b708b', 'Vera Nursiani', 'BRI', '17/05/2023', '16:13:12', '503503662491', 3000000, 'a92da30cabcd3e346e21ef140ab20dcf.jpg', 2, '2023-05-19 10:08:16', '45', 1, '', ''),
(1044, '1010583664619dca16ab3', 'Ana Laila Sari', 'KALBAR', '19/05/2023', '09:46:46', '04/8', 7290000, '92f8838d4c1bf88c315f85fdb667646e.jpg', 2, '2023-05-19 10:29:56', '45', 1, '', ''),
(1040, '16345820644a57a5549a3', 'LORENSIUS PENDI', 'Bank Kalbar', '17/05/2023', '13:11:11', '4010006517', 7040000, 'f84403d625c318bd320f850e10c3090d.jpg', 2, '2023-05-19 10:11:04', '45', 1, '', ''),
(1041, '389838466411b0d91137d', 'DIYAND SAPUTRA', 'KalBar', '17/05/2023', '13:29:18', '.', 7290000, 'bbdf0d2827112df677f2dc67e9a9300a.jpg', 2, '2023-05-19 10:42:07', '45', 1, '', ''),
(1050, '3396270463ee1a67a1567', 'Maria Yolanda P a', 'Kalbar', '19 Mei 2023', '10:30', '27144', 7290000, 'e21c368060bd83eed687ceba7d80d304.jpeg', 2, '2023-05-19 18:46:19', '45', 1, '', ''),
(1043, '21148107645a3d1205292', 'INCAU', 'BANK BRI', '18/05/2023', '13:17:36', '535292893977', 1510000, 'd1d2530b3b3ed4cedaa7f04bda124f53.jpg', 2, '2023-05-19 09:57:34', '45', 1, '', ''),
(1051, '83795053640333214ed18', 'SITI', 'BANK KALBAR', '19/05/2023', '09:50:46', 'TL06/14', 7290000, 'c4d9352ec14b5e5bb488d3792f2f7447.jpg', 2, '2023-05-19 18:44:29', '45', 1, '', ''),
(1048, '56299338643b66aeaf53f', 'Clara Sinta purnama', 'BANK KALBR', '19/05/2023', '9:25:58', '110705', 7040000, 'c547abc28f963b22a999e8fd55f2a7ca.jpg', 2, '2023-05-19 10:36:33', '45', 1, '', ''),
(1052, '224564766452543b87864', 'Nurul sulma', 'BANK KALBAR', '19/05/2023', '09:11:45', 'KBK062TLO1', 7290000, 'ed062a47fc0518aed28e332879642a54.jpeg', 2, '2023-05-20 10:30:35', '45', 1, '', ''),
(1063, '582196926404b02b79faf', 'Maria Ratna Wati', 'Bank Kalbar', '21/05/2023', '14:52:41', '009241', 7040000, '99e48c1b4c7bcfad38720c7db56b8f57.jpg', 2, '2023-05-22 09:01:02', '45', 1, '', ''),
(1062, '39012739644340c6d330e', 'SONY CHAHYADI', 'Konter', '21/5/2023', '13:12:34', '536325456753', 1510000, '48e6fdbae5194695ba904599565a425b.jpg', 2, '2023-05-22 09:00:14', '45', 1, '', ''),
(1060, '16469714644df161c2226', 'Sinta Karmila', 'BNI', '20/05/2023', '16:00', '115596', 5010000, 'cd9c28647e9c681905d0732b466d1dc0.jpg', 2, '2023-05-22 08:58:43', '45', 1, '', ''),
(1059, '1697320463f9e3292a1ce', 'Novertus Pratama', 'BANK KALBAR', '20/05/2023', '15:42', '35802', 7290000, 'a8822d89b09a855df0a09bd8046ffe4f.jpg', 2, '2023-05-22 09:02:19', '45', 1, '', ''),
(1064, '10658560645c8ed11e116', 'Valentino Kurniawan', 'Bank Kalbar', '19/05/2023', '10:06:06', '37', 5000000, 'db508f051cd08ebfad2cc649461a267b.jpg', 2, '2023-05-22 08:56:36', '45', 1, '', ''),
(1066, '95522632645623d15200e', 'Miftahul Jannah', 'BANK KALBAR', '22/05/2023', '08:14:50', '-', 7040000, '3fc855aedad9cb168d4cdc14d8d71bc0.jpeg', 2, '2023-05-22 12:01:42', '45', 1, '', ''),
(1068, '83443070644cb0dae0207', 'Risna', 'BANK BRI', '22/05/2023', '09:21:26', '000004796974', 7290000, 'd4598a79f2df24dc2cde2cb9e9fc379c.jpg', 2, '2023-05-22 12:04:09', '45', 1, '', ''),
(1069, '74713819645ce846a1046', 'Juraini', 'Bank kalbar', '22/05/2023', '09:33:55', '138060', 7290000, 'cb4f390123d999cf0f123d503214af63.jpg', 2, '2023-05-22 11:12:25', '45', 1, '', ''),
(1070, '2092699064619dbd2c982', 'Asriatun Zanah', 'BANK KALBAR', '22/05/2023', '9:14:12', '04/13', 7290000, '09b6016c742d7a4750fb0917891f96eb.jpg', 2, '2023-05-22 11:06:56', '45', 1, '', ''),
(1074, '88714015642f70677cbdd', 'Zulkarnaen', 'Bank kalbar', '22/5/2023', '10:47:33', 'TL02/49', 7290000, '025afbf44ac9dd82e4e85cae64afcb20.jpg', 2, '2023-05-22 12:08:11', '45', 1, '', ''),
(1075, '2780294264096c70482c6', 'Brunosius Herix', 'Bank Kalbar', '22/05/2023', '10:11:22', 'TL7/12', 7290000, 'b3b3b73152be968045dd8621e3bd16d5.jpg', 2, '2023-05-22 12:09:18', '45', 1, '', ''),
(1073, '101007186460c010455cb', 'Andriono, SP', 'BRI', '22/05/2023', '09:50:13', '0301011660478138079035392', 2000000, '28ea62de2dab84037e962a89ceae9bd3.jpg', 2, '2023-05-22 11:10:58', '45', 1, '', ''),
(1088, '171539586434099224d0b', 'Christian Embu Marno', 'Bank Kalbar', '22/05/2023', '09:45:17', 'TL 01/33', 7290000, '7298ab78780244ef2110ce1b9feaa9e8.jpg', 2, '2023-05-23 05:44:03', '45', 1, '', ''),
(1087, '64850397642ad2133fe86', 'Yeny widya rachma', 'Kalbar', '22/05/2023', '08:49:05', '4010006517', 7040000, '5392ffe918328ac10bfa8d93148776f4.jpg', 2, '2023-05-23 05:52:21', '45', 1, '', ''),
(1078, '4671890663feb9be48640', 'Maria Carolina Selfia', 'BANK KALBAR', '22/05/2023', '09:23:53', 'T 1.37', 7290000, '71ac612e1cf01d257929733d324f6f83.jpg', 2, '2023-05-22 12:10:21', '45', 1, '', ''),
(1079, '8964459064341391073bc', 'Fernando Alonso Jori', 'Bank Kalbar', '22/05/2023', '09:50:11', 'TL 02/03', 7290000, 'e93e828d6347ea63a749ce0c223a4c59.jpeg', 2, '2023-05-22 12:05:43', '45', 1, '', ''),
(1086, '19762408642e830e372ba', 'Carolina valensia lara', 'Kalbar', '22/05/2023', '11:01:06', 'T1.61', 7040000, 'b40bf6f86de47c6188abc3f87f361d04.jpg', 2, '2023-05-23 05:50:05', '45', 1, '', ''),
(1085, '846938016403dccbad8c1', 'Margareta sovi', 'BANK KALBAR', '22/05/2023', '09:20:57', '123', 7040000, 'a06ad5e5e7bb55871784c90592dfadb4.jpg', 2, '2023-05-23 05:57:06', '45', 1, '', ''),
(1084, '92064238645c7c203e6ce', 'Denis Andrian Mahesta', 'BANK KALBAR', '22/05/2023', '11:10:31', '136422', 7290000, '2e77e777cefabdabf7198b656aa66928.jpg', 2, '2023-05-22 12:06:50', '45', 1, '', ''),
(1094, '136378436406ac5e92164', 'VANESA', 'BANK KALBAR', '22/05/2023', '14:31:42', '002', 7290000, 'ca8552bea67e011c9abc13eb638bf096.jpg', 2, '2023-05-23 05:55:33', '45', 1, '', ''),
(1095, '16636115642584f32de0d', 'Rachel Amanda', 'Bank Kalbar', '22/05/2023', '13:11:05', '069Tl-68', 7040000, '49d6ae1d12154c3abed86ba494afae13.jpg', 2, '2023-05-23 05:54:07', '45', 1, '', ''),
(1090, '130576466433c47d71f06', 'Meisa Yulanda Jevi', 'Bank KALBAR', '22/05/2023', '14:11.50', 'T33', 7040000, '1b9d284ec71dab88dee295d2509c09fe.jpg', 2, '2023-05-23 05:46:19', '45', 1, '', ''),
(1092, '116220036437da9635b2c', 'Puja Astuti', 'Bank Kalbar', '22/05/2023', '11:15', '023041', 3790000, '02e79044f81eeb5afad3ae0438a70953.jpg', 2, '2023-05-23 05:38:57', '45', 1, '', ''),
(1093, '211018066437a009475dd', 'Resha Agustin', 'Bank Kalbar', '22/05/2023', '11:01:33', '00000', 2000000, '4442068ce5f777d51c88b79c6993aa0d.jpg', 2, '2023-05-23 05:41:40', '45', 1, '', ''),
(1097, '1094234864618ff8dd243', 'SHEVIA NUR JULIANTI', 'BPD KALBAR Simpang Pandan', '22/05/2023', '11:09:52', '040KBK040TL04023040PT0100000063', 7040000, '5459dd83c4b08080ec35c086bef86866.jpg', 2, '2023-05-23 05:31:45', '45', 1, '', ''),
(1098, '10532830642f919cb42b6', 'Yunita fitasari', 'Bank Kalbar', '22/05/2023', '13:44:32', '123', 7290000, '22cbecd3a048fd073396e79b6ebe20af.jpeg', 2, '2023-05-23 05:48:04', '45', 1, '', ''),
(1100, '80768322646080e2e6031', 'ALI', 'Bank Mandiri', '22/05/2023', '21:26:20', '2305221122796713202', 7290000, '62d7654532fdff58397863771829e410.jpg', 2, '2023-05-23 05:36:02', '45', 1, '', ''),
(1101, '937101426458bf4a9419a', 'SUHADI', 'mandiri', '23 Mei 2023', '08:44:37', '2305231122797140063', 1510000, '92a7fdd483cf9fa1369654038518d541.jpg', 2, '2023-05-23 10:19:07', '45', 1, '', ''),
(1103, '5786012063f2ca87cc237', 'PURWIRISWANTI', 'BRI', '23/05/2023', '09:12:28', '536953272129', 7040000, '6a08b65a340a5be8eb50e6a1e362eda8.jpg', 2, '2023-05-23 11:25:48', '45', 1, '', ''),
(1104, '141659596405839841210', 'Amanda Sri Padilah', 'Bank Kalbar', '22 Mei 2023', '11:00', '123', 7040000, '12e24bbb31ec530c8a3d5ef50be06dd4.jpg', 2, '2023-05-23 16:14:33', '45', 1, '', ''),
(1105, '14590823640460be2d1ef', 'RIO FEBRIYAN', 'BANK KALBAR', '23/5/2023', '11.14.30', '123', 7290000, '93ce0d4376c71f49d219640333ad6937.jpeg', 2, '2023-05-23 11:23:43', '45', 1, '', ''),
(1107, '294568426436a1753d41c', 'Olipia', 'Bank KalBar', '23/05/2023', '08:36:09', 'TL.04', 7290000, '96c80293a4b650e9fd6ddd248f44050c.jpg', 2, '2023-05-23 11:26:43', '45', 1, '', ''),
(1111, '488991326403e07c7b468', 'Ijartiah', 'Bri', '23/5/2023', '12:06:37', '000003934873', 3500000, 'a477f3c6da88a16c2a10397670f13ff8.jpg', 2, '2023-05-24 10:35:55', '45', 1, '', ''),
(1109, '19169973645c5302a2d3d', 'Trisiniria', 'Bank Kalbar', '23/05/2023', '14:05:10', '135954', 7290000, '8a9d4bfc92beee70d66dafcc7d24e372.jpg', 2, '2023-05-23 16:12:59', '45', 1, '', ''),
(1112, '88692264644872893cbce', 'MAKHRUDDIN', 'BANK KALBAR', '23/05/2023', '15:38:28', '537086187221', 7290000, '314126fef8c1cdad5da3ea9677449019.jpeg', 2, '2023-05-25 09:18:58', '45', 1, '', ''),
(1113, '201840346441df2cdf65f', 'Paskalia Margareta Srigandi', 'Bank Kalbar', '22/05/2023', '09:30:15', '103896', 7290000, 'ad54fa4d7f70ad58f065da96440dcca5.jpg', 2, '2023-05-24 10:29:20', '45', 1, '', ''),
(1114, '720921186417ed066af3e', 'DIANA JUANITA SISIK', 'BANK KALBAR', '22/05/2023', '08:31:28', '1', 7290000, '6ceef9e77832211cd62d3963509c497a.jpg', 2, '2023-05-24 10:33:45', '45', 1, '', ''),
(1115, '81551991643519c3db75c', 'DEA AGNES SINGGAR SARI', 'BANK KALBAR', '23/05/2023', '13:48:10', 'TO2/34', 7040000, '5c51af0193d02d22a4ee8b0b768d0660.jpg', 2, '2023-05-24 10:24:06', '45', 1, '', ''),
(1116, '441880316449c9d8c2b92', 'NURMALISA', 'BANK KALBAR', '23/05/2023', '13:39:36', '111852', 7290000, 'f31bd72db6551fbf0657f8946d65d9f3.jpg', 2, '2023-05-24 10:22:45', '45', 1, '', ''),
(1117, '600561186422621534e9b', 'Septia Rosiana', 'Bank Kalbar', '23/05/2023', '13:35:46', 'T0. 17', 7290000, '96c3cd6554671305791e49a333c21567.jpg', 2, '2023-05-24 10:32:09', '45', 1, '', ''),
(1125, '1481930664361f3981e71', 'Ayu Lestari', 'Bank Kalbar', '24/05/2023', '12:05:20', '1', 7290000, 'ec4a58efb1f7a8ae868ea08a9d268b31.jpg', 2, '2023-05-25 09:20:32', '45', 1, '', ''),
(1119, '1762002564350d3a5c0f6', 'Julianus Bagas', 'Bank Kalbar', '23/05/2023', '8 : 56 : 34', 'TL01/21', 7290000, 'f12984705f6ea04dbbadcd6b4c8cc824.jpg', 2, '2023-05-25 09:21:46', '45', 1, '', ''),
(1121, '74229640644a5bf4869fa', 'Yuliana', 'Bank Kalbar', '23/5/23', '13:36:25', '113490', 3790000, 'ef53db1fa0d7e4e0a2099b0fa11d1654.jpg', 2, '2023-05-25 09:15:59', '45', 1, '', ''),
(1122, '9647781064314d1338cac', 'Fransiska sobeang', 'Bank kalbar', '24/05/2023', '10:35', '84708', 7290000, 'd876978a99b43417d7d1b927b9c390ea.jpg', 2, '2023-05-25 09:24:40', '45', 1, '', ''),
(1123, '12850286643397e6932ea', 'F Melisa Ribas S', 'Bank Kalbar', '24/05/2023', '10:42:27', '85410', 7290000, '58417e1e40ac7e3c753a7bdbf6178f71.jpeg', 2, '2023-05-25 09:23:05', '45', 1, '', ''),
(1124, '514908546411bbb73eccf', 'IGNASIUS SUNARNO', 'BANK Kalbar', '24/05/2023', '13:41:47 WIB', '2305241122799379356', 7290000, '69aa29709deab3a61ee16b6146d2db92.jpg', 2, '2023-05-27 11:27:12', '45', 1, '', ''),
(1126, '40332025645b2cfc216b8', 'Gina Elviana', 'Bank Kalbar', '23/05/2023', '12:48:26', 'TL09/32', 7040000, '7a3ddd7cd9c9cd2c7cf6160e76700543.jpg', 2, '2023-05-25 09:08:19', '45', 1, '', ''),
(1130, '6202647363fb4a5ea8c08', 'Aristo', 'Kalbar', '24/05/2023', '10:41:14', '37206', 4760000, 'f4cd51e89301c2085e12c5bc5ec0a1be.jpg', 2, '2023-05-25 09:28:00', '45', 1, '', ''),
(1138, '1704608163f32973588df', 'M.K. Sintia Caroline', 'Bank Kalbar', '25/05/2023', '10.38', '29250', 7040000, '93b7be5f3ccd0294bfd23513b244ff06.jpeg', 2, '2023-05-25 15:13:56', '45', 1, '', ''),
(1132, '59906596645628a3a3d9e', 'KALISTA APRILLA', 'BRI', '23/05/2023', '09:29:50', '503561192281', 1510000, '037ef02d9d83a11d31de8a87e7fd0f07.jpg', 2, '2023-05-25 09:13:31', '45', 1, '', ''),
(1134, '131123436451aceac3cad', 'Dea nandawati', 'Bank kalbar', '23/05/2023', '13 : 26 : 13', '002', 7290000, '65c678d5d99dc0ae87814dfb6b4371cb.jpg', 2, '2023-05-25 11:22:21', '49', 1, '', ''),
(1135, '13616610643ccdadc961a', 'AGUSTIAN', 'BANK MANDIRI', '25/05/2023', '08:42:22', '314538986966', 7290000, '32906e3261db6e9fb04610d45f7b7bee.jpeg', 2, '2023-05-25 13:52:29', '45', 1, '', ''),
(1142, '7505953763eeba60c1c2d', 'Efronika', 'Bank Kalbar', '25/05/2023', '11:17:42', 'T029', 1510000, 'b704a83569563d1d89266f431c0028c6.jpeg', 2, '2023-05-26 08:18:29', '45', 1, '', ''),
(1140, '57388910643c9bdbc675b', 'ALBERT DIO CRISTY', 'Bank Kalbar', '25/05/2023', '11:10:25', '001', 7290000, '6a97a734f8ec7f71e74e167f1215e533.jpg', 2, '2023-05-25 13:53:45', '45', 1, '', ''),
(1141, '17354331640f28a33b63b', 'Sumar', 'BANK Kalbar', '21/5/2023', '10:49:12', 'TL18', 7040000, 'ecf08008fba5b0c8ab0653787dbd6bc2.jpeg', 2, '2023-05-25 15:13:13', '45', 1, '', ''),
(1143, '25414790642bbaccd00e6', 'DEFY ARDITA', 'BANK KALBAR', '26/05/2023', '08:30:27', 'TL09/08', 7290000, 'a51d3fb8e3e50dc880cc0b4c3e06bf2d.jpg', 2, '2023-05-26 13:44:37', '45', 1, '', ''),
(1161, '333452286436617e5ab2e', 'OKTAVIANUS SAMUEL', 'Bank Kalbar', '26 Mei 2023', '8:57:25', '1010006517', 1510000, '94a03dbfc7e65e2985b31cd724c2e58c.jpeg', 2, '2023-05-29 08:55:25', '45', 1, '', ''),
(1160, '183890126424362f01781', 'ALYA SYAVITRI', 'Bank kalbar', '26/05/2023', '13:00:21', 'TL065/16', 7290000, 'a70b1a126a6cf2133418a5b4e337024d.jpg', 2, '2023-05-29 09:01:37', '45', 1, '', ''),
(1146, '1390023064545e5c46170', 'Della Puspita Sari', 'Kalbar', '26/05/2023', '08:37', 'T002', 7290000, '3cfd8dc01ac76c8c78f635a195b2c15a.jpg', 2, '2023-05-26 13:43:22', '45', 1, '', ''),
(1147, '40968414645609c3a1f2f', 'Dayang Aulia Maharani', 'BANK KALBAR', '25/05/2023', '10:32:06', '123786', 5000000, '1c325f50216b2c3bedd6846d490888fe.jpg', 2, '2023-05-26 13:41:26', '45', 1, '', ''),
(1148, '512238476458b7212cea3', 'Lili veronika', 'Kal-Bar', '26-05-2023', '09:23:49', 'TL03/15', 1510000, 'cf718927de0bbe4292ee91c9e3dc6110.jpg', 2, '2023-05-26 13:39:55', '45', 1, '', ''),
(1153, '1265187963f74aef2e1e7', 'ELSHA ADRIAN SUSILO', 'BANK KALBAR', '25:05:2023', '10:43:46', 'TL.17', 7290000, '05633c6be38ee57967a00b22cdc19f20.jpg', 2, '2023-05-26 13:47:25', '45', 1, '', ''),
(1159, '1281943764067f33d97f4', 'Ijartiah', 'Bank BRI', '26/05/2023', '13:06:21', '000003476805', 7290000, 'cc54e9dcb9264ab06b237249bd8c5632.jpg', 2, '2023-05-29 09:07:45', '45', 1, '', ''),
(1156, '15568166641dacdbc812e', 'ANYAN', 'BANK KALBAR', '26 MAY 2023', '11:24:45.054', '477481124440', 2000000, 'a1393e4378f3056c5e8df1dc061aab56.jpg', 2, '2023-05-26 13:45:46', '45', 1, '', ''),
(1157, '12488042643b4121a5f87', 'Alias sepanya', 'BPD Kalbar', '26/05/2023', '13:02:37', 'Kbk097TL01', 4000000, '3e112b696f92f2a2a07f3dfe673a6622.jpg', 2, '2023-06-02 08:21:55', '45', 1, '', ''),
(1163, '1353742164392c797caf0', 'Reva paradina', 'Bank kalbar', '26/05/2023', '13:09', 'TL17', 7040000, '962c490262e05a5561597a4e580629be.jpg', 2, '2023-05-29 08:53:11', '45', 1, '', ''),
(1164, '18418248644a57a8715ac', 'Yudi petran', 'KALBAR', '26/05/2023', '09:19:01', '113256', 2000000, '49aa6981a8e6e9160750afcbaadf71b4.JPG', 2, '2023-05-29 08:51:46', '45', 1, '', ''),
(1185, '139161216422a87c5e5cf', 'Yeni Septiani', 'Bank Kalbar', '29/05/2023', '10.30', '67392', 7040000, '6c9b38dd239faaec814c6dae3e1b490e.jpg', 2, '2023-05-29 11:36:15', '45', 1, '', ''),
(1186, '113143376422d1834c22f', 'Hanisah', 'Bank Kalbar', '29/05/2023', '10:33:00', '68094', 7290000, 'ff1ab54af868cac5228c2ed7625db1d6.jpg', 2, '2023-05-29 11:34:28', '45', 1, '', ''),
(1170, '63763426645873f084d7b', 'NOBERTUS CANDRA', 'KALBAR', '26/05/2023', '09:05', '085251080750', 7290000, '032b3d1e5097ed80338aa8df48df149e.jpg', 2, '2023-05-29 08:48:34', '45', 1, '', ''),
(1172, '20582132642e05e207e2c', 'Yunika', 'Bank BRI', '26/5/2023', '18:49:37', '538383493052', 7290000, 'abf8d8f50c0ba019508ad71924e2668b.jpg', 2, '2023-05-29 08:59:37', '45', 1, '', ''),
(1173, '3839301563f33479cc401', 'MARIANA NOVIANTI', 'Bank kalbar', '27/5/2023', '11:10', '29484', 7040000, 'bc1782867c871d23fb4c343ad1d1db64.jpg', 2, '2023-05-29 09:10:38', '45', 1, '', ''),
(1187, '11903219645f89abbb2ed', 'RUSIANI', 'BANK KALBAR', '29/05/2023', '11:32:30', '48/12', 3500000, '3b6a983f01aee36f5dd34e5f206a3558.jpg', 2, '2023-05-29 11:39:32', '45', 1, '', ''),
(1175, '48490947645dd18e9382a', 'Gina Sonia', 'Bank Kalbar', '25/05/2023', '11:52:00', '140166', 7290000, '7aa48bc19d3396c04a161984576cc96d.jpg', 2, '2023-05-29 08:47:30', '45', 1, '', ''),
(1176, '1309334963f7032ab001d', 'Mella Suhardany', 'Bank Kalbar', '27/05/2023', '18:24:14', '704800624120', 7290000, '790c856bd0a01bb07ea6778481e290d1.jpg', 2, '2023-05-29 09:09:19', '45', 1, '', ''),
(1177, '98711671643509619454e', 'MEITRIANA MEZI', 'BRI', '28/05/2023', '10:53:41', '538949389312', 7290000, 'a4b039a648903dd3b24ea38889a15e10.jpg', 2, '2023-05-29 08:57:46', '45', 1, '', ''),
(1178, '184604486410461a745c4', 'SUWANDI', 'BRI', '28/05/2023', '13:10:59', '000003293101', 5000000, 'e3a11b76b0d69e07f25d071ab018bdbd.jpeg', 2, '2023-05-29 09:03:25', '45', 1, '', ''),
(1180, '184604486410461a745c4', 'SUWANDI', 'BRI', '28/05/2023', '13:11:53', '000003297281', 2290000, 'e13f729ed1b9745a4c73ebef03c83071.jpeg', 2, '2023-05-29 09:04:00', '45', 1, '', ''),
(1184, '13048973645a2945028c5', 'MATIAS DAMARYANTO', 'BANK KALBAR', '29/05/2023', '10:18:34', '48/12', 5010000, '70d44458ab60f269e665763a2ed3bb41.jpg', 2, '2023-05-29 11:38:38', '45', 1, '', ''),
(1181, '287469596442ac794e8bb', 'MEITRIANA MEZI', 'BRI', '28/05/ 2023', '15:53:45', '539034382935', 1510000, '7f0885810d52c57b8639e1ae463788f6.jpg', 2, '2023-05-31 13:21:00', '45', 1, '', ''),
(1182, '13541235645f02901c283', 'Dayang Yunita Aryanti', 'Bank Kalbar', '28/05/2023', '16:47:49', '001', 7040000, 'c0ea9dc14b03c98151c56e3652f92aef.jpg', 2, '2023-05-29 08:45:49', '45', 1, '', ''),
(1183, '599854566456486248e06', 'EDC sarbini', 'Bri', '29 5 2023', '8,20', '-', 4000000, 'b0d386787e94d0a0eb9850d64608ec94.jpg', 2, '2023-05-29 08:50:45', '45', 1, '', ''),
(1188, '190396426436a611988e6', 'Andri sugianto', 'Bank mandiri', 'Senin,29/05/2023', '09: 21:45', '314931812329', 7290000, '1084048b406ddc834025cd421d7aee75.jpg', 2, '2023-05-29 15:46:27', '45', 1, '', ''),
(1189, '157730516446071b07961', 'Veronika Angelina Mentari', 'Bank Kalbar', '29/05/2023', '1510.000', 'TL03/12', 1510000, '079d01e770d6d5afc1248df24cfc3994.jpg', 2, '2023-05-29 15:43:31', '45', 1, '', ''),
(1190, '157730516446071b07961', 'Veronika anggelina Mentari', 'Bank kalbar', '29/05/2023', '09:19', 'TL03/10', 3250000, '75d3e9c18c0cf7e99a0daf223348aa5a.jpg', 2, '2023-05-29 15:43:37', '45', 1, '', ''),
(1191, '157730516446071b07961', 'Veronika anggelina mentari', 'Bank kalbar', '29/05/2023', '09:16', 'TL03/09', 2280000, '4dafca1f61e27b6b4afe3bcf723fa829.jpg', 2, '2023-05-29 15:43:43', '45', 1, '', ''),
(1207, '746390206455cd71af1d1', 'FLORA SANTIKA', 'BANK KALBAR', '29/05/2023', '10:09:42', 'T013', 7290000, 'a49c122e245fe642b8d8fb677931435e.JPG', 2, '2023-05-30 11:43:54', '45', 1, '', ''),
(1194, '129157946417ea90b2232', 'Ijartiah', 'BRI', '29/05/2023', '11:26:52', '000003161587', 7290000, 'bdf3ee8e43ba2c19d0c92ff6b522e9c7.jpeg', 2, '2023-05-29 15:50:38', '45', 1, '', ''),
(1195, '81664500645b1a31bdc0f', 'LUTER', 'BANK KALBAR', '29/05/2023', '11:42:31', '001903', 3500000, '8335640090d53535c50e4d3d6318c2e8.jpg', 2, '2023-05-29 15:40:18', '45', 1, '', ''),
(1219, '10966393645bab459459b', 'Victorinus Susilo', 'Bank Kalbar', '30/05/2023', '10:45:22', '123', 1510000, 'bb9b92116936c4e90ccb44859da11d7c.jpg', 2, '2023-05-31 12:32:33', '45', 1, '', ''),
(1208, '1865920563a1433378df4', 'FARIDA ULAN FITRIYANI', 'KALBAR', '29/05/2023', '14:09:15', '14:04', 3500000, '0b7b16b66aa13aeaab4c3807ed45e571.jpg', 2, '2023-05-30 11:50:48', '45', 1, '', ''),
(1202, '186174016408339130ced', 'Desi', 'KALBAR', '29 mei 2023', '13.40', '48204', 1500000, '8e2ae7123dfe695b3f63641fa109c24f.jpg', 2, '2023-05-29 15:51:44', '45', 1, '', ''),
(1203, '815828016454a01a3f08b', 'Mariyata', 'Kalbar', '29/05/2023', '11:25:47', 'TL03/30', 1510000, '7b73a1f183e88e4285a92c4aa61f9d44.jpg', 2, '2023-05-29 15:41:38', '45', 1, '', ''),
(1209, '1865920563a1433378df4', 'FARIDA ULAN FITRIYANI', 'KALBAR', '29/05/2023', '14:11:40', '0000000', 2280000, '6f7098072145e341c1955cbdae219d5f.jpg', 2, '2023-05-30 11:50:44', '45', 1, '', ''),
(1210, '10532533643255a98b1a2', 'EXPIDITUS PRIYOSA', 'BANK KALBAR', '29/05/2023', '14:41:35', '018970241320', 7040000, '47e3010af7a1243335aa717943d8457e.jpg', 2, '2023-05-30 11:47:53', '45', 1, '', ''),
(1211, '2135532664589643bc906', 'MULYADI', 'BRI', '29/05/2023', '13:58:54', '000001171865', 7290000, '0be5800c447b4cfde70f1bc0361ead3e.jpg', 2, '2023-05-30 11:41:09', '45', 1, '', ''),
(1212, '738365606458691bed6a9', 'Rosalia', 'Kalbar', '29/05/2023', '11:10:52', 'TL03/28', 2280000, 'd2c99c3f3b8919c544a7d09a3dc265d5.jpg', 2, '2023-05-30 11:42:17', '45', 1, '', ''),
(1213, '11038859641fd41002cf1', 'NURHUPINIAH', 'Bank Kalbar', '30/05/2023', '08:51:17', '432650851150', 7040000, 'e8f450c5f09cbd4e380c50e8c55cfb2f.jpeg', 2, '2023-05-30 11:48:36', '45', 1, '', ''),
(1214, '21114179645b93e0e92da', 'Cordamia karolin eva', 'BANK KALBAR', '30/05/2023', '09.58', '1', 1510000, '9d9b32e4fee65f57b6657436077a87ff.jpg', 2, '2023-05-30 11:39:44', '45', 1, '', ''),
(1216, '514329966454778d0b8a1', 'Yesaya Fanuel', 'BANK BRI', '30/05/23', '08:33:24', '3063', 5800000, '3224c7da082355650a3d3ecb93c70c82.jpg', 2, '2023-05-30 11:46:10', '45', 1, '', ''),
(1217, '182500606460c14b48102', 'Neli Sulistiani', 'Bank Kalbar', '30 mei 2023', '08:53:55', 'TL09/24', 7290000, '71cad3532698f75b71826ca38df67e37.jpg', 2, '2023-05-30 11:38:23', '45', 1, '', ''),
(1220, '75037050645edd23a6f64', 'Maria erina', 'Bank kalbar', '30/05/2023', '11:11:05', '123', 7290000, '4da1b99614433e73b9e492c599d15e6e.jpg', 2, '2023-05-31 12:24:26', '45', 1, '', ''),
(1221, '116173586458a920a0dd2', 'ANDRIANA MARSELA', 'BRI', '29/05/2023', '12:31:18', '128232', 7290000, '0ad5cd3c947747fa09f4c1df51ec57ae.jpg', 2, '2023-05-31 12:41:35', '45', 1, '', ''),
(1258, '18743570645dae96a77a2', 'Monica Sri Mulyani', 'Bank KALBAR', '31/05/2023', '12:03:01', 'TL03/23', 7290000, 'eecb06f48c79c092809795c4cee0c71d.jpg', 2, '2023-06-02 08:01:57', '45', 1, '', ''),
(1224, '172419426418517a3bba5', 'Suci Intan Berliani', 'Bank Kalbar', '30/05/2023', '13:18:48', '1.47', 3500000, '2c9755b2b239d85309bca1a3079f58bb.jpeg', 2, '2023-06-02 08:28:01', '45', 1, '', ''),
(1225, '1411035564380284829c9', 'Cucun Suryani', 'Bank kalbar', '30/05/2023', '13:41:16', '0.35', 7290000, '5c357ee99e19674921a1a97f602a5bb3.jpg', 2, '2023-05-31 13:02:28', '45', 1, '', ''),
(1226, '14243386644875769e779', 'MELKI', 'Kalbar', '30/5/2023', '13:52:43', 'TL03/23', 3790000, 'a1e94feb758e47839b0926d221772787.jpg', 2, '2023-05-31 12:59:51', '45', 1, '', ''),
(1254, '3702399763fb54ca53af0', 'Nessty Agustin', 'Bank Kalbar', '31/05/23', '10:09:54', '3.6', 7040000, '34bdc496e6f8fca881cf1328e836616b.jpeg', 2, '2023-05-31 13:29:50', '45', 1, '', ''),
(1255, '71237674644cceadce63b', 'ValenTinus DamaSaputra', 'Bank Kalbar', '29/05/2023', '13:24:28', 'TL.25', 4000000, '4537016bfebe6748dc7c305d947fa4e5.jpg', 2, '2023-06-02 08:11:25', '45', 1, '', ''),
(1229, '837985496445d2bee39db', 'Apiang', 'BRI', '30/05/2023', '15:14:59', '000006740237', 2040000, 'f23a94706e93e78e26a5d070f9e95019.jpg', 2, '2023-05-31 13:09:29', '45', 1, '', ''),
(1230, '837985496445d2bee39db', 'Apiang', 'BRI', '30/05/2023', '15:13:27', '000006729729', 5000000, 'b2ee0b09b7958ce591bd23a1c2484c4e.jpg', 2, '2023-05-31 13:08:55', '45', 1, '', ''),
(1231, '1134822664547f6f983d1', 'Eliya.M', 'Bank BRI', '30-05-2023', '16:13:5', '503630682506', 1000000, '67248e06e51c566a3a1d8fbe3f9432d1.jpg', 2, '2023-05-31 12:58:26', '45', 1, '', ''),
(1232, '1134822664547f6f983d1', 'Eliya.M', 'Bank BRI', '30-05-2023', '16:11:02', '503630646922', 5000000, '84db1f4f78dbedbc19e4a4d989ceffaf.jpg', 2, '2023-05-31 12:58:32', '45', 1, '', ''),
(1233, '14722336644714ea8b1a1', 'JAMHOR', 'BRI', '30/05/2023', '18:03:51', '539877872664', 7040000, 'd658990376b5bfead549767224806a63.jpg', 2, '2023-05-31 13:05:39', '45', 1, '', ''),
(1234, '1044751564429b82052b9', 'MEITRIANA MEZI', 'BRI', '30/05/2023', '18:42:42', '539895213857', 1510000, 'e97f101c7659b6dd7aeb46de79b80ef6.jpg', 2, '2023-05-31 13:28:16', '45', 1, '', ''),
(1235, '287469596442ac794e8bb', 'MEITRIANA MEZI', 'BRI', '30/052023', '18:54:07', '539900204487', 3500000, 'd7b92211704018f13be5c05adde092c7.jpg', 2, '2023-05-31 13:19:41', '45', 1, '', ''),
(1256, '47388036645900b105f5c', 'PRISKILA', 'Bank Kalbar', '30/05/2023', '10:32:58', 'TL09/36', 3500000, '2622b27dc04ec0aaab38d8bbf4ff6c04.jpg', 2, '2023-06-02 08:09:10', '45', 1, '', ''),
(1238, '2017850764547be7c0088', 'ARIEL YAWAN', 'BANK KALBAR', '26/5/2023', '11:03:47', 'TL 47/52', 7290000, '104ddfae1c74960bc71b81169b1e4877.jpg', 2, '2023-05-31 12:47:40', '45', 1, '', ''),
(1239, '1244315164264c729ea78', 'Nurhupiniah', 'Bank Kalbar', '30/05/2023', '08:49:24', '432650849230', 3000000, '1ae8bb422ca87e645127d48476d3334f.jpg', 2, '2023-05-31 13:31:25', '45', 1, '', ''),
(1257, '81478512644c82e8b5ec5', 'Noviani kuras', 'Bank Kalbar', '31/05/2023', '13:15:35', '114426', 1510000, '83bc88f44f8242c0d32d3118363094e1.jpeg', 2, '2023-06-14 10:38:09', '45', 1, '', ''),
(1245, '132870356402f674ad120', 'DIAS ASTIZA', 'BANK KALBAR', '30/05/2023', '9:52:02', '01/20', 1510000, 'a70e976eb55bea3955de4b2264fc037c.jpeg', 2, '2023-06-02 09:51:36', '45', 1, '', ''),
(1247, '1106962964619b4b95457', 'RITA', 'Bank kalbar', '31/05/2023', '9:33:32', 'TL03/12', 7290000, '8ab7769e4cbe113c57aaeb7c9a82fa69.jpeg', 2, '2023-05-31 12:28:18', '45', 1, '', ''),
(1260, '1413427364040739d9f5f', 'Rendi oktavianus', 'Bank Kalbar', '22-05-2023', '13:37:53', '43758', 1510000, '08484ec5c4028fb8b739a02894157269.jpg', 2, '2023-06-02 09:56:51', '45', 1, '', ''),
(1259, '13858775642524237d9d2', 'Siprianus Listo', 'Bank Kalbar', '26/05/2023', '13:36:47', 'TL03/33', 1510000, '513dd2011a77955729e9d194ac1f9b97.jpeg', 2, '2023-06-02 08:24:28', '45', 1, '', ''),
(1269, '94347616645db1ddc682b', 'Thomas Joni Verawanto Aristo', 'Bank BNI', '2/6/2023', '07:51:06', '11109696', 2280000, 'ec60942d7c087d7cf3ff2ae42b723e1f.jpeg', 2, '2023-06-02 08:04:39', '45', 1, '', ''),
(1263, '2621903664042f3788fa1', 'IRANI MEDISA NATANIA', 'Bank Kalbar', '30/05/2023', '07:24:35', '6277617106995610', 4000000, 'efa9720caac1ba19e93947ceebef5816.jpg', 2, '2023-06-02 09:47:19', '45', 1, '', ''),
(1264, '1727671463f421621c606', 'LISELA RISELAWATI', 'Cabang Tepuai (BANK KALBAR)', '30/05/2023', '08:18:23', '069TI 11', 3500000, 'c18f0d6bb23742ed99aec808799137c1.jpg', 2, '2023-06-02 09:53:37', '45', 1, '', ''),
(1265, '960128456403177d2d46f', 'Lusia Maria malisin', 'Bank kalbar', '31/05/2023', '10.21', '03/21', 3000000, '935059171f338c332cbdb4a7d2815360.jpg', 2, '2023-06-02 09:49:51', '45', 1, '', ''),
(1266, '31118940643d0cca60627', 'Apriyanto (Arbertus )', 'Flip (Mandiri)', '31/05/2023', '18:32:56', '100854', 1510000, '4cf197b8d5f6a52f9b2e4c57a43b33b9.jpg', 2, '2023-06-10 08:15:48', '45', 1, '', ''),
(1267, '803952086439377b4b8ef', 'ITO ERLANGGA', 'BANK KALBAR', '31/05/2023', '09:53:25', '123', 1510000, '9e91fec4b8a3010bec43aa46fc19ff16.jpg', 2, '2023-06-02 08:23:14', '45', 1, '', ''),
(1268, '19522176643cbfc791e0b', 'Marselina Ninit', 'KALBAR', '26/05/2023', '09:20:20', '99918', 3520000, '49d08acc7bd06575ae7399912a4ddc83.jpg', 2, '2023-06-02 08:14:10', '45', 1, '', ''),
(1270, '12855038640315d459f47', 'Melly febriani', 'Bank kalbar', '24/05/2023', '11:32:15', 'Tl03/33', 7040000, 'de64f65c016baec542769e79f0a806fb.jpg', 2, '2023-06-05 07:48:19', '45', 1, '', ''),
(1271, '146489066430e0a5bfbbd', 'IGNASIUS WIRA', 'Bank Kalbar', '29/05/2023', '12:56:39', '83538', 7290000, 'd342f41d547e5bdcf7865fee8d36e71d.jpg', 2, '2023-06-02 14:49:40', '45', 1, '', ''),
(1279, '333452286436617e5ab2e', 'OKTAVIANUS SAMUEL', 'Bank BRI', '05/06/2023', '15 : 34 :40', '503688557645', 2280000, '5f9cc725388b97cdedd26facae52b661.jpg', 2, '2023-06-12 08:36:09', '45', 1, '', ''),
(1276, '3728346564453867b6ebd', 'maria elisa', 'Bank kalbar', '05-06-2023', '12:20:45', '060 K8K060TI 01 023060PT01 00000 181 K8K06HC01', 7290000, '4867678083864cd464dbc9b64f64ebc4.jpg', 2, '2023-06-08 12:56:07', '45', 1, '', ''),
(1275, '24222402643cc3016f264', 'Natalia Sopi', 'KALBAR', '26/05/2023', '09:15:20', '100152', 3520000, 'fe86ad4930668936f9f730c1213035e5.jpg', 2, '2023-06-05 07:47:07', '45', 1, '', ''),
(1280, '562200736450556da51b0', 'Susana', 'Bank kalbar', '21-06-2023', '11:40:23', '117468', 7290000, '9a60d12e0858a75c790160dd1f97cca7.jpg', 2, '2023-06-22 08:09:34', '45', 1, '', ''),
(1282, '6202647363fb4a5ea8c08', 'Aristo', 'Kalbar', '22/06/2023', '13:06:25', '37206', 2280000, '1cd6754606ab6f5721b54358775d9b0c.jpg', 2, '2023-06-23 07:48:19', '45', 1, '', ''),
(1283, '211018066437a009475dd', 'Resha Agustin', 'Bank Kalbar', '26/06/2023', '10:13:28', 'TL01/54', 5040000, 'a678a8f4c768737b30a95112f1058101.jpg', 2, '2023-06-26 12:00:25', '45', 1, '', ''),
(1284, '8398325963bebea49d406', 'Maris stella', 'kalbar', '06/26/2023', '12:55:31', '191151256080', 2280000, '60891c294b672cf5b6a2198ac97449f1.jpeg', 2, '2023-06-26 13:17:32', '45', 1, '', ''),
(1285, '1963847063e473cedc098', 'GENOVEVA JENISARI', 'Bank kalbar', '05/06/2023', '10:02:65', '24570', 7000000, '2164d9cb125504d41a66b7a912fb6f51.jpg', 2, '2023-06-30 10:23:46', '45', 1, '', ''),
(1286, '1963847063e473cedc098', 'GENOVEVA JENISARI', 'Angen brilink', '27/02/23', '18:45:31', '24570', 290000, 'bea8f1e7faa699ae748570d63e7cde9e.jpg', 2, '2023-07-05 07:10:52', '45', 1, '', ''),
(1287, '20544666644a012bef04a', 'Cantika Putri', 'Bank Kalbar', '03/07/2023', '10:24:51', '123', 7040000, 'c68d515293f6a55db92573f994bb262e.jpg', 2, '2023-07-04 09:57:36', '45', 1, '', ''),
(1288, '73355155645077e06d6e2', 'MARIA BELLA OKTAVIANI', 'BANK KALBAR', '04/07/2023', '11:21:15', '123', 1510000, 'c816870093bb7ac1460b5faa16f3d29a.jpg', 2, '2023-07-05 07:14:24', '45', 1, '', ''),
(1289, '738365606458691bed6a9', 'Rosalia', 'Kalbar', '04/07/2023', '11:02:39', 'Tl03/31', 1510000, 'b2942284f5bbf95523789338826cb25a.jpg', 2, '2023-07-05 07:13:19', '45', 1, '', ''),
(1290, '21082867644064c494b6b', 'THENNI DEBBY TRIANNI', 'BANK KALBAR', '05/07/2023', '13:50:40', 'TL0636', 7040000, 'e12f2be8a0fa8910a4bb4f8423cbe52b.jpg', 2, '2023-07-06 06:54:57', '45', 1, '', ''),
(1294, '1413563563f31ad666f35', 'Aviza oktavia rahmadhani', 'Bank kalbar', '17-07-2023', '10:18:47', 'TL03', 7040000, '8e386ad926e67dd9dea80b3e37e31f00.jpg', 2, '2023-07-17 14:50:41', '45', 1, '', ''),
(1292, '101007186460c010455cb', 'Kian kiong', 'Bank mega', '6/07/2023', '12:17:02', '20230706MEGAIDJA01000210226324', 3000000, '59a9f44675b7ee0b8d60e284b4f1224e.jpg', 2, '2023-07-24 10:04:49', '49', 1, '', ''),
(1293, '333452286436617e5ab2e', 'Oktavianus samuel', 'Bank kalbar', '13 Juli 2023', '13:22:53', '1010006517', 3500000, '1e447f5099f88e77ee9f5c258dc25cd6.jpg', 2, '2023-07-13 20:17:44', '45', 1, '', ''),
(1295, '156119476434c10151686', 'Suci Isaura', 'Bank KALBAR', '17/07/2023', '10:44:18', 'T3.18', 7040000, '9a0a807ccb38b96ad37238ddbea09122.jpeg', 2, '2023-07-17 14:49:36', '45', 1, '', ''),
(1296, '13858775642524237d9d2', 'SIPRIANUS LISTO', 'KALBAR', '17/07/2023', '14:06:09', 'T058', 3250000, 'bc675d3b66afd2122822058011e56db7.jpg', 2, '2023-07-20 09:57:28', '45', 1, '', ''),
(1297, '13858775642524237d9d2', 'SIPRIANUS LISTO', 'KALBAR', '17/07/2023', '14:06:54', 'T059', 2280000, '045a0d2d46dffbca503a031ceb69df2c.jpg', 2, '2023-07-20 09:57:49', '45', 1, '', ''),
(1298, '16742081646c3f0d4609f', 'Rupinus Viki', 'Kalbar', '18/07/2023', '08:42:08', '06', 7040000, '34a5581a5749af41ac2f01afa0292bad.jpg', 2, '2023-07-20 09:55:04', '45', 1, '', ''),
(1299, '81664500645b1a31bdc0f', 'Th Setia Mandiri', 'BANK KALBAR', '19/07/2023', '07/11/02', '004239', 2000000, 'df8ede329620453f6875510b55985687.jpg', 2, '2023-07-20 09:56:20', '45', 1, '', ''),
(1300, '1680794363f763d9ea7fd', 'DYAN FISEZA', 'Bank Kalbar', '20/07/2023', '01:45:03', 'T3.37', 7040000, '82e04b2434620c37522a2cbd59190ec2.jpg', 2, '2023-07-24 10:08:12', '49', 1, '', ''),
(1306, '18418248644a57a8715ac', 'Yudi petran', 'BANK KALBAR', '24/07/2023', '11:16:13', '113256', 5040000, '78c1e200de10fe208484bdccd0c3be63.jpg', 2, '2023-07-25 14:29:20', '45', 1, '', ''),
(1302, '13401766643fd05d31434', 'desi catur lestari', 'kalbar', '21/07/2923', '09:05:04', 'T TL06/07', 3700000, 'ef4790513a46d53dee7b60cee9b6e1d9.jpeg', 2, '2023-07-24 10:07:12', '49', 1, '', ''),
(1303, '201589036462d0ad5a029', 'Antonius Rafid', 'Bank Kalbar', '22/07/2023', '15:53:08', '006274', 2280000, '67fe2f51f3fb3477b7e2f86bbc5240de.jpg', 2, '2023-07-24 14:03:34', '49', 1, '', ''),
(1305, '158557906442a2e6d248a', 'APRIANUS REFLIANTO', 'BRI', '23/07/2023', '10:21:56', '562192341393', 4000000, '8667466ce0ab6f43ceeaf5aa0ec93a81.jpg', 2, '2023-07-24 14:04:05', '49', 1, '', ''),
(1307, '47388036645900b105f5c', 'Priskila', 'Bank Kalbar', '01-06-2023', '09:45:37', '129870', 3500000, '85505c3cb889814eeda912b6877573dd.jpg', 3, '2023-07-25 14:37:35', '45', 1, '', ''),
(1308, '47388036645900b105f5c', 'Priskila', 'Bank Kalbar', '01-06-2023', '09:45:37', '129870', 3500000, '86403f3c3db8e02f24b0d94d83ff2427.jpg', 3, '2023-07-25 14:37:16', '45', 1, '', ''),
(1309, '13387430646f063b42908', 'Aria', 'Kalbar', '25/072023', '09:23:39', '-', 1510000, 'd8aea3e2f95eeb62065afd233f7f73e2.jpg', 2, '2023-07-25 14:39:13', '45', 1, '', ''),
(1315, '182141026464d6aebc16c', 'Stepanus Komenta Utai', 'Kalbar', '26-07-2023', '10:30', '157482', 7290000, '2188787fc4b7a23058d016ed0f115507.jpg', 2, '2023-07-27 08:17:04', '45', 1, '', ''),
(1312, '12240801646434c98bdaa', 'Lasmi sri rahayu', 'KALBAR', '25/07/2023', '10:40', '155142', 1510000, 'b68fc79802823b554925a79326d912cb.jpg', 2, '2023-07-26 09:11:04', '45', 1, '', ''),
(1313, '14297895646433d4825b9', 'Isna Hanida Oktavia', 'Bank kalbar', '25/07/2023', '10:40', '154908', 1510000, 'eeb8c2ee0f0062d128215846c33157f4.jpeg', 2, '2023-07-26 09:13:03', '45', 1, '', ''),
(1314, '599854566456486248e06', 'Sarbini', 'BRI', '26/7/2023', '08:43:28', '-', 3290000, '8498d17d234e6798ccd491d11993e9bc.jpg', 2, '2023-07-26 09:14:54', '45', 1, '', ''),
(1316, '132564746487125d9e4dd', 'ARIYEL', 'Kalbar', '26/7/2023', '08:45:33', 'TI03/05', 7040000, '6a32c5f3746727c47f1c3bc3e5c518d7.jpg', 2, '2023-07-27 08:16:11', '45', 1, '', ''),
(1317, '59243413648a80b46156c', 'Magdalena', 'Kalbar', '26/07/2023', '12:29:06', '040  KBK040TL01  D23040LN07  00000 098', 7290000, '6b7f6ef4f91a3fcfc8c6ad2364ada603.jpeg', 2, '2023-07-27 08:15:13', '45', 1, '', ''),
(1335, '1727671463f421621c606', 'LISELA RISELAWATI', 'Bank Kalbar', '28/07/2023', '08:56:40', '069TI.22', 3790000, '7836155fea3443b35a542ddd5ad12f96.jpg', 2, '2023-07-28 10:00:15', '45', 1, '', ''),
(1321, '5402774264a248df47875', 'HERI ANITA', 'BRI', '26/07/2023', '14:19:53', '563528316414', 1510000, '3e4e760974e02eb9e597aa44cfcb4add.jpg', 2, '2023-07-27 08:14:17', '45', 1, '', ''),
(1322, '168541576458db843fb27', 'Maria octaviana ica', 'Kalbar', '26/7/2023', '14:13', '128934', 7290000, '80ad7409ab8b318364afd035fb35fb39.jpg', 2, '2023-07-27 08:17:47', '45', 1, '', ''),
(1324, '237977796462b0da4cb2c', 'GUNTUR HARIS SETIAWAN', 'BANK KALBAR', '27 Juli 2023', '10.11', 'TL 09/26', 7040000, '046ea41076edcb62e729594534502064.jpg', 2, '2023-07-27 16:00:52', '45', 1, '', ''),
(1326, '9371612964699531312b6', 'Nur wafa adauwiyah', 'Bank kalbar', '27/07/2023', '11:15:25', '604161115170', 7290000, '5eb7d9c5e14c67fb9f64f9bf83a5f89c.jpg', 2, '2023-07-27 15:58:57', '45', 1, '', ''),
(1334, '116220036437da9635b2c', 'Puja astuti', 'Bank kalbar', '28/7/2023', '9:15', '023041', 3500000, '10177f64be9d3cb913fee917beb6656a.jpeg', 2, '2023-07-28 09:57:37', '45', 1, '', ''),
(1333, '74229640644a5bf4869fa', 'Yuliana', 'Bank kalbar', '17/07/2023', '15:10:13', '113490', 3500000, 'e7aef3d35556eb491f435e11a4fa42ef.jpg', 2, '2023-07-28 07:29:59', '45', 1, '', ''),
(1329, '10481948647ff0ad30648', 'Ayu lestari', 'Bank kalbar', '27/07/2023', '11:26:2u', 'TL09/32', 1000000, 'acebd1074ba14be5570ee954eaddee1e.jpg', 2, '2023-07-27 15:56:13', '45', 1, '', ''),
(1332, '3204457764b09643aa294', 'Hendri', 'Bank BRI', '26/07/2023', '12:11:57', '208962', 1510000, '744a5da68baaff897c682484ca5df015.jpg', 2, '2023-07-28 07:26:10', '45', 1, '', ''),
(1336, '174334816402f59295002', 'PRKMPULN BDN  PEND KARYA BANGSA', 'BANK KALBAR', '04-03-2023', '14:42:09', '005007', 250000, '94b089673a331a75532b24e47f88ab83.jpg', 3, '2023-07-29 08:25:21', '45', 1, '', ''),
(1337, '21148107645a3d1205292', 'INCAU', 'BANK BRI', '29/07/2023', '10:51:35', '564691525894', 4000000, '9d2291ae7e242aca7e0a653152c01f6d.jpg', 2, '2023-07-30 06:44:17', '45', 1, '', ''),
(1338, '406339976499904b811ad', 'BPK SEFNAT AGRIPA', 'BANK BNI', '29 Juli 2023', '12: 56', '000000000962', 1510000, 'bd5294276fe3c206a97e82488d7965cc.jpeg', 2, '2023-07-30 06:42:22', '45', 1, '', ''),
(1342, '707304566462cb44945c2', 'LESRI ASTIKA', 'BANK KALBAR', '31/07/2023', '11:31:14', 'T TI 03/53', 7290000, 'afca668d4bcfbe574fb3433c5e6b44e5.jpg', 2, '2023-07-31 15:12:42', '45', 1, '', ''),
(1341, '1560872464643808ca77b', 'Andrew Robert', 'KALBAR', '31/7/2023', '9:02:33', '123', 1510000, 'd1b8d713bb253b1d80151e223a01a0c6.jpg', 2, '2023-07-31 10:10:49', '45', 1, '', ''),
(1347, '1460083564ae9dc8cc2e4', 'Wanda Apriana Uli', 'Kalbar', '31/07/2023', '11:46:06', 'Tl 03/57', 1510000, '74ce815c90cdd6a97c621c58360c9ea4.jpg', 2, '2023-07-31 16:04:11', '45', 1, '', ''),
(1348, '17896047647e930f8c4a2', 'Julius', 'BANK KALBAR', '1/08/2023', '10:42:55', 'KBK048TL01', 7040000, 'caba6646c04786763e529222834ba369.jpg', 2, '2023-08-01 15:51:04', '45', 1, '', ''),
(1345, '1321475464a2a0c741682', 'Gracia Angelin Elisabet Dada', 'Bank BRI', '31/07/2023', '10:46:43', '31186', 1510000, '5713b2aed75f568912199732f7de26f7.jpeg', 2, '2023-07-31 15:10:10', '45', 1, '', ''),
(1346, '1811689063f9f7820e87f', 'ALDYSIUS SAPUTRA', 'BANK KALBAR', '31/07/2023', '13:52:31', '007', 2290000, 'd7fb578fb8d97f19ccf93e9a46d2ff40.jpg', 2, '2023-07-31 16:07:18', '45', 1, '', ''),
(1355, '928041576462fa81a459e', 'Neni Oktavia', 'Bank Kalbar', '01/08/2023', '15:57:19', '153036', 3000000, 'c995e1e41f0b281ee894ade926fa8226.jpg', 2, '2023-08-02 07:35:03', '45', 1, '', ''),
(1350, '69429803649e8d89229b3', 'kristian viery', 'kalbar', '1 agustus 2023', '11:32:27', '201942', 3645000, '880d6d4718a0b019c89398d57014d786.jpg', 2, '2023-08-01 15:47:08', '45', 1, '', ''),
(1352, '171740736462c84b49288', 'Hengky Kurniawan Oktavianus', 'Bank Kalbar', '1/8/2023', '9:59', '002', 2500000, '42c5c31572f6d36c553e748f7f277dc2.jpg', 2, '2023-08-01 15:52:03', '45', 1, '', ''),
(1353, '804949436494495a630c4', 'Elsa Angela', 'Bank Kalbar', '1/8/2023', '9:37:58', '040 KBK040TL09 D23040TL09 00000 027', 1510000, '2f71f0d281e8df183257f5352bf66827.jpg', 2, '2023-08-01 15:50:08', '45', 1, '', ''),
(1354, '1946058464b3ae8f91329', 'Mawar Yuliana Riski', 'Bank Kalbar', 'Selasa 1 Agustus 202', '10:22 wib', '123', 1500000, 'db7da29a62d0966da8e22d4be4f8da88.jpg', 2, '2023-08-01 15:46:09', '45', 1, '', ''),
(1357, '11897806649c4b92381a3', 'Dewi Vitasari', 'Kalbar', '2/08/2023', '09:02:41', '020', 1510000, '1b5ce7246b88f20ab4ba54376c6621a8.jpg', 2, '2023-08-02 15:15:59', '45', 1, '', ''),
(1358, '5402774264a248df47875', 'HERI ANITA', 'BRI', '02/08/2023', '10:44:19', '566452301755', 5530000, '2998aa28b95335095ebe12df2762399f.jpg', 2, '2023-08-02 15:14:47', '45', 1, '', ''),
(1359, '1244315164264c729ea78', 'Abdurani', 'Bank BRI', '03/08/2023', '09:20:00', '504297716260', 4040000, 'a2942af50c1920910d7bc4dbaf9639d3.jpg', 2, '2023-08-03 11:59:53', '45', 1, '', ''),
(1360, '162810426480801da1d96', 'TATI SUMIRA', 'BANK KALBAR', '03/08/2023', '09:05:20', '004156', 1510000, 'fc9fe8e01cb1de50a1faf33efdc5a862.jpg', 2, '2023-08-03 11:58:48', '45', 1, '', ''),
(1361, '19769921648d059677838', 'Nursindin', 'BANK KALBAR', '3/8/2023', '09:13:27', '024', 1510000, 'c6c34a58b6bd8abec1e094f0a38b6d45.jpg', 2, '2023-08-03 11:57:11', '45', 1, '', ''),
(1362, '16833626648b14705e484', 'ALVIN MAY SAPUTRA', 'Bank KALBAR', '3/08/2023', '13:26:04', '-', 5010000, '3fe49c15ddf38fe2c6cc5ab44e1bdb6a.jpg', 2, '2023-08-04 10:46:40', '45', 1, '', ''),
(1371, '9943287464683f6929566', 'Suhadi', 'Bank mandiri', '5 Agustus 2023', '11:12:33 WIB', '2308051121916869054', 1510000, 'fb4dabee954825041ba710fb6740c039.jpg', 2, '2023-08-07 08:09:08', '45', 1, '', ''),
(1369, '316050126495138ca00d3', 'Wastina', 'Kalbar', '04/08/2023', '14:20:25', '195858', 1510000, 'e34596485beb7810930a2cad5c616102.jpg', 2, '2023-08-04 15:42:38', '45', 1, '', ''),
(1365, '1883652264a65b18e0820', 'NINA JURITA', 'BANK KALBAR', '01/08/2023', '13:48:30', '204750', 1510000, 'bce2e3873b21df9b6b8bf4005d8525a9.jpg', 2, '2023-08-04 10:43:09', '45', 1, '', ''),
(1366, '14243386644875769e779', 'MELKI', 'Kalbar', '1/8/2023', '10:56:12', 'TL03/29', 3500000, 'ba82249fd44c20dce336c9f6d8bf30e8.jpg', 2, '2023-08-04 10:48:16', '45', 1, '', ''),
(1367, '7837751164a658df5c73a', 'TINORIA', 'BANK KALBAR', '01/08/2023', '13:48:59', '204516', 1510000, '3ebb48846eb35e0622bb26d99c6849cf.JPG', 2, '2023-08-04 10:45:01', '45', 1, '', ''),
(1368, '1988328664b5f6e2aca14', 'Lusia Leni', 'bank Kalbar', '1/08/2023', '10:38', 'TL18', 5000000, '0c802411ab1a766079f0bbf5125a3cfa.jpeg', 2, '2023-08-04 10:42:01', '45', 1, '', ''),
(1372, '1560872464643808ca77b', 'Andrew Robert', 'Kalbar', '7/8/2023', '9:45:57', '123', 5780000, '1cddd1f910337d3cba8340bf9fa69bda.jpg', 2, '2023-08-07 10:37:13', '45', 1, '', ''),
(1373, '21271205649173ed06db0', 'CORRY FRISKILA ANGGAL', 'BANK BRI', '07/08/2023', '10:48:10', '000004653281', 1510000, 'a59fcc82f7810e5867a7a654e3f0843e.jpg', 2, '2023-08-07 16:27:58', '45', 1, '', ''),
(1382, '7746029664c9ac5cd9ec0', 'Guslan Radino', 'Bank Kalbar', '08/08/23', '10:34:17', '002', 1500000, 'ab777e834da2ad8d5c9129ccf3bcb54e.jpg', 2, '2023-08-09 06:16:30', '45', 1, '', ''),
(1381, '12958417649bbbf4499f3', 'Rosita Palentina', 'Bank BRI', '07/08/2023', '18:14:50', '568674611346', 7040000, 'd01582dd49d4ca0859fb1749c57fbd58.jpeg', 2, '2023-08-08 08:36:58', '45', 1, '', ''),
(1377, '1836807863de4fe775c9b', 'Seriana', 'BRI', '07/08/2023', '09:44:26', '000001795523', 2280000, '248c1a0e711e964c913fcccec35a8c4c.jpg', 2, '2023-08-07 16:31:39', '45', 1, '', ''),
(1378, '16624180649166344a493', 'Teresia Elti', 'Bank BRI', '07/08/2023', '14:09:58', '568578188039', 7290000, 'b4ec787a20aad3433507de2efd1ef031.jpg', 2, '2023-08-07 16:29:07', '45', 1, '', '');
INSERT INTO `bukti_bayar` (`id_bukti_bayar`, `akunb_msiswa`, `nama_pengirim`, `bank_pengirim`, `tgl_trans`, `jam_trans`, `nomor_refe`, `jlh_bayar`, `bukti_bayar`, `validasi_bukti`, `tgl_validbukti`, `yg_validasi`, `konfirm_bauk`, `yg_validasibauk`, `tgl_konfirmbauk`) VALUES
(1379, '8680011464b8912d99891', 'Olivia', 'Bank Kalbar', '7/8/2023', '13:43:09', '069TI', 2000000, 'fa6f64a8a37291191629343aeb56e6f3.jpeg', 2, '2023-08-07 16:24:56', '45', 1, '', ''),
(1391, '1387605963d658664be4a', 'Mila Rosita', 'Bank Kalbar', '8/08/2023', '11:29:02', 'TL01/44', 5780000, '11833044ee33a22e04c32e1b45c050fc.jpeg', 2, '2023-08-09 06:36:15', '45', 1, '', ''),
(1384, '160266216491cc52a3a61', 'Magdalena victoria bungkas', 'BANK KALBAR', '07/08/2023', '13.44.23', '002', 2000000, 'f0cacd865845b77174eba6441e8c3a85.jpeg', 2, '2023-08-09 06:12:49', '45', 1, '', ''),
(1392, '18791392648c593a5461f', 'Faisal edwin', 'BANK KALBAR', '08/08/2023', '14:09:23', '011758', 5000000, '455fb9dd30642a8d72c87273b4d1431b.jpg', 2, '2023-08-10 07:08:47', '45', 1, '', ''),
(1387, '150595656492ba13376e4', 'Desiana ratna', 'Bank Kalbar', '7/08/2023', '13.44.23', '002', 2000000, '0cbcaafd1abcce3690d40c5d97d4d1fa.jpg', 2, '2023-08-09 06:11:40', '45', 1, '', ''),
(1388, '14297895646433d4825b9', 'Isna Hanida Oktavia', 'Bank Kalbar', '8/8/2023', '10:45', '154908', 3000000, 'd6aaadf9cb8b3cbe8855c4d3c0bdd8b0.jpeg', 2, '2023-08-09 06:21:12', '45', 1, '', ''),
(1389, '14804361646f40b021145', 'Dina Nirmala', 'BNI', '08/08/2023', '10:46', '000000202023', 7300000, '1631fa3f8d7759be2740753181cd2a62.jpg', 2, '2023-08-09 06:19:23', '45', 1, '', ''),
(1390, '13401766643fd05d31434', 'Desi Catur lestari', 'BANK KAlBAR', '8/08/2023', '10:06:56', 'T TL06/09', 3340000, '0888ebc2d51db6fcd75ab176fc3987b6.jpg', 2, '2023-08-09 06:22:59', '45', 1, '', ''),
(1410, '2621903664042f3788fa1', 'IRANI MEDISA NATANIA', 'BANK KALBAR', '10/08/2023', '09:50:19', '005818', 40000, '42d3641a919f6ae3fa54d6e38da0a62f.jpeg', 2, '2023-08-11 07:36:25', '45', 1, '', ''),
(1394, '20422527646426fa85565', 'VENCENSIUS JOKO LUNA', 'BRI', '09/08/23', '12:17:35', '154674', 7290000, '9107f1049e29ab5d3e1d654fd7af862e.jpg', 2, '2023-08-10 07:11:55', '45', 1, '', ''),
(1395, '1905896864951d8777a8c', 'Lisius Arlan', 'Kalbar', '09/08/2023', '13:05:38', '123', 7290000, 'fbed9fa91ce4a5605354be3a73fd68d9.jpeg', 2, '2023-08-10 07:06:19', '45', 1, '', ''),
(1397, '1443965464c3a3ef582a7', 'Suci rahmawati', 'Bank kalbar', '4/8/2023', '14:56:14', 'IL02/84', 7290000, '26bf49971b1ba1b6710f28343499dafa.jpg', 2, '2023-08-10 07:03:38', '45', 1, '', ''),
(1411, '1005139564c8abd792f4a', 'Muhammad Dimas Putra Wiadrian', 'Bank Kalbar Cabang Putussibau', '10/08/2023', '09:16:43', 'T 060TI/17', 7040000, 'eba00678b535cc9d2ff1aaa7c366d2cb.jpg', 2, '2023-08-11 06:52:00', '45', 1, '', ''),
(1409, '2621903664042f3788fa1', 'ISHAK/IRANI MEDISA NATANIA', 'BANK KALBAR', '09/08/2023', '8:41:41', '-', 3000000, 'e3072d9cd845de37ca397accda5dfe19.jpeg', 2, '2023-08-11 07:34:46', '45', 1, '', ''),
(1423, '70482066646444a3b2b0d', 'HERIYANTA MUKHAIRI', 'Bank Kalbar', '10-8-2023', '13:45:05', '156078', 7290000, '361c68aa9325c2ad71c064ececbae2d1.jpg', 2, '2023-08-12 08:08:25', '45', 1, '', ''),
(1406, '178803816494f6e3c1258', 'Kristian Mandiri', 'BANK KALBAR', '10/09/2023', '08 :46 :39', '007', 5010000, '8f3aa4a9dccca69238cdfd7285f81399.jpg', 2, '2023-08-11 06:58:01', '45', 1, '', ''),
(1407, '1945950864b25060698d0', 'REHGIA MARIS LUMBAN GAOL', 'BANK KALBAR', '10/08/2023', '9:45:00', '013', 1510000, '54027dfd3f2e854139dadc9edfce70a5.jpg', 2, '2023-08-11 06:53:30', '45', 1, '', ''),
(1433, '1594558964622ab2d6738', 'Ziyanti Manda sari', 'Bank kalbar', '12/08/2023', '10:53:36.036', '604161053320', 7290000, 'ed9a6b3df6d58b143279d931d2357b35.jpg', 2, '2023-08-14 08:31:24', '45', 1, '', ''),
(1413, '12240801646434c98bdaa', 'Lasmi Sri rahayu', 'bank Kalbar', '8/8/2023', '10:36:08', 'T060TL03/025', 3000000, '9609a8aeccda6f516e037ec42293fbd8.jpeg', 2, '2023-08-11 07:32:33', '45', 1, '', ''),
(1414, '5163822864a402e27cf8f', 'Adrianus Obazin', 'BANK KALBAR', '09/08/2023', '09:22:23', 'T022', 7290000, '7c906717e529374ef54481f1d9106f74.jpeg', 2, '2023-08-11 07:26:55', '45', 1, '', ''),
(1416, '1603582764c72bc782b83', 'Risa', 'PT Fliptech Lentera', '9/08/2023', '18:33:20 wIB', 'ID#FT362699528', 1510000, '62a75b7a9d7dae3712137bdf1ab21ac1.jpg', 2, '2023-08-14 09:01:01', '49', 1, '', ''),
(1417, '1776691064a4d2a2a59ae', 'Aselia lusiana putri', 'Bank kalbar', '10/8/2023', '12:20', '0000017', 1510000, 'd479f829d8115a23e095efd9785708c9.jpg', 2, '2023-08-11 06:56:40', '45', 1, '', ''),
(1418, '2318057464d2e5a8ab11b', 'Elicia selly Junica', 'Bank kalbar cabang UUM sintang', '10/08/2023', '13:58:55', '36', 3645000, 'afbe6aa2a740c526d1007d906d08578a.jpg', 2, '2023-08-11 06:50:21', '45', 1, '', ''),
(1422, '14224461647d59b0d74c5', 'RIKI SUPRIADI', 'Bank Kalbar', '09/08/2023', '18:56:10', '015468', 6000000, '7d1d5cfb2922c428a59dccdaddf2e593.jpg', 2, '2023-08-12 08:06:00', '45', 1, '', ''),
(1421, '1268687164942df20e83c', 'Agustina Merry jawai', 'Bank Kalbar', '09/08/2023', '13:05:20', '002', 7040000, '2b828663b8b53a90126212a4bde0f9ea.jpeg', 2, '2023-08-11 07:29:19', '45', 1, '', ''),
(1425, '16956842647ef46043916', 'Viky Satria Arlangga', 'Bank KALBAR', '07/08/2023', '13:14:34', 'T103/45', 7290000, '49c1339b8953beb7cb9acf50975a6b20.jpg', 2, '2023-08-12 08:04:12', '45', 1, '', ''),
(1427, '8499044764d0d5ec76415', 'ANISA TIANA DEWI', 'BNI', '11/08/2023', '13:47:52', '570163132138', 3000000, '4c4bfab5715bfecdffa21abc5b767479.jpg', 2, '2023-08-12 08:01:08', '45', 1, '', ''),
(1428, '18473424648ff203c6e05', 'Junti maria', 'Bank kalbar', '11/08/2023', '10:42:22', 'Tl03/19', 2490000, '13cf2d7118afa037af6382669a911413.jpeg', 2, '2023-08-12 08:02:53', '45', 1, '', ''),
(1429, '18473424648ff203c6e05', 'Junti maria', 'Bank kalbar', '11/08/2023', '11:34:20', 'Tl03/17', 1510000, '707cf05e8d3aa90b97c63e1abba87aa5.jpeg', 2, '2023-08-12 08:03:00', '45', 1, '', ''),
(1430, '189768796462d6e72501c', 'Kristina novani yuba', 'Bank Kalbar', '28/7/2023', '13:43:10', '151164', 1500000, '29aec03bff0263d77d6da211d744cab4.jpg', 2, '2023-08-12 08:09:58', '45', 1, '', ''),
(1432, '211660846462fbc58cf46', 'Pitus', 'Bank Kalbar', '09/8/2023', '14:48:16', 'T076', 1510000, 'd866df48f00327e5173d5117b27cd0b8.jpg', 2, '2023-08-14 08:30:11', '45', 1, '', ''),
(1434, '4071694964990fbc15d6a', 'Angli Pratama', 'BANK KALBAR', '14/08/2023', '8:52', '-', 1510000, '9400029dd5572753c40f9f7a622aa695.jpg', 2, '2023-08-14 12:30:02', '45', 1, '', ''),
(1437, '9546936564d45f8213270', 'LORENSIUS AKON', 'BANK KALBAR', '14/08/2023', '09:20:12', '*', 7290000, '2924abb8c9e91e96970f1e63aa1329a8.jpeg', 2, '2023-08-14 12:24:43', '45', 1, '', ''),
(1438, '1705457664cc799c30dbd', 'SDR RUDIANTO', 'BANK BNI', '14/08/2023', '10:03', '000000001352', 7040000, '50d864fa2476cdbd64ba060ead9bab99.jpg', 2, '2023-08-14 12:27:01', '45', 1, '', ''),
(1439, '1958635564812f11dac1a', 'Rocky Muhammad Wibowo', 'BANK KALBAR', '14/08/2023', '10:07:07', 'T TL04/9', 1510000, '2914be234e0ebac412660c96f4ef2ee0.jpg', 2, '2023-08-14 12:31:16', '45', 1, '', ''),
(1440, '8680011464b8912d99891', 'Olivia', 'Kalbar', '14/08/2003', '10:30:00', '069TI', 5290000, '2d1483a8578bb780243b3b3137b1e661.jpg', 2, '2023-08-14 12:28:12', '45', 1, '', ''),
(1441, '16833122646c9b832ab67', 'SUSI AYU ANGGRENI', 'kalbar', '14/08/2023', '10:57:22', 'T 060TL', 4290000, 'f0caee5fa1b67b303faf8928fcf1628a.jpeg', 2, '2023-08-15 08:09:09', '45', 1, '', ''),
(1442, '13510416646ca6c2e8e64', 'Sandra ayu Asti', 'kalbar', '14/08/2023', '10:58:19', 'T 060TL03', 3650000, 'f85f0c7d88793c4f058e772568530cd9.jpeg', 2, '2023-08-15 08:08:21', '45', 1, '', ''),
(1443, '20892705646c270e77427', 'Hizkia R Nugraha', 'kalbar', '14/08/2023', '13:51:47', 'T TL06/43', 7040000, '9b517e6fd7c31a5407c0799bab8b1670.jpeg', 2, '2023-08-15 08:09:57', '45', 1, '', ''),
(1444, '9605642464815c07908c1', 'Agusti putra', 'kalbar', '14/08/2023', '09:33:14', 'T 060TL02/31', 7290000, 'c4d06238c068deb991c8a2fba12a63be.jpeg', 2, '2023-08-15 08:05:02', '45', 1, '', ''),
(1445, '206941876440b9e7425ab', 'TIA WASTI', 'kalbar', '31/05/2023', '11:10:42', 'T 3.26', 5000000, 'ca2bca6c3460bb01cf76e78f8dae550f.jpeg', 2, '2023-08-15 08:19:23', '45', 1, '', ''),
(1446, '206941876440b9e7425ab', 'TIA WASTI', 'kalbar', '14/08/2023', '11:51:33', 'T 3.26', 2290000, 'c705c588b48137ffbc0ad3cb4df36886.jpeg', 2, '2023-08-15 08:15:32', '45', 1, '', ''),
(1451, '1046938564814afe927d3', 'Mariana fransiska', 'Bank KAL-BAR', '15/08/2023', '08:06:57', 'TL01/04', 7290000, '2a015119d8420bddc9bcdecd049ceb53.jpg', 2, '2023-08-15 14:07:35', '45', 1, '', ''),
(1449, '672418576447f26f82e86', 'ALPIN', 'BRI', '14 agustus 2023', '19:04:03', '571355955534', 7290000, '19686de9b9e5471eec9a101876bcca07.jpg', 2, '2023-08-15 08:12:15', '45', 1, '', ''),
(1450, '16867519647c11adc8a55', 'Iskandar', 'Bank mandiri', '14/08/2023', '18:44:54', '322635920335', 1510000, '1fd47573d015958776526b5c220d1a27.jpg', 2, '2023-08-15 08:06:40', '45', 1, '', ''),
(1452, '605884186462f697978f6', 'NOVIYANTO EDITYA NYURUNG', 'KALBAR', '15/08/2023', '08:54:43', '007', 7290000, 'aa685c3019c3ed0e3bb4da262cab1b2d.jpg', 2, '2023-08-15 14:09:58', '45', 1, '', ''),
(1453, '1299026263e44e0bd7525', 'HAFIZAN', 'BNI', '15/08/2023', '09:49:16', '88377576', 3250000, 'b82782dcd12e870f0fa7b3cf9d8b840b.jpg', 2, '2023-08-15 14:12:56', '45', 1, '', ''),
(1454, '1785229164c8662057206', 'Elleska', 'Bank kalbar', '15/08/2023', '09:24:03', '002', 1510000, '47ddd371d40d516f9478ba8f237e8346.jpeg', 2, '2023-08-15 13:53:46', '45', 1, '', ''),
(1455, '4737359264954dbfc3fac', 'Marrylin Moris', 'Bank BRI', '15/08/2023', '10:39:14', '000003993966', 1510000, 'a6cea3a7d35c9437279deb8313dd85b8.jpeg', 2, '2023-08-15 17:40:49', '45', 1, '', ''),
(1468, '742122716469734ad090a', 'Franciskus pabio', 'BANK BRI', '15/08/2023', '14:35:38', '000003543198', 7290000, 'f933caf32ad8f99159b071e3dc01176f.jpg', 2, '2023-08-16 08:29:56', '45', 1, '', ''),
(1457, '1104544664583ad31e6cd', 'Selvya', 'BANK KALBAR', '15/08/2023', '10:28:30', '126360', 1510000, 'ee67a74cfe98af09970666cd8f1aeb78.jpg', 2, '2023-08-15 14:10:55', '45', 1, '', ''),
(1458, '1043503664644a1751191', 'MIA SAFIRA', 'kalbar', '15/08/2023', '10:22:00', 'T028', 5000000, 'ff1140bc200756164642876cb00b3229.jpeg', 2, '2023-08-15 14:08:32', '45', 1, '', ''),
(1462, '1874962864cb8e147ca49', 'Tamiyasari', 'Bank kalbar', '15/08/2023', '13:43:06', '61TL01/68', 7290000, '02ec70b9bc07c8bacdeda5ff66af3904.jpg', 2, '2023-08-15 17:37:47', '45', 1, '', ''),
(1461, '2183012864ae4d1879eee', 'VAJAR TULISTIWA', 'BANK KALBAR', '15/08/2023', '10:10:36', 'TL 03-14', 7290000, 'fd0f4946f46137a378f1dd4f838038e5.jpg', 2, '2023-08-15 14:06:12', '45', 1, '', ''),
(1463, '7405410664908fe94937a', 'Margareta tia', 'BANK KALBAR', '15/08/2023', '9:39:24', '002', 7290000, '138991eb5deed0a92eef0e6b8e8d20f8.jpg', 2, '2023-08-15 17:41:55', '45', 1, '', ''),
(1467, '1047981864a806139f914', 'NATALIA', 'BANK KALBAR', '15/08/2023', '14:38:48', '206154', 7040000, 'a223bf5baab7875a8f495f8d4ddbff88.jpg', 2, '2023-08-15 17:38:51', '45', 1, '', ''),
(1469, '501693166475ad9fae92d', 'Bujang mas wandi', 'BRI', '15/08/2023', '19:52:04', '571789240292', 7290000, '014065ac0b5a089d073ef1af4eb1db1a.jpg', 2, '2023-08-16 08:26:59', '45', 1, '', ''),
(1470, '136558286487d9f53da9b', 'Liman', 'BCA', '15/08/2023', '07:46:46', '20230815CENAIDJA51023468223', 1510000, '0f1ba94226be20da9a926bd9c69edae2.jpg', 2, '2023-08-17 08:29:26', '45', 1, '', ''),
(1471, '928041576462fa81a459e', 'Neni Oktavia', 'Bank Kalbar', '15/08/2023', '10:58:41', '131234130014100', 4040000, '48c08bd18ad4ca7d7e366baccc0e6684.jpg', 2, '2023-08-16 08:36:27', '45', 1, '', ''),
(1472, '1852569764b0f66ceaf0c', 'Tio saputra', 'Bank kalbar', '16/07/2023', '09:29', 'Bayar Di Bank Kalbar', 7290000, '62038456407d84016985e65025309d81.jpg', 2, '2023-08-16 10:26:03', '45', 1, '', ''),
(1473, '104199516461b4e3c2e31', 'Yosia esi Dila kaci', 'Kalbar', '16/08/2023', '10:04:04', '002', 7040000, '71452c915d4bb0c49046e01bba32a841.jpg', 2, '2023-08-17 08:23:18', '45', 1, '', ''),
(1474, '162810426480801da1d96', 'TATI SUMIRA', 'BANK KALBAR', '16/08/2023', '10:20:19', '006219', 2280000, '1b0c733a94d286e2f34d84b0fe880d72.jpg', 2, '2023-08-17 08:09:57', '45', 1, '', ''),
(1476, '43568023646ade7370233', 'Suprianus musa', 'Bank KALBAR Cabang Putussibau', '16/08/2023', '10:13', '162162', 7290000, '235734ee5ad1cb19460fd2cddfff7c85.jpg', 2, '2023-08-19 08:55:29', '45', 1, '', ''),
(1481, '21114179645b93e0e92da', 'CORDAMIA KAROLIN EVA', 'Bank Kalbar', '16/08/2023', '14:34:57', 'T36', 5780000, 'aefe1e5b6729649be9f4fc3ffc053bbd.jpg', 2, '2023-08-17 08:24:16', '45', 1, '', ''),
(1478, '102485064ab75b8cfe21', 'ANDRIANUS ASIN', 'KALBAR', '16/08/2023', '11:30', '206856', 6000000, 'b272f7a414fc8eccee6eb8c90cdaec55.jpg', 2, '2023-08-17 08:06:17', '45', 1, '', ''),
(1479, '2704494364af7a1de14a4', 'Marta Tandani', 'Bank kalbar', '16/08/2023', '10:32:51', 'T16', 7290000, '204787d759cce220054b091e616f5e0c.jpg', 2, '2023-08-17 08:05:04', '45', 1, '', ''),
(1480, '15840377647d4b1a37b0e', 'KRISTINI JUNIANTI', 'Bank Mandiri', '16/08/2023', '07:30:35', '230816112193939602583', 4000000, 'a50168c38200d6a8c2179852cb8ac05e.jpg', 2, '2023-08-17 08:12:20', '45', 1, '', ''),
(1483, '15568166641dacdbc812e', 'ANYAN', 'Bank Kalbar', '16/08/2023', '16:33:35.370', '477480433330', 5290000, '46c5da2dfe6058af39bd2193a6801283.jpg', 2, '2023-08-17 08:25:10', '45', 1, '', ''),
(1485, '174334816402f59295002', 'Kristina Baki Sulaona', 'BANK KALBAR', '16-08-2023', '13:16:44', '40482', 1510000, '8cbb84af8f55d22854b27f6b252d4a3c.jpg', 2, '2023-08-17 08:26:42', '45', 1, '', ''),
(1486, '212787236467140d55dcd', 'Anjela yoki', 'BNI', '16-08-2023', '_', 'IB1333605434', 7290000, '1c2568bf1e31dd01bf75b1fb6a0d256a.jpg', 2, '2023-08-17 08:21:01', '45', 1, '', ''),
(1495, '19005542646c4f51b7835', 'Fitri ramadani', 'kalbar', '18/08//2023', '14:47', 'T40', 7290000, '7b3d9fe2968c0b039611e8c651b1fa44.jpeg', 2, '2023-08-21 07:51:50', '45', 1, '', ''),
(1498, '1458494764bfb6865eb4c', 'Asih Sarohana Sinaga', 'Bank Kalbar', '21/08/2023', '10:35:42', 'TL09/40', 1510000, 'a7c62c4a601454371d04e77b8bce71ec.jpeg', 2, '2023-08-21 15:19:28', '45', 1, '', ''),
(1490, '18759737648f05e5420d0', 'ELDA GRACIA FUTRI', 'BANK BRI', '18/08/2023', '10:06:12', '1849', 7290000, 'fe78fc69563a0715092c14d7ae3ff4d3.jpg', 2, '2023-08-19 08:50:39', '45', 1, '', ''),
(1491, '5128025064709aa52b4bb', 'yospian putra triwijaya', 'Bank Kalbar', '18/08/2023', '08:44:03', '095TL01-19', 3500000, '137e011f78e8a5cdf3497b1bf3c03978.jpeg', 2, '2023-08-19 08:51:55', '45', 1, '', ''),
(1494, '200393446462fedfbd8e1', 'SOFI', 'BRI', '19/08/2023', '10:57:16', '153270', 1510000, '3054a59bff9b18088c323fd0bbf24a3c.jpg', 2, '2023-08-22 06:34:06', '45', 1, '', ''),
(1493, '465336456462eac06f673', 'Veronika Lita Berlina', 'Bank Kalbar', '7/08/2023', '10:13:20', '151866', 4000000, '3fe35388cffbbcf9a7512a8a429e825c.jpeg', 2, '2023-08-21 07:52:57', '45', 1, '', ''),
(1497, '94347616645db1ddc682b', 'Anasartika amoi', 'Bank kalbar', '21/08/2023', '07:09:54', '566680709530', 4760000, '88bf5133f574841c48cf226d1d85c1e0.jpg', 2, '2023-08-21 07:50:01', '45', 1, '', ''),
(1499, '97935590648d55543377d', 'Muhammad Fajril', 'KALBAR', '21 AGUSTUS 2023', '11:23:43', 'TL01/70', 7290000, 'cad5895abb21d8d60c3c1c62efcb705d.jpg', 2, '2023-08-21 15:20:58', '45', 1, '', ''),
(1500, '6601373064c4c4970871b', 'Andreas Diko Hartadi', 'Bank Kalbar', '21/08/2023', '10:49:33', 'TL01/12', 7290000, 'b12d34d03505465aa366df28e60503e9.jpg', 2, '2023-08-21 15:17:44', '45', 1, '', ''),
(1501, '104692546487f19a78766', 'WELLY SANJAYA', 'Bank Kalbar', '21/08/2023', '10/36/43', '4010006517', 2500000, 'c2f08cbbee4fc283a72ec6019d945a25.jpg', 2, '2023-08-21 15:22:29', '45', 1, '', ''),
(1502, '2279966664b5f8088483c', 'Lusia Lena', 'Bank Kalbar', '14/08/2023', '11:42:50', 'TL.33', 5000000, '16ea402dbd615725addffd66ca8e3130.jpg', 2, '2023-08-22 06:35:49', '45', 1, '', ''),
(1503, '8398325963bebea49d406', 'Alexsius', 'Bank kalbar', '21/08/2023', '16:59:56', '191150501280', 3500000, 'c1d0b04de5c9f6ee8baed0950136e4ab.jpg', 2, '2023-08-22 06:36:55', '45', 1, '', ''),
(1505, '38804775645cc28adef23', 'Maria Dyan', 'Bank Kalbar', '22/08/2023', '08:34:16', '123', 7040000, 'e65e6e9461f967965418a1f21e3e2d83.jpg', 2, '2023-08-22 09:26:27', '45', 1, '', ''),
(1507, '1241970864afb01094211', 'Vinsensia Laura Praditha', 'BANK KALBAR', '22/08/2023', '11:20:29', '0', 7040000, '0c7d9c537275718467209dae209ff2e9.jpg', 2, '2023-08-22 15:44:11', '45', 1, '', ''),
(1509, '35993858646ac62834299', 'Grevonius varel', 'Bpd kalbar', '22/08/23', '12', '6109012704060001', 7040000, '51f6d6972b6fc72bd138ad94d7b5023d.jpg', 2, '2023-08-22 15:46:44', '45', 1, '', ''),
(1510, '1205821964d5f197e862a', 'FAHRI MUHAMMAD BINTANG', 'BANK KALBAR', '22/08/2023', '10:06:05', 'TL09/21', 7040000, '36ff3f0971f71d8aa7abed1861ad90b8.jpg', 2, '2023-08-22 15:42:58', '45', 1, '', ''),
(1511, '160266216491cc52a3a61', 'Magdalena', 'BANK KALBAR', '22/08/2023', '14:06:24', '002', 5290000, 'f06ee5b64d8cd470c1d31fe29d6d9aa4.jpg', 2, '2023-08-22 15:45:48', '45', 1, '', ''),
(1512, '150595656492ba13376e4', 'Desiana ratna', 'Bank Kalbar', '22/08/2023', '14.06.58', '002', 5290000, 'be37948cb14f8a3b0dc91be9607d1acb.jpg', 2, '2023-08-22 15:45:05', '45', 1, '', ''),
(1513, '1134822664547f6f983d1', 'Eliya. M', 'BRI', '22/08/2023', '15:42:36', '574243602724', 1040000, '448350d59331277f6bd2c6701eccd709.jpg', 2, '2023-08-23 06:27:33', '45', 1, '', ''),
(1514, '6383417164a62c46819bf', 'Apriliandini Santa Putri', 'Bank kalbar', '22/08/2023', '12:02:19', '123', 7290000, '9532fc5e89d1058eae0133ced12e9748.jpg', 2, '2023-08-23 06:24:48', '45', 1, '', ''),
(1515, '546909186487e0a075dca', 'Margareta aprilia mayantir', 'bank Kalbar', '15/08/2023', '08:51:36', 'TL04/05', 7290000, '2e72c3a105dfd76aa8cc69abd76e424b.jpeg', 2, '2023-08-23 12:39:38', '45', 1, '', ''),
(1516, '13387430646f063b42908', 'Aria', 'Kalbar', '23/08/2023', '10:06:52', '-', 5530000, '76680cf5c503e3f1c224849571e857b1.jpg', 2, '2023-08-23 12:40:59', '45', 1, '', ''),
(1517, '17307805648ba2e6078b2', 'ETTY DEBORAWATI', 'KALBAR', '23/08/2023', '11:39:03', 'T1.29', 7290000, 'a9a473cf58071023e5c404f6f0e6e341.jpeg', 2, '2023-08-24 06:29:18', '45', 1, '', ''),
(1518, '14297895646433d4825b9', 'Isna Hanisa oktavia', 'Bank kalbar', '23/08/2023', '09:27:21', '060TL03/012', 2780000, 'a6403cbe977dc60e748a16283095f0d2.jpeg', 2, '2023-08-24 10:37:27', '45', 1, '', ''),
(1519, '151864296465781e9465e', 'Stenly susyaputra', 'bank Kalbar', '23/08/2023', '11:48:43', 'T049', 1510000, '842a3d6adbae5a81f63486432b143c5f.jpeg', 2, '2023-08-24 06:30:14', '45', 1, '', ''),
(1520, '103139556461af0101b1e', 'Angela Hasyanta Destyn Anjilo', 'Bank Kalbar', '23/08/2023', '08:26:53', 'TL08/03', 7040000, '1674ff009575090b3dd86d399244cdcc.jpg', 2, '2023-08-24 06:33:14', '45', 1, '', ''),
(1525, '61360499645e2d237ef4e', 'Anggara Bernal', 'Bank Kalbar', '24/08/2023', '09:55:30', '07', 7040000, '3fb4ffe142f36d245bd4a9060e482a5b.jpg', 2, '2023-08-24 14:18:53', '45', 1, '', ''),
(1526, '21271205649173ed06db0', 'CORRY FRISKILA ANGGAL', 'BANK BRI', '24/08/2023', '11:46:210', '000004736487', 3000000, '59ad7611801b6ae8294ca140523f06d1.jpg', 2, '2023-08-24 14:17:57', '45', 1, '', ''),
(1527, '6977168264d8323f621be', 'Rachmawati', 'BANK KALBAR', '24/08/2023', '13.24.49', '043', 7290000, '53aec8c559079f814613e8bd58945583.jpg', 2, '2023-08-24 14:16:52', '45', 1, '', ''),
(1528, '13048973645a2945028c5', 'MATIAS DAMARYANTO', 'BANK KALBAR', '24/08/2023', '14:48:46', '48/32', 2280000, 'de03122ff4c0013c09c1a123db462678.jpg', 2, '2023-08-24 17:17:04', '45', 1, '', ''),
(1529, '177435576490439b16b22', 'CECEP KARBANI', 'Bank Neo', '24/08/2023', '19:40:57', '0301011694691256115933184', 3500000, '25de95b642dbb1bf77c4366ab0b5a195.jpg', 2, '2023-08-25 07:02:31', '45', 1, '', ''),
(1530, '189875866462e17acc301', 'Yessy Saputri', 'Bank Kalbar', '24/08/2023', '09:56:44', '151632', 1510000, 'debe8050530bc30d3e38afafe9d8e693.jpg', 2, '2023-08-25 07:03:17', '45', 1, '', ''),
(1531, '148722196494ff8f827f3', 'Oktaviana Novi Astuti', 'Bank BRI', '24/08/2023', '20:27:56', '5221843174667589', 1510000, '7e82ac976bebd582dd57f2040b8560e4.jpg', 2, '2023-08-25 07:00:56', '45', 1, '', ''),
(1532, '738365606458691bed6a9', 'Rosalia', 'Kalbar', '25/08/2023', '08:31:29', 'Tl 03/05', 3250000, '137aa2aabdfc4cdf7106769e6b56b9a8.jpg', 2, '2023-08-25 11:17:32', '45', 1, '', ''),
(1533, '159231706464a13fcc944', 'Sedi', 'bank Kalbar', '20/08/2023', '11:17', '333331117060', 1510000, '9e58f4f1f8701510dc802b68c6926ffb.jpeg', 2, '2023-08-25 11:14:57', '45', 1, '', ''),
(1534, '2318057464d2e5a8ab11b', 'Elicia selly junica', 'Bank kalbar cabang UUM sintang', '25/08/2023', '10:59:59', '16', 3645000, 'c7a51fa171f3cee1c54707592dfc7181.jpg', 2, '2023-08-25 11:16:32', '45', 1, '', ''),
(1535, '201589036462d0ad5a029', 'Antonius Rafid', 'Bank Kalbar', '25/08/2023', '13:15:09', 'TL 47/48', 3250000, '2cbd7858554c3c0c50db200b1fca7826.jpg', 2, '2023-08-25 14:30:22', '45', 1, '', ''),
(1536, '10147367646241692b5a3', 'Karnelis', 'Kalbar', '25/8/2023', '14:22:56', 'TI09/53', 4760000, '89b4235a2228f203dc014b660fefed9d.jpg', 2, '2023-08-26 06:44:09', '45', 1, '', ''),
(1537, '7413499863fb4729aa3fd', 'Intan Irsanti', 'Bank Kalbar', '24/08/2023', '08:33:41', '006', 7040000, 'd03b2051e1ab7d50c0f8714cfabd6a71.jpg', 2, '2023-08-26 06:42:44', '45', 1, '', ''),
(1540, '9943287464683f6929566', 'AHO', 'BANK MANDIRI', '25/08/2023', '17:00:11', '2380251121958103997', 3250000, '74dfc48713ca81a694ea1df5129340e6.jpg', 2, '2023-08-28 09:50:24', '45', 1, '', ''),
(1539, '1299026263e44e0bd7525', 'HAFIZAN', 'BNI', '26/08/2023', '00:53:36', '99816159', 2280000, '364b05c00ff974d2fdb29fb870ed3d6e.jpeg', 2, '2023-08-26 06:46:38', '45', 1, '', ''),
(1541, '10481948647ff0ad30648', 'Ayu lestari', 'Bank kalbar', '26/08/2023', '09:23:27', 'TL09/32', 510000, 'd3bae0392ce2456bb6f10adc0d37a57e.jpeg', 2, '2023-08-28 10:59:38', '45', 1, '', ''),
(1542, '10768821646ee19d58b0a', 'Anggelina Geladis', 'KALBAR', '21/08/2023', '08:26:07', '002', 7040000, 'c0867263945808a291499f21e6d09505.jpg', 2, '2023-08-28 09:47:09', '45', 1, '', ''),
(1543, '166310676487d916c404b', 'Anggelina Delia', 'BRImo', '26/08/2023', '09:56:33 WIB', '575691934921', 7040000, '986cd0832590e368d2513f2ee37be878.jpeg', 2, '2023-08-28 09:23:26', '45', 1, '', ''),
(1544, '1522343664c1dc71c4c90', 'YOSIA NATANEL PERKA', 'LINK MANDIRI', '26/08/2023', '10:47:50', '2308261122994150598', 7290000, 'ad0d17d1e74388cb926deb3a5899ace4.jpeg', 2, '2023-08-29 09:35:22', '45', 1, '', ''),
(1545, '101007186460c010455cb', 'Edy Prayitno', 'Bank Mega', '26/8/2023', '17:17:11', '20230826MEGAIDJA01000210882643', 2300000, 'd326f3739d7a4e41b33b57ddf1930654.jpg', 2, '2023-08-28 09:45:07', '45', 1, '', ''),
(1546, '159231706464a13fcc944', 'Edy Prayitno', 'BNI', '26/08/2023', '17:24:11', '00594251', 5780000, '2ea05993f1b19d8c8f33c684d6bf3271.jpg', 2, '2023-08-28 09:26:49', '45', 1, '', ''),
(1550, '1276122264a7ce08eba10', 'Enjelina Resta Yolanda Elvita Riono', 'BRI', '27/08/2023', '08:22:18', '205218', 3040000, 'b927d14ee6bc9115066a3fc0189ebd30.jpeg', 2, '2023-08-28 11:01:33', '45', 1, '', ''),
(1548, '2091067364ce04773d0cc', 'Emiliana Bastiana putri', 'BRI bukti transaksi agen berlink WARUNG KENZIE DES', '27/08/2023', '11:57:40', '504541859171', 2000000, '9354d7936df8a50b57c4974747b8b3d4.jpg', 2, '2023-08-28 09:33:23', '45', 1, '', ''),
(1549, '1220046464c759f7413f6', 'Simon', 'BANK KALBAR', '26/08/2023', '18:06:34', '006480', 1510000, 'a0cdbe21413b2bf5d67c8c18c25ed5b1.jpeg', 2, '2023-08-28 09:19:50', '45', 1, '', ''),
(1551, '49527345646c394d264f8', 'Nicodemus nayung', 'Kalbar', '28/08/2023', '08:17:43', 'Tl09/07', 4000000, 'f0ffa943ee93489e9788a40769171766.jpg', 2, '2023-08-28 11:02:58', '45', 1, '', ''),
(1552, '13155561646c305b70650', 'Helaria wiwin', 'Kalbar', '28/08/2023', '08:17:24', 'Tl09/06', 7040000, 'fa954adc4bce549939a55be95df62dd9.jpg', 2, '2023-08-28 11:04:16', '45', 1, '', ''),
(1553, '1500085264d5883a6d66e', 'Edy prayitno', 'Bank mega', '28/08/2023', '10:50:12', '9409123606644', 3000000, '0d9be0a75ab2b801e7df957d03386416.jpg', 2, '2023-08-29 09:33:21', '45', 1, '', ''),
(1554, '16833626648b14705e484', 'ALVIN MAY SAPUTRA', 'Bank KALBAR', '28/08/2023', '08:56:44', 'TL09/07', 2280000, '743ac41718ed68d02cc2ea5eedd87e12.jpg', 2, '2023-08-29 05:04:02', '45', 1, '', ''),
(1555, '11517077647010127836b', 'OSTARIA SINDY ANDAP', 'KALBAR', '28/08/2023', '15:10', '083', 1510000, 'f7e6fa4d38d08f041ec0d40bd62adb1c.jpg', 2, '2023-08-29 05:02:24', '45', 1, '', ''),
(1556, '19161225648d1491433ea', 'Ariati', 'bank Kalbar', '29/08/2023', '08:16:35', 'TL09/04', 3000000, 'afe8f10c0804192a38d2494ed9d82202.jpeg', 2, '2023-08-29 14:44:15', '45', 1, '', ''),
(1557, '4737359264954dbfc3fac', 'Agus Purnomo', 'Bank BRI', '29/08/2023', '11:41:58', '000009392629', 5780000, '0d5bf6bddc6f4dd549513a5b68cdf40d.jpg', 2, '2023-08-29 18:15:28', '45', 1, '', ''),
(1558, '1958635564812f11dac1a', 'Rocky Muhammad Wibowo', 'BANK KALBAR', '29-08-2023', '09:25:04', 'T  TL04/4', 5530000, '035d7fafd418e7bf3beb954216cf53b6.jpg', 2, '2023-08-30 08:23:22', '45', 1, '', ''),
(1559, '9148195064b4d9df6d269', 'Vaza auviana razifa', 'Bank kalbar', '29/08/2023', '13:53:54', 'Tl09/44', 7290000, 'd869844463b84bcb0bc6607ffefb3714.jpg', 2, '2023-08-30 08:21:47', '45', 1, '', ''),
(1560, '7505953763eeba60c1c2d', 'Efronika', 'Bank Kalbar', '28/08/2023', '13:20:23', 'T029', 5780000, '726ab9cc1a0f8f935de06f92e8c6735a.jpeg', 2, '2023-08-30 08:20:24', '45', 1, '', ''),
(1562, '488991326403e07c7b468', 'Rihana Anggela Trivina', 'Kalbar', '28-08-2023', '14:26:30', '4010006317', 3800000, '138e015e62bb305921090f1fe846cb4a.jpg', 2, '2023-08-30 19:19:08', '45', 1, '', ''),
(1564, '201589036462d0ad5a029', 'Antoninus Rafid', 'Bank Kalbar', '30/08/2023', '21:19:52', '020574', 1510000, '1e4c0a41e98bbd4f747958c1b4168305.jpg', 2, '2023-08-31 07:52:58', '45', 1, '', ''),
(1566, '4578768664e3dec28b482', 'Imelda', 'Kalbar', '31/08/2023', '11.30', '231894', 7290000, '788cebb298e043a588ba349b7661f4ee.jpg', 2, '2023-09-01 15:13:20', '45', 1, '', ''),
(1567, '6218522764c99ab0402df', 'Agnes delila', 'Bank BRI', '26/08/2023', '07:43:55', '0000004755958', 5000000, '23d6cc232d23a77fdcaf12df7e9da0f7.jpg', 2, '2023-09-01 15:20:47', '45', 1, '', ''),
(1569, '19769921648d059677838', 'Nursindin', 'Bank Kalbar', '31/08/2023', '08:26:28', '003', 5530000, '238de7470b7f0d20d555372d78aab389.jpg', 2, '2023-09-01 15:17:30', '45', 1, '', ''),
(1570, '7597041264b8b4f3916d7', 'Cristian Sesa', 'Bank Kalbar', '31-08-2023', '14:43:17', '020777', 7040000, 'f89583f19562acc65c08eed3ab2cccd6.jpeg', 2, '2023-09-01 15:14:28', '45', 1, '', ''),
(1571, '9940610563bbbc98ea876', 'Bernadeta Novia', 'BRI', '31/08/2023', '19:08:35', '577884800371', 5530000, '857c0eb8173ccee2eab35b098605eeaf.jpeg', 2, '2023-09-01 15:18:42', '45', 1, '', ''),
(1572, '1921282964ee870953e51', 'ASEP SETIAWAN', 'BANK BRI', '31/8/23', '15:18:15', '236808', 7290000, 'f0d6a1decac0ff90615cfb8576bcf733.jpg', 2, '2023-09-01 15:12:02', '45', 1, '', ''),
(1573, '1580093764b77919a83e1', 'GRYGORIA MELLFREDAY', 'Bank Kalbar', '26/08/2023', '16:33:39', '138710433360', 4000000, '6b98c316ec750c84eba7dec846f91f84.jpg', 2, '2023-09-01 15:22:25', '45', 1, '', ''),
(1574, '721837976461f4a873cf4', 'Anastasia Mimi', 'Bank kalbar', '28/08/2023', '11:34:09', 'TL01/48', 5780000, '51f2aa7ce1092366282d33b26200a381.jpeg', 2, '2023-09-04 05:15:17', '45', 1, '', ''),
(1575, '2102247364755db96d73a', 'Tania Anjeli', 'Bank Kalbar', '28/08/2023', '2:35:15', 'TL01/', 7290000, 'b8de87301d4abb966b424680e81b82c8.jpg', 2, '2023-09-04 05:13:16', '45', 1, '', ''),
(1576, '721837976461f4a873cf4', 'Anastasia Mimi', 'Bank kalbar', '05/08/2023', '16:21:09.075', '761810421080', 1510000, 'd62fed8a678134c1490e0092344f8d0c.jpg', 2, '2023-09-04 05:17:16', '45', 1, '', ''),
(1577, '937101426458bf4a9419a', 'SUHADI', 'Bank Mandiri', '3 September 2023', '11:41:28 wib', '2309031122013195257', 3250000, '8baf3726e7e16be5c80e4fa0e00187b9.jpg', 2, '2023-09-04 05:19:30', '45', 1, '', ''),
(1578, '59906596645628a3a3d9e', 'Kalista Aprilla', 'BRI', '3/09/2023', '11:47:13', '401006517', 2000000, 'b6b5964f9dd33264903c498e9386503d.jpg', 2, '2023-09-04 05:21:24', '45', 1, '', ''),
(1579, '59906596645628a3a3d9e', 'Kalista Aprilla', 'BRI', '3/09/2023', '14:06:18', '401006517', 280000, '0a85d8b77881f2657f881b880cc9a9a6.jpg', 2, '2023-09-04 05:22:51', '45', 1, '', ''),
(1580, '189768796462d6e72501c', 'Kristina novani yuba', 'Bank Kalbar', '4/9/2023', '12:02:26', '151164', 4500000, '0883173e889f966631f1dfcf042afe15.jpg', 2, '2023-09-05 07:19:26', '45', 1, '', ''),
(1581, '16867519647c11adc8a55', 'Konter alva', 'Bank kalbar', '04/09/2023', '18:30', '761810630290', 3500000, '65a70b9285ceaf95b09fa120752fb908.jpg', 2, '2023-09-05 07:18:34', '45', 1, '', ''),
(1582, '21148107645a3d1205292', 'ONGGIE MALLARADA', 'BANK BRI', '04/09/2023', '19:17:09', '4010006517', 1780000, 'fcd910d4ea72ae84d9d5e1b6314caedd.jpg', 2, '2023-09-05 07:20:42', '45', 1, '', ''),
(1589, '2142883164eb283bbd189', 'Bernike Anggelia francisca', 'Kalbar', '06/09/2023', '11:14:54', 'Tl03/26', 7290000, '8619f8a0d0f693ea027bb6d9dd6b2b75.jpg', 2, '2023-09-06 13:07:53', '45', 1, '', ''),
(1585, '6303209664efd015a8b9e', 'Damianus oldifianus bata', 'Bank kalbar', '05/09/2023', '1033', '123', 7290000, 'ba34cd8904d57f506ff788c32864ae84.jpg', 2, '2023-09-06 07:26:02', '45', 1, '', ''),
(1588, '49527345646c394d264f8', 'Nicodemus Nayung', 'kalbar', '06/09/2023', '08:17:41', 'TL01-06', 3290000, 'ed7dafebfb59583eb40b7adbaad55ebd.jpeg', 2, '2023-09-06 13:08:33', '45', 1, '', ''),
(1587, '2065515664edb9e852627', 'Marsianus salauwanda', 'BRI', '05/09/2023', '14:44', '580040889216', 1510000, '33dc37cc6fe8d22a24b9dbdc18e08890.jpeg', 2, '2023-09-06 13:07:07', '45', 1, '', ''),
(1590, '3204457764b09643aa294', 'Teller 3 Bank Kalbar', 'Bank kalbar', '06/09/2023', '13:22:00', 'TL03/33', 2280000, 'fe6fe3e171d5c0fe3014b4bdf8a161c9.jpg', 2, '2023-09-07 07:15:49', '45', 1, '', ''),
(1591, '186174016408339130ced', 'Desi', 'Bank kalbar', '09-08-2023', '09:57:19', 'TL03/20', 5790000, 'd018041a82a41251cb3cf5ced876637b.jpg', 2, '2023-09-07 07:12:55', '45', 1, '', ''),
(1592, '1711228064df5cb2bab4c', 'Ester Yuria', 'Bank kalbar', '06/09/2023', '11:05:05', '4010006517', 5000000, '635af9b28aa7beda6542ab00fad2e461.jpg', 2, '2023-09-07 11:15:26', '45', 1, '', ''),
(1593, '1458494764bfb6865eb4c', 'Asih Sarohana Sinaga', 'Bank Kalbar', '07/09/2023', '08:42:02', 'TL01/07', 4780000, '6bac76dfebbf4664cbc0a66399422eff.jpg', 2, '2023-09-08 05:27:58', '45', 1, '', ''),
(1594, '59906596645628a3a3d9e', 'Kalista Aprilla', 'BRI', '11/9/2023', '14:14:21', '401006517', 500000, 'f548c9b329bc82b724dc3e5e57b06f4c.jpg', 2, '2023-09-12 06:12:46', '45', 1, '', ''),
(1595, '12488042643b4121a5f87', 'Alias sepanya', 'BPD Kalbar', '11/09/2023', '14:36:04', 'KBK040TL01', 3040000, '2b4be9e06ebf47e72d8ed09daaa89cd4.jpeg', 2, '2023-09-14 05:51:55', '45', 1, '', ''),
(1596, '7391786264fa6cdf6b923', 'Osin Hestiyocka M', 'Bank Kalbar', '12/09/2023', '13:28:59', '238680', 1510000, '984822609bb8955d1ff5e3022ccee982.jpg', 2, '2023-09-14 05:56:05', '45', 1, '', ''),
(1597, '465336456462eac06f673', 'Veronika Lita Berlina', 'BANK KALBAR', '05/09/2023', '10:44:54', '002', 3290000, '557d3f650ab9ebe0a8af085ff6c9aaf9.jpeg', 2, '2023-09-14 05:59:50', '45', 1, '', ''),
(1598, '10481948647ff0ad30648', 'Ayu lestari', 'Bank kalbar', '12/09/2023', '11:26:27', 'TL09/32', 5845000, '2680715a58d20c2f34cbc96b60dd556d.jpg', 2, '2023-09-14 05:53:23', '45', 1, '', ''),
(1599, '2065515664edb9e852627', 'Marsianus salauwanda', 'Bank kalbar', '13/08/2023', '09:49:23', 'TL 09/23', 5780000, 'e5c30df5d67b99ddfd763a7b26520885.jpg', 2, '2023-09-14 05:57:21', '45', 1, '', ''),
(1600, '1448853464083e3a10cd1', 'Ernesta Tia', 'Bank Kalbar', '13/09/2023', '13:42:06', 'TL03/33', 7040000, '8297309d9a3c34ecab8d47dbb0c889b3.jpeg', 2, '2023-09-14 05:57:55', '45', 1, '', ''),
(1601, '18791392648c593a5461f', 'Faisal edwin', 'BANK KALBAR', '12/09/2023', '12 : 56 : 00', '026042', 2290000, '1f3111977cbb701778851110540f9b4e.jpg', 2, '2023-09-14 05:54:42', '45', 1, '', ''),
(1602, '512238476458b7212cea3', 'lili veronika', 'bank Kalbar', '13/09/2023', '08:13:57', 'Tl03/09', 2300000, '1d758817bc5a3c3a525c604cd7b296b1.jpeg', 2, '2023-09-16 06:28:20', '45', 1, '', ''),
(1603, '1945950864b25060698d0', 'Rehgia Maris Lumban Gaol', 'bank Kalbar', '4/9/2023', '10:43', 'TL13', 3500000, 'c4eac4452f3c699cfc9bb582ec42a925.jpeg', 2, '2023-09-16 06:26:52', '45', 1, '', ''),
(1604, '1321475464a2a0c741682', 'Gracia Angelin Elisabet Dada Pote', 'BANK KALBAR', '15/09/2023', '09:45', 'TI 03/21', 5780000, 'a82f460a8c49d17a489eef40386a08f6.jpg', 2, '2023-09-16 06:30:58', '45', 1, '', ''),
(1605, '7609813764ecc5c737960', 'Arif rahman', 'Bca', '15/09/2023', '12:22:40', '20230915CENAIDJA51060871525', 7000000, '216afe5e08b870cc046ee325cf74e018.jpg', 2, '2023-09-16 06:30:19', '45', 1, '', ''),
(1612, '69429803649e8d89229b3', 'Eva Fitriyani', 'bank Kalbar', '20/09/2023', '09:51', '103640951050', 3645000, '58ad07162a2ab79f7b07ac5275d9eae5.jpeg', 1, '', '', 1, '', ''),
(1608, '172419426418517a3bba5', 'Suci Intan Berliani', 'Bank kalbar', '11/09/2023', '14:00:27', '1.60', 3790000, '82e29d4796f7ba21e160c0fb4605bf66.jpeg', 2, '2023-09-18 17:31:44', '45', 1, '', ''),
(1609, '6609480664d9dbf30aaeb', 'ANTONIUS ROMI', 'Kalbar', '4/9/2023', '09:39:00', 'TI 03/18', 7040000, '01851d6561a18f960a103ea255c86096.jpg', 2, '2023-09-18 17:26:21', '45', 1, '', ''),
(1613, '11903219645f89abbb2ed', 'RUSIANI', 'BANK KALBAR', '20/09/2023', '11:44:15', '48/12', 3790000, '05478657540e4f2e89aa027cdcaca79e.jpg', 1, '', '', 1, '', ''),
(1611, '12240801646434c98bdaa', 'Isna Hanida', 'Transfer Bi-fast', '18//09/2023', '09:09:30', '585231943259', 2780000, '43eb41f0bfcb35a058e6b96b5050ca60.jpeg', 2, '2023-09-18 17:34:19', '45', 1, '', ''),
(1614, '18473424648ff203c6e05', 'Junti maria', 'kalbar', '21/09/2023', '13:01:03', 'TL03/27', 3290000, 'e4a5a193a956e93420bda0d869fa57de.jpeg', 1, '', '', 1, '', ''),
(1615, '162810426480801da1d96', 'TATI SUMIRA', 'BANK KALBAR', '22/09/2023', '12:56:50', '012071', 3500000, 'dee3cf84c6440357376d8e37f0474097.jpg', 1, '', '', 1, '', ''),
(1616, '16833122646c9b832ab67', 'Susi Ayu Anggreni', 'KALBAR', '25/09/2023', '14:19:34', '073', 3000000, '', 1, '', '', 1, '', ''),
(1617, '59906596645628a3a3d9e', 'Kalista Aprilla', 'BRI', '25/9/2023', '11:22:23', '401006517', 3000000, 'a8c6e09f629bad39f35056a5290f3e4c.jpg', 1, '', '', 1, '', ''),
(1618, '4071694964990fbc15d6a', 'Angli Pratama', 'BANK KALBAR', '26 September 2023', '14.04', '-', 2280, '1dc87f181753712b77d65e8359ac1166.jpg', 1, '', '', 1, '', ''),
(1619, '4071694964990fbc15d6a', 'Angli Pratama', 'BANK KALBAR', '26 September 2023', '14.04', '-', 3020, 'f15fefde6bde2b47171dd091e82686b6.jpg', 1, '', '', 1, '', ''),
(1620, '7609813764ecc5c737960', 'Arif rahman', 'Bca', '25/09/2023', '12:22:40', '20230915CENAIDJA51060871525', 290000, '86118124ec108bef1c380a346acd6659.jpg', 1, '', '', 1, '', ''),
(1621, '804949436494495a630c4', 'Elsa Angela', 'Bank Kalbar', '27/09/2023', '10:34:48', '040 KBK040TL01 D23040TL01 00000 067', 3500000, 'e69c83720d2eb5c10428b630991135c7.jpeg', 1, '', '', 1, '', ''),
(1622, '1776691064a4d2a2a59ae', 'Aselia lusiana putri', 'Bank kalbat', '27/9/2023', '11:15', '007', 5780000, 'c28d38b1919415f00ba1146efab947d7.jpg', 1, '', '', 1, '', ''),
(1623, '1776691064a4d2a2a59ae', 'Aselia lusiana putri', 'Bank kalbar', '27/9/2023', '11:15', '007', 5780000, '', 1, '', '', 1, '', ''),
(1624, '73355155645077e06d6e2', 'MARIA BELLA OKTAVIANI', 'BANK KALBAR', '27/09/2023', '13:25:37', '123', 5530000, '2069587b4312965ef4c17d4841828290.jpg', 1, '', '', 1, '', ''),
(1625, '16469714644df161c2226', 'Marsusi', 'BRI', '27/09/2023', '18:37:26', '589104146621', 2280, '347bff2af90985f77a33d7292c63bca1.jpg', 1, '', '', 1, '', ''),
(1626, '1785229164c8662057206', 'Elleska', 'Bank kalbar', '25/09/23', '09:21:36', '002', 5780000, '98faa1ff342dc671ab999d978ff7299c.jpg', 1, '', '', 1, '', ''),
(1627, '1946058464b3ae8f91329', 'Mawar Yuliana Riski', 'BANK BRI', '29/09/2023', '10:28:36', '-', 5790000, '88cf8d509a39e029f76e31e0ba3e0c4d.jpg', 1, '', '', 1, '', ''),
(1628, '1531089764635119b40ed', 'Tasya Zikri Marwa', 'BANK KALBAR', '29/09/2023', '15:12:45', '154206', 7290000, '', 1, '', '', 1, '', ''),
(1629, '8184682464916f9b926b7', 'Nikolaus', 'kalbar', '02//10/2023', '10:32:31', 'TL03/18', 7290000, '84230a5e35c9ce9cd51e080b10901711.jpeg', 1, '', '', 1, '', ''),
(1630, '16469714644df161c2226', 'MARSUSI', 'BANK KALBAR', '27/09/2023', '18:37:26', '115596', 228000000, '5afb646539c75d03447a57815d78d35b.jpg', 1, '', '', 1, '', ''),
(1631, '16469714644df161c2226', 'MARSUSI', 'BANK KALBAR', '27/09/2023', '18:37:26', '115596', 228000000, '41a7e53b67c5cf9620bcd7a39baf8f2b.jpg', 1, '', '', 1, '', ''),
(1632, '16469714644df161c2226', 'MARSUSI', 'Bank BRI', '27/09/2023', '18:37:26', '115596', 228000000, '799c75b2fdeb4b72ac1785cf223dbb42.jpeg', 1, '', '', 1, '', ''),
(1633, '10966393645bab459459b', 'VICTORINUS SUSILO', 'BANK KALBAR', '02/10/2023', '14:31:03', '123', 3500, '773fd06a2d7a0dedc9c9db84b032cf29.jpg', 1, '', '', 1, '', ''),
(1634, '10966393645bab459459b', 'VICTORINUS SUSILO', 'BANK KALBAR', '02/10/2023', '14:31:03', '002', 3500000, '587a23b55289bfa2e4fbebec1eeb4071.jpg', 1, '', '', 1, '', ''),
(1635, '17026985645d06ca25a73', 'Angela jesica wea', 'Bank kalbar', '27/09/2023', '10:05:54', '040 KRK040TI 03 D23040TI 03 00000 014', 1510000, '2366508c3592b6b45a5026ae9e14d3d4.jpg', 1, '', '', 1, '', ''),
(1636, '148722196494ff8f827f3', 'Oktaviana Novi Astuti', 'Bank BRI', '03/10/2023', '17:15;23', '195624', 5530, '57de56177bddf57c5e2f321714fd09df.jpg', 1, '', '', 1, '', ''),
(1637, '197573966464e019d97f4', 'Dewi wanti', 'Bank kalbar', '3/10/2023', '9:58:00', 'Tlo1/21', 1510000, '', 1, '', '', 1, '', ''),
(1638, '8499044764d0d5ec76415', 'Anisa Tiana Dewi', 'Kalbar', '6/10/2023', '10:04:39', 'TL01/16', 4290000, 'd5875dfd87253f08a13423d72aa21473.jpg', 1, '', '', 1, '', ''),
(1639, '1460083564ae9dc8cc2e4', 'Wanda Apriana Uli', 'Bank kalbar', '10/10/2023', '09:58:51', '002', 3500000, '31318be3e745f7259c2b1a67f08c8820.jpg', 1, '', '', 1, '', ''),
(1640, '7609813764ecc5c737960', 'Arif rahman', 'Bca', '25/09/2023', '19:43:25', '8665188244', 290000, '', 1, '', '', 1, '', ''),
(1641, '1274663764f52cb88a09d', 'Laily Badri', 'KALBAR', '25/10/23', '14/27/14', '403130227130', 3290000, '5cac34b5821484026411dc2edb811fc1.jpg', 1, '', '', 1, '', ''),
(1642, '3204457764b09643aa294', 'Teller Bank Kalbar', 'Bank kalbar', '21/11/2023', '13.30', '10017754230707198', 3500000, '228386168c4eb9eff080d6da8b950ee5.jpg', 1, '', '', 1, '', ''),
(1643, '3204457764b09643aa294', 'Teller Bank Kalbar', 'Bank kalbar', '21/11/2023', '13.30', '10017754230707198', 3500000, '', 1, '', '', 1, '', ''),
(1644, '1432555663db6345ca88f', 'Iqbal', 'Kalbar', '23/11/2023', '07:30:10', 'TVA09123', 7500000, '', 1, '', '', 1, '', ''),
(1645, '171740736462c84b49288', 'Hengky', 'Bank Kalbar', '14:35', '14:35:46', '77', 2, 'da7197c3b6adfd78fac4f95bef6cf4b0.jpg', 1, '', '', 1, '', '');

-- --------------------------------------------------------

--
-- Struktur dari tabel `captcha`
--

CREATE TABLE `captcha` (
  `captcha_id` bigint(13) NOT NULL,
  `captcha_time` int(10) NOT NULL,
  `ip_address` varchar(45) NOT NULL,
  `word` varchar(20) NOT NULL,
  `file` varchar(225) NOT NULL
) ENGINE=MyISAM DEFAULT CHARSET=latin1 COLLATE=latin1_swedish_ci;

--
-- Dumping data untuk tabel `captcha`
--

INSERT INTO `captcha` (`captcha_id`, `captcha_time`, `ip_address`, `word`, `file`) VALUES
(261499, 1701144522, '52.167.144.145', '8277', '1701144521.8321.jpg'),
(261500, 1701144529, '145.14.139.62', '6574', '1701144528.8948.jpg'),
(261498, 1701144502, '180.242.213.97', '3320', '1701144502.2602.jpg'),
(261497, 1701144481, '180.242.213.97', '2697', '1701144481.3031.jpg'),
(261496, 1701144479, '180.242.213.97', '3225', '1701144478.6771.jpg'),
(261488, 1701144351, '180.242.213.97', '1618', '1701144351.4381.jpg'),
(261489, 1701144355, '110.50.81.196', '1933', '1701144354.5959.jpg'),
(261490, 1701144365, '180.242.213.97', '4115', '1701144365.3659.jpg'),
(261491, 1701144396, '180.242.213.97', '8792', '1701144395.9187.jpg'),
(261492, 1701144406, '180.242.213.97', '5843', '1701144406.0801.jpg'),
(261494, 1701144415, '180.242.213.97', '6383', '1701144414.5624.jpg'),
(261495, 1701144477, '180.242.213.97', '1512', '1701144477.3705.jpg'),
(261493, 1701144414, '180.242.213.97', '0344', '1701144414.2391.jpg');

-- --------------------------------------------------------

--
-- Struktur dari tabel `pembayaran_rinci`
--

CREATE TABLE `pembayaran_rinci` (
  `id_pembayaran_rinci` int(11) NOT NULL,
  `bukti_id_bayar` int(11) NOT NULL,
  `tanggal_rinci` datetime NOT NULL DEFAULT current_timestamp(),
  `akun_pembayaran` varchar(225) NOT NULL,
  `jenis_bayar_rinci` int(11) NOT NULL,
  `user_id_rinci` varchar(225) NOT NULL,
  `jumlah_rinci` int(11) NOT NULL,
  `semester_rinci` int(11) NOT NULL,
  `smt_nama` varchar(20) NOT NULL,
  `tahun_ajaran` varchar(20) NOT NULL
) ENGINE=MyISAM DEFAULT CHARSET=latin1 COLLATE=latin1_swedish_ci;

--
-- Dumping data untuk tabel `pembayaran_rinci`
--

INSERT INTO `pembayaran_rinci` (`id_pembayaran_rinci`, `bukti_id_bayar`, `tanggal_rinci`, `akun_pembayaran`, `jenis_bayar_rinci`, `user_id_rinci`, `jumlah_rinci`, `semester_rinci`, `smt_nama`, `tahun_ajaran`) VALUES
(2357, 964, '2023-02-20 14:06:03', '1757841863bd4b6872d1a', 1, '', 1510000, 1, 'ganjil', '2021/2022'),
(2358, 964, '2023-02-20 14:06:03', '1757841863bd4b6872d1a', 2, '', 3500000, 1, 'ganjil', '2021/2022'),
(2359, 964, '2023-02-20 14:06:03', '1757841863bd4b6872d1a', 3, '', 2280000, 1, 'ganjil', '2021/2022'),
(2360, 965, '2023-02-20 14:30:53', '9189861063c1f42bdd268', 1, '', 1510000, 1, 'ganjil', '2021/2022'),
(2361, 965, '2023-02-20 14:30:53', '9189861063c1f42bdd268', 2, '', 3250000, 1, 'ganjil', '2021/2022'),
(2362, 965, '2023-02-20 14:30:53', '9189861063c1f42bdd268', 3, '', 2280000, 1, 'ganjil', '2021/2022'),
(2432, 989, '2023-02-23 18:34:54', '1817558963e9908755de8', 3, '', 2280000, 1, 'ganjil', '2021/2022'),
(2416, 984, '2023-02-21 18:31:24', '2143710863ddc0e18312f', 2, '', 3500000, 1, 'ganjil', '2021/2022'),
(2417, 984, '2023-02-21 18:31:24', '2143710863ddc0e18312f', 3, '', 2280000, 1, 'ganjil', '2021/2022'),
(2438, 991, '2023-02-24 11:42:08', '1700603163db59aeb8dad', 3, '', 2280000, 1, 'ganjil', '2021/2022'),
(2375, 969, '2023-02-20 18:33:59', '1836807863de4fe775c9b', 1, '', 1510000, 1, 'ganjil', '2021/2022'),
(2369, 968, '2023-02-20 15:39:45', '1394361163ba3d1e0eda5', 1, '', 1510000, 1, 'ganjil', '2021/2022'),
(2370, 968, '2023-02-20 15:39:45', '1394361163ba3d1e0eda5', 2, '', 3500000, 1, 'ganjil', '2021/2022'),
(2371, 968, '2023-02-20 15:39:45', '1394361163ba3d1e0eda5', 3, '', 2280000, 1, 'ganjil', '2021/2022'),
(2372, 963, '2023-02-20 16:06:19', '9274496263da075134f0f', 1, '', 1510000, 1, 'ganjil', '2021/2022'),
(2373, 963, '2023-02-20 16:06:19', '9274496263da075134f0f', 2, '', 3500000, 1, 'ganjil', '2021/2022'),
(2374, 963, '2023-02-20 16:06:19', '9274496263da075134f0f', 3, '', 2280000, 1, 'ganjil', '2021/2022'),
(2412, 983, '2023-02-21 15:34:32', '1072028563b564695c36e', 1, '', 1510000, 1, 'ganjil', '2021/2022'),
(2413, 983, '2023-02-21 15:34:32', '1072028563b564695c36e', 2, '', 3500000, 1, 'ganjil', '2021/2022'),
(2414, 983, '2023-02-21 15:34:32', '1072028563b564695c36e', 3, '', 2280000, 1, 'ganjil', '2021/2022'),
(2415, 984, '2023-02-21 18:31:24', '2143710863ddc0e18312f', 1, '', 1510000, 1, 'ganjil', '2021/2022'),
(2385, 973, '2023-02-20 19:38:14', '1402666063bf803712eab', 1, '', 1510000, 1, 'ganjil', '2021/2022'),
(2386, 973, '2023-02-20 19:38:14', '1402666063bf803712eab', 2, '', 3500000, 1, 'ganjil', '2021/2022'),
(2387, 973, '2023-02-20 19:38:14', '1402666063bf803712eab', 3, '', 2280000, 1, 'ganjil', '2021/2022'),
(2468, 1003, '2023-02-27 15:27:46', '9940610563bbbc98ea876', 1, '', 1510000, 1, 'ganjil', '2021/2022'),
(2467, 1002, '2023-02-27 15:21:29', '1818811863a0559e6ed90', 3, '', 2280000, 1, 'ganjil', '2021/2022'),
(2441, 992, '2023-02-24 14:01:37', '2114182463cb8c76992de', 3, '', 2280000, 1, 'ganjil', '2021/2022'),
(2436, 991, '2023-02-24 11:42:08', '1700603163db59aeb8dad', 1, '', 1510000, 1, 'ganjil', '2021/2022'),
(2437, 991, '2023-02-24 11:42:08', '1700603163db59aeb8dad', 2, '', 3500000, 1, 'ganjil', '2021/2022'),
(2431, 989, '2023-02-23 18:34:54', '1817558963e9908755de8', 2, '', 3500000, 1, 'ganjil', '2021/2022'),
(2430, 989, '2023-02-23 18:34:54', '1817558963e9908755de8', 1, '', 1510000, 1, 'ganjil', '2021/2022'),
(2423, 986, '2023-02-23 11:19:55', '1913336163cba5ca4f43f', 3, '', 2280000, 1, 'ganjil', '2021/2022'),
(2422, 986, '2023-02-23 11:19:55', '1913336163cba5ca4f43f', 2, '', 3500000, 1, 'ganjil', '2021/2022'),
(2440, 992, '2023-02-24 14:01:37', '2114182463cb8c76992de', 2, '', 3500000, 1, 'ganjil', '2021/2022'),
(2439, 992, '2023-02-24 14:01:37', '2114182463cb8c76992de', 1, '', 1510000, 1, 'ganjil', '2021/2022'),
(2421, 986, '2023-02-23 11:19:55', '1913336163cba5ca4f43f', 1, '', 1510000, 1, 'ganjil', '2021/2022'),
(2403, 979, '2023-02-21 08:35:57', '8586780263db527d023d1', 2, '', 3250000, 1, 'ganjil', '2021/2022'),
(2404, 980, '2023-02-21 08:39:32', '8586780263db527d023d1', 1, '', 1510000, 1, 'ganjil', '2021/2022'),
(2405, 980, '2023-02-21 08:39:32', '8586780263db527d023d1', 2, '', 3250000, 1, 'ganjil', '2021/2022'),
(2466, 1002, '2023-02-27 15:21:29', '1818811863a0559e6ed90', 2, '', 3500000, 1, 'ganjil', '2021/2022'),
(2465, 1002, '2023-02-27 15:21:29', '1818811863a0559e6ed90', 1, '', 1510000, 1, 'ganjil', '2021/2022'),
(2464, 1001, '2023-02-27 15:08:18', '5406232863ed984d9decc', 3, '', 2280000, 1, 'ganjil', '2021/2022'),
(2463, 1001, '2023-02-27 15:08:18', '5406232863ed984d9decc', 2, '', 3500000, 1, 'ganjil', '2021/2022'),
(2462, 1001, '2023-02-27 15:08:18', '5406232863ed984d9decc', 1, '', 1510000, 1, 'ganjil', '2021/2022'),
(2461, 1000, '2023-02-27 14:04:29', '3703614163e376dde38f9', 1, '', 1510000, 1, 'ganjil', '2021/2022'),
(2460, 999, '2023-02-27 13:42:02', '1110940863cfa5ffd5037', 1, '', 1510000, 1, 'ganjil', '2021/2022'),
(2459, 998, '2023-02-26 18:58:34', '9245609263df6e9a4b0b4', 3, '', 2280000, 1, 'ganjil', '2021/2022'),
(2458, 998, '2023-02-26 18:58:34', '9245609263df6e9a4b0b4', 2, '', 3500000, 1, 'ganjil', '2021/2022'),
(2457, 998, '2023-02-26 18:58:34', '9245609263df6e9a4b0b4', 1, '', 1510000, 1, 'ganjil', '2021/2022'),
(2454, 997, '2023-02-24 14:27:04', '1926061863da12cf1962f', 1, '', 1510000, 1, 'ganjil', '2021/2022'),
(2455, 997, '2023-02-24 14:27:04', '1926061863da12cf1962f', 2, '', 3500000, 1, 'ganjil', '2021/2022'),
(2456, 997, '2023-02-24 14:27:04', '1926061863da12cf1962f', 3, '', 2280000, 1, 'ganjil', '2021/2022'),
