-- phpMyAdmin SQL Dump
-- version 5.2.1
-- https://www.phpmyadmin.net/
--
-- Host: localhost:3306
-- Waktu pembuatan: 09 Des 2024 pada 15.00
-- Versi server: 10.11.9-MariaDB-cll-lve
-- Versi PHP: 8.3.13

SET SQL_MODE = "NO_AUTO_VALUE_ON_ZERO";
START TRANSACTION;
SET time_zone = "+00:00";


/*!40101 SET @OLD_CHARACTER_SET_CLIENT=@@CHARACTER_SET_CLIENT */;
/*!40101 SET @OLD_CHARACTER_SET_RESULTS=@@CHARACTER_SET_RESULTS */;
/*!40101 SET @OLD_COLLATION_CONNECTION=@@COLLATION_CONNECTION */;
/*!40101 SET NAMES utf8mb4 */;

--
-- Database: `u4397696_pmb2021`
--

-- --------------------------------------------------------

--
-- Struktur dari tabel `angket_dosen`
--

CREATE TABLE `angket_dosen` (
  `id_angket_dosen` int(11) NOT NULL,
  `semester_dosen` varchar(100) NOT NULL,
  `tahun_ajaran_dosen` varchar(50) NOT NULL,
  `1a` int(11) NOT NULL,
  `2a` int(11) NOT NULL,
  `3a` int(11) NOT NULL,
  `4a` int(11) NOT NULL,
  `5a` int(11) NOT NULL,
  `6a` int(11) NOT NULL,
  `7a` int(11) NOT NULL,
  `8a` int(11) NOT NULL,
  `9a` int(11) NOT NULL,
  `10a` int(11) NOT NULL,
  `11a` int(11) NOT NULL,
  `12a` int(11) NOT NULL,
  `13a` int(11) NOT NULL,
  `14a` int(11) NOT NULL,
  `15a` int(11) NOT NULL,
  `tdl_input_dosen` datetime NOT NULL DEFAULT current_timestamp(),
  `ip_address` varchar(45) NOT NULL
) ENGINE=InnoDB DEFAULT CHARSET=latin1 COLLATE=latin1_swedish_ci;

--
-- Dumping data untuk tabel `angket_dosen`
--

INSERT INTO `angket_dosen` (`id_angket_dosen`, `semester_dosen`, `tahun_ajaran_dosen`, `1a`, `2a`, `3a`, `4a`, `5a`, `6a`, `7a`, `8a`, `9a`, `10a`, `11a`, `12a`, `13a`, `14a`, `15a`, `tdl_input_dosen`, `ip_address`) VALUES
(1, 'ganjil', '2021/2022', 4, 4, 4, 3, 2, 2, 2, 3, 2, 2, 3, 2, 3, 3, 3, '2021-08-03 01:13:56', '180.246.189.145');

-- --------------------------------------------------------

--
-- Struktur dari tabel `angket_karyawan`
--

CREATE TABLE `angket_karyawan` (
  `id_angket_karya` int(11) NOT NULL,
  `semester_karya` varchar(100) NOT NULL,
  `tahun_ajaran_karya` varchar(50) NOT NULL,
  `1b` int(11) NOT NULL,
  `2b` int(11) NOT NULL,
  `3b` int(11) NOT NULL,
  `4b` int(11) NOT NULL,
  `5b` int(11) NOT NULL,
  `6b` int(11) NOT NULL,
  `7b` int(11) NOT NULL,
  `8b` int(11) NOT NULL,
  `9b` int(11) NOT NULL,
  `10b` int(11) NOT NULL,
  `11b` int(11) NOT NULL,
  `12b` int(11) NOT NULL,
  `13b` int(11) NOT NULL,
  `14b` int(11) NOT NULL,
  `15b` int(11) NOT NULL,
  `tdl_input_karya` datetime NOT NULL DEFAULT current_timestamp(),
  `ip_address` varchar(45) NOT NULL
) ENGINE=InnoDB DEFAULT CHARSET=latin1 COLLATE=latin1_swedish_ci;

-- --------------------------------------------------------

--
-- Struktur dari tabel `angket_mahasiswa`
--

CREATE TABLE `angket_mahasiswa` (
  `id_angket_maha` int(11) NOT NULL,
  `semester_maha` varchar(100) NOT NULL,
  `tahun_ajaran_maha` varchar(50) NOT NULL,
  `1c` int(11) NOT NULL,
  `2c` int(11) NOT NULL,
  `3c` int(11) NOT NULL,
  `4c` int(11) NOT NULL,
  `5c` int(11) NOT NULL,
  `6c` int(11) NOT NULL,
  `7c` int(11) NOT NULL,
  `8c` int(11) NOT NULL,
  `9c` int(11) NOT NULL,
  `10c` int(11) NOT NULL,
  `11c` int(11) NOT NULL,
  `12c` int(11) NOT NULL,
  `13c` int(11) NOT NULL,
  `14c` int(11) NOT NULL,
  `15c` int(11) NOT NULL,
  `tdl_input_maha` datetime NOT NULL DEFAULT current_timestamp(),
  `ip_address` varchar(45) NOT NULL
) ENGINE=InnoDB DEFAULT CHARSET=latin1 COLLATE=latin1_swedish_ci;

-- --------------------------------------------------------

--
-- Struktur dari tabel `biaya_kuliah`
--

CREATE TABLE `biaya_kuliah` (
  `biaya_kuliah_id` int(11) NOT NULL,
  `jenis_bayar_id1` int(3) NOT NULL,
  `prodi_id1` int(3) NOT NULL,
  `tahun_masuk` int(11) NOT NULL,
  `jumlah` int(11) NOT NULL
) ENGINE=MyISAM DEFAULT CHARSET=latin1 COLLATE=latin1_swedish_ci;

--
-- Dumping data untuk tabel `biaya_kuliah`
--

INSERT INTO `biaya_kuliah` (`biaya_kuliah_id`, `jenis_bayar_id1`, `prodi_id1`, `tahun_masuk`, `jumlah`) VALUES
(33, 6, 1, 2015, 0),
(32, 4, 1, 2015, 0),
(31, 2, 1, 2015, 0),
(30, 5, 1, 2014, 55000),
(29, 1, 1, 2014, 1750000),
(28, 10, 1, 2014, 2750000),
(27, 9, 1, 2014, 800000),
(26, 8, 1, 2014, 570000),
(25, 7, 1, 2014, 2000000),
(45, 4, 1, 2014, 0),
(46, 6, 1, 2014, 0),
(22, 2, 1, 2014, 0),
(34, 7, 1, 2015, 0),
(35, 8, 1, 2015, 0),
(36, 9, 1, 2015, 0),
(37, 10, 1, 2015, 0),
(38, 1, 1, 2015, 0),
(39, 5, 1, 2015, 0),
(492, 7, 1, 2020, 0),
(493, 8, 1, 2020, 0),
(494, 9, 1, 2020, 0),
(47, 2, 1, 2021, 20000),
(48, 4, 1, 2021, 0),
(49, 6, 1, 2021, 0),
(50, 7, 1, 2021, 0),
(51, 8, 1, 2021, 0),
(52, 9, 1, 2021, 0),
(53, 10, 1, 2021, 0),
(54, 1, 1, 2021, 0),
(55, 5, 1, 2021, 0),
(56, 2, 5, 2020, 3000000),
(57, 4, 5, 2020, 0),
(58, 6, 5, 2020, 0),
(59, 7, 5, 2020, 0),
(60, 8, 5, 2020, 0),
(61, 9, 5, 2020, 0),
(62, 10, 5, 2020, 0),
(63, 11, 5, 2020, 1400000),
(64, 1, 5, 2020, 2000000),
(65, 5, 5, 2020, 65000),
(491, 6, 1, 2020, 75000),
(490, 4, 1, 2020, 0),
(489, 2, 1, 2020, 0),
(69, 2, 4, 2019, 0),
(70, 4, 4, 2019, 0),
(71, 6, 4, 2019, 0),
(72, 7, 4, 2019, 0),
(73, 8, 4, 2019, 0),
(74, 9, 4, 2019, 0),
(75, 10, 4, 2019, 0),
(76, 11, 4, 2019, 0),
(77, 1, 4, 2019, 2000000),
(78, 5, 4, 2019, 65000),
(79, 2, 1, 2017, 3000000),
(80, 4, 1, 2017, 0),
(81, 6, 1, 2017, 0),
(82, 7, 1, 2017, 2280000),
(83, 8, 1, 2017, 570000),
(84, 9, 1, 2017, 800000),
(85, 10, 1, 2017, 2750000),
(86, 11, 1, 2017, 1075000),
(87, 1, 1, 2017, 2000000),
(88, 5, 1, 2017, 60000),
(439, 2, 9, 2014, 0),
(90, 4, 7, 2019, 0),
(91, 6, 7, 2019, 0),
(92, 7, 7, 2019, 0),
(93, 8, 7, 2019, 0),
(94, 9, 7, 2019, 0),
(95, 10, 7, 2019, 0),
(96, 11, 7, 2019, 1350000),
(97, 1, 7, 2019, 2000000),
(98, 5, 7, 2019, 65000),
(99, 2, 8, 2020, 0),
(100, 4, 8, 2020, 0),
(101, 6, 8, 2020, 0),
(102, 7, 8, 2020, 0),
(103, 8, 8, 2020, 0),
(104, 9, 8, 2020, 0),
(105, 10, 8, 2020, 0),
(106, 11, 8, 2020, 0),
(107, 1, 8, 2020, 2000000),
(108, 5, 8, 2020, 65000),
(109, 2, 8, 2019, 0),
(110, 4, 8, 2019, 0),
(111, 6, 8, 2019, 0),
(112, 7, 8, 2019, 0),
(113, 8, 8, 2019, 0),
(114, 9, 8, 2019, 0),
(115, 10, 8, 2019, 0),
(116, 11, 8, 2019, 0),
(117, 1, 8, 2019, 2000000),
(118, 5, 8, 2019, 65000),
(119, 2, 9, 2020, 1400000),
(120, 4, 9, 2020, 0),
(121, 6, 9, 2020, 0),
(122, 7, 9, 2020, 0),
(123, 8, 9, 2020, 0),
(124, 9, 9, 2020, 0),
(125, 10, 9, 2020, 0),
(126, 11, 9, 2020, 3250000),
(127, 1, 9, 2020, 2000000),
(128, 5, 9, 2020, 65000),
(129, 2, 3, 2019, 0),
(130, 4, 3, 2019, 0),
(131, 6, 3, 2019, 0),
(132, 7, 3, 2019, 0),
(133, 8, 3, 2019, 0),
(134, 9, 3, 2019, 0),
(135, 10, 3, 2019, 0),
(136, 11, 3, 2019, 0),
(137, 1, 3, 2019, 2000000),
(138, 5, 3, 2019, 65000),
(139, 2, 3, 2020, 0),
(140, 4, 3, 2020, 0),
(141, 6, 3, 2020, 75000),
(142, 7, 3, 2020, 0),
(143, 8, 3, 2020, 0),
(144, 9, 3, 2020, 0),
(145, 10, 3, 2020, 0),
(146, 11, 3, 2020, 0),
(147, 1, 3, 2020, 2000000),
(148, 5, 3, 2020, 65000),
(149, 2, 7, 2020, 0),
(150, 4, 7, 2020, 0),
(151, 6, 7, 2020, 0),
(152, 7, 7, 2020, 0),
(153, 8, 7, 2020, 0),
(154, 9, 7, 2020, 0),
(155, 10, 7, 2020, 0),
(156, 11, 7, 2020, 0),
(157, 1, 7, 2020, 2000000),
(158, 5, 7, 2020, 65000),
(159, 2, 3, 2018, 0),
(160, 4, 3, 2018, 0),
(161, 6, 3, 2018, 0),
(162, 7, 3, 2018, 2280000),
(163, 8, 3, 2018, 0),
(164, 9, 3, 2018, 0),
(165, 10, 3, 2018, 0),
(166, 11, 3, 2018, 0),
(167, 1, 3, 2018, 2000000),
(168, 5, 3, 2018, 60000),
(169, 2, 8, 2018, 0),
(170, 4, 8, 2018, 0),
(171, 6, 8, 2018, 0),
(172, 7, 8, 2018, 2280000),
(173, 8, 8, 2018, 0),
(174, 9, 8, 2018, 0),
(175, 10, 8, 2018, 0),
(176, 11, 8, 2018, 0),
(177, 1, 8, 2018, 2000000),
(178, 5, 8, 2018, 60000),
(179, 2, 3, 2017, 0),
(180, 4, 3, 2017, 0),
(181, 6, 3, 2017, 0),
(182, 7, 3, 2017, 0),
(183, 8, 3, 2017, 570000),
(184, 9, 3, 2017, 800000),
(185, 10, 3, 2017, 0),
(186, 11, 3, 2017, 0),
(187, 1, 3, 2017, 2000000),
(188, 5, 3, 2017, 60000),
(189, 2, 9, 2017, 0),
(190, 4, 9, 2017, 0),
(191, 6, 9, 2017, 0),
(192, 7, 9, 2017, 2280000),
(193, 8, 9, 2017, 570000),
(194, 9, 9, 2017, 800000),
(195, 10, 9, 2017, 2750000),
(196, 11, 9, 2017, 0),
(197, 1, 9, 2017, 2000000),
(198, 5, 9, 2017, 60000),
(199, 2, 4, 2017, 0),
(200, 4, 4, 2017, 0),
(201, 6, 4, 2017, 0),
(202, 7, 4, 2017, 0),
(203, 8, 4, 2017, 570000),
(204, 9, 4, 2017, 800000),
(205, 10, 4, 2017, 2750000),
(206, 11, 4, 2017, 0),
(207, 1, 4, 2017, 2000000),
(208, 5, 4, 2017, 60000),
(209, 2, 6, 2018, 0),
(210, 4, 6, 2018, 0),
(211, 6, 6, 2018, 0),
(212, 7, 6, 2018, 2280000),
(213, 8, 6, 2018, 0),
(214, 9, 6, 2018, 0),
(215, 10, 6, 2018, 0),
(216, 11, 6, 2018, 0),
(217, 1, 6, 2018, 2000000),
(218, 5, 6, 2018, 60000),
(219, 2, 9, 2019, 0),
(220, 4, 9, 2019, 0),
(221, 6, 9, 2019, 0),
(222, 7, 9, 2019, 0),
(223, 8, 9, 2019, 0),
(224, 9, 9, 2019, 0),
(225, 10, 9, 2019, 0),
(226, 11, 9, 2019, 0),
(227, 1, 9, 2019, 2000000),
(228, 5, 9, 2019, 65000),
(229, 2, 6, 2016, 0),
(230, 4, 6, 2016, 0),
(231, 6, 6, 2016, 0),
(232, 7, 6, 2016, 0),
(233, 8, 6, 2016, 570000),
(234, 9, 6, 2016, 800000),
(235, 10, 6, 2016, 2750000),
(236, 11, 6, 2016, 0),
(237, 1, 6, 2016, 1850000),
(238, 5, 6, 2016, 60000),
(239, 2, 2, 2019, 0),
(240, 4, 2, 2019, 0),
(241, 6, 2, 2019, 0),
(242, 7, 2, 2019, 0),
(243, 8, 2, 2019, 0),
(244, 9, 2, 2019, 0),
(245, 10, 2, 2019, 0),
(246, 11, 2, 2019, 0),
(247, 1, 2, 2019, 2000000),
(248, 5, 2, 2019, 65000),
(249, 2, 5, 2019, 0),
(250, 4, 5, 2019, 0),
(251, 6, 5, 2019, 75000),
(252, 7, 5, 2019, 0),
(253, 8, 5, 2019, 0),
(254, 9, 5, 2019, 0),
(255, 10, 5, 2019, 0),
(256, 11, 5, 2019, 0),
(257, 1, 5, 2019, 2000000),
(258, 5, 5, 2019, 65000),
(259, 2, 1, 2019, 0),
(260, 4, 1, 2019, 0),
(261, 6, 1, 2019, 0),
(262, 7, 1, 2019, 0),
(263, 8, 1, 2019, 0),
(264, 9, 1, 2019, 0),
(265, 10, 1, 2019, 0),
(266, 11, 1, 2019, 0),
(267, 1, 1, 2019, 2000000),
(268, 5, 1, 2019, 65000),
(269, 2, 1, 2013, 0),
(270, 4, 1, 2013, 0),
(271, 6, 1, 2013, 0),
(272, 7, 1, 2013, 0),
(273, 8, 1, 2013, 0),
(274, 9, 1, 2013, 0),
(275, 10, 1, 2013, 2750000),
(276, 11, 1, 2013, 0),
(277, 1, 1, 2013, 0),
(278, 5, 1, 2013, 0),
(279, 2, 3, 2014, 0),
(280, 4, 3, 2014, 0),
(281, 6, 3, 2014, 0),
(282, 7, 3, 2014, 0),
(283, 8, 3, 2014, 0),
(284, 9, 3, 2014, 0),
(285, 10, 3, 2014, 2750000),
(286, 11, 3, 2014, 0),
(287, 1, 3, 2014, 1750000),
(288, 5, 3, 2014, 55000),
(289, 2, 3, 2016, 0),
(290, 4, 3, 2016, 0),
(291, 6, 3, 2016, 0),
(292, 7, 3, 2016, 0),
(293, 8, 3, 2016, 570000),
(294, 9, 3, 2016, 800000),
(295, 10, 3, 2016, 0),
(296, 11, 3, 2016, 0),
(297, 1, 3, 2016, 1850000),
(298, 5, 3, 2016, 60000),
(299, 2, 9, 2018, 0),
(300, 4, 9, 2018, 0),
(301, 6, 9, 2018, 75000),
(302, 7, 9, 2018, 2280000),
(303, 8, 9, 2018, 0),
(304, 9, 9, 2018, 0),
(305, 10, 9, 2018, 0),
(306, 11, 9, 2018, 0),
(307, 1, 9, 2018, 2000000),
(308, 5, 9, 2018, 60000),
(309, 2, 5, 2018, 0),
(310, 4, 5, 2018, 0),
(311, 6, 5, 2018, 0),
(312, 7, 5, 2018, 2280000),
(313, 8, 5, 2018, 0),
(314, 9, 5, 2018, 0),
(315, 10, 5, 2018, 0),
(316, 11, 5, 2018, 0),
(317, 1, 5, 2018, 2000000),
(318, 5, 5, 2018, 60000),
(319, 2, 2, 2020, 0),
(320, 4, 2, 2020, 0),
(321, 6, 2, 2020, 0),
(322, 7, 2, 2020, 0),
(323, 8, 2, 2020, 0),
(324, 9, 2, 2020, 0),
(325, 10, 2, 2020, 0),
(326, 11, 2, 2020, 0),
(327, 1, 2, 2020, 2000000),
(328, 5, 2, 2020, 65000),
(329, 2, 4, 2020, 0),
(330, 4, 4, 2020, 0),
(331, 6, 4, 2020, 0),
(332, 7, 4, 2020, 0),
(333, 8, 4, 2020, 0),
(334, 9, 4, 2020, 0),
(335, 10, 4, 2020, 0),
(336, 11, 4, 2020, 0),
(337, 1, 4, 2020, 2000000),
(338, 5, 4, 2020, 65000),
(339, 2, 4, 2018, 0),
(340, 4, 4, 2018, 0),
(341, 6, 4, 2018, 0),
(342, 7, 4, 2018, 2280000),
(343, 8, 4, 2018, 0),
(344, 9, 4, 2018, 0),
(345, 10, 4, 2018, 0),
(346, 11, 4, 2018, 0),
(347, 1, 4, 2018, 2000000),
(348, 5, 4, 2018, 60000),
(349, 2, 9, 2013, 0),
(350, 4, 9, 2013, 0),
(351, 6, 9, 2013, 0),
(352, 7, 9, 2013, 0),
(353, 8, 9, 2013, 0),
(354, 9, 9, 2013, 0),
(355, 10, 9, 2013, 2750000),
(356, 11, 9, 2013, 0),
(357, 1, 9, 2013, 1700000),
(358, 5, 9, 2013, 50000),
(359, 2, 7, 2018, 0),
(360, 4, 7, 2018, 0),
(361, 6, 7, 2018, 0),
(362, 7, 7, 2018, 2280000),
(363, 8, 7, 2018, 0),
(364, 9, 7, 2018, 0),
(365, 10, 7, 2018, 0),
(366, 11, 7, 2018, 0),
(367, 1, 7, 2018, 2000000),
(368, 5, 7, 2018, 60000),
(369, 2, 3, 2013, 0),
(370, 4, 3, 2013, 0),
(371, 6, 3, 2013, 0),
(372, 7, 3, 2013, 0),
(373, 8, 3, 2013, 0),
(374, 9, 3, 2013, 0),
(375, 10, 3, 2013, 2750000),
(376, 11, 3, 2013, 0),
(377, 1, 3, 2013, 1720000),
(378, 5, 3, 2013, 55000),
(379, 2, 1, 2018, 0),
(380, 4, 1, 2018, 0),
(381, 6, 1, 2018, 0),
(382, 7, 1, 2018, 2280000),
(383, 8, 1, 2018, 0),
(384, 9, 1, 2018, 0),
(385, 10, 1, 2018, 0),
(386, 11, 1, 2018, 0),
(387, 1, 1, 2018, 2000000),
(388, 5, 1, 2018, 60000),
(389, 2, 9, 2015, 0),
(390, 4, 9, 2015, 0),
(391, 6, 9, 2015, 0),
(392, 7, 9, 2015, 2280000),
(393, 8, 9, 2015, 0),
(394, 9, 9, 2015, 800000),
(395, 10, 9, 2015, 2750000),
(396, 11, 9, 2015, 0),
(397, 1, 9, 2015, 1850000),
(398, 5, 9, 2015, 55000),
(399, 2, 8, 2017, 0),
(400, 4, 8, 2017, 0),
(401, 6, 8, 2017, 0),
(402, 7, 8, 2017, 2280000),
(403, 8, 8, 2017, 570000),
(404, 9, 8, 2017, 800000),
(405, 10, 8, 2017, 0),
(406, 11, 8, 2017, 0),
(407, 1, 8, 2017, 2000000),
(408, 5, 8, 2017, 60000),
(409, 2, 6, 2017, 0),
(410, 4, 6, 2017, 0),
(411, 6, 6, 2017, 0),
(412, 7, 6, 2017, 0),
(413, 8, 6, 2017, 570000),
(414, 9, 6, 2017, 800000),
(415, 10, 6, 2017, 0),
(416, 11, 6, 2017, 0),
(417, 1, 6, 2017, 2000000),
(418, 5, 6, 2017, 60000),
(419, 2, 9, 2016, 0),
(420, 4, 9, 2016, 0),
(421, 6, 9, 2016, 0),
(422, 7, 9, 2016, 2280000),
(423, 8, 9, 2016, 570000),
(424, 9, 9, 2016, 800000),
(425, 10, 9, 2016, 2750000),
(426, 11, 9, 2016, 0),
(427, 1, 9, 2016, 1850000),
(428, 5, 9, 2016, 60000),
(429, 2, 6, 2019, 0),
(430, 4, 6, 2019, 0),
(431, 6, 6, 2019, 0),
(432, 7, 6, 2019, 0),
(433, 8, 6, 2019, 0),
(434, 9, 6, 2019, 0),
(435, 10, 6, 2019, 0),
(436, 11, 6, 2019, 0),
(437, 1, 6, 2019, 2000000),
(438, 5, 6, 2019, 65000),
(440, 4, 9, 2014, 0),
(441, 6, 9, 2014, 0),
(442, 7, 9, 2014, 0),
(443, 8, 9, 2014, 570000),
(444, 9, 9, 2014, 800000),
(445, 10, 9, 2014, 2750000),
(446, 11, 9, 2014, 0),
(447, 1, 9, 2014, 1750000),
(448, 5, 9, 2014, 55000),
(449, 2, 3, 2015, 0),
(450, 4, 3, 2015, 0),
(451, 6, 3, 2015, 0),
(452, 7, 3, 2015, 0),
(453, 8, 3, 2015, 0),
(454, 9, 3, 2015, 800000),
(455, 10, 3, 2015, 0),
(456, 11, 3, 2015, 0),
(457, 1, 3, 2015, 1850000),
(458, 5, 3, 2015, 55000),
(459, 2, 6, 2020, 0),
(460, 4, 6, 2020, 0),
(461, 6, 6, 2020, 0),
(462, 7, 6, 2020, 0),
(463, 8, 6, 2020, 0),
(464, 9, 6, 2020, 0),
(465, 10, 6, 2020, 0),
(466, 11, 6, 2020, 0),
(467, 1, 6, 2020, 2000000),
(468, 5, 6, 2020, 65000),
(469, 2, 2, 2018, 0),
(470, 4, 2, 2018, 0),
(471, 6, 2, 2018, 0),
(472, 7, 2, 2018, 2280000),
(473, 8, 2, 2018, 0),
(474, 9, 2, 2018, 0),
(475, 10, 2, 2018, 0),
(476, 11, 2, 2018, 0),
(477, 1, 2, 2018, 2000000),
(478, 5, 2, 2018, 60000),
(479, 2, 7, 2017, 0),
(480, 4, 7, 2017, 0),
(481, 6, 7, 2017, 0),
(482, 7, 7, 2017, 0),
(483, 8, 7, 2017, 570000),
(484, 9, 7, 2017, 800000),
(485, 10, 7, 2017, 0),
(486, 11, 7, 2017, 0),
(487, 1, 7, 2017, 2000000),
(488, 5, 7, 2017, 60000),
(495, 10, 1, 2020, 0),
(496, 11, 1, 2020, 0),
(497, 1, 1, 2020, 2000000),
(498, 5, 1, 2020, 65000),
(499, 2, 6, 2013, 0),
(500, 4, 6, 2013, 0),
(501, 6, 6, 2013, 0),
(502, 7, 6, 2013, 0),
(503, 8, 6, 2013, 0),
(504, 9, 6, 2013, 0),
(505, 10, 6, 2013, 2750000),
(506, 11, 6, 2013, 0),
(507, 1, 6, 2013, 1700000),
(508, 5, 6, 2013, 55000),
(509, 8, 6, 2014, 570000),
(510, 9, 6, 2014, 800000),
(511, 10, 6, 2014, 2750000),
(512, 1, 6, 2014, 1750000),
(513, 5, 6, 2014, 55000),
(514, 22, 4, 2017, 110000),
(515, 22, 1, 2017, 110000),
(516, 23, 1, 2017, 70000),
(517, 24, 1, 2017, 50000),
(518, 25, 1, 2017, 70000),
(519, 26, 1, 2017, 50000),
(520, 27, 1, 2017, 70000),
(521, 29, 1, 2017, 10000),
(522, 25, 8, 2019, 10000),
(523, 23, 8, 2019, 70000),
(524, 26, 8, 2019, 110000),
(525, 23, 9, 2020, 10000),
(526, 28, 7, 2018, 110000),
(529, 28, 9, 2018, 110000),
(530, 27, 9, 2018, 10000),
(531, 26, 5, 2019, 110000),
(532, 26, 9, 2019, 110000),
(533, 26, 3, 2019, 110000),
(534, 28, 8, 2018, 110000),
(535, 24, 9, 2020, 110000),
(536, 22, 6, 2017, 110000),
(537, 28, 4, 2018, 110000),
(538, 28, 3, 2018, 110000),
(539, 24, 5, 2020, 110000),
(540, 22, 3, 2017, 110000),
(541, 28, 2, 2018, 110000),
(542, 28, 6, 2018, 110000),
(543, 26, 7, 2019, 110000),
(544, 24, 3, 2020, 110000),
(545, 28, 1, 2018, 110000),
(546, 22, 8, 2017, 110000),
(547, 24, 4, 2020, 110000),
(548, 24, 2, 2020, 110000),
(549, 22, 9, 2017, 110000),
(550, 24, 1, 2020, 110000),
(551, 23, 1, 2020, 10000),
(552, 24, 6, 2020, 110000),
(553, 24, 7, 2020, 110000),
(554, 30, 9, 2017, 100000),
(555, 26, 1, 2019, 110000),
(556, 24, 8, 2020, 110000),
(557, 26, 2, 2019, 110000),
(558, 26, 4, 2019, 110000),
(559, 26, 6, 2019, 110000),
(560, 25, 1, 2019, 10000),
(561, 29, 6, 2017, 10000),
(562, 29, 9, 2017, 10000),
(563, 8, 4, 2015, 0),
(564, 9, 4, 2015, 0),
(565, 10, 4, 2015, 0),
(566, 22, 4, 2015, 0),
(567, 1, 4, 2015, 1850000),
(568, 5, 4, 2015, 0),
(569, 34, 3, 2015, 10000),
(570, 28, 5, 2018, 110000),
(571, 30, 1, 2017, 100000),
(572, 32, 6, 2016, 110000),
(573, 32, 9, 2016, 110000),
(574, 31, 9, 2016, 160000),
(575, 7, 1, 2016, 0),
(576, 8, 1, 2016, 570000),
(577, 9, 1, 2016, 800000),
(578, 10, 1, 2016, 2750000),
(579, 22, 1, 2016, 0),
(580, 23, 1, 2016, 0),
(581, 24, 1, 2016, 0),
(582, 25, 1, 2016, 0),
(583, 26, 1, 2016, 0),
(584, 27, 1, 2016, 0),
(585, 28, 1, 2016, 0),
(586, 29, 1, 2016, 0),
(587, 30, 1, 2016, 0),
(588, 31, 1, 2016, 0),
(589, 32, 1, 2016, 110000),
(590, 33, 1, 2016, 0),
(591, 34, 1, 2016, 0),
(592, 1, 1, 2016, 1850000),
(593, 5, 1, 2016, 55000),
(594, 32, 3, 2016, 110000),
(595, 34, 9, 2015, 10000),
(596, 22, 7, 2017, 110000),
(597, 33, 9, 2014, 20000),
(598, 30, 9, 2015, 100000),
(599, 30, 9, 2014, 100000),
(600, 30, 3, 2017, 100000),
(601, 30, 6, 2017, 100000),
(602, 30, 4, 2017, 100000),
(603, 30, 9, 2016, 100000),
(604, 30, 7, 2017, 100000);

-- --------------------------------------------------------

--
-- Struktur dari tabel `biaya_kuliah_pmb`
--

CREATE TABLE `biaya_kuliah_pmb` (
  `id_biayakuliahpmb` int(11) NOT NULL,
  `item_biaya` varchar(100) NOT NULL,
  `jlh_uang` int(11) NOT NULL
) ENGINE=MyISAM DEFAULT CHARSET=latin1 COLLATE=latin1_swedish_ci;

--
-- Dumping data untuk tabel `biaya_kuliah_pmb`
--

INSERT INTO `biaya_kuliah_pmb` (`id_biayakuliahpmb`, `item_biaya`, `jlh_uang`) VALUES
(1, 'Registrasi Mahasiswa Baru', 1510000),
(2, 'Pengembangan Kampus', 3000000),
(3, 'SPP Tetap / Semester', 2000000);

-- --------------------------------------------------------

--
-- Struktur dari tabel `biaya_kuliah_pmbtest`
--

CREATE TABLE `biaya_kuliah_pmbtest` (
  `id_biayakuliahpmb` int(11) NOT NULL,
  `item_biaya` varchar(100) NOT NULL,
  `jlh_uang` int(11) NOT NULL
) ENGINE=MyISAM DEFAULT CHARSET=latin1 COLLATE=latin1_swedish_ci;

--
-- Dumping data untuk tabel `biaya_kuliah_pmbtest`
--

INSERT INTO `biaya_kuliah_pmbtest` (`id_biayakuliahpmb`, `item_biaya`, `jlh_uang`) VALUES
(1, 'Registrasi Mahasiswa Baru', 1510000),
(2, 'Pengembangan Kampus', 3250000),
(3, 'SPP Tetap / Semester', 2000000);

-- --------------------------------------------------------

--
-- Struktur dari tabel `bukti_bayar`
--

CREATE TABLE `bukti_bayar` (
  `id_bukti_bayar` int(11) NOT NULL,
  `akunb_msiswa` varchar(225) NOT NULL,
  `nama_pengirim` varchar(100) NOT NULL,
  `bank_pengirim` varchar(50) NOT NULL,
  `tgl_trans` varchar(20) NOT NULL,
  `jam_trans` varchar(20) NOT NULL,
  `nomor_refe` varchar(225) NOT NULL,
  `jlh_bayar` int(11) NOT NULL,
  `bukti_bayar` varchar(225) NOT NULL,
  `validasi_bukti` int(2) NOT NULL,
  `tgl_validbukti` varchar(50) NOT NULL,
  `yg_validasi` varchar(10) NOT NULL,
  `konfirm_bauk` int(2) NOT NULL,
  `yg_validasibauk` varchar(50) NOT NULL,
  `tgl_konfirmbauk` varchar(50) NOT NULL
) ENGINE=MyISAM DEFAULT CHARSET=latin1 COLLATE=latin1_swedish_ci;

--
-- Dumping data untuk tabel `bukti_bayar`
--

INSERT INTO `bukti_bayar` (`id_bukti_bayar`, `akunb_msiswa`, `nama_pengirim`, `bank_pengirim`, `tgl_trans`, `jam_trans`, `nomor_refe`, `jlh_bayar`, `bukti_bayar`, `validasi_bukti`, `tgl_validbukti`, `yg_validasi`, `konfirm_bauk`, `yg_validasibauk`, `tgl_konfirmbauk`) VALUES
(16, '49466206603e3d8c8b0ff', 'Aku', 'BCA', '28/07/2020', '19:20:30', '3424', 3510000, '8d022345fd674c146b6536e870b9b0b5.jpg', 3, '2021-03-05 00:27:44', '45', 2, '45', '2021-03-05 00:26:56'),
(15, '18040523602e187cda0ca', 'Veronika Suryajuanti', 'BCA', '04/03/2021', '14:34:25', '234587', 6510000, '873963625bf033a6955660d51267f2e4.jpeg', 2, '', '', 2, '48', '2021-03-08 11:30:48'),
(14, '1771226460178733d95ad', 'Felisia Venti Widati', 'Balai Sepuak', '04/03/2021', '10:45:07', '041', 6510000, 'c21f7397b66481c01ab3c9e2fa906285.jpeg', 2, '', '', 1, '', ''),
(13, '110776376027514610e55', 'Veronika', 'Bank Kalbar', '04/03/2021', '10:47:09', '042', 6510000, '5d7f0095e56384094d6ec8c36693a856.jpeg', 2, '', '', 2, '52', '2021-03-06 08:02:55'),
(12, '4378207760405c1ababaa', 'yoseph', 'bni', '24/06/1998', '12.14', '535', 6510000, '817d015be6988237a00850dea3b65a1e.jpg', 3, '', '', 1, '', ''),
(17, '18320725601787d406004', 'Vincentia Frisca Nugraheni', 'BANK KALBAR', '5/03/2021', '09:22:56', '123456', 6510000, '2a499c8bd1470b01e852f22866be3928.jpg', 3, '2021-03-05 19:49:46', '49', 1, '', ''),
(18, '18320725601787d406004', 'Vincentia Frisca Nugraheni', 'BANK KALBAR', '5/03/2021', '09:22:56', '017', 6510000, 'dc89d5b07070f31fbae8c2aa455e4781.jpg', 2, '2021-03-05 19:49:28', '49', 1, '', ''),
(19, '18320725601787d406004', 'Vincentia Frisca Nugraheni', 'BANK KALBAR', '5/03/2021', '09:22:56', '123456', 6510000, 'a559b86b709f003e5239e9574f5d11f8.jpg', 3, '2021-03-05 19:50:02', '49', 1, '', ''),
(20, '1816954960220b9bec20d', 'ASBARIYAH', 'BRI', '08/03/2021', '11:40:08', '000006567426', 6510000, '605f1869f534b17b9bb3569e5a266c74.jpg', 2, '2021-03-10 08:46:49', '49', 2, '48', '2021-04-07 08:35:04'),
(46, '20487662601784555af4c', 'Lili Mirawati', 'Bank Kalbar', '16/03/2021', '14:04:46', '018913', 1510000, '9a92042af51cb2b340e0dffccb831ff7.jpeg', 2, '2021-03-16 16:26:50', '49', 2, '48', '2021-04-07 08:27:52'),
(24, '18040523602e187cda0ca', 'Trisia olivia', 'M-Transfer', '04/03/2021', '14:34:25', '4010006517', 6510000, '9c47cb46c46cd433fc677ca08a0737c6.jpg', 3, '2021-03-09 18:39:39', '45', 1, '', ''),
(25, '42510300601785020ddc2', 'Edi Murdani', 'BRI', '09/03/2021', '11:02:17', '000000882997', 5000000, '181cf27b2f6f9fef9ac4e7cb10f350d4.jpg', 2, '2021-03-12 12:26:19', '49', 2, '48', '2021-04-07 14:00:51'),
(26, '18040523602e187cda0ca', 'Trisia olivia', 'M-Transfer', '04/03/2021', '14:34:25', '4010006517', 6510000, '9edaa8ebe1206751fa5e13e44eed5a8f.jpg', 3, '2021-03-09 18:39:47', '45', 1, '', ''),
(27, '42510300601785020ddc2', 'Edi Murdani', 'BRI', '09/03/2021', '11:02:54', '000000888638', 1510000, '0667607e8c05bcb2b06c4872a23d8217.jpg', 2, '2021-03-12 12:26:47', '49', 1, '', ''),
(28, '166793346029e33403366', 'monika andini', 'bank kalbar', '09/03/2021', '11:01:24', '002', 6510000, '4fbbe9cd8d6519be5ccc56f31da77f84.jpg', 2, '2021-03-10 08:31:21', '49', 2, '48', '2021-04-07 08:28:45'),
(30, '14327104601783cbb9b73', 'Rintan destauri', 'Bank kalbar', '09/03/2021', '13:18:41', '123', 6510000, '7b7cafcb12777a08885afadd40a10239.jpg', 2, '2021-03-10 08:30:42', '49', 2, '48', '2021-04-07 08:26:49'),
(44, '12025890601782f167895', 'Kurniatun', 'Bank Kalbar', '15/03/2021', '13:42:41', '41', 4510000, 'cb4f4599047b17df554a1b5018e7c3cc.jpg', 2, '2021-03-16 16:18:15', '49', 1, '', ''),
(33, '91504315601e9232d5d98', 'Gedion malasari', 'Bank Kalbar', '08-03-2021', '11:04:033', 'TL.03.031', 4510000, '3b65366f920ddb39d7748f4856cbaf7a.jpg', 2, '2021-03-10 09:09:12', '49', 2, '48', '2021-04-07 08:35:27'),
(34, '19738460601b4e6c1cb79', 'RATIH PURWANTI', 'BANK KALBAR', '10/03/2021', '09:40:00', '014', 4510000, '98c8070466eb4bfd5a643e06b82ac61c.jpeg', 2, '2021-03-10 10:42:12', '49', 1, '', ''),
(43, '143392296022448dcb9ad', 'LIli.K', 'Bank Kalbar', '15/03/2021', '13:41:45', '40', 6510000, '59b02f2323c6662d06cdc36a47d4d539.jpg', 2, '2021-03-16 16:12:19', '49', 2, '48', '2021-04-07 08:33:04'),
(36, '1649299560227c17916d0', 'IDA SAFITRI', 'BANK BRI', '10/03/2021', '10:57:08', '000001218061', 1510000, '6d88ac3a77f0ed47703a93ed1e28a233.jpg', 2, '2021-03-12 08:03:36', '49', 2, '48', '2021-04-07 08:32:38'),
(41, '1705926260273f837de08', 'SRIYOSI HERA ASNANDA', 'BANK MANDIRI', '10/03/21', '17:44:54', '106936603459', 1510000, '54bfaa5a175794bac944c5b8c6fa4fb3.jpg', 2, '2021-03-12 11:55:14', '49', 2, '48', '2021-04-07 08:29:27'),
(42, '172639186017877d049da', 'Murni Rospitasari', 'Bank BRI', '12/03/2021', '12:16:26', '123', 1510000, 'c264f8f150353a275402ae8688fdca2b.jpg', 2, '2021-03-12 12:24:10', '49', 1, '', ''),
(57, '202827556017841cde202', 'Natalia Rutina', 'BANK KALBAR', '24 Maret 2021', '10:42:26', '00000056', 6575000, '69f1d1554ecb03e5e7cd4adadf77b156.jpg', 3, '2021-06-10 12:21:35', '49', 1, '', ''),
(56, '91504315601e9232d5d98', 'Gedion Malaisari', 'ATM BRI', '22/03/2021', '11:18:07', '22193', 2000000, '29580f677af09e8879c2dbb7af55d226.jpg', 2, '2021-03-23 07:54:55', '49', 2, '48', '2021-04-07 08:36:10'),
(51, '7261850960178357a4890', 'Valentinus perdi', 'Bank Kalbar', '18 maret 2021', '10:54:55', 'T11', 6510000, '380248950fe6625a59c319d6e8fc3f4b.jpg', 2, '2021-03-19 13:46:30', '49', 2, '48', '2021-04-07 08:26:24'),
(54, '1783416560177d32e0bc4', 'Fira Fahrita', 'BPD', '17/03/2021', '10:35', '18', 6510000, '1edb63dcc38a81ea84a5415c1c229962.jpg', 2, '2021-03-22 10:25:40', '49', 2, '48', '2021-04-07 08:23:43'),
(59, '202827556017841cde202', 'Natalia Rutina', 'BANK KALBAR', '24/04/2021', '10:42:26', '00000056', 6575000, '7efd4bf8f6b9897f81bac3aec894ccb0.jpeg', 2, '2021-03-24 13:48:00', '49', 2, '48', '2021-04-07 08:27:28'),
(60, '12025890601782f167895', 'Kurniatun', 'Agen Mandiri', '28/03/2021', '17:08:15', '-', 2000000, '33112f7c6d1766311022bc1509a1e7e7.jpg', 2, '2021-04-06 10:06:00', '49', 2, '48', '2021-04-07 08:25:15'),
(61, '172639186017877d049da', 'REVIRA AYU LESTARI', 'Bank Kalbar', '29/03/2021', '08:48:27', '08', 5000000, 'bbf24b244147249e4c7da04b6bef1f09.jpeg', 2, '2021-03-29 10:00:17', '49', 1, '', ''),
(62, '32850891602ca23a70308', 'RENI ARDIANTI', 'Bank Kalbar', '29/03/2021', '08:46:18', '06', 6510000, 'bb1ad02707aeb7eaf5987d588cb6923e.jpeg', 2, '2021-03-29 09:59:53', '49', 2, '48', '2021-04-07 08:28:29'),
(63, '14162961602e1215945f0', 'DEVI KRISTIANI', 'Bank Kalbar', '29/03/2021', '08:45:11', '05', 1510000, '881ccbb480581c52147e88fcac570ea8.jpeg', 2, '2021-03-29 09:59:43', '49', 2, '48', '2021-04-07 08:28:14'),
(71, '34835717602340f052c48', 'Putri Joana Revi', 'Bank Kalbar', '30/03/2021', '13:19:01', '21', 6510000, '12bd3f26d17243475007f192fbda35ec.jpg', 2, '2021-03-30 17:50:01', '49', 2, '48', '2021-04-07 08:29:51'),
(69, '19738460601b4e6c1cb79', 'RATIH PURWANTI', 'KALBAR', '30/03/2021', '13:42:57', '066', 2000000, '263b914a640e06bbd92f50a9d8e3472c.jpeg', 2, '2021-03-30 17:33:03', '49', 1, '', ''),
(70, '1486294660178207b22e5', 'YANI PASMARAYU', 'Bank kalbar', '29/03/2021', '13:37:55', '40100065171', 1510000, '14cbfda63396ab818cc5444e9f5dafbd.jpg', 2, '2021-03-30 17:35:20', '49', 2, '48', '2021-04-06 09:25:10'),
(72, '142538736051515699a99', 'Maria Teovela', 'Bank Kalbar', '07/04/2021', '08:24:09', '02', 1510000, '0164048232b17a1b5f43ac4dc5021454.jpg', 2, '2021-04-07 11:55:52', '49', 2, '48', '2021-04-27 15:30:25'),
(73, '707620986052833dbf0e9', 'Asrini Haroya Saesinggah', 'Bank Kalbar', '08/04/2021', '10:29:32', '21', 6510000, '623ad7ddd12fd29601541c3dbf6f2af2.jpg', 2, '2021-04-08 18:57:39', '45', 2, '48', '2021-04-27 15:29:53'),
(74, '79686430605191093f8c4', 'LAMBERTHA LELI HAKIKIYANI', 'KALBAR', '08-04-2021', '14:32:28', '60TL02/068', 4510000, '3ae06c49c0cf085fccb997381adf1add.jpg', 2, '2021-04-09 14:26:36', '49', 2, '48', '2021-04-27 15:30:11'),
(75, '1649299560227c17916d0', 'MURTASIH', 'BRI', '10/04/2021', '16:18', '000003609474', 3000000, 'e64ada7d20a2a2b18eb84a781ac6331b.jpg', 2, '2021-04-12 08:23:02', '49', 1, '', ''),
(76, '58218816604303af07c78', 'Dominika Hani Destari', 'Bank KALBAR', '14/04/2021', '13:18:59', '123', 6575000, '767051b6c16d22013ba7a3f3663fb442.jpg', 2, '2021-04-14 13:48:52', '49', 2, '48', '2021-04-27 15:32:52'),
(77, '48632825605fe382e3b59', 'Kornelia Septi', 'Bank Kalbar', '14/04/2021', '09:57:50', 'TL09/11', 1510000, '699ef12f4c27749c5905b69399c50fa2.jpg', 2, '2021-04-16 14:08:03', '49', 2, '48', '2021-05-20 12:40:10'),
(78, '186389246035c9910f0b6', 'Ardianus Seno', 'Bank Kalbar', '15/4/2021', '11:04:19', 'TL03/21', 6510000, 'bd5a1a3998111b7ce6c5350f7c0660aa.jpeg', 2, '2021-04-16 14:09:59', '49', 1, '', ''),
(81, '77100385603314223b46b', 'VERONIKA', 'BANK KALBAR', '19/04/2021', '10:17:42', '123', 6575000, '2583a71b6b553ef3d30669a85b8a8369.jpg', 2, '2021-04-19 11:27:26', '49', 1, '', ''),
(80, '10176506603c74218bb91', 'HERDINA PINARTA', 'Kalbar', '15-04-2021', '09:23:59', '4010006517', 6510000, '8d8ad8ebc7b4510dcc4bb04f249f8223.jpg', 2, '2021-04-19 11:21:15', '49', 1, '', ''),
(82, '695801456041a379da7d8', 'Putri Ika mulyanti', 'Bank Kalbar', '19/04/2021', '10:50:30', '162642', 6510000, '20aa22d79da7159f6b91dd4c7a243bf5.jpg', 2, '2021-04-19 11:26:09', '49', 1, '', ''),
(83, '17790798604303ea19313', 'Sarmila', 'Bank Kalbar', '19/4/2021', '10:33:51', 'TL02/24', 2000000, '0e3fdb249644effabc6806378b5b50d0.jpeg', 2, '2021-04-19 13:37:39', '49', 2, '48', '2021-04-27 15:32:30'),
(84, '48712197605403471ddee', 'M suriyadinata', 'Bank kalbar', '21/04/2021', '11:45:55', 'TL09/35', 6510000, 'f57594777de7a0b12133bd6200da013c.jpeg', 2, '2021-04-22 12:15:12', '49', 2, '48', '2021-04-27 15:29:37'),
(85, '1389929860333e3b2934d', 'RICI RIKARDUS UCOK.A', 'Bank Kalbar', '21/04/2021', '09:30:00', 'IB1506435384', 1510000, '4772756fb467fc91b2f1878cba794f7b.jpg', 2, '2021-04-22 12:38:35', '49', 1, '', ''),
(86, '85472486604c09662c13b', 'Yoseph', 'Bank BRI', '26/04/2021', '09:13:43', '5248898', 1510000, 'e75512d8d825231dc4feb38c4982bc61.jpg', 2, '2021-04-26 11:12:44', '49', 2, '48', '2021-04-27 15:30:51'),
(87, '1602639460483e129cb5a', 'Normanita', 'BRI', '26/04/2021', '10:19:29', '26181', 6575000, '52ad17f25304426fa7fa1d81349c8355.jpg', 2, '2021-04-26 11:10:34', '49', 2, '48', '2021-04-27 15:32:04'),
(88, '11247934605a20326bcdc', 'Yustika Sari Boru Panggabean', 'Bank Kalbar', '26/04/2021', '10:14:19', '060TL01/035', 6510000, '0c1416959ae817f3d60a56230d1f8c2a.jpg', 2, '2021-04-26 11:03:21', '49', 2, '48', '2021-04-27 15:28:12'),
(89, '45417478603625deaf861', 'RISKA ZULAIKATUN NIKMAH', 'BANK KALBAR', '26/04/2021', '9:45:44', '153516', 6510000, 'c27deb8f8f89c73cf5ac3bf9772fe56d.jpg', 2, '2021-04-26 11:04:53', '49', 1, '', ''),
(92, '19718653603327d1bf900', 'Andika Dwi Ayu', 'Bank Kalbar', '22/04/2021', '10:56:21', '26', 2000000, 'f589f42451a1d9265c06004d8ff5d11c.jpeg', 2, '2021-04-26 11:20:57', '49', 1, '', ''),
(93, '64922091605d2b3569125', 'Yessy Lia Laura duri', 'Bank kalbar', '26/04/2021', '09:58:17', '067TL.21', 6510000, '7887a4cfd4537aa01c65a8e5ee61f2aa.jpg', 2, '2021-04-26 11:32:12', '49', 2, '48', '2021-04-27 15:26:44'),
(95, '17377363604bfade6cbd0', 'Eni Aulia', 'Bank Kalbar', '26/04/2021', '09:03:41', 'TL01/014', 6510000, '7436ea5f6105948fc209a1a65d2151a6.jpeg', 2, '2021-04-26 14:52:05', '49', 2, '48', '2021-04-27 15:31:10'),
(96, '10436051603eeacd457ef', 'Dimas dero pranata', 'BRI', '26/04/2021', '15:05:20', '26267', 6575000, '669f3ef5b189737882caa384415562d8.jpg', 2, '2021-04-26 16:01:30', '49', 1, '', ''),
(97, '94808655603347fc99f7d', 'Albertus janok', 'Bank Kalbar', '26/04/2021', '08:30:58', '123', 1500000, '96b4032b702ddc7505976026a6e2059b.jpg', 2, '2021-04-26 16:45:34', '49', 1, '', ''),
(98, '7096122660557f49b34d1', 'Metah Nurjanah', 'Bank BRI', '26/04/2021', '14:53:33', '175746', 1510000, '1f135ef627de754a652c38837e9b18ac.jpg', 2, '2021-06-11 10:40:21', '49', 2, '48', '2021-04-27 15:29:23'),
(99, '30891527605c1b51c3c3b', 'Andreas', 'Bank Kalbar', '26/04/2021', '11:11:50', '123456', 1500000, 'e23f030d7c158b2e407b769fafd3740f.jpg', 2, '2021-04-27 18:49:53', '49', 1, '', ''),
(110, '1008779060389ba65bb4e', 'Erastus', 'Bank Kalbar', '26/4/2021', '9:48:40', 'T03', 1510000, '23713a28c851e1fb764357a9d91de487.jpg', 2, '2021-04-28 15:27:52', '49', 1, '', ''),
(106, '17490239605d44dbc863b', 'Ganda jaya', 'Bank mandiri', '27/04/2021', '15:28:56', '111735819798', 1510000, '417c546b3c7e971745745c01408d3d61.jpg', 2, '2021-04-27 16:25:05', '49', 1, '', ''),
(104, '97751927605c96f1aab41', 'Imanudin', 'BRI', '27/4/2021', '08:32:47', '000006583430', 1510000, '354f9cd68fb74e45940e08cf01686bfd.jpeg', 2, '2021-04-27 16:07:31', '49', 1, '', ''),
(105, '97751927605c96f1aab41', 'Imanudin', 'BRI', '27/4/2021', '08:31:40', '000006572913', 5000000, '44a12e0184e33549f3231ece24a0cdcf.jpeg', 2, '2021-04-27 16:07:40', '49', 1, '', ''),
(107, '114429306029d8c6e5fe9', 'Indah Sulis Setiawati', 'Bank Kalbar', '26/04/2021', '08:56:41', 'TL09/04', 3510000, 'ef03e0238168385b5fe8ec7693775f5a.jpeg', 2, '2021-04-27 17:00:53', '49', 1, '', ''),
(109, '18477923603db2483ed91', 'NODIKA RIYESKY RAHMADA', 'Bank Kalbar', '28/4/2021', '10:22:53', 'T033', 6510000, '4bf1b28c4e2eeed203d4efbeec49c427.jpeg', 2, '2021-04-28 15:17:47', '49', 1, '', ''),
(111, '19900347603894fac8490', 'Elma Destari', 'Bank Kalbar', '26/4/2021', '09:52:00', 'T05', 1510000, 'fa2ca24121b0f387cd413b7f2470b86b.jpg', 2, '2021-04-28 15:30:18', '49', 1, '', ''),
(113, '1772427260506c4e23857', 'Candra Didik Saputra', 'Bank Kalbar', '26/04/2021', '09:50:32', 'T04', 1510000, 'd71127abdc56787b3e1e4698c202ba74.jpg', 2, '2021-04-29 12:08:00', '49', 1, '', ''),
(114, '1720880360339cdb7afe7', 'SAI DONI', 'BANK KALBAR', '28/04/2021', '10:40:13', '149772', 3000000, 'e3457dbb1bdd5b846c9a1a0c25608542.jpg', 2, '2021-05-04 11:12:08', '49', 1, '', ''),
(138, '13653437605c920cf24ac', 'ERUAN CHANDRA', 'BRI', '07/05/2021', '14:47:02', '000001892542', 1510000, '767c00b0029b444c3dc20a5128c81870.jpeg', 2, '2021-05-10 08:27:03', '49', 2, '48', '2021-05-20 12:40:55'),
(116, '164700776033ae6647b67', 'Tania Yuniarti', 'Bank Kalbar', '26/04/2021', '09:54:04', 'T06', 1510000, '28676ab13ad1c93f891391629bec1716.jpg', 2, '2021-04-29 12:06:54', '49', 1, '', ''),
(120, '19774012603209fc66ed7', 'salmia rahika', 'BANK KALBAR', '28/04/2021', '10:09:48', 'T11', 6510000, '44f8f61984c0766e61f9813148806cd2.jpg', 2, '2021-04-30 10:36:51', '49', 1, '', ''),
(118, '74565348604afbf29e86a', 'Marsiana Mitha Widiawaty', 'BANK PANIN', '29/04/2021', '11:34', 'MB104290026203TB', 1510000, 'b2998e76ca853736db926e6015af04b4.jpg', 2, '2021-04-29 13:58:58', '49', 1, '', ''),
(122, '67409883605c1d0d935e6', 'Angga Ponsel (Agen BRI Link)', 'BRI Link', '30/04/2021', '13:31:26', '101731769422', 6510000, 'c8d6a3d2c1b340df5446dfe19c8df580.jpeg', 2, '2021-04-30 13:54:47', '49', 1, '', ''),
(137, '11189035605413a602eb7', 'Yunika Sara', 'Bank Kalbar', '03/05/2021', '8:37:34', 'T07', 2000000, '71641f24440e1c96306e1b6ba1770dae.jpg', 2, '2021-05-03 12:37:48', '49', 1, '', ''),
(136, '863769356038a0f1dd428', 'Wiwit', 'Bank Kalbar', '03/05/2021', '08:35:53', 'T06', 2510000, '4eee00e6d777459a39c8ebbbd2595ab7.jpg', 2, '2021-05-03 12:37:58', '49', 1, '', ''),
(128, '66841721605afa9a9d49f', 'Susanto Yak Aban', 'BRI', '30/04/2021', '18:34:39', '000005349219', 1500000, '897c52687d1fd4974ec3a8dc2f7eed99.jpg', 2, '2021-05-03 08:01:29', '49', 1, '', ''),
(132, '10946681603dcbeae5dd7', 'Damiana Theresia Septi Sami', 'Kalbar', '3/5/2021', '08:31', 'T011', 1510000, '8c043defe2125bdda58d7f9c2af1ac87.jpeg', 2, '2021-05-03 12:17:50', '49', 1, '', ''),
(134, '178569096038a02193e55', 'Kesten della tri utami', 'Bank Kalbar', '03/05/2021', '8:39:16', 'T08', 2700000, '95c78464d6fc7f9a7667b389a76e1b5d.jpg', 2, '2021-05-03 12:38:07', '49', 1, '', ''),
(131, '17108061605a228ba45cc', 'Susanto Yak Aban', 'BRI', '2/05/2021', '14:41', '000005567055', 1510000, '64ea6508692fbaab8b49b92f196dc5b7.jpeg', 2, '2021-05-03 08:16:04', '49', 1, '', ''),
(141, '13653437605c920cf24ac', 'ERUAN CHANDRA', 'BRI', '07/05/2021', '14:47:02', '000001892542', 1510000, '1d6d94d819cb6c6695c14f9fb0ad6a52.jpeg', 3, '2021-06-10 12:21:24', '49', 1, '', ''),
(144, '40034969605977201488c', 'Tomo', 'Bank Kalbar', '02/06/2021', '9 : 47 : 07', 'TL05/09', 1510000, 'd7eac1c4a4e75e003179f1ef48f9b25f.jpeg', 2, '2021-06-02 11:04:02', '49', 1, '', ''),
(142, '645154796034a7419f06e', 'Nopita  sari', 'BANK KALBAR', '28/42021', '8:00', '4010006517', 3000000, 'b70e21e2ef82144987ae39c302ae5dea.jpg', 2, '2021-05-10 09:03:26', '49', 1, '', ''),
(143, '22657617605dabaa5628d', 'MARGARETHA ANGELA', 'BRI', '11/05/2021', '11:35:05', '000002457401', 60000000, 'e65671e1104f91cf993936ea091b1ed1.jpg', 3, '2021-06-08 16:46:13', '49', 1, '', ''),
(145, '40034969605977201488c', 'Tomo', 'Bank Kalbar', '02-06-2021', '09 : 47 : 07', 'TL05/09', 1510000, 'de3697d849c4f3843680ecc6c095598d.jpeg', 3, '2021-06-08 16:45:32', '49', 1, '', ''),
(147, '22657617605dabaa5628d', 'Natalai', 'BRI', '11/05/2021', '11:20:28', '000002457401', 600000, 'ecf47ea044ebb624c6d09b434a231d05.jpg', 2, '2021-06-10 12:19:16', '49', 1, '', ''),
(149, '793172946022740b5efac', 'Maria Therisia KowaiSka', 'Bank Kalbar', '02/06/2021', '13:24:50', 'T 36', 2500000, '59da090544c3715bcf779ce9f8d868dd.jpeg', 2, '2021-06-02 15:32:35', '49', 1, '', ''),
(153, '1667425360938b387b13b', 'Fani Setiana', 'BANK KALBAR', '09/06/2021', '08:40:00', 'T 011', 6760000, '47810c5a6be71ba330be62cb623f60ea.jpg', 2, '2021-06-09 09:30:30', '49', 1, '', ''),
(154, '2076474460854cfc61bb9', 'Marselina', 'Bank Kalbar', '09/06/2021', '09:01:59', '534250901570', 6760000, '51c84e7fcc5822a6d3cce70526a73ff5.jpg', 2, '2021-06-09 09:35:05', '49', 1, '', ''),
(155, '7096122660557f49b34d1', 'Metah Nurjanah', 'Bank BRI', '08/06/2021', '17:16:10', '175746', 2000000, 'a04d00bb001d1dba5e95b1583adc55be.jpg', 3, '2021-06-11 10:37:56', '49', 1, '', ''),
(156, '16911232602dd3892870b', 'Riska indriani', 'Bank Kalbar', '09/06/2021', '09:38:51', '046', 6760000, '6c86f02a8ae6079f27b0a01bf24c1f92.jpg', 2, '2021-06-10 12:17:23', '49', 1, '', ''),
(171, '7096122660557f49b34d1', 'Metah Nurjanah', 'Bank BRI', '08/06/2021', '17:16:10', '175746', 2000000, '6c97d731785df00052288cdf634f5b49.jpg', 2, '2021-06-11 10:37:10', '49', 1, '', ''),
(160, '1691433960a5f0fd38192', 'Rufini', 'KALBAR', '10/06/2021', '10:08:25', 'Rufini T 16', 6760000, 'bd46bf51f3db23bee77fb2f35d8edfd6.jpg', 2, '2021-06-10 11:33:12', '49', 1, '', ''),
(168, '1130797060a1cead5df4e', 'Astrid fatika', 'kalbar', '10/06/2021', '10:30', '0000', 6760000, 'fdd7b3e67a315c3be3aa72ee05bb51b1.jpg', 2, '2021-06-10 12:12:35', '49', 1, '', ''),
(173, '477711256071381c9e38e', 'M.W.RAZZAQ.EFFENDI', 'BANK KALBAR', '10/06/2021', '11:45', 'T01 14', 6760000, 'da576ca7c8ed5f0f9da2a99102a0e7cf.jpg', 2, '2021-06-11 11:46:44', '49', 1, '', ''),
(163, '9146679460867a3a4c672', 'Leonardus Rangga', 'Bank Kalbar', '10/06/2021', '09:57:24', '002', 1510000, '3836cc8509d8021d24e9723cceaf1368.jpg', 2, '2021-06-10 11:29:04', '49', 1, '', ''),
(179, '3097671360af30a23aa7f', 'Nova Rosadika', 'Bank Kalbar', '09/06/2021', '09:31:39', 'T18', 3760000, 'c4e11365ec9446bf1fa197d34cb6c3e5.jpeg', 2, '2021-06-11 11:44:59', '49', 1, '', ''),
(169, '461284956075059e9dff2', 'Yupita Mariani olang', 'Bank Kalbar', '10-06-2021', '11:17:56', 'T 049', 6760000, 'f742a3b60a064c2f47151bbfdc26d9e0.jpg', 2, '2021-06-10 12:13:58', '49', 1, '', ''),
(174, '141567986097b8f55e8f2', 'Muhammad Fikri Isnaini', 'Kalbar', '10/06/2021', '12:46', '000000478357', 6760000, '769278d53f20252bf7ca5909ce2e1c18.jpg', 2, '2021-06-14 10:21:58', '49', 1, '', ''),
(175, '10152412606fd94161f00', 'Alfi Rohmatim Mufarida', 'Bank\'Kalbar', '11/06/2021', '10:22:31', '1.28', 6760000, '7b254a716c9ceb218b58bb66ab298f2b.jpg', 2, '2021-06-11 11:31:14', '49', 1, '', ''),
(176, '754374626080c8c6aac74', 'ESTER NOVIA', 'BANK KALBAR', '11/06/2021', '10:28:23', '1.29', 6760000, 'e9868be5613afe5c931668f13688bab0.jpg', 2, '2021-06-11 11:30:12', '49', 1, '', ''),
(177, '101339806077b28de6901', 'ANGELA PUTRI', 'BANK KALBAR', '11/06/2021', '10:16:48', '1.27', 6760000, '3a7ff752d90286bb7a2d4bd807c38a4a.jpg', 2, '2021-06-11 11:32:10', '49', 1, '', ''),
(187, '20557545607bf6c53bf34', 'Amanda Novitasari', 'BANK KALBAR', '11/06/2021', '13:44:11', 'T 39', 6760000, '34787c57db43d7ebc2f412b3a9b4ee06.jpg', 2, '2021-06-14 09:41:22', '49', 1, '', ''),
(182, '6948617460330bba88a11', 'Yulia noveria', 'Bank kalbar', '11 Juni 2021', '9:00:41', 'T 18', 2500000, '77d315dbbe5d8ca934ec83527f970f21.jpg', 2, '2021-06-14 09:51:18', '49', 1, '', ''),
(183, '33741049608117b1df294', 'SARBINI', 'BRILINK', '11/06/2021', '12:55:31', '000006240885', 5000000, 'd79a1fc25e592367b911fe3485c1b17a.jpg', 2, '2021-06-11 13:41:39', '49', 1, '', ''),
(186, '33741049608117b1df294', 'SARBINI', 'BRILINK', '11/06/2021', '12:55:31', '000006240885', 1760000, '4d53cc591a6ab2dd771c5d317b1ca4da.jpeg', 2, '2021-06-14 10:30:37', '49', 1, '', ''),
(185, '33741049608117b1df294', 'SARBINI', 'BRILINK', '11/06/2021', '12:56:16', '000006246078', 5000000, 'ca617ab1193759212f3eed360c43358f.jpg', 3, '2021-06-14 10:31:29', '49', 1, '', ''),
(206, '170689316077fb4dc9dc2', 'SEVI RODANA', 'KALBAR', '14/06/2021', '11:28:05', 'TI01.42', 6760000, 'd354bcef33d2a2a4c21df1cc7f303d03.jpeg', 2, '2021-06-15 08:40:36', '49', 1, '', ''),
(189, '1323500660969572616ab', 'Meinar sari lubis', 'BNI', '11-06-2021', '18:48:56', '20210611184848339321', 3000000, '695f06aa4d3a7e5496dbc5fba4ac67bb.jpg', 2, '2021-06-14 09:29:32', '49', 1, '', ''),
(207, '9808245160753de26f9c9', 'Juli Astri', 'Bank Kalbar', '13/06/2021', '11:42:28', '423407391605', 6760000, '528a52c8816e577900359f7dd0c8deb6.jpg', 2, '2021-06-15 09:25:43', '49', 1, '', ''),
(192, '1982846960861d156132c', 'Noflin Christian', 'BANK BRI', '12/06/2021', '10;07;51', '000004248886', 5000000, '0c0548b1b6ed97ca56ba2effcf5fe8bb.jpg', 2, '2021-06-14 09:37:07', '49', 1, '', ''),
(193, '1982846960861d156132c', 'Noflin Christian', 'BANK BRI', '12/06/2021', '10;09;10', '000004250643', 1760000, '66ea6ddd40c29a0159a672baf22eec4b.jpg', 2, '2021-06-14 09:38:37', '49', 1, '', ''),
(194, '65162819609e0acea4275', 'Fitri Rupita Sari', 'Bank Kalbar', '12/06/2021', '19/22/21', '002419', 6760000, '367b792fd02fa81850f0c19f82978678.jpg', 2, '2021-06-14 09:20:26', '49', 1, '', ''),
(205, '1675077960700433d51f5', 'Herwin', 'Livin Mandiri', '14/06/2021', '09:41:55', '202106141037428828', 6760000, '5e620577e5bc147f823ab4397de5f6c2.jpeg', 2, '2021-06-14 15:43:05', '49', 1, '', ''),
(197, '18071315608b609e0e4ad', 'Ernia Ira', 'BRI', '14/06/21', '08:20:36', '1421', 4760000, 'a250adaf77a811edbda3925761d427b5.jpg', 2, '2021-06-14 09:34:22', '49', 1, '', ''),
(199, '119106066090f51c1808e', 'Romanius Wirawan', 'BRI Link', '12/06/2021', '13:17:12', '121317120003081', 6760000, '3c23408b1095f541f1335eeb8670fe0e.jpeg', 2, '2021-06-14 09:10:24', '49', 1, '', ''),
(200, '14844616605bffcdbee65', 'Dian Kurnia Dewi', 'Bank Kalbar', '14/06/2021', '08:24:34', '436690824320', 6760000, 'feb679b3a606cf3b7db1d2e04b5eba2d.jpg', 2, '2021-06-14 10:06:32', '49', 1, '', ''),
(201, '199113006021e46019aeb', 'Cici Anggrena Wati', 'BANK KALBAR', '14/06/2021', '09:47:33', 'T 16', 6760000, '76aec19d7a380d00346e6b997b00ce89.jpg', 2, '2021-06-14 11:23:28', '49', 1, '', ''),
(202, '1953600760820f6531d0f', 'Tety Trivelia', 'Bank Kalbar', '14/06/2021', '11:58:12', '1.29', 6760000, '40713f448130851fa2917489a0f0ba9f.jpeg', 2, '2021-06-14 14:59:59', '49', 1, '', ''),
(203, '113468646080f75aa38cd', 'MULYADI S.SOS', 'BANK BRI', '14/06/21', '10:29:24', '426', 6760000, 'e1bbcd16d478897b36d3dff077386e0a.jpeg', 2, '2021-06-14 15:03:46', '49', 1, '', ''),
(208, '1331235660a791b312ea3', 'STEPANUS ARDI REDIYANTO', 'Bank mandiri', '15/06/2021', '08:44:13', '202106151591870679', 6760000, '1065bfa460c82b264bd26716c6993d4d.jpg', 2, '2021-06-15 09:20:18', '49', 1, '', ''),
(210, '258036836090ab88373c9', 'Verdinandus Jun Belo', 'BANK KALBAR', '14/06/2021', '10:49:46', 'T 60TL02/050', 6760000, 'd449327d957db5d7d183229ce766f963.jpg', 2, '2021-06-15 09:32:06', '49', 1, '', ''),
(215, '779890186080e9365be71', 'Saharman', 'Bank kalbar', '15/06/2021', '9:50:1', 'T022', 6760000, 'fddcc7edd0bc773d3bae30682e4d434a.jpeg', 2, '2021-06-15 11:32:51', '49', 1, '', ''),
(212, '19138037608d73dff09b3', 'IBU WARTIAH', 'BANK BNI', '15/06/2021', '08:54', '000000010979', 4000000, '0a3f831bd5b55b838cc696d424017916.jpeg', 2, '2021-06-15 09:36:00', '49', 1, '', ''),
(216, '18273831609e283b254c0', 'YUNIAS', 'KALBAR', '15 JUNI 2021', '11:19', 'T 28', 1510000, 'afd8f74be676e71ce595e1ed71cb1541.jpeg', 2, '2021-06-15 12:11:19', '49', 1, '', ''),
(217, '18273831609e283b254c0', 'YUNIAS', 'KALBAR', '15 JUNI 2021', '11:19', 'T 28', 1510000, '5aac9c5156c84ba31e7e395346b2f7a9.jpeg', 3, '2021-06-15 12:08:53', '49', 1, '', ''),
(218, '527078986098b103bf2d8', 'A. Suherman A', 'BANK KALBAR', '15/06/2021', '10:48:48', 'T 1.5', 6760000, '7fcb8facb83d4ecebc13cf38b5001d19.jpg', 2, '2021-06-15 12:20:42', '49', 1, '', ''),
(219, '47010094607f84cd578ed', 'MUHAMAD DAWI', 'KALBAR', '15/06/2021', '09.14.12', 'T 17', 6760000, 'f5863eb6fe2513f8a3a2a5fb084d12bd.jpg', 2, '2021-06-15 12:17:40', '49', 1, '', ''),
(233, '17360099608756960e853', 'Rupina Milu', 'BANK KALBAR', '14/06/2021', '09:02:36', '095TI01-17', 6760000, 'ee06ff9c14bf3c149503770884d7d7dd.jpeg', 2, '2021-06-16 07:57:55', '49', 1, '', ''),
(234, '2101055160a4ee4b2f006', 'SUMBER AGUS SISWANTO', 'BANK BRI', '15/06/2021', '12:04:09', '000004039117', 2760000, '5f55e44ef81584e3af66721a5267bb5e.jpeg', 2, '2021-06-20 22:28:45', '49', 1, '', ''),
(236, '1578753560aaf9ae53e53', 'Sumber Agus siswanto', 'BRI', '15 juni 2021', '12:10:24', '000004086689', 6760000, '2ebf174ced345fb4b03ccbe4407643d6.jpeg', 2, '2021-06-20 22:23:28', '49', 1, '', ''),
(231, '1305786360a11abb620fa', 'BUNGA', 'BANK KALBAR', '15/06/2021', '09:54:49', 'TTL22', 6760000, '85fd40710759f02ab24f763cfc9ff22c.jpeg', 2, '2021-06-15 12:23:57', '49', 1, '', ''),
(232, '1300078460a48ae429f7b', 'VICTORIA TRI JULIANI', 'BANK KALBAR', '15/06/2021', '10:39:02', 'TL01/13', 1510000, 'b70ab7a8b536c1660477eef6f72c0050.jpg', 2, '2021-06-15 12:29:55', '49', 1, '', ''),
(242, '1271137660920fb6e5f90', 'EVI LESTARI', 'Bank Kalbar', '15/06/2021', '12:31:20', '24', 6760000, '05b37fec7e34be1216a8bd858bf86191.jpg', 2, '2021-06-16 07:36:12', '49', 1, '', ''),
(230, '1033277460a26fb572ca4', 'BPK HADI SUGITO', 'NGSABANK BNI', '14/06/2021', '16:10', '1288', 6760000, 'ada9ba39e6067190dcaf78f2bd47c45e.jpeg', 2, '2021-06-15 12:53:10', '49', 1, '', ''),
(237, '2101055160a4ee4b2f006', 'SUMBER AGUS SISWANTO', 'BRI', '15/06/2021', '12:00:47', '000004013604', 4000000, '27c7303b5cc76c1597122afd9d7980d4.jpeg', 2, '2021-06-20 22:29:24', '49', 1, '', ''),
(241, '2139738060a3ad9253140', 'Risky septyan kuswara', 'BCA', '15/06/2021', '14:39:43', '435284', 6760000, 'cf38b846231dd11de504dd5c1cc4b676.jpeg', 2, '2021-06-16 07:47:59', '49', 1, '', ''),
(240, '19865840605936e0e843f', 'Sulastri', 'KALBAR', '15/06/2021', '11:30:38', '17', 6760000, 'b6b3afe9e2e9ef6924ff074de7c616c7.jpeg', 2, '2021-06-15 12:48:59', '49', 1, '', ''),
(245, '19338229608e2d983d7b3', 'Victoria Ringkai', 'BANK BRI', '15/06/2021', '11:53:25', '000000955176', 3760000, '3bba689b4e97b05c95794b0a7626e4e5.jpg', 2, '2021-06-16 07:41:00', '49', 1, '', ''),
(246, '19338229608e2d983d7b3', 'Victoria Ringkai', 'BANK BRI', '15/06/2021', '11:54:27', '000000963511', 3000000, '195dc6d2635ed08d52bfb1a6f0231ad9.jpg', 2, '2021-06-16 07:41:31', '49', 1, '', ''),
(251, '7522347860a482a7894e1', 'Marena Eva', 'Bank kalbar', '16-06-2021', '11:22:50', '039', 6760000, '75f6627c2919f8e159772852bd094101.jpeg', 2, '2021-06-16 16:21:03', '49', 1, '', ''),
(249, '63733629609b41b700a2c', 'Yosipa kristiana', 'Bank Kalbar', '15/06/2021', '90.33.02', 'T 11', 4000000, 'f22b32fc865a073c175724f5fcd6c915.jpeg', 2, '2021-06-16 11:11:40', '49', 1, '', ''),
(252, '8135284660b44737e82cb', 'Hermanso', 'BRI', '16/06/2021', '12:53', '172808', 2000000, 'f30e4c73c04ea2427bcfe0d191b6c930.jpg', 2, '2021-06-16 13:49:15', '49', 1, '', ''),
(253, '9146679460867a3a4c672', 'Leonardus Rangga', 'Bank Kalbar', '14/06/2021', '10.00', '002', 2000000, 'fffd1b6319f6dd211cf75efc67f428b1.jpg', 2, '2021-06-16 16:25:19', '49', 1, '', ''),
(254, '9146679460867a3a4c672', 'Leonardus Rangga', 'Bank Kalbar', '14/06/2021', '10.00', '002', 3250000, '06d42062b23949f71aee543dcacaffdf.jpg', 2, '2021-06-16 16:26:31', '49', 1, '', ''),
(255, '338826466090d750269da', 'Cecelia yesi kartika', 'Bank kalbar', '14/06/2021', '09:30:45', '02 dan 54', 3510000, '4f8e0f1c348330f39bda17907f4d1bb0.jpg', 2, '2021-06-16 15:24:04', '49', 1, '', ''),
(305, '497612166059d479eb0e2', 'Dewi Pratiwi', 'Bank Kalbar', '16/06/2021', '14:02:28', 'T51', 6500000, 'b9b4035bbbcad32e95899eb27b553b46.jpg', 2, '2021-06-18 16:46:38', '49', 1, '', ''),
(257, '1878802260a7438616903', 'YUNI FITRI HARTATI', 'BANK PEMBANGUNAN DAERAH KALBAR', '16/06/2021', '10:48:53', 'T TL01.35', 6760000, '70ffcf9fc931daf3295fa9b1af9bab3b.jpeg', 2, '2021-06-17 08:15:43', '49', 1, '', ''),
(258, '2521958160a5d753eac02', 'Dara suryawara', 'BANK KALBAR', '16/06/2021', '10:55:24', 'T Tl 01.36', 4000000, '40259ccb6776bd0ab4a949ac471df76b.jpeg', 2, '2021-06-17 08:10:11', '49', 1, '', ''),
(259, '19596251608389a0dcf16', 'Deby Christin Adventa', 'BRI', '17/06/2021', '10:53:24', '000005998734', 5000000, 'd8becc7be2eaf8eb1a20ba575eab8eab.jpg', 2, '2021-06-18 15:44:21', '49', 1, '', ''),
(260, '19596251608389a0dcf16', 'Deby Christin Adventa', 'BRI', '17/06/2021', '10:54:27', '000005008904', 1760000, '078a1b0424fc975a617783852b458fe4.jpg', 2, '2021-06-18 15:47:07', '49', 1, '', ''),
(261, '812936196059514503358', 'JARNIATI', 'BRI', '17/06/2021', '10:50:29', '000006969909', 5000000, 'c9d743b2d0357c1fda3b4c3827e9176b.jpg', 2, '2021-06-20 22:06:27', '49', 1, '', ''),
(262, '36050998605e906756454', 'Sarbini', 'BRI', '17/06/2021', '10:47:30', '171047306940721', 5000000, '4bbec63ab4605474cf651d08fe7d39cd.jpeg', 2, '2021-06-18 16:37:34', '49', 1, '', ''),
(264, '36050998605e906756454', 'Sarbini', 'BRI', '17/06/2021', '10:48:14', '171048146947792', 1760000, 'f512891badc17282ff2cadb0897cf653.jpeg', 2, '2021-06-18 16:35:42', '49', 1, '', ''),
(265, '1679955360a0881ad60c0', 'BPK SUTIYO', 'A BABANK BNI', '17/06/2021', '11:29', '000000000005', 6760000, '96b2133ddb4e8350e73ec50e868f20e7.jpg', 2, '2021-06-20 22:16:00', '49', 1, '', ''),
(267, '5949927960593d959211d', 'Floragrasia Rezzy', 'Bank Kalbar', '17/06/2021', '11:15:58', '060TL01/012', 6760000, '0d4e920d8c67bc8ff4df5e6d9765a3b5.jpg', 2, '2021-06-20 22:08:34', '49', 1, '', ''),
(268, '17245909607cdc287edde', 'EMI JUMHARNI', 'Bank KALBAR', '17/06/2021', '11:31:04', '20', 6760000, '3345cb835f652697db553d11e326db80.jpeg', 2, '2021-06-18 16:02:49', '49', 1, '', ''),
(269, '65785499607ce0347d736', 'Dela Puspita Sari', 'Bank Kalbar', '17/06/2021', '11.36.40', '22', 6760000, '20a67bfaf163115edc5f12a1b6414cb5.jpg', 2, '2021-06-18 16:00:11', '49', 1, '', ''),
(270, '15269584607d2d44ed5bd', 'Alexi novaldi', 'Bank kalbar', '17/06/2021', '17:1:30', 'T1. 9', 3510000, '1f1cdf6ee0fc84dd393bcab96931633d.jpeg', 2, '2021-06-18 15:52:57', '49', 1, '', ''),
(271, '123268466090bf90e90ac', 'Agustin Suriani', 'Bank kalbar', '17/06/2021', '11:34:49', '21', 1510000, '170bfdc27ed5192a910c0fcf3df74799.jpg', 2, '2021-06-18 15:18:19', '49', 1, '', ''),
(272, '2004630060627c2bde7ed', 'Teresia ramina', 'Bank kalbar', '17/06/2021', '14:39:33', '061', 6760000, 'aaeb29c888c08ac221a7d047d2fba0b5.jpeg', 2, '2021-06-18 16:24:09', '49', 1, '', ''),
(310, '982796126076a3b991c8b', 'Lusia Rupina', 'Bank kalbar', '18/06/2021', '10: 10: 29', 'T20', 2000000, '02abe5d2fb52619d04371ca7c5ad5ad6.jpg', 2, '2021-06-18 16:41:59', '49', 1, '', ''),
(274, '19349386608bf07256289', 'Syah Reza Fahlevi', 'Bank kalbar', '17/06/2021', '09:42:28', 'T TL01.07', 6760000, '8714c3deb3bbfa55d3307d182ef31e38.jpg', 2, '2021-06-18 15:29:46', '49', 1, '', ''),
(279, '2124312360765be6c551b', 'Natalia cici', 'Kantor pos  Nanga kantuk', '18/06/2021', '09:32', 'ARJ210618000522', 6760000, 'eff5a841f96f7100955839670d505050.jpg', 2, '2021-06-18 16:11:21', '49', 1, '', ''),
(281, '1152178360863411d5888', 'Septiana Sari', 'Bank Kalbar', '18/06/2021', '09:22:36', '09', 6760000, '057c29982d7fd49e6ebcd6675e66c7db.jpeg', 2, '2021-06-18 15:40:28', '49', 1, '', ''),
(282, '254719896090bfebb6638', 'Susan Eri', 'Bank Kalbar', '18/06/2021', '09:37:56', '13', 1510000, 'ef20d0b002e81e2dfa1223473ca36d87.jpg', 2, '2021-06-18 15:14:35', '49', 1, '', ''),
(284, '57115136608b5cbd3d2bf', 'ALBERTUS NOPERIANUS SENOBOL', 'BANK KALBAR', '18/6/2021', '10:16:22', 'TL01.15', 6760000, '5665e8703859711c3e11fdbd85bac459.jpg', 2, '2021-06-18 15:34:36', '49', 1, '', ''),
(286, '764622376090b12491aeb', 'Klanus oktavia', 'Bank kalbar', '18/06/2021', '9:51:54', 'T 14', 1510000, 'bcc2607de33afe97ff51c9034960a128.jpg', 2, '2021-06-18 15:21:45', '49', 1, '', ''),
(287, '12980625609a4c6f2a80a', 'Agustina Wati', 'BPD KalBar cabang Nanga Pinoh', '17/06/2021', '11:31:43', '123', 1510000, 'dd46c17598eb1672a7d55ea3e7cc2510.jpg', 2, '2021-06-18 15:01:17', '49', 1, '', ''),
(289, '13665268607a766ee1a98', 'Zukrinepi', 'BRI', '18/06/2021', '11:15:32', '423633486681', 6760000, '7643c200d616d4f7363c8129b235beeb.jpg', 2, '2021-06-18 16:07:16', '49', 1, '', ''),
(290, '207322636073adf7989fb', 'DELLA', 'BRI', '16/6/2021', '11:47:07', '123456', 6760000, '2bc50fc8d3a9e46d3baaaf0487560aa2.jpg', 2, '2021-06-18 16:18:34', '49', 1, '', ''),
(312, '1849813260ab2896743e1', 'Tresia', 'Bank kalbar', '17/06/2021', '2:00', 'T 19', 6760000, 'b877fc51a1729853e9e8710f355c40b9.jpg', 2, '2021-06-20 20:49:08', '49', 1, '', ''),
(293, '6333882560910856ef26f', 'Selsilia Elinur Masari', 'Bank kalbar', '14/06/2021', '09:31:45', '49', 3510000, 'c927fc14dfc297f1d2a2232503c12eed.jpg', 2, '2021-06-18 15:12:19', '49', 1, '', ''),
(294, '1028842660a21084ef53e', 'DEVY YANTI', 'BANK KALBAR', '18/06/2021', '11:10:52', '002184', 6760000, '3d0eabb126ba54376c938b38522a0ef8.jpg', 2, '2021-06-20 21:03:21', '49', 1, '', ''),
(423, '5782031760b07139662a1', 'Olano pelasari', 'Bank Kalbar', '21/06/2021', '13:56:20', '051', 6760000, '18e68df3271e678e28dfb7174a31fbe3.jpg', 2, '2021-06-21 14:33:25', '49', 1, '', ''),
(297, '558064336094d26cb9173', 'Alldina putri ', 'Bank Kalbar', '18-6-2021', '09:00:30', 'TL01.12', 6760000, '5aaf875d998d5b11cb998da754fa4b5c.jpg', 2, '2021-06-18 15:05:03', '49', 1, '', ''),
(307, '22387789608122f8754b3', 'Simson', 'Bank kalbar', '17/06/2020', '08:42:21', '123', 6760000, 'b02d97c9f0f1389b9ba521a11a95fdd9.jpg', 2, '2021-06-18 15:27:10', '49', 1, '', ''),
(300, '14723549605968c28233f', 'Yesa Amanda Putri', 'Bank KALBAR', '18/06/2021', '13:33:27', 'T101 43', 6760000, 'ca6f8a5fd0ba35acc28bd96283648389.jpg', 2, '2021-06-20 22:04:39', '49', 1, '', ''),
(301, '140730666023fdb2ea244', 'Juil Mambang', 'Kantor Pos Nanga Kantuk 78768', '18/06/2021', '09:40:13', '7876800', 6760000, '84fcb64da5a39ab48f68760e89a1b758.jpeg', 2, '2021-06-20 22:39:33', '49', 1, '', ''),
(382, '24599342608660ebec2e7', 'Merti Ilona Iho', 'Bank Kalbar', '21/06/2021', '07:56:23', 'T   TL02/04', 6760000, 'c886714a5b0c2ced44fc089f4ab215a7.jpg', 2, '2021-06-21 13:02:41', '49', 1, '', ''),
(380, '106776136094a1db0c487', 'Randu ova Trianto', 'Bank kalbar', '17-06-2021', '10:04:23', 'T8', 3000000, '938cc8e4f2423e0844491c1595da622a.jpg', 2, '2021-06-21 07:58:58', '49', 1, '', ''),
(381, '19843003607694c68a977', 'Relagius agung', 'BNI', '21/06/2021', '08:19', '000000011809', 1510000, '23228330e40a0a61b4c6a938c1161334.jpeg', 2, '2021-06-21 13:38:28', '49', 1, '', ''),
(306, '1479695360b0b6a13a303', 'Caroline Cristie', 'Bank Kalbar', '18/06/2021', '10:12:37', 'T 21', 1510000, '06a246d8756eb3ddd858b2c35180dc85.jpg', 2, '2021-06-18 16:43:58', '49', 1, '', ''),
(309, '17933362607d1d3c132d7', 'Irvan arianto habaraja', 'Bank kalbar', '18/06/2021', '10:38:21', 'TL065/12', 6760000, '6844770ea14140dfcd87087510241dd7.JPG', 2, '2021-06-18 15:55:24', '49', 1, '', ''),
(315, '1353145360a61a340270b', 'Clemensia Winti Asta', 'Bank Kalbar capem lanjak', '18/06/2021', '10:05:56', '064TL01/011', 6760000, '5a70ff795d343fe1ff69f15478a0c9f3.jpg', 2, '2021-06-20 20:57:49', '49', 1, '', ''),
(316, '50355427608e34de34171', 'DANIEL ARIE KRISTIAN', 'Bank Kalbar', '19/06/2021', '88:38:16', '190838162889713', 5000000, 'f879955c9ced66872bea02cb41dda371.jpg', 2, '2021-06-20 21:32:45', '49', 1, '', ''),
(317, '50355427608e34de34171', 'DANIEL ARIE KRISTIAN', 'Bank Kalbar', '19/06/2021', '08:39:09', '190839092895487', 1760000, '715319c26c6d9dca2a70fb90092f319a.jpg', 2, '2021-06-20 21:32:54', '49', 1, '', ''),
(318, '1771272360920a4acb34b', 'Erva', 'Bank BRI', '19/06/2021', '08:27:42', '244440827400', 6760000, 'aba3eb3c008499530d96dfd2b973c8d9.jpg', 2, '2021-06-20 21:21:42', '49', 1, '', ''),
(320, '6581557660936996e78db', 'Maksima Valena', 'Bank BRI', '18/06/2021', '13:12:26', '181323484698534', 3000000, '39c51f8d94f9c124e63449077e67dcf9.jpg', 2, '2021-06-20 21:14:05', '49', 1, '', ''),
(321, '6581557660936996e78db', 'Maksima Valena', 'Bank BRI', '18/06/2021', '13:13:22', '181324444707089', 3760000, '14045b9eda6cb1756f33f8fa4cf5a83c.jpg', 2, '2021-06-20 21:13:14', '49', 1, '', ''),
(322, '101538046069e7a66fe24', 'Monica Sentia Betris', 'BANK KALBAR', '19/06/2021', '10:41:30', '50', 6760000, '6c0723f2e5976118ec988068da3a9282.jpg', 2, '2021-06-20 21:58:51', '49', 1, '', ''),
(325, '107553006091437119e8c', 'FAIZ MAULA ADITYA SAPUTRA', 'KALBAR', '18/06/2021', '13:06:04', '35', 6760000, '67b123e2a67f84de65800f9cb49d9a65.jpg', 2, '2021-06-20 21:24:14', '49', 1, '', ''),
(385, '1556571160865bd6c75fa', 'Adriana', 'Bank Kalbar', '21/06/2021', '09:26:59', 'T  TL03/22', 6760000, '5828fa8e142b6f69670a40a3c3b181eb.jpg', 2, '2021-06-21 13:05:12', '49', 1, '', ''),
(386, '88846079607d3a9b69ff3', 'Catharina Fera Selestina', 'BRI', '21/06/21', '09:05:26', '2143', 3750000, 'e65e51f237d3cf9efbaf7ac67c5cdc1d.jpg', 2, '2021-06-21 13:28:17', '49', 1, '', ''),
(388, '1936863360a478c69b884', 'Yuli Sri Kendawati', 'BANK KALBAR', '16/06/2021', '14:20:30', '123', 3250000, '3d8178d54fe34f8f146d9ce8a85605a3.jpg', 2, '2021-06-21 12:08:50', '49', 1, '', ''),
(389, '8519969260aa4cc71b34e', 'TERTURIANUS BENU', 'BRI', '21/06/2021', '08:50:11', '000000409506', 3760000, '28cc4c9ce04d621611f992d6516c179a.jpg', 2, '2021-06-21 12:01:11', '49', 1, '', ''),
(390, '8519969260aa4cc71b34e', 'TERTURIANUS BENU', 'BRI', '21/06/2021', '08:51:19', '000000421254', 3000000, 'db9227a237eb542c08ce1463ca0e2bd0.jpg', 2, '2021-06-21 11:58:43', '49', 1, '', ''),
(412, '8971528860934fa31ba43', 'Stefani anggelina putri', 'BNI', '19/6/2021', '09:34', '000000000002', 3500000, 'eba4a410aad8ad90a72c638634649a63.jpg', 2, '2021-06-21 12:57:53', '49', 1, '', ''),
(411, '1091587460810c81f1c1b', 'Margareta Nana', 'Bank Kalbar', '21/06/2021', '10:27:42', 'T 25', 4000000, 'fd94b76a2b6a177e86474fcaa7f1292d.jpg', 2, '2021-06-21 13:12:45', '49', 1, '', ''),
(393, '52862687607845985a851', 'EVA EVIANTI', 'BRI', '20/06/2021', '10:13:29', '000004367332', 1510000, '87402e7dd073523cc91961cf4edd5cf3.jpg', 2, '2021-06-21 13:33:32', '49', 1, '', ''),
(396, '43532051609e26e121a62', 'Alafh Deo Septerio', 'Bank Kalbar', '21/06/2021', '10:20:35', 'T 29', 1510000, 'd6d38b2bce3f5387c3bee9d3c76ae3ad.jpg', 2, '2021-06-21 12:26:22', '49', 1, '', ''),
(397, '19135751608a7a6131a2e', 'NOVIA TRIFENA', 'KALBAR', '21/06/2021', '10:23:22', 'T 30', 1510000, '761c005b8f49621255a8267ddf00f742.jpg', 2, '2021-06-21 13:00:02', '49', 1, '', ''),
(414, '1990976060a7c8f725e19', 'Istipanus Rintit', 'Bank kalbar', '19 Juni 2021', '12.00', 'T 25', 1510000, '0221f06f9007cba2294a46384371a2ba.jpeg', 2, '2021-06-21 13:56:31', '49', 1, '', ''),
(419, '2128764660a7aef3f0453', 'Yupita', 'Bank maybank', '21/06/2021', '12:44:50', '0504658537', 3500000, '88fef554ba0c55a7d78aef3cfd11484b.jpg', 2, '2021-06-21 13:17:02', '49', 1, '', ''),
(394, '18273831609e283b254c0', 'YUNIAS', 'KALBAR', '15 JUNI 2021', '11:19', 'T 28', 1510, '3cc54b35f9fd42f352e5aa3580f6d582.jpeg', 3, '2021-06-21 12:20:42', '49', 1, '', ''),
(352, '12522372608cf13599a1a', 'Yupita Aseni', 'Kantor pos 78653', '19/06/2003', '09:30:47', '7865300-02/21/001668', 4760000, '65a173c248c0b22ce695ad80f8b955a3.jpg', 2, '2021-06-20 21:40:40', '49', 1, '', ''),
(354, '1294071160459463289cc', 'wartiah', 'BRI', '19 juni 2021', '10:55:21', '000003901223', 3300000, '5599d706110a3355df09c23f961483dc.jpg', 2, '2021-06-20 22:12:56', '49', 1, '', ''),
(355, '9307419560767448ea219', 'Andreas mj', 'BRI', '17/06/2021', '13:25:31', '000001223770', 1760000, 'dfbfb25f345f9f696639b114a47ec9cd.jpg', 2, '2021-06-20 21:52:35', '49', 1, '', ''),
(357, '599927666066b7d200650', 'Herni Mulia', 'Bank kalbar', '19/06/2021', '12:03:58', '000000364420', 1760000, 'c640fc495b5aee9002accee5322e67c8.jpg', 2, '2021-06-20 22:00:29', '49', 1, '', ''),
(358, '13324599608f97b51f92d', 'AKENTA YENTI', 'BPD KALBAR', '19/06/2021', '11:02:42', '003497', 6760000, '43e8c64eab6ee3d4d87caf6479e7d00a.jpg', 2, '2021-06-20 21:28:54', '49', 1, '', ''),
(360, '7377355460b046e67e2e7', 'Tri Aldian Zulmi', 'BRI', '19/06/2021', '12:23:08', '000003479976', 5000000, 'f345d5091491e4ac0b423273346d87a0.jpg', 2, '2021-06-20 20:45:01', '49', 1, '', ''),
(361, '7377355460b046e67e2e7', 'Tri Aldian Zulmi', 'BRI', '19/06/2021', '12:26:27', '000003479974', 1760000, '4350d846db7b4b99e3a71f7a29334692.jpg', 2, '2021-06-20 20:45:57', '49', 1, '', ''),
(362, '632732466090cabb79557', 'IMA', 'BANK MANDIRI', '19/06/2021', '06:53:53', '117033595854', 5000000, 'c7da4793be7cb9c3d6a9e1aec4092566.jpg', 2, '2021-06-20 21:27:12', '49', 1, '', ''),
(363, '167579936092771eee04d', 'Carolina liliana Maria reny', 'BRI', '19/06/2021', '13:13:53', '1991', 3250000, '21d7e414af3a1af89d19a0665da424d5.jpeg', 2, '2021-06-20 21:18:40', '49', 1, '', ''),
(364, '211848716090cbb5ce6eb', 'Yumba larasati', 'BANK MANDIRI', '19/06/2021', '07:06:38', '117033604741', 4000000, 'd098ef4e504c017ec74f56b4fa554ad3.jpg', 2, '2021-06-20 21:25:41', '49', 1, '', ''),
(365, '61770342608e2824d5288', 'Natalia Desy', 'BRI', '19/06/2021', '14:09:55', '000002120553', 5000000, '56ae42a32546b9dd3a44ed6ab0118d77.jpg', 2, '2021-06-20 21:37:06', '49', 1, '', ''),
(366, '61770342608e2824d5288', 'Natalia Desy', 'BRI', '19/06/2021', '14:10:47', '000002125901', 1760000, 'f3ffa4a152cd3f854cf15401710c9f60.jpg', 2, '2021-06-20 21:37:16', '49', 1, '', ''),
(367, '66212509607539b7d3468', 'Julia citra', 'Bank kalbar', '18/06/2021', '18:50:10', '005292', 6760000, '589fef7462075cfc6c30d58beabbcc69.jpg', 2, '2021-06-20 21:54:32', '49', 1, '', ''),
(413, '8914854660935b51d4c23', 'Fransiska Marselina', 'BRI', '21/06/2021', '11:22', '000006033090', 1510000, 'bd7c7739266b8e944c0211edff13dad3.jpeg', 2, '2021-06-21 12:53:20', '49', 1, '', ''),
(369, '6807827960a5b04593a6d', 'Bernadeta mirna efendi', 'Bank kalbar', '19/06/2021', '15:47', 'T 02', 1510000, 'fa7607f18827a2b88d41a0715e2635b8.jpg', 2, '2021-06-20 20:59:36', '49', 1, '', ''),
(370, '32402404606540d9161a6', 'ZULKARNAIN', 'Mandiri', '19/06/2021', '18:55:16', '191658', 6760000, '29277aa9744a4ce63649c07002bfe5fb.jpeg', 2, '2021-06-20 22:35:45', '49', 1, '', ''),
(371, '1278416560a871ca00e78', 'Ferima Ranti', 'BRI', '18/06/2021', '14:59:18', '000008505098', 6670000, 'f8abc82efcad94764dd47555a80cbdce.jpg', 2, '2021-06-20 20:51:26', '49', 1, '', ''),
(372, '21366245607a6f9c003cb', 'ZUKRINEPI', 'BRI', '18/06/2021', '11:12:33', '423633335741', 6760000, '079fa1fd88e9678887fd944c73675be0.jpg', 2, '2021-06-20 21:47:39', '49', 1, '', ''),
(373, '1665755960a7d4a9e0de2', 'Maylia Pradista', 'BRI', '20/06/2021', '09:33:32', '000003095822', 3000000, 'a0bb6487cce080d8ed05969800398d3f.jpg', 2, '2021-06-20 20:54:39', '49', 1, '', ''),
(374, '1665755960a7d4a9e0de2', 'Maylia Pradista', 'BRI', '20/06/2021', '09:34:41', '000003102209', 3760000, '84c1fb1d60c5971a15acdb1411fbfeae.jpg', 2, '2021-06-20 20:56:22', '49', 1, '', ''),
(377, '16808136607064bcb2a90', 'Agnesia Mega', 'Bank Kalbar', '20/06/2021', '16:21:42', '002319', 1510000, 'f0b8f2e218f4be5c5e5e2f3001294d6d.jpg', 2, '2021-06-20 21:55:48', '49', 1, '', ''),
(420, '1837302960a7481d8743c', 'Yustina tenti', 'Kalbar', '21/06/2021', '11:51:08', '097TL01/74', 6760000, '371e0873421829e0cec6b9d1f5bf4d28.jpg', 2, '2021-06-21 13:30:03', '49', 1, '', ''),
(403, '81211124609d1992cabe9', 'Rosalia devi yanti', 'Bank kalbar', '21/06/2021', '10:20:09', '27', 6760000, '6fd8252d76b048dfa811e11c0a5a0864.jpeg', 2, '2021-06-21 12:50:05', '49', 1, '', ''),
(404, '1452228060a213b62003e', 'Eligia paulena', 'Bank kalbar', '21 Juni 2021', '10:35:00', 'T 062TL01/025', 6760000, '2f4ba3f418f5af2a6c2f176837c15c8e.jpg', 2, '2021-06-21 12:15:13', '49', 1, '', ''),
(427, '8882968260a1cafd266dd', 'Bonifasius Pantura', 'BANK KALBAR', '31/06/2021', '14:02:04', '070', 3510000, '6a3c30c7db3547ba51ff1d73747f3cd8.jpeg', 2, '2021-06-21 15:02:57', '49', 1, '', ''),
(406, '103063546059d8f3453e9', 'Lorda Maria', 'Bank Kalbar', '21/06/2022', '11-11-44', 'TL03.040', 700000, '60850d8700a96b6904708136be2220fe.jpg', 2, '2021-06-21 13:51:39', '49', 1, '', ''),
(408, '1998127160a347eeb11fc', 'LIDIA ERNI', 'BANK KALBAR', '16/06/2021', '09:25:45', '-', 3500000, '71575d8f59c1c09dc3c5e4f911eec0ec.jpg', 2, '2021-06-21 12:11:04', '49', 1, '', ''),
(415, '1743962560a3d67a239e0', 'Susanto yak aban', 'Bri', '21/06/2021', '06:06:30', '000005459197', 1510000, '53397f15ad7e53a3f1f91b44dc73f70f.jpg', 2, '2021-06-21 12:42:08', '49', 1, '', ''),
(416, '1897067160a4cad1b90d4', 'ANTONIUS HASAN', 'KALBAR', '21/06/2021', '12:16:26', 'TL03.041', 700000, 'a84a9a3cc7fa13df2b9429c0b55d163e.jpeg', 2, '2021-06-21 14:01:04', '49', 1, '', ''),
(417, '16866625608416c3e8247', 'Apriyani', 'Cu lantang tipo', '21/06/2021', '11:51:52', '1', 1510000, 'a51eee4d04677baf84c4bb10e2fcdc2e.jpeg', 2, '2021-06-21 13:08:27', '49', 1, '', ''),
(424, '1754151360aa55a549dfd', 'Bukit', 'Bank Kalbar', '19/6/2021', '08:35:59', '1989', 6760000, 'c66e186757c6f78712b8257572b9005f.jpeg', 2, '2021-06-21 14:19:00', '49', 1, '', ''),
(425, '2871360260961ed6a7f97', 'DESI', 'BRI', '21/06/2021', '12:37:02', '000008674046', 1510000, 'fbcaf07ca600fb7a080450c78a26f82f.jpeg', 2, '2021-06-21 14:36:59', '49', 1, '', ''),
(426, '20294961607c48ff94b6b', 'SUHADI', 'Mandiri', '21/06/2021', '12:50:53', '202106211106188459', 1510000, '43af8a7d1b4bf6e3e39ad3b449c91635.jpg', 2, '2021-06-21 14:51:05', '49', 1, '', ''),
(428, '46399649609a1bff0536e', 'HORNINIA', 'Bank KALBAR', '21 juni 2021', '14:02:55', 'TL 05/38', 1510000, 'd97a08c4e5d63e558b3fe16d484ab64c.jpg', 2, '2021-06-21 15:05:02', '49', 1, '', ''),
(431, '17245640609f27ef203b2', 'Tiara Ika Novera', 'Bank Kalbar', '21/6/2021', '10/07/2021', 'T20', 6760000, '40a340b683f4da739369b23cc430286e.jpeg', 2, '2021-06-21 15:23:52', '49', 1, '', ''),
(430, '5303628960855ced290fa', 'Suci Wulandari', 'Bank Kalbar', '21/6/2021', '10:03:42', 'T 19', 6760000, '873e1a61ec5bd34e23e83daf5f327121.jpeg', 2, '2021-06-21 15:20:01', '49', 1, '', ''),
(432, '1350106560af1a2478e56', 'Firmus allan kusuma', 'Bank Kalbar', '21/6/2021', '11:29:49', 'T52', 4000000, '860768ce3d9d4bd2e65922c658c49fe4.jpeg', 2, '2021-06-21 15:29:29', '49', 1, '', ''),
(433, '1263974260a5ce83143fe', 'Egi Cristian', 'Bank Kalbar', '21/6/2021', '13:22:31', 'T 47', 4000000, '749d61d9c80a2190061881d1adc7dc17.jpeg', 2, '2021-06-21 15:31:58', '49', 1, '', ''),
(434, '1423239760b6dc7216626', 'BAGAS PRATAMA', 'Bank Kalbar', '21/6/2021', '13:21:03', 'T 46', 6760000, '1335be7ef91198b0802d65865cbeb1f1.jpeg', 2, '2021-06-21 15:34:17', '49', 1, '', ''),
(435, '1786519060b4c1cc6de5e', 'ALBERTUS AGUSTINUS IRWANTO', 'Bank Kalbar', '21/6/2021', '13:32:56', 'T 53', 6760000, 'dc07935b16703885a080b1ee1255e02b.jpeg', 2, '2021-06-21 15:38:11', '49', 1, '', ''),
(436, '730630806099dc71f3e78', 'Dina octavia', 'Bank Kalbar', '21/6/2021', '13:27:28', 'T 51', 1000000, 'ec6b4e4d2198ae40c1d167dd3c13d503.jpeg', 2, '2021-06-21 15:41:32', '49', 1, '', ''),
(437, '1305946460adc9d794ed6', 'Dika', 'Bank Kalbar', '21/6/2021', '13:26:34', 'T 50', 2000000, '91034cdf458fc8e7048c997ff6f400f4.jpeg', 2, '2021-06-21 15:46:39', '49', 1, '', ''),
(438, '1800206760a5c5a28ec0a', 'MIA SHILFA OKTAVIYANI', 'Bank Kalbar', '21/6/2021', '09:58:57', 'T 17', 1510000, 'f2c0af170ca53f7dbab6293b6c7a8e9f.jpeg', 2, '2021-06-21 15:49:30', '49', 1, '', ''),
(439, '362515406090da58f3abf', 'TERSIA ANJILA', 'Bank Kalbar', '21/6/2021', '10:08:58', 'T 21', 2000000, '913e00f448962161946e83abae089079.jpeg', 2, '2021-06-21 15:51:38', '49', 1, '', ''),
(440, '2115087860a48c1f185bb', 'Yolanda', 'Bank Kalbar', '21/6/2021', '09:54:08', 'T 15', 1510000, 'b53650bbf9c0dd6f05fa9aa70e58959e.jpeg', 2, '2021-06-21 15:54:44', '49', 1, '', ''),
(441, '17713553609cc309b2a83', 'Kharisma Dharma', 'Bank Kalbar', '21/6/2021', '13:25:12', 'T 49', 3000000, 'c000078a8b322e37b8adabefdd672ced.jpeg', 2, '2021-06-21 15:56:42', '49', 1, '', ''),
(443, '15112790607fc664e25bc', 'MARIA SISKA', 'Bank Kalbar', '21/6/2021', '11:29:32', 'TL01-68', 1510000, 'bcbb90183bf7a338ff04a353c8931906.jpeg', 2, '2021-06-21 16:00:53', '49', 1, '', ''),
(448, '1078465860ac95d772513', 'Ica Kurniawati', 'BNI', '19/6/2021', '16:36:45', '3965', 3500000, 'd2b6ddd520b1862a5504c224848cc5e7.jpeg', 2, '2021-06-21 16:43:57', '49', 1, '', ''),
(445, '1942223960af6aca2bea0', 'Antonius', 'BNI', '21/6/2021', '14:29', '000028', 3000000, 'f791356e97af2ff3d80a514e24a16cae.jpeg', 2, '2021-06-21 16:07:50', '49', 1, '', ''),
(446, '204329366091fad24dfea', 'Usman Ali', 'BNI', '21/6/2021', '10:27', '8921', 1500000, 'c6f3a44f19ee4721b47019e4688850c8.jpeg', 2, '2021-06-21 16:22:13', '49', 1, '', ''),
(447, '702231196022027f89124', 'Patrisia Yuleti', 'Bank Kalbar', '18/06/2021', '13:53:21', '44', 3200000, '951850889ce32e845b57f4c25c95d784.jpeg', 2, '2021-06-21 16:27:32', '49', 1, '', ''),
(449, '2633406460a46c444a0bb', 'Maya Anggela P', 'Bank Kalbar', '14/06/2021', '13:57:59', 'T 63', 1510000, '60c6c2480205fc90d85067cca9ba6684.jpeg', 2, '2021-06-21 16:49:10', '49', 1, '', ''),
(464, '27141003608fd646da3f9', 'Zukri', 'BRI', '19/6/2021', '12:59:13', '191310351763280', 1500000, '5f018d0b83da01ae6a672f2cdac2e5c8.jpeg', 2, '2021-06-22 09:27:33', '49', 1, '', ''),
(453, '1043539460a526677cb78', 'Ruslanto', 'BRI', '21/6/2021', '16:30:31', '37517', 4760000, '3bb2e44857684baf624be7df9a467094.jpeg', 2, '2021-06-21 17:00:01', '49', 1, '', '');
INSERT INTO `bukti_bayar` (`id_bukti_bayar`, `akunb_msiswa`, `nama_pengirim`, `bank_pengirim`, `tgl_trans`, `jam_trans`, `nomor_refe`, `jlh_bayar`, `bukti_bayar`, `validasi_bukti`, `tgl_validbukti`, `yg_validasi`, `konfirm_bauk`, `yg_validasibauk`, `tgl_konfirmbauk`) VALUES
(452, '1043539460a526677cb78', 'DEYA RAHMANDA', 'BRI', '20/06/2021', '12:03:39', '54983', 2000000, '29ca7477434b2af8db53eb4bb59eb0f6.jpeg', 2, '2021-06-21 17:00:16', '49', 1, '', ''),
(456, '5973688660a3b57a242e3', 'Wanda Riska Dewi', 'BANK KALBAR', '21/06/2021', '14:26:11', 'TL01/24', 6760000, '265105b1e21605a728613d1f822ea060.jpg', 2, '2021-06-22 08:49:45', '49', 1, '', ''),
(462, '2114128060a6024f97aaf', 'Elisa Natalia', 'Bank kalbar', '16/06/2021', '10:26', 'T 06', 3760000, 'a0d24aa55a526873a10546fa639df763.jpeg', 2, '2021-06-22 09:17:54', '49', 1, '', ''),
(457, '1691433960a5f0fd38192', 'Rufini', 'KALBAR', '10/06/2021', '10:08:25', 'Rufini T 16', 6760000, '28ab8e0deee0a16c7041e0d444a2bce9.jpg', 3, '2021-06-22 08:48:10', '49', 1, '', ''),
(461, '3087529660aef3d90ae6d', 'Bernadeta Oktadiana Sundari', 'Bank Kalbar', '21/6/2021', '10:03:47', 'T 13', 4000000, '6874e0c499a6a629c44cffa2f33a95f4.jpeg', 2, '2021-06-22 08:57:48', '49', 1, '', ''),
(460, '5797172360812c7c5fce3', 'Sindy Agustini', 'Bank Kalbar', '21/6/2021', '09:05:26', 'T 18', 6760000, '2fe6020265075ac851df777ffa630cdc.jpeg', 2, '2021-06-22 08:55:02', '49', 1, '', ''),
(465, '4856011560a5ba112974c', 'OKTAVIA SITUN', 'Bank Kalbar', '22/06/2021', '09:02:12', 'T 4', 3250000, '728db3437b97d4f537fe29eee8df53e3.jpeg', 2, '2021-06-22 10:27:42', '49', 1, '', ''),
(466, '9466779460b6ffe32f8cc', 'Mellya puzie utami syahnural', 'Bank Kalbar', '22/06/2021', '08:59:53', 'T 3', 3000000, '88a26846688fb2e1d9b3b7aad4b23aca.jpeg', 2, '2021-06-22 10:31:21', '49', 1, '', ''),
(467, '12638986604701e0d0e83', 'Losina', 'Mobile Banking', '22/06/2021', '10:28:03', '221028253005190', 5000000, '517a4032d0def5231b0f4f4182356a64.jpeg', 2, '2021-06-22 11:11:25', '49', 1, '', ''),
(470, '2038519360af4b524306f', 'Antonius', 'ATM BNI', '25/06/2021', '09:52:04', '251003260000005', 4500000, 'cb2a07167bcc49faaf1eabce959db5d7.jpeg', 2, '2021-06-25 12:23:15', '49', 1, '', ''),
(471, '1853173960ab2db3268d9', 'Yustina', 'Bank Kalbar', '25/06/2021', '13:32:41', 'T 17', 1510000, '360a04c26fa05bfd2c6594aabf4347bc.jpeg', 2, '2021-06-25 15:35:40', '49', 1, '', ''),
(472, '8914854660935b51d4c23', 'Apiang', 'BRI', '29/06/2021', '12:34', '291234536862109', 5000000, 'c388a6c4a63afea72a927380e125493d.jpeg', 2, '2021-06-29 14:43:24', '49', 1, '', ''),
(473, '8914854660935b51d4c23', 'Apiang', 'BRI', '29/06/2021', '12:35', '291235426868308', 250000, '215b837d712dcdf917d343ba3e6818f5.jpeg', 2, '2021-06-29 14:44:05', '49', 1, '', ''),
(474, '8924606260842eda63094', 'Agustini Saverin Deran Beda', 'Bank Kalbar', '30/6/2021', '10:45', '40TL02/16', 5000000, '9e24dd5a24ca0eab8fce28cbdf5d92f4.jpg', 2, '2021-06-30 14:09:37', '49', 1, '', ''),
(479, '10946681603dcbeae5dd7', 'Damiana Theresia Septi Sami', 'Kalbar', '8/7/2021', '10:37', 'T032', 2000000, '108d87f13d6fd6691f166c5394b95fff.jpeg', 2, '2021-07-08 14:29:53', '49', 1, '', ''),
(480, '202743206090c0aea9e84', 'Wila Yohana', 'Bank Kalbar', '12/07/21', '09:26:58', 'T 09', 5000000, '1cb15619d3399b95e3194e3d80a203d1.jpeg', 2, '2021-07-13 13:11:21', '49', 1, '', ''),
(478, '18071315608b609e0e4ad', 'Apina Siska Eka Yanti', 'Bank kalbar', '30/6/2021', '11:22:39', '044', 2000000, '0bdc4504f6d4679b0ff54128623ff69e.jpg', 2, '2021-06-30 14:06:17', '49', 1, '', ''),
(482, '17108061605a228ba45cc', 'Ervan chandra', 'BRI', '13/07/2021', '09:52:22', '000001605530', 1500000, '2d301924bb80fcec95e6cb23e45b43ab.jpg', 2, '2021-07-13 10:49:13', '49', 1, '', ''),
(503, '8429072060a88a42c5524', 'Meilly hartati', 'Bank Kalbar', '26/7/2021', '10:58:11', '7', 3250000, '042bbe0efbe21168b26fe8097462fdd6.jpeg', 2, '2021-07-28 12:44:37', '49', 1, '', ''),
(485, '87058046607e40ff3e300', 'Maya Ladia Kula', 'Bank Kalbar', '13/07/2021', '9:35:31', 'T12', 3500000, '4181a85a8a8bb55f1c0bb7f52a45721b.jpeg', 2, '2021-07-13 10:42:14', '49', 1, '', ''),
(486, '4856011560a5ba112974c', 'OKTAVIA SITUN', 'Bank Kalbar', '13/07/2021', '9:24:25', 'T 7', 3760000, '55b8f3a474facd91f1dba6df8d8ac71e.jpeg', 2, '2021-08-31 16:13:55', '49', 1, '', ''),
(487, '20104062608535fb24636', 'NERI YANUS', 'BANK KALBAR', '14/06/2021', '07:21:39', '753', 6760000, '095eb34ad5ccd9325e665a9cf50a14e0.jpg', 2, '2021-07-13 13:20:28', '49', 1, '', ''),
(488, '3097671360af30a23aa7f', 'NOVA ROSADIKA', 'Bank Kalbar', '13/07/2021', '11:41:44', 'T 34', 3000000, 'f31fc2fd9410a68f67132808920fd4e8.jpeg', 2, '2021-07-13 12:51:52', '49', 1, '', ''),
(490, '2791540660afc140ed001', 'Ela biata Barbie', 'Bank kalbar', '15 Juli 2021', '10:13:31,766', '138711016070', 3380000, '36ec0bd8209e8259bdb580ab9fdbbf73.jpg', 2, '2021-07-19 16:23:25', '49', 1, '', ''),
(505, '1294071160459463289cc', 'Wartiah', 'BRI', '31/07/2021', '09:14:24', '000003653685', 3460000, 'a296b34ae360be7d699a464d52ad56dc.jpg', 2, '2021-08-02 08:34:22', '49', 1, '', ''),
(504, '702231196022027f89124', 'Patrisia Yuleti', 'KALBAR', '26/07/2021', '11:32:07', 'T 042', 3560000, 'b01a21bb6aa52372358a3c48a742d376.jpg', 2, '2021-07-30 12:14:07', '49', 1, '', ''),
(493, '2521958160a5d753eac02', 'Dara suryawara', 'Bank kalbar', '16 Juli 2021', '12:57:45', 'T 062TL01/021', 2760000, '9ddae81b2401aa0bb6e1704b8d7cda86.jpg', 2, '2021-07-19 16:08:19', '49', 1, '', ''),
(494, '6601264160a3ad0cbe704', 'Lewi', 'BANK MANDIRI', '17/7/2021', '18:40:23', '000002321000439', 3380000, '4c4dfde0f74da07d64ab2c65d945b573.jpg', 2, '2021-07-20 21:11:03', '49', 1, '', ''),
(495, '6601264160a3ad0cbe704', 'Lewi', 'BANK MANDIRI', '18/7/2021', '15:31:22', '000002321000439', 3380000, '51eceaf114f3d46f58647120d708cfc0.jpg', 2, '2021-07-27 15:16:48', '49', 1, '', ''),
(496, '36947638605dcccd6d425', 'Mini', 'Bank kalbar', '23/07/2021', '10:30:21', 'T 22', 6510000, 'a8564f67f330261110f6c913f4bc40fa.jpeg', 2, '2021-07-27 15:21:05', '49', 1, '', ''),
(497, '338826466090d750269da', 'Cecelia yesi kartika', 'Bank kalbar', '26/07/2021', '10:31:27', '025', 3250000, '775a6188acee4c02c32a6743e6366041.jpg', 2, '2021-07-27 15:11:05', '49', 1, '', ''),
(499, '6333882560910856ef26f', 'Selsilia Elinur Masari', 'Bank kalbar', '26/07/2021', '10:31:25', '026', 3250000, '060b5b228a17bd400df61c3c319db82b.jpg', 2, '2021-07-27 15:06:47', '49', 1, '', ''),
(502, '8135284660b44737e82cb', 'Hermanso', 'BRI', '26/07/2021', '13:48', '000008084214', 4760000, 'f186ff6fa8de28d690b8f51ecb556401.jpg', 2, '2021-07-27 13:25:32', '49', 1, '', ''),
(512, '1799345660ab9ddc86fab', 'Evi Netiana', 'BRI Link', '31/07/2021', '13:29:54', '311341238051409', 3000000, '1c06c34665ebdee40148d5a63dc48cdf.jpeg', 2, '2021-08-08 15:59:36', '49', 1, '', ''),
(507, '6948617460330bba88a11', 'Yulia noveria', 'Bank kalbar', '02/08/2021', '11 : 23 : 20', 'T 058', 4075000, '7d18c9fd0fe1d9d14b95228138a7583b.jpg', 2, '2021-08-08 16:11:23', '49', 1, '', ''),
(508, '9466779460b6ffe32f8cc', 'Mellya puzie utami syahnural', 'Bank Kalbar', '03/08/2021', '14:05:27', '54', 3760000, 'c1ff0dd233290321610e5eafdc9413c2.jpeg', 2, '2021-08-03 16:04:01', '49', 1, '', ''),
(509, '812936196059514503358', 'JARNIATI', 'BRI', '04/08/2021', '10:06:33', '000006177909', 1760000, '2491a44843e90c2b34f0c1069d197b5d.jpg', 2, '2021-08-08 16:03:38', '49', 1, '', ''),
(510, '1300078460a48ae429f7b', 'VICTORIA TRI JULIANI', 'BANK KALBAR', '04/08/2021', '10:14:37', 'T029', 5250000, '6db5fc47c47fd96acdd6820d55eb7a34.jpg', 2, '2021-08-08 15:53:16', '49', 1, '', ''),
(511, '94808655603347fc99f7d', 'Yopi Hiasinta', 'Bank Kalbar', '06/08/2021', '09:49:21', '123', 5010000, 'd6bbf814c9409d4a5cf5d1baf91899fb.jpg', 2, '2021-08-08 16:05:14', '49', 1, '', ''),
(513, '1799345660ab9ddc86fab', 'Evi Netiana', 'BRI Link', '31/07/2021', '13:31:16', '311342468062424', 3760000, '3c4a5d6adec020d9139c8e97be38c4f0.jpeg', 2, '2021-08-08 16:00:57', '49', 1, '', ''),
(514, '11189035605413a602eb7', 'Yunika Sara', 'Bank Kalbar', '03/08/2021', '14:00:46', '53', 4510000, '2bea55f1482b4068cb4a8b9eb7ae9ba8.jpeg', 2, '2021-08-08 17:06:15', '49', 1, '', ''),
(515, '148169066089ea91a2e9e', 'Victoriana Tompok', 'Bank mobile cu. Keling Kumang', '09/08/2021', '09:30:11', '255072', 6760000, 'b78cb3373538e39f62a486777e1fc508.jpg', 2, '2021-08-09 10:25:16', '49', 1, '', ''),
(516, '106776136094a1db0c487', 'randu ova trianto', 'Bank Kalbar', '9/08/2021', '9:35:46', '1', 3760000, 'ead443010cfaf0920de3598bd8e80eb5.jpg', 2, '2021-08-10 07:45:39', '49', 1, '', ''),
(517, '1091587460810c81f1c1b', 'Margareta Nana', 'Bank Kalbar', '9/08/2021', '13:09:10', 'T 46', 2760000, '879ed14883b9bc9d1d8078a63041b2f8.jpg', 2, '2021-08-10 07:48:09', '49', 1, '', ''),
(518, '1323500660969572616ab', 'Meinar Sari Lubis', 'BNI', '10/08/2021', '10:16:48', '20210810101642029486', 3760000, '90e356449ce26b2d831889c2ddbdc735.jpeg', 2, '2021-08-11 20:48:55', '49', 1, '', ''),
(520, '2090107660a5c493df895', 'BPK BUDIMAN', 'A BANANK BNI', '10/8/2021', '10:49', '50993554', 6760000, '35a07829de89f5910f5c4f9fa8581636.jpg', 2, '2021-08-16 09:53:38', '49', 1, '', ''),
(521, '1388680060d086ac645ef', 'YOHANES MARIANUS MADU', 'BRI', '10/08/2021', '21:37:50', '426570395203', 3500000, '963d0a4658415f13c2e05914939c1ee3.jpg', 2, '2021-08-11 20:44:15', '49', 1, '', ''),
(522, '2099894560eed5ca2e1a7', 'Winda Lestari', 'MANDIRI', '11/08/2021', '08:17:48', '20210811518200099', 6760000, 'c02dc5a840a5c035d00eba15bcbc89fd.jpg', 2, '2021-08-11 20:40:54', '49', 1, '', ''),
(523, '3960409360e93ea6c3766', 'FRANSISKUS AGUSTYAN SANDA', 'BANK BRI', '11/08/21', '13:07:04', '11253', 1510000, 'e6292d571ae63dc246e2a763b3f7ba7b.jpg', 2, '2021-08-11 20:42:35', '49', 1, '', ''),
(524, '212216196088ee27edff0', 'Nana', 'Bank BRI', '11/08/2021', '15:36:35', '000006715153', 5000000, '37aca638a72ccf8153b93c5227dd754d.jpg', 2, '2021-08-11 20:55:32', '49', 1, '', ''),
(525, '212216196088ee27edff0', 'Nana', 'Bank BRI', '11/08/2021', '15:37:11', '000006719357', 1000000, '93f03fcc05a4ed1614a0fa5a140dd93f.jpg', 2, '2021-08-11 20:56:04', '49', 1, '', ''),
(526, '114429306029d8c6e5fe9', 'Indah Sulis Setiawati', 'Bank Kalbar', '29/07/2021', '10:31:22', 'TL02/07', 3000000, '4bc71db4df723fe799fe74dac1800b7c.jpeg', 2, '2021-08-12 08:15:58', '49', 1, '', ''),
(527, '1157339660c7652c2b727', 'Lola Florina', 'Bank Kalbar cabang Sekadau', '12/08/2021', '09:14:52', '310062', 6760000, 'dcadd2ea1c52ddbdc69ddeb28dba0420.jpg', 2, '2021-08-12 11:01:27', '49', 1, '', ''),
(528, '4664569860c75677d4449', 'Margareta Novela Emi', 'Bank Kalbar', '12/06/2021', '09:53:45', '2.08', 6760000, '2ff7599de8d33baf605adbaafe49d131.jpeg', 2, '2021-08-12 11:01:47', '49', 1, '', ''),
(529, '8266174660c6d1c37c1d3', 'Julianisda Edelwise Sari', 'Bank Kalbar', '12/08/2021', '10:37:38', 'TL02/12', 6760000, 'd0eddbe4b810fbe2d50c4493abe4868f.jpeg', 2, '2021-08-12 11:11:00', '49', 1, '', ''),
(532, '1556654060ebbacf26315', 'Arlin desiana', 'Bank kalbar', '12/08/2021', '11:45:45', '95TL02/61', 6760000, 'f4a83cbb39e260fe5c0db12c9253bfac.jpeg', 2, '2021-08-13 08:55:16', '49', 1, '', ''),
(531, '1844515760ceee555cf17', 'Agustiman', 'Bank kalbar', '12 Agustus 2012', '11:08:09', '318486', 3380000, '183724e5da0a885fe9be352e7b0540c6.jpg', 2, '2021-08-12 11:24:32', '49', 1, '', ''),
(533, '1823697960f0e2fccd7c6', 'Paijin', 'Bank Kalbar', '12/08/2021', '11:38:49', 'T19', 3510000, '195b0c9ce4aca8e3ef750066176b9350.jpg', 2, '2021-08-13 08:08:01', '49', 1, '', ''),
(534, '2055439160d7e1a949f19', 'SUWANDI', 'BRI', '12/08/2021', '18:57:37', '000003440833', 1760000, '4a48e83b92cefb26541f29671cf5871c.jpg', 2, '2021-08-13 08:15:05', '49', 1, '', ''),
(535, '2055439160d7e1a949f19', 'SUWANDI', 'BRI', '12/08/2021', '18:57:06', '000003437176', 5000000, 'cf54be1969b00fd9c31d0eeb1427fbde.jpg', 2, '2021-08-13 08:14:57', '49', 1, '', ''),
(537, '1630741460c317af68221', 'Gatot Subroto', 'ATM Mandiri', '12/08/2021', '20:20:33', '122020320578771', 1510000, '6f95628bdbc55fc1ba34cdbafaeb5648.jpeg', 2, '2021-08-13 08:19:49', '49', 1, '', ''),
(538, '4998295460b842b44d3b8', 'Renaldi Mulya', 'ATM Bank Kalbar', '12/08/2021', '15:20:20', '002053', 6760000, 'e458cf940d13a6a425bdd7ceb18a4722.jpeg', 2, '2021-08-13 08:24:55', '49', 1, '', ''),
(539, '488812246075031b0a1fe', 'Fiesta Raines', 'Bank Kalbar', '09/08/2021', '10:58:59', '35', 3250000, 'ca22e7ac53408c5af9793435aa27fbdb.jpeg', 2, '2021-08-13 08:38:59', '49', 1, '', ''),
(541, '1729334560c7413657062', 'Agung Sintani', 'Bank Kalbar', '13/08/2021', '08:59:27', 'T008', 6760000, '7b3d36d36c2a885b90c62a00d846be3d.jpg', 2, '2021-08-13 10:32:37', '49', 1, '', ''),
(546, '8276747060ab13c46be10', 'Blandina Della Riska', 'Mobile Banking', '13/08/2021', '09:17:43', '130917430001334', 6510000, '1d8993195bb290ef3eeeef2ff0066d47.jpeg', 2, '2021-08-13 10:38:49', '49', 1, '', ''),
(545, '1210486360f10374833b9', 'Evi Zurnas', 'ATM Bank Kalbar', '13/08/2021', '08:43:43', '001130', 6760000, 'e90d5a515a1eaeefafe98724ed75da53.jpeg', 2, '2021-08-13 10:30:30', '49', 1, '', ''),
(552, '12522372608cf13599a1a', 'Yupita Aseni', 'Kantor pos', '13/08/2021', '10:07:43', '7865300-02/21/001668', 2000000, '29216a86ac25578a8dcf997ce5ff8050.jpg', 2, '2021-08-16 09:40:38', '49', 1, '', ''),
(551, '2083936060f0d291d8d6a', 'Hendrikus', 'BRI', '13/08/2021', '11:21:33 wib', '426721976518', 6510000, '7a159c0220465fe069cc7a90b089ef9d.jpg', 2, '2021-08-16 09:28:09', '49', 1, '', ''),
(550, '1906511460c44ec739085', 'Ella Ermiliani', 'ATM BRI', '13/08/2021', '10:33:06', '131033068547485', 4000000, '4ec381dc45854924ea1c7749bae3cc95.jpeg', 2, '2021-08-13 11:19:23', '49', 1, '', ''),
(553, '1335299960ac48f575535', 'PRICILIA ANITA', 'BANK BRI', '14/08/2021', '08.51:00', '279174', 6510000, '0f664af5a141b26bba8fbf39609604b9.jpg', 2, '2021-08-16 09:31:26', '49', 1, '', ''),
(554, '1450954360c7169a461c2', 'Suwandi', 'BRI', '14/08/2021', '13:54:40', '0000033595530', 5000000, 'afe70d8799d194fdc5880a70b0ab4635.jpg', 2, '2021-08-16 10:03:07', '49', 1, '', ''),
(555, '1450954360c7169a461c2', 'Suwandi', 'BRI', '14/08/2021', '13:54:40', '000003359530', 1760000, 'a3f2291a31b9665d9003b570a4994b50.jpg', 2, '2021-08-16 10:02:56', '49', 1, '', ''),
(556, '103063546059d8f3453e9', 'Lorda Maria', 'Bank Kalbar', '13-08-2021', '18:36:38', '002913', 6060000, '89243d8cf5cd52741494eaae714294d7.jpg', 2, '2021-08-16 09:43:11', '49', 1, '', ''),
(559, '3216441460cdd82a184a1', 'ADVENIA SESILIA DESI', 'BRI', '16/08/21', '14:06:56', '000005159475', 3760000, 'dc11b7a89cecccae7f92b9561f8fe86b.jpg', 2, '2021-08-17 10:46:01', '49', 1, '', ''),
(558, '2083936060f0d291d8d6a', 'hendrikus', 'BRI', '16/08/2021', '09:24:32', '426879904195', 250000, '102d3c0adc6e32db4cc57b4333b16f1e.jpg', 2, '2021-08-16 09:49:43', '49', 1, '', ''),
(560, '3216441460cdd82a184a1', 'ADVENIA SESILIA DESI', 'BRI', '16/08/21', '14:06:56', '000005159475', 3000000, '4d67065998b0faf3416758d65c57b670.jpg', 2, '2021-08-17 10:41:58', '49', 1, '', ''),
(561, '2106288660e522c5efe34', 'Nikodena natalia', 'Bank Kalbar', '16 Agustus 2021', '14:34:00', '123', 6760000, 'caf67e5ea2c2314db08f513528439dc4.jpg', 2, '2021-08-17 11:00:12', '49', 1, '', ''),
(562, '1205756560ebaaef5bffa', 'TABITA', 'KALBAR', '16/08/2021', '11:05:10', '12', 6760000, 'bdcb1a01ed9d46941228010ee0e494b6.jpg', 2, '2021-08-17 10:20:48', '49', 1, '', ''),
(563, '1897067160a4cad1b90d4', 'Pronika Linda', 'ATM BRI', '14/08/2021', '18:31:07', '141831060631050', 6060000, 'ea9e3b5c0fa26d729028dfb82ee03464.jpeg', 2, '2021-08-16 16:01:40', '49', 1, '', ''),
(570, '1993576760fbf4eb73867', 'Siti Kalsum', 'ATM BRI', '16/08/2021', '16:04:10', '161615440279494', 1760000, '750560ef1e8ab5b875a4fa73f8ca8716.jpg', 2, '2021-08-17 11:18:15', '49', 1, '', ''),
(565, '4549412660bb62c836eed', 'Yuliandi', 'Danamon', '16/08/2021', '11:08:58', '21081621772120', 6510000, '453754703c3d99a686306d7c5d76988b.jpg', 2, '2021-08-17 10:35:32', '49', 1, '', ''),
(566, '8971528860934fa31ba43', 'Stefani anggelina putri', 'ATM BNI', '13/08/2021', '10:21:29', '000007', 3260000, 'bd1d1f8ccab6794cfdfd134fcb394579.jpeg', 2, '2021-08-16 16:15:21', '49', 1, '', ''),
(567, '1993576760fbf4eb73867', 'Siti Kalsum', 'BRI', '16/08/2021', '16:10:49  16:15:44', '-', 5000000, '841ebb3a17f0e597b46e856effa35c9b.jpg', 2, '2021-08-17 11:15:05', '49', 1, '', ''),
(568, '1303077260be199d57b57', 'Tiara Grace Amanda', 'Bank Kalbar', '16/08/2021', '09:27:51', '18', 6760000, '1ae874f833a584962dd20e44fccb1497.jpeg', 2, '2021-08-16 16:56:06', '49', 1, '', ''),
(569, '1657071060d1a41d14a58', 'Yovita Yessi', 'Bank kalbar', '16/08/2021', '10:35:22', '33', 6760000, '0cf4eb8d2398103f23fa0057b7de7231.jpg', 2, '2021-08-17 10:53:32', '49', 1, '', ''),
(571, '1087833060b8b40b40fe6', 'Fransiska mei kasiana', 'BCA', '17 agustus 2021', '11.06.53', '6164', 6510000, '20987fcc4893ddfaee517d9d0597ee94.jpg', 2, '2021-08-18 08:20:48', '49', 1, '', ''),
(573, '8000256260fffb952db4c', 'Melda Apri Yeni', 'Bank Kalbar', '16/08/2021', '10:34:53', '048 KBK048TL01 D23048TL01 00000 063 KBK048PC01', 6760000, '8202b6406b5f4178b6b69c43201fe5c5.jpg', 2, '2021-08-18 08:29:11', '49', 1, '', ''),
(578, '1194305460a203a006419', 'Valentina Tutu Angin', 'Bank Kalbar', '16/08/2021', '09:56:19', 'TL03.021', 6510000, '8674679626cf53ef36428c341de039a6.jpeg', 2, '2021-08-18 08:39:20', '49', 1, '', ''),
(575, '3228176660d31a16d1651', 'Yudita', 'Bank Kalbar', '16/08/2021', '10:01:01', '048 KBK048TL01 D23048TL01 00000 049 KBK048PC01', 3000000, 'cd21788c5d1b02d94c0774b8343e9dc8.jpg', 2, '2021-08-18 08:25:55', '49', 1, '', ''),
(576, '1487885960bc4adbab98d', 'ERVAN CHANDRA', 'Bank rakyat Indonesia', '16/08/2021', '16:30:38', '426908375805', 6760000, '96542e01b87795bbdd59d77ddce17260.jpg', 2, '2021-08-18 08:23:48', '49', 1, '', ''),
(579, '1913298360d2c66dc6f5d', 'ISTIAJAH', 'BANK KALBAR', '18 AGUSTUS 2021', '09:12:11', '324804', 6760000, '13e737ab4cbfbd5b948580b6bdd90625.jpg', 2, '2021-08-19 14:35:17', '49', 1, '', ''),
(580, '1874410160f170a029268', 'Damiana Lusi A.P', 'BNI', '18/08/2021', '09:35:13', '000000015147', 6760000, '62f5bf9f07eaff5b3b27a1e8d1f42b69.jpg', 2, '2021-08-18 14:53:40', '49', 1, '', ''),
(583, '1525086660fa219f3475d', 'NELY ELSA FADHILLAH', 'PRKMPULN BDN PEND KARYA BANGSA', '18/08/2021', '10:44:29', 'TL065/7', 6760000, '424cad110d2a38e07f3cc712a0b54618.jpg', 2, '2021-08-18 14:54:57', '49', 1, '', ''),
(584, '9122545360fe6a3ea9361', 'TRI KURNIA ZUL AIDA', 'BANK KALBAR', '18/8/2021', '11:07:06', '401000657', 6760000, '2df4816e9631376afefed88904a4602c.jpg', 2, '2021-08-19 11:07:02', '49', 1, '', ''),
(605, '1954676460cd623f90138', 'Semigawati', 'Bank Kalbar', '18/08/2021', '12:36', '-', 6760000, 'd9d183b70f6b9fdc3b77b07058485587.jpeg', 2, '2021-08-19 14:02:38', '49', 1, '', ''),
(622, '1990976060a7c8f725e19', 'ISTIPANUS RINTIT', 'Bank Kalbar', '18/08/2021', '09:32:00', '15', 3000000, '76163502a70e57aea577f1b5109cb27b.jpeg', 2, '2021-08-19 11:55:10', '49', 1, '', ''),
(601, '6190107860c732af73597', 'JESIKA', 'BANK KALBAR', '18/08/2021', '11:00:31', '02.22', 6760000, 'ea45faf43e7560228b69cfbfc71c0da7.jpg', 2, '2021-08-19 11:14:19', '49', 1, '', ''),
(599, '204329366091fad24dfea', 'Bpk Usman Ali', 'NGSABANK BNI', '16/08/2021', '16:55', '12089', 5260000, 'b60b2f7d1e9a9fa4f213f3e06ea7713d.jpeg', 2, '2021-08-19 11:47:37', '49', 1, '', ''),
(592, '396405136103efd61e602', 'NOVIANTO ALDO', 'BANK KALBAR', '18/08/2021', '10:18:34', '370434', 6760000, '0636169044c66d4006a8fb9537ae669e.jpg', 2, '2021-08-18 14:48:53', '49', 1, '', ''),
(636, '5227469860b9cf4cb2a71', 'Dewi', 'Bank Kalbar', '19/08/2021', '12:10:00', '-', 3000000, '39b2dc9f9399d917da1c0888050bc102.jpg', 2, '2021-08-19 14:17:58', '49', 1, '', ''),
(595, '1832280660f52df40900d', 'Tommi Jepissa', 'Bank Kalbar', '18/08/2021', '10:57:39', '02.21', 6760000, 'e49207719da005b8443011d6b20e0dc6.jpg', 2, '2021-08-18 15:54:20', '49', 1, '', ''),
(634, '1238211360b5a9227fb99', 'Santy lanya', 'ATM Bank Kalbar', '19/8/2021', '10:03:01', '191024120006792', 3255000, 'cb249e1cfec3d6dc9fcc4c132411ead0.jpeg', 2, '2021-08-19 13:44:42', '49', 1, '', ''),
(608, '1931660860ed28b400833', 'Ignasia indrariya', 'Bank BRI', '19/08/2021', '06:36:40', '346800', 6760000, '4aee9b0240aa05c4bb012767f5012286.jpg', 2, '2021-08-19 11:10:54', '49', 1, '', ''),
(621, '1185339960ba034da9b1f', 'Maria Nuriati', 'Bank Kalbar', '19-08-2021', '10:55:38', '294852', 6760000, '100d6ad62ac6091dc6c3566f2d043b18.jpg', 2, '2021-08-19 13:13:40', '49', 1, '', ''),
(620, '1984315760b9f943db510', 'SA\'DIYAH', 'Bank Kalbar', '16/08/2021', '13:19:42', 'TL01.46', 6510000, '75860d2fc935f2981ee7da28e278f9ac.jpeg', 2, '2021-08-19 11:35:17', '49', 1, '', ''),
(613, '2791540660afc140ed001', 'Ela biata Barbie', 'Bank kalbar', '18 Agustus 2021', '10:42;47,971', '938111042430', 3380000, 'fedf0cce7a81e9c8759c1eac092d57d3.jpg', 2, '2021-08-19 11:17:53', '49', 1, '', ''),
(615, '2028127060de9f442322a', 'Sakriana Nita', 'BRI', '19:08:2021', '09:45', '738701008703530', 5000000, '9355fd776aa43e62cf8db6fdbdc1c9e8.jpeg', 2, '2021-08-20 08:29:59', '49', 1, '', ''),
(616, '48632825605fe382e3b59', 'Kornelia Septi', 'Bank Kalbar', '19/08/2021', '9:12:33', '07', 5000000, 'f12a641082cfa918ac12dc9c4274e84b.jpg', 2, '2021-08-19 11:20:58', '49', 1, '', ''),
(619, '8999663760e3bf7d901e5', 'Susan', 'Bank Kalbar', '16/08/2021', '13:12:55', 'TL02/44', 6760000, '3c101be8eb89f145e8be95aa1a0e2ed5.jpeg', 2, '2021-08-19 11:26:57', '49', 1, '', ''),
(627, '1688093960cb17a0b4cb0', '95TL06/12', 'Bank Kalbar', '18/08/2021', '10:11:46', '95TL06/12', 1510000, 'd4c923e781411839f9305b3194cfe499.jpeg', 2, '2021-08-19 12:18:02', '49', 1, '', ''),
(629, '1786568260d40397655e4', 'Sunarti', 'Kalbar', '19/08/2021', '09.23', '04', 4000000, '42ba1c1efe822bba2f0400acf124aaee.jpg', 2, '2021-08-19 14:08:51', '49', 1, '', ''),
(635, '1508297960c6c414d7698', 'DISKA EVI LILISYANI', 'ATM BRI', '18/08/2021', 'Diska Evi lilisyani', '181206001786615', 4000000, '9e2d6f5da56620f906df30c7a23f0db2.jpeg', 2, '2021-08-19 13:52:15', '49', 1, '', ''),
(631, '153329236108988acec15', 'Fajar imam Sabarudin', 'Bank Kalbar', '18/08/2021', '9:34:11', 'T 06', 3510000, '4e986d8ec72f54d04dcff2300c779103.jpg', 2, '2021-08-19 13:07:59', '49', 1, '', ''),
(632, '8564116660f7bf4e71e9a', 'Wulan Nopita Sari', 'Bank Kalbar', '18/08/2021', '11:12:24', '20', 6760000, '49c5882f2b8b9e55b0967ff0dd7657f0.jpeg', 2, '2021-08-19 12:39:39', '49', 1, '', ''),
(637, '2693886760ee889646708', 'Nur Karmila', 'Bank Kalbar', '21/8/2021', '10:12:02', '25', 6760000, 'aeb0120307985bdf8997bd8282064086.jpeg', 2, '2021-08-19 14:13:00', '49', 1, '', ''),
(633, '2283663760cc2b8b8797d', 'Maria fentalis saulin', 'Bank Kalbar', '18/08/2021', '10:36:24', '10:36:24', 6760000, 'f7f165e3cf79e41dddd8ab4628f39a12.jpeg', 2, '2021-08-19 13:05:19', '49', 1, '', ''),
(638, '1521896260c7282a8c61b', 'Ribka langki', 'Bank BCA', '19/08/2021', '14:07:14', '308658', 6760000, 'd4f5347d2bdc03efe1a91bdb61b60b5b.jpg', 2, '2021-08-19 14:32:36', '49', 1, '', ''),
(646, '2028127060de9f442322a', 'sakriana Nita', 'ATM BRI', '19/8/2021', '09:34:35', '190946184530343', 1510000, 'fc455c9b5149c19d4593e740878f2b21.jpeg', 2, '2021-08-20 08:35:46', '49', 1, '', ''),
(645, '1675234460d181ec3c066', 'Putri Bella Utami', 'Bank Kalbar', '19/08/2021', '14:30:46', '323166', 6760000, 'a7789520ec8e80708f2c72fce4d78f63.jpg', 2, '2021-08-20 08:09:49', '49', 1, '', ''),
(647, '5577633860d2a5a567e1b', 'Toko Marliz', 'Mitra Bukalapak', '20/08/2021', '9:08 WIB', '363399001091', 6760000, 'fa712ae0efe04ecb2cbe4c046e1521c1.jpg', 2, '2021-08-20 15:37:17', '49', 1, '', ''),
(648, '8747108860b88eaff04e5', 'Veronica Angelia', 'KALBAR', '20/08/2021', '10:04:26', '128141004240', 6510000, 'd61426b22831159426abd74797b3c095.jpg', 2, '2021-08-20 15:28:39', '49', 1, '', ''),
(651, '5883707560e2a1810db9a', 'Rospiti', 'Bank Kalbar', '20/08/2021', '09:30:51', 'TL02/15', 3380000, 'bc85f4073feee6cf0bd66e05bbf02ef4.jpeg', 2, '2021-08-20 15:43:52', '49', 1, '', ''),
(650, '3547983960bed5e8ca613', 'Septianda Rikyandi', 'Bank Kalbar', '19/08/2021', '8:52:46', 'T 005', 3000000, '0fb67499b01d5d90865f1d975426dd8d.jpg', 2, '2021-08-20 15:31:19', '49', 1, '', ''),
(652, '4488068360e2a4b515504', 'Atun Rosmini', 'Bank Kalbar', '20/08/2021', '09:44:07', 'TL02/16', 3380000, '70fdf30336944a8bfd0beba754ffcb86.jpeg', 2, '2021-08-20 15:51:38', '49', 1, '', ''),
(657, '212216196088ee27edff0', 'Sarbini', 'ATM BRI', '20/08/2021', '13:28:30', '201340046879572', 760000, 'e24dca2a8569120c40486c255d93ca14.jpeg', 2, '2021-08-22 12:26:53', '49', 1, '', ''),
(654, '8882968260a1cafd266dd', 'Bonifasius Pantura', 'Bank Kalbar', '20/08/2021', '10:27:44', '39', 3000000, '6fc58a1535c37a0d8b19684bd603f057.jpeg', 2, '2021-08-20 16:12:30', '49', 1, '', ''),
(655, '1810889760d2ab9475ceb', 'Fransiska erni lianti', 'Bank Kalbar', '19/8/2021', '09:51:27', '7', 4000000, '2e531e519ebc8242ee92732b4aeec911.jpeg', 2, '2021-08-20 16:36:27', '49', 1, '', ''),
(656, '8370578160d87f662b335', 'WAWAN SETIAWAN', 'Bank Kalbar', '20/08/2021', '10:38:35', '44', 3600000, '3d1e8cb72874ad62e41d12ac8a3109a5.jpeg', 2, '2021-08-20 16:46:00', '49', 1, '', ''),
(658, '8747108860b88eaff04e5', 'Veronica Angelia', 'ATM Bank Kalbar', '20/08/2021', '14:32:48', '201444230244220', 250000, '613117b01a923304e5f4e4b53b0b14d3.jpeg', 2, '2021-08-22 13:15:24', '49', 1, '', ''),
(659, '8755402660f91d6265864', 'RIO MARDI', 'CU Keling Kumang', '18/08/2021', '14:09:30', 'IB1421153804', 6760000, '23c7bf1cd32e47fd7d74e5d852351525.jpeg', 2, '2021-08-22 13:57:36', '49', 1, '', ''),
(660, '3852641760d5711dde59a', 'Agustina', 'Bank Kalbar', '20/08/2021', '13:13:16', '60TL02/028', 4760000, 'c3f80c6df55ec42d888fabd5e346c95f.jpeg', 2, '2021-08-22 18:28:56', '49', 1, '', ''),
(661, '2024066660e3f8f417b2a', 'RISKI PUSPITA SARI', 'Bank Kalbar', '19/8/2021', '13:14:44', '32', 6760000, 'ff51a6833f62051085268d92549be563.jpeg', 2, '2021-08-22 19:17:58', '49', 1, '', ''),
(662, '6746401760b9d73e8d99d', 'Umi Karmila', 'Bank Kalbar', '19/8/2021', '13:11:07', '31', 6760000, '00f3ab05b97697e64d7d45a9abf8b545.jpeg', 2, '2021-08-22 19:21:45', '49', 1, '', ''),
(663, '1376643860ebcb0225da9', 'Robenson Hendri', 'Bank Kalbar', '18/08/2021', '14:06:00', '55', 4510000, '615fa932ded6acdf04bd5c7cc092212d.jpeg', 2, '2021-08-22 19:27:24', '49', 1, '', ''),
(664, '5383236560e3e46ca5f85', 'Alberta angelina', 'Bank Kalbar', '18/08/2021', '14:13:00', '57', 6760000, '9ca5e1f170d39d5e403cb3b1dfc2c773.jpeg', 2, '2021-08-22 19:30:16', '49', 1, '', ''),
(665, '9582042360f8f8ac0ed2a', 'Angela Septi Brigita', 'Bank Kalbar', '13/8/2021', '13:44:25', '34', 6760000, '6dd7e6d34bd2c652d3b271fc6308530f.jpeg', 2, '2021-08-22 19:55:41', '49', 1, '', ''),
(666, '1604395760ffa440e4a70', 'Dety Julianti', 'Bank Kalbar', '13/08/2021', '13:47:00', '35', 4000000, '231ad3355222ee1437e1863b850d7668.jpeg', 2, '2021-08-22 19:58:54', '49', 1, '', ''),
(667, '982796126076a3b991c8b', 'Lusia Rupina', 'Bank Kalbar', '13/08/2021', '13:36:50', '32', 4760000, '9b77e161237693c6ded0a6d206a5363c.jpeg', 2, '2021-08-22 20:01:47', '49', 1, '', ''),
(668, '1258461860d17c11ed256', 'Puja. S', 'Bank Kalbar', '13/08/2021', '13:38:31', '33', 1510000, 'af01d7b4abff87d371f39916b90cedc7.jpeg', 2, '2021-08-22 20:06:28', '49', 1, '', ''),
(670, '1471942160d00d6fcac12', 'Darwani', 'Bank Kalbar', '16/08/2021', '13:39:39', '40', 6760000, 'e9c4d0fe8a7a9a86ec3d3b81d4e6233d.jpeg', 2, '2021-08-22 20:12:54', '49', 1, '', ''),
(671, '1932054860d5627baaaf5', 'Wahidah', 'Bank Kalbar', '16/08/2021', '13:35:22', '37', 6760000, '67cf15b320ac69190758917ac69012b8.jpeg', 2, '2021-08-22 20:16:53', '49', 1, '', ''),
(672, '3607249460fa0ff681b47', 'PETRONIA ASTER', 'Bank Kalbar', '16/08/2021', '13:32:20', '34', 6760000, '203e48c9231d8116e4175713906606ce.jpeg', 2, '2021-08-22 20:41:52', '49', 1, '', ''),
(673, '9307419560767448ea219', 'Andreas mj', 'BRI', '23/08/2021', '11:23:31', '000001782948', 5000000, '2134bf8445c03960920b6474b625275f.jpg', 2, '2021-08-27 12:37:20', '49', 1, '', ''),
(674, '19900347603894fac8490', 'Elma Destari', 'Bank Kalbar', '23/08/2021', '10:05:33', '20', 5000000, 'd7eed4b555fdd77e827080e71f160a1e.jpeg', 2, '2021-08-23 16:17:05', '49', 1, '', ''),
(675, '1909504060c6b20f0a4b5', 'ANNISA HASANATUL. P', 'Bank Kalbar', '23/08/2021', '10:01:45', '17', 3000000, 'ed89fd2f466e227543f8ae0771937f4a.jpeg', 2, '2021-08-23 16:23:12', '49', 1, '', ''),
(676, '8704003360c6ba10b0b2b', 'Basilika Ayoni Fernanda', 'Bank Kalbar', '23/08/2021', '09:55:29', '13', 6760000, 'd321f6607de702bf31b63b63fe29310e.jpeg', 2, '2021-08-23 16:29:14', '49', 1, '', ''),
(677, '3357258060c6b9fe6ca90', 'Clarisa Natalia Yulisam', 'Bank Kalbar', '23/08/2021', '09:59:22', '16', 6760000, '6fb937cd5abab4dbb1c5b282d4bebfa6.jpeg', 2, '2021-08-23 16:46:57', '49', 1, '', ''),
(678, '1652074760d5373ae9541', 'Astri rita lupika', 'Bank Kalbar', '23/08/2021', '09:45:23', '12', 6760000, 'c01be602d55349dbe612aaf6c9457b6b.jpeg', 2, '2021-08-23 16:59:32', '49', 1, '', ''),
(679, '2128764660a7aef3f0453', 'Prisila rosalia dea', 'Bank Kalbar', '23/08/2021', '14:11:13', '47', 3260000, 'ccbac3f8c1de761e061e6072e81af5f1.jpeg', 2, '2021-08-23 17:05:59', '49', 1, '', ''),
(680, '1106374960d91b111bc35', 'Erma susilawati', 'Bank Kalbar', '23/08/2021', '14:09:10', '46', 3000000, '3e102071ed050f777b746a1d77618dbd.jpeg', 2, '2021-08-23 17:15:51', '49', 1, '', ''),
(698, '7045003461108ae8c1cef', 'Selviana', 'Bank Kalbar', '27/08/2021', '10:37:05', 'T14', 6760000, '408318b3454ca93abf0c7e014694b947.jpg', 2, '2021-08-27 14:00:16', '49', 1, '', ''),
(682, '2089905160f54d10d1f5d', 'P.RIKO.A', 'Bank Kalbar', '24/08/2021', '11:42:16', '006212', 6760000, 'f59a2db9bfa7e803b9012b662af32b82.jpg', 2, '2021-08-27 12:01:04', '49', 1, '', ''),
